aa1fd,3,2009-12-01,Conversation with my Congressman,dmuma,politics,https://www.reddit.com/r/politics/comments/aa1fd/conversation_with_my_congressman/,"**I wrote my Congressman (Burgess) with concerns about DOMA and received this response:**

Dear Mr. [Me]: 

Thank you for contacting me regarding same-sex marriage. I appreciate hearing from you on this important issue. 

As you know, federal law does not recognize same-sex marriages. The Defense of Marriage Act (DOMA), P.L. 104-199 was passed in 1996. It prohibits federal recognition of same-sex marriages and allows individual states the right to refuse to recognize such marriages performed in other states. 

Texas, along with 22 other States, has a Constitutional Amendment that prohibits same-sex marriage. Article 1, section 32 of the Texas Constitution provides that: ""Marriage in this state shall consist only of the union of one man and one woman. This state or a political subdivision of this state may not create or recognize any legal status identical or similar to marriage."" 

I believe that the institution of marriage is a legal and moral bond between a man and a woman; therefore, I cosponsored H.J.Res.88, The Marriage Protection Amendment. If enacted, H.J. Res. 88 would have defined marriage as the union of a man and a woman, and make any state law defining it in any other way unconstitutional. For enactment, this joint resolution required passage by two-thirds, or 290 yeas, by each chamber. Unfortunately, on July 18, 2006, this legislation only received a vote of 236-187. However, I remain committed to oppose efforts on the federal level to legally recognize same-sex marriages during my tenure as a United States Congressman. The Senate also had similar legislation, S.J. Res. 1. On June 7, 2006, the Senate voted on this legislation, and it failed by a vote of 49-48. 

I understand that you are supportive of same sex marriage. While we may not see eye-to-eye on this issue, please know that I do value your comments. Since this is also a state issue, I also encourage you to contact your state representatives on this matter. 

Again, thank you for taking the time to contact me. I appreciate having the opportunity to represent you in the U.S. House of Representatives. Please feel free to visit my website (www.house.gov/burgess) or contact me with any future concerns. 

Sincerely, 

Michael C. Burgess, M.D. 
Member of Congress 

**So, I figured it was best to reply in kind. And thusly done:** 

Thank you (or your office staff/unpaid intern) for your speedy response which I received this afternoon. 

I appreciate your values of having marriage as a legal and moral partnership between a man and a woman. Because of your stirring arguement to this end, I have decided to change my position: I no longer would like you to introduce a bill to repeal DOMA. In fact, I think we need to strengthen legislature towards defending marriage. 

I have seen statistics which suggests that 50% of all marriages result in divorce. Clearly efforts of defending marriage by not recognizing same-sex couples have been unsuccessful. We need further action, and we need it now! 

I don't think an act like DOMA is enough, Congressman Burgess, not nearly enough. Perhaps we could prohibit divorce, or require all couples to have a mandatory six month courtship. Of course, these things would require bigger government, which is ideologically askew from the Republican party's credo. But it is for the betterment of the sacred institution of marriage, Congressman! You'll have to find some way to communicate this with fellow Republicans so that you can maintain your party's support. 

Can we also pass a law to prevent certain types of people from performing marriages? I feel that marriages done by Elvis impersonators are more likely to create a substantial drain on our system, and really hurt the integrity of marriage. I don't have any data on this, but surely the government could fund a study, and pass the tax burden on to married couples. After all - they should be the ones paying for the protection of marriage. This helps keep the tax burden for single people steady. And if we encourage more people to be single, we won't have as many threats to the institution of marriage (although there may be a higher occurence of sexually transmitted diseases, but I'm not worried about that because I learned about abstinence in high school). 

Oh! I've also noticed that people from Oklahoma are terrible drivers. I know this isn't marriage related, but it seems like Congress is able to dictate laws to the states as to what licenses and judicial proceedings the state is able to not recognize (I figured this was unconstitutional because of the Full Faith and Credit Clause, but I'm no expert). Can you pass some sort of law so that Texas doesn't have to recognize Oklahoma drivers' licenses anymore? Or really, any state should have that option. Oklahoma drivers are a menace! 

Congressman (or staff/unpaid intern), I'm sorry for rambling, you have just so emboldened me into defending marriage and its sacred institution that I have a zeal about me. I hope you'll take my suggestions to heart as ways to protect marriage and keep crazy people off our safe, Texas highways. 

Thank you again for your service as our representative, and I'll be watching out for you on C-SPAN! 

Sincerely, 

[Me]
Married, but Not Married Guy 

P.S. My given name is [Me], so I would appreciate it if you choose not to recognize my married name that you instead address your response to ""[Me],"" or ""[Me]."" Thanks!"
aa2qe,1,2009-12-01,Hiring managers! I'm starting to write my CV,gabu05,AskReddit,https://www.reddit.com/r/AskReddit/comments/aa2qe/hiring_managers_im_starting_to_write_my_cv/,"I'm starting to update metamorphize my resume into a CV since science majors/health professionals should have one. The first thing I've noticed is that I don't think I have enough experience. I've had many odd jobs but I'm not even going to list them. I do have one job that's in my field and I've been there for about two years. I've done alot at that job and I was wondering what should I or should not put on my CV and if it looks bad to try and whore my one experience. I'm not really well rounded. I'm in a few organizations but I haven't done anything worthwhile except help run a booth at a healthfair (although I did do alot of logistics for setting it up).

What are you looking for, hiring managers? What kind of classless stuff should I be wary of? I'm looking at a company's website and they have an internship for the summer that I'm interested it. Is it good mannerism to try to email somebody at the company saying that I'm interested in it? I don't want to come off as brash or rude, since science is a small net community. 

As always, reddit, thanks. Let me know if you need more details. "
aa6p7,2,2009-12-02,TF2 n00b here looking for an answer: what to get for a TF2 fan from Akihabara in Japan?,tf2n00b,tf2,https://www.reddit.com/r/tf2/comments/aa6p7/tf2_n00b_here_looking_for_an_answer_what_to_get/,"This is for a X-mas gift exchange at my work. Our intern is a young TF2 fan and I am currently on travel in Japan. Any idea what I could get him from the Akihabara technology/gaming district?

EDIT: Thanks for all the responses so far. Seems like Japan isn't the right place for TF2 swag. Any other (non-TF2) suggestions are most welcome! BTW - he is an avid poster here, so I am using a throwaway account."
aah1z,1,2009-12-02,Need Ideas For A Retirement Gift For A Tech Coordinator... Any Help?,CyberPrime,AskReddit,https://www.reddit.com/r/AskReddit/comments/aah1z/need_ideas_for_a_retirement_gift_for_a_tech/,"I worked as a student intern under a Public School District's Technology Coordinator for about 4 years. I've had a mentorship with him, and have worked closely with him for a couple of years. This is a really great guy, and I want to send him off well.

Keep in mind I am a high school senior, so no Rolex watches or anything, but something that he might find cool. I really don't have many ideas. Thanks!"
aay0a,7,2009-12-04,Houston redditors - know of any good job-finding resources for the Houston area?,oemta,houston,https://www.reddit.com/r/houston/comments/aay0a/houston_redditors_know_of_any_good_jobfinding/,"I'm taking next semester off and am looking for a software job or internship.  So does anybody know of any good listing sites for software jobs?  

Or if anybody knows of someone who is interested in hiring a java developer, pm me.  I haven't had the chance to gain much work experience, but who knows, I may be the right person for somebody's project.  I'll greatly appreciate any resource of job lead."
ab4wd,4,2009-12-04,"Hey Reddit, does anyone know how to go about searching for accounting/finance internships in Hong Kong?",ilikejuice,AskReddit,https://www.reddit.com/r/AskReddit/comments/ab4wd/hey_reddit_does_anyone_know_how_to_go_about/,"I'm currently a Freshman in college and I have a pretty strong interest in working in China later on. I recently contacted an alumni in Hong Kong to see if I could get any internships and he said that since I don't have an HK ID card or the permission to work there, I have to go through a large investment bank or global MNC in order to find an internship. My question is if that's the case where do I search? I've been googling sites, but you have to pay if you want to intern abroad? Is that really the only way? Also, isn't it that you have to be in the country already working to get an ID card? Thanks for any help. I appreciate it."
abh1w,0,2009-12-05,"DAE in retail, meet amazing customers who have turned out to really help out in some way.",Shnoop,DAE,https://www.reddit.com/r/DAE/comments/abh1w/dae_in_retail_meet_amazing_customers_who_have/,"Ive worked in Apple retail for a few years now and over the last few, I have met some unbelievably powerful and generous people. Last year I spent a few hours with a customer buying a few mac pros for his studio. After the sale he gave me his information and told me to give him a call if i ever need anything. Six months later I was on an internship with Capitol Records and traveled across Asia on their expense :D

Anyone else had some similar experiences, or met any other amazing customers?"
abjg9,29,2009-12-05,IAmA librarian. Our library has the oddest incident reports in the area. AMA.,BlakeII7,IAmA,https://www.reddit.com/r/IAmA/comments/abjg9/iama_librarian_our_library_has_the_oddest/,"We currently hold the record for most incident reports of our library cooperative, and we have the oddest ones too. I have been working there for just shy of 3 years. I have seen the police come at least 5 times, even more when I am not there. We are also in Michigan, so most of the people we get are laid off, so it makes for a 'fun' work day.

EDIT: As was pointed out, I do not have my degree, I work as a librarian through an internship job. I do the same work though, and my job description is that of ""Librarian and General Services"""
abjpo,0,2009-12-05,Dear Reddit: I'm a sophmore CE major in Minnesota and I'm looking for internships and advice,lordloss,reddit.com,https://www.reddit.com/r/reddit.com/comments/abjpo/dear_reddit_im_a_sophmore_ce_major_in_minnesota/,"Like the title says, I'm going to school for computer engineering and I'm starting to look for internships for next summer after my junior year. I'm interested to hear from others on how they went about finding an internship or how they were able to stand out and get noticed. 

I'm not sure how to market myself against all of my classmates, all of us have taken the same classes and those classes are pretty much the same as all the classes the other schools offer too. At this point almost all my math and physics is done and i'm almost done with circuits. As far es extra curricular activities go, i'm participating in a robotics competition where we are designing something to navigate through a maze.

If anyone has gotten an engineering internship or gives out internships, what do they/you look for?"
abtwn,113,2009-12-06,I am posting this because of my dad. Sadly he was diagnosed with pancreatic cancer it and given a short time to live. He bounced back by writing this funny and off-beat mystery. I hope you check it out. It'll raise the Old Boy's spirits. ,humphries3,AskReddit,https://www.reddit.com/r/AskReddit/comments/abtwn/i_am_posting_this_because_of_my_dad_sadly_he_was/," My fathers words:

""December 6th, 2009

The Day Everything Changed
 Richard Humphries

It wasn’t good news, that’s for sure, when my big jolly Irish nurse came back to the hospital room. With an unwanted Intern. A dour and intense, dark-eyed Intern who sat on the foot of my bed while the now un-jolly nurse turned down the volume on the television. She had tears in her eyes. Shit.
“Well, it doesn’t look like good news,” I tried.
His words in reply were fast and breathy.
“It isn’t good news, Mister Humphries. It isn’t good at all.” He said it as if he was angry but we three knew it was pretense. “The tests came back and the pathology report says the growth on your pancreas is a carcinoma.”
“That means cancer, doesn’t it?”
“Yes. Cancer.”
“I have pancreatic cancer?”
“Yes, you do.”
“Fuck.”
“You have pancreatic cancer.” He needed the practice of saying these things to patients.
“Sorry, Nurse, about the swearing.”
“That’s okay. Really. Really.”
My vision narrowed to a tight tunnel while my mind insisted I was watching a movie, or in some horrible joke, or the victim of a mistake in the lab. The wrong slide with some other guy’s name that sounded like mine. It couldn’t be. It just could not be. Not me. I had things to do. Plans. At least one great novel to write.
“Isn’t that the kind of cancer that kills you in, like, three months?”
“At the stage you’re at, we generally say three to six months until . . .”
“Until I die? What ‘stage’ am I at?”
“Stage Four. “
“How many stages are there?” I was hoping there were a great many.
“Four.”
“Fuck.”
“It’s advanced.” The Intern stood from my bed, straightening his white coat, making his escape.
“Would you like us to send the Chaplain?” She was Irish to the core.
“Yes. Please. Send the Chaplain. I won’t swear at him. Promise.”
“I’m sure it would be fine if you did. We’ll have him come up.”
“Thank you,” I said. I can’t imagine what for.
They both took it as an excuse to vamoose, however, and I was suddenly very and completely alone. Alone. Alone and scared.
This happened twenty-one months ago.
I still get scared about disappearing from this world soon—dying and being put in a box or burnt to ash– and so had to write this book. It isn’t a ‘cancer’ book or self-help, but rather the kind of sexy/funny murder mysteries I tore through in my youth. Kind of a way for me to be around once I am gone.
I’m now working on book #2.
I never did see the goddamn Chaplain.""

 He has written a great comic novel, it's only people like you who can help get this popular. It's available on his scribd account. It is free to sample and rate at 
http://www.scribd.com/readmybook

Paperback writer was taken, but readmybook was free. that's my dad!
"
abwjk,5,2009-12-07,"Dear reddit, can you give me advice regarding grad school?",blowjobtransistor,AskReddit,https://www.reddit.com/r/AskReddit/comments/abwjk/dear_reddit_can_you_give_me_advice_regarding_grad/,"Hi, I'm an undergraduate student in Electrical Engineering at WSU.  I am graduating this coming fall, and for some reason this the first year in which I considered getting my masters. My GPA is very slightly above 3.0. I plan to take the GRE in April. Employment instead of getting a masters is an option, but the M.S. would definitely open a lot of doors job-wise.  My questions, succinctly:

* **Can I expect to get into a decent graduate program with this lackluster GPA?**
* **How can I improve my chances of admission?**

This is the long story:

I graduated high-school with a terrible work ethic.  It has improved steadily during my time studying EE, but a cynicism towards academia has come with it.  Since my first internship I have been told about the large gap between academia and professional engineering. This has prompted me to disregard things that don't seem particularly important, like homework.

Needless to say, this has not helped my grades.  People call me smart, and more often than not it seems that I am explaining things to my peers.  I know with a decent amount of studying I could do well on the GRE.  I've greatly impressed the people I worked with in my internships, and they could supply sparkling recommendations.  These were medical electronics companies, so their expectations were high.  I am very creative (an amateur artist in my pass time), I have great communication skills, and a great ability to work within groups.  I know there are universities that will automatically disqualify me as a candidate due to my GPA.  Is there a way I can get the admissions office to look past my GPA?  Which universities should I shoot for if I am interested in microelectronics and medical electronics?

Thanks so much! Your advice means a lot to me.
"
ac0qd,3,2009-12-07,Can't find a job...Advice?,confusedgrad,AskReddit,https://www.reddit.com/r/AskReddit/comments/ac0qd/cant_find_a_jobadvice/,"I graduated from college in August and have been having trouble finding a job.  No phone calls, no interviews even.  I have a good GPA and a good internship.  When I applied to my internship, the hiring partner was very impressed with my resume, so i don't think that's the issue.  I have a basic cover letter that discusses my ""determination"" and ""go getting attitude"" along with my school and internship experience.  In addition, i usually add a paragraph that relates to the specific company/position i'm applying to.  Maybe that's not what they're looking for?

I think part of the problem is that i'm located in Michigan. Do employers in NY and Conn look for a local to hire?  

Also, many of the companies i want to apply to have a college graduate recruitment program that have set deadlines.  Many of these deadlines have already ended.  Is it worth my time to call/visit/kiss ass in order to apply to these programs or am i out of luck?

My internship employer did not have a history of offering full time employment to their interns.  There were/are possibilities within that firm to which my internship would be beneficial, however, i would prefer to look at other opportunities.

Do i need to eliminate my standards and send out resumes to any and all employers?  Thankfully, i don't need to work, but i do feel more and more like a ""loser"" when i hear about friends who haven't graduated yet getting jobs.

Are things really this tough?  Am i not working hard enough at this?  Thanks for your advice."
ac7lw,4,2009-12-07,"Help me define ""internship""",Synthos,AskReddit,https://www.reddit.com/r/AskReddit/comments/ac7lw/help_me_define_internship/,"* Can I be graduating and still do an internship ? (starting the summer after I graduate)
* What if I'm going to grad school after the internship?
* Can an internship be as short as 4 months, or as long as 12?
* Does my school have to do anything for me to be an intern?
"
acgug,1,2009-12-08,Has anyone had any experience with the Institute for Humane Studies?,djrocksteady,Libertarian,https://www.reddit.com/r/Libertarian/comments/acgug/has_anyone_had_any_experience_with_the_institute/,"""The Institute for Humane Studies supports the development of talented students, scholars, and other intellectuals who share an interest in liberty.""

I am currently looking for internships and I came across this group. I was wondering if anyone in this subreddit has had any experiences with them and would like to share. I am in the process of applying for a Broadcast Production internship. I am looking to get involved in the news/documentary sector, from a libertarian perspective of course. I was also wondering if anyone knew of similar organizations just in case they reject my application. Thanks!"
acknq,5,2009-12-08,Any advice for a guy trying to transfer colleges with the odds hopelessly stacked against him?,cefriano,AskReddit,https://www.reddit.com/r/AskReddit/comments/acknq/any_advice_for_a_guy_trying_to_transfer_colleges/,"I got this idea from a [comment](http://www.reddit.com/r/IAmA/comments/a7t91/iama_college_admissions_officer_ama/c0g9asn) in an AMA from an admissions officer.  Just like the guy who commented, I have mediocre grades from a good high school and slightly better college grades (though this semester's grades might be great).  I have pretty good SAT scores, probably the best aspect of my credentials.  My extracurriculars are meh, and I don't have a whole lot to send them in the way of a creative supplement.  What I *do* have is an intense passion for this school and a strong desire to do whatever it takes to get in.  I'm competing for about the same amount of spots that the commenter was.  I have been talking to a teacher there that runs a games lab, and am working on securing an internship at the lab over the summer.  I'm also going to visit at the end of winter break to talk with her and maybe other faculty.  Any suggestions for what to talk about, what else to do while I'm there, or what to do with my application would be greatly appreciated."
acnyb,0,2009-12-09,Hi REDDIT! Can anyone give me some tips on negotiating my first salary?,MikeD1988,AskReddit,https://www.reddit.com/r/AskReddit/comments/acnyb/hi_reddit_can_anyone_give_me_some_tips_on/,"Hi guys, 
I graduate in May and I've been working for a small international company for the last 8 months as a paid intern. I was originally only supposed to intern for the summer but they've kept me on during the school year. I've spoken with our president about being hired when I graduate, but haven't been able to confirm any details because I still wasn't sure what I was doing after school. Next week, I plan on trying to firm up those details and possibly start negotiating my salary, then I realized I have NO idea how to go about it. I have a number in mind, and the minimum I would accept is not far below it. I was hoping for advice on the best way to negotiate in order to receive the best salary possible. I would really appreciate your help reddit! Thanks for your input and advice!"
acojx,0,2009-12-09,"Reddit, I need to come up with $6K by the end of December or I don't get to go to college.",Imagist,reddit.com,https://www.reddit.com/r/reddit.com/comments/acojx/reddit_i_need_to_come_up_with_6k_by_the_end_of/,"I don't have high hopes of getting anywhere with this, but I'm running out of options and I don't want to give up hope until I've tried every single thing I can possibly think of to get myself out of this mess.  Asking Reddit for help is one of those things.  So here goes.

I'm a 22-year-old college student studying computer science at Drexel University in Philadelphia.  I am trying to transfer to a less-expensive school, but I can't do that until Drexel sends my transcripts to the schools I've applied to.  And Drexel won't do that until I've paid them the money I owe them: $5914.70.

I'm not looking for a free ride.  I am looking for one of two things:

1. A cosigner for a loan.
2. Work that will pay up-front.

I have internship experience in web development and also in Java development.  Off the job I have done extensive work in Python and C.  I am also a somewhat-skilled tenor and I have been teaching karate to children for a few years.  I have been a Redditor for a while.

I am offering the following:

1. 400 hours of work using any skills I have, to be completed ASAP and no later than 2010 AND my sincerest promises not to default on the loan, in exchange for cosigning my loan.  The 400 hours figure is intended to represent working off the full $6000 of the loan at $15/hour.  In comparison, my last job paid $18.75/hour.

2. 400 hours of work using any skills I have, to be completed ASAP and no later than 2010, AND the full loan paid back by 2015, if you would be willing to pay up front ASAP.  If multiple people want to give money, I am willing to split up my hours between people.

I will sign whatever contracts are necessary to make you feel safe that you won't be ripped off.  I would be willing to travel wherever public transit will take me in the Philadelphia area.

[Here](http://imgur.com/7AKbt) is a picture of my bill in the Drexel financial system.  If you can think of any other ways I can verify that my situation is as I say it is without getting my identity stolen, I'll happily provide the information.  I'll also send you my resume if you PM me.

Feel free to ask me any relevant questions.  Please help a fellow Redditor out."
ad8ch,5,2009-12-10,Best examples of intern abuse.,stoicsmile,AskReddit,https://www.reddit.com/r/AskReddit/comments/ad8ch/best_examples_of_intern_abuse/,What are some of the funniest/worst examples of intern abuse or misuse that you have ever encountered either as an intern or as an employee at a company that uses interns?
