8xdmz,8,2009-07-01,I'm new to the Twin Cities.  Please help.,kelsey_leigh,meetup,https://www.reddit.com/r/meetup/comments/8xdmz/im_new_to_the_twin_cities_please_help/,"A few facts:
1. I'm doing an internship in Minneapolis for about another month and a half.
2. I'm a month away from 21.
3. I'm bored as shit.

Most of my days are spent by going to work, coming home, going to the gym, eating dinner, walking around, and watching way too much TV.  I'd like to meet some easygoing people who don't mind socially awkward situations to keep me from going insane.  I'm pretty cool, I swear."
8yvx6,174,2009-07-07,"My buddy got killed by a monorail to the face, and I've been flipping shit all day. ",Hiaw,self,https://www.reddit.com/r/self/comments/8yvx6/my_buddy_got_killed_by_a_monorail_to_the_face_and/,"It was any other day, I needed to weedwack and I had a job interview at 3:45. I go to check my inbox where my dad, a self-professed Disney nut (who has been following the news about the monorail crash), reports to me that the pilot used to work in the Sunset Attractions Area during the summer of 2008. 

This matters, because that summer I too worked the Sunset Attractions area as a sort of intern for Disney in their college program. I clicked on the link he had forwarded in the e-mail, and I saw the pilot's photograph. 

No fucking way. It was Austin. 

I immediately tabbed my browser to check facebook, while firing up pidgin to see if I could contact somebody I used to work with. Sure enough, there was the.. 

""RIP Austin Wuennenberg - Driver in WDW Monorail Crash 07/05/2009""

..group on facebook. And already, Austin's facebook page had become a tombstone; The kind of digital graveyard phenomenon I had only read about in Wired, but never witnessed firsthand. Friends, family, peers, his girlfriend, telling stories about his life, sharing memories, crying out in anger, all in the sort of morbid lingo you hear at funerals, made all the more stoic and absolute in typeface.

""He will be missed""  

I wrote my piece on his wall, is this modern grieving? Why do I feel I need to tell all of reddit? Maybe just to highlight the human element behind just another news story that made the front page of reddit, because until today that's all it was for me.

But damn, what a way to go. However, Austin was known for his dark sense of humor, I would appreciate, and I know he would have, any good joke relating to being killed by a monorail. There has got to be half a year's worth of material in there. You're either laughing or your crying and besides, you assholes are going to upvote the most in-appropriate one anyway. God* I love reddit. 

*If you are an atheist just substitute the word fuck here. 

  "
8z4fn,0,2009-07-07,"Hey, I would appreciate some ruby help if anyone has the time. ",[deleted],programming,https://www.reddit.com/r/programming/comments/8z4fn/hey_i_would_appreciate_some_ruby_help_if_anyone/,"If you're willing to PM me your email address that would be amazing but here is some back story and current questions.

I'm an intern, my internship isn't supposed to be for programming but I've gotten a bit of a side project with ruby on rails. My programming experience is all in computational physics and networking dynamics simulation (math) so I'm not really a web developer. I know a few languages but not ruby at all. 

I would love a quick overview on how ruby works (especially the directory structure and stuff). I've been editing files and attempting to see what happens to no avail. 

How do I push updates to the code to be live?

Anything important I should know?

Thanks a lot in advance. "
8z82t,7,2009-07-08,Dear Reddit: What should I do in Berlin? ,HeNeArKrXeRn,AskReddit,https://www.reddit.com/r/AskReddit/comments/8z82t/dear_reddit_what_should_i_do_in_berlin/,"Hi, first post on reddit:

I'm spending the summer in Berlin, doing an internship. Any advice on where to go and what to see on the weekends? I've been here already a couple of times so I saw the major sights - Alexander Platz, Potsdamer Platz, Unter den Linden, Potsdam, saw the prostitutes and done the pub crawl on Oranienburgstrasse and have been enjoying Doner Kebabs regularly. Are there any good nightlife hotspots?"
8zh14,77,2009-07-08,"Hey, Reddit I just got back from meeting with Ron Paul. Here's the more interesting bits (with info about the |,,L sign).",Wwoody123,ronpaul,https://www.reddit.com/r/ronpaul/comments/8zh14/hey_reddit_i_just_got_back_from_meeting_with_ron/,"He arrived half an hour late because he was voting on the floor during our scheduled meeting time but was very gracious about apologizing and inviting myself and the other ten interns into his office. We all sat down in his office and started talking about different policies and proposed bills. Since I was in a pretty big group I didn't get to ask very many questions, but here were what I thought were the more interesting parts:

1) He supports jury nullification as a method of protesting unjust laws.
2) He would vote against the Sotomayor nomination if he were in the Senate.
3) It is ""unlikely"" that he will run in 2012 as a Republican, even less likely as a third party candidate.
4) The CIA is likely involved in instigating opposition within Iran.
5) He makes it through the day and keeps fighting because he knows he has the support of young people helping him. He seemed to love meeting with us and spent almost 45 minutes talking with us before we voluntarily left.
6) He thinks that if the federal government went bankrupt, it would be a mixed blessing because we would focus on survival rather than expanding our empire.
7) I suggested that the |,,L sign was for UT or love but he said he thinks it’s his arthritis. 

I also thanked him for his integrity and conviction and told him he has supporters around the world, per your request in my previous post. EDIT: I didn't ask him for permission to release the audio, so I only plan to use it to clarify the above points or maybe quote or transcribe some of it."
8znfh,0,2009-07-09,Perfect Shirt For Your Interns! - Igenious Idea!,NotANiche,reddit.com,https://www.reddit.com/r/reddit.com/comments/8znfh/perfect_shirt_for_your_interns_igenious_idea/,The New York Agency JWT had an ingenious idea for their interns. To prepare their interns for the intense 10-week summer internship they created this great t-shirt with silkscreen-printed sweat stains and rips that resembled whip marks. Hilarious!
8zpi9,0,2009-07-09,JobBug,JobBug,reddit.com,https://www.reddit.com/r/reddit.com/comments/8zpi9/jobbug/,"JobBug is a job site for students and new graduates looking for full time, part time or summer jobs as well as co-op and intern opportunities in the Greater Toronto Area."
91gbo,7,2009-07-15,AskReddit: Is it morally wrong of me to draw out my project at work so that I keep getting paid? [See details],j-mar,AskReddit,https://www.reddit.com/r/AskReddit/comments/91gbo/askreddit_is_it_morally_wrong_of_me_to_draw_out/,"Me: College student.  Starting my third year as a CS major.  I like my gadgets and I like having nice toys (read: iPhone, car, computer), not to mention I like going out and having a good time with my girlfriend.  In the fall my mom and her fiancé are moving 12 hours away from me, thus leaving me completely independent; tuition, food, housing, gas is all up to me.

Employer:  High roller life insurance company.

Job Details:  I was hired as a summer intern to create them a user's manual for one of their systems.  They have 3 systems in which they enter all their clients and where they do all sorts of insurance related transactions.  They were audited and told that they needed to have documentation on how to use their newest system, which everyone’s been using for a few years now.  As such, all of the employees here know how to use the system and the manual is really just to meet some requirements, it's not all that needed.  Their system is pretty intuitive ... for the most part.

This job pays really well for someone my age/education level.  I don't clock in or out.  I come in around 8 and then leave at 4:30 like they told me.  I had various car issues over the last few weeks in which I couldn't get to work.  I emailed a semi-manager to tell her I wouldn't be in.  *I still ended up getting paid for the 2 and a half days I missed.*  They aren't really organized in this department of the company, and they really don't care too much about me and my task, which is fine.  By no means am I trying to ""teach them a lesson.""  However, I just had a meeting, like I do every other week, where they ask me about my progress.  I was asked if I'd ""get it done by the time \[I\] go back to school.""  I could easily be done by next Friday, but after that the paychecks will stop and I'm sure I won't be able to find another job for the rest of the summer.

I recognize that I’m very, *very* fortunate to have this job.  At the end of it all I **will** be handing them an excellent product, in my opinion.  I have spent a ton of hours working on it so far and I’m quite proud of what I’ve accomplished.  There have been a few days where I have come in and been waiting on a meeting or something and had them push off the meeting in which case I’ll just browse reddit for literally 8.5 hours.  I’m fine with that.  There have been *days* in a row where I’ve done that.  I have no problem coming in every day to do this for the money I’m getting paid.  By delaying this project, I don’t feel that anyone will be harmed or influenced at all.  They really have no bearing on how big or small the task is.  They aren’t rushing me and they told me I’m doing fine and that I just need to give them a week or so heads up before it’s done so we can review it.

As far as the money goes, I mentioned a few frivolous reasons why I need the money.  However, I should note that most of my money has been saved.  I have treated myself nicely thus far, but I know that I’ll need the money in the future for school.  Pretty much from here out, 75-85% of my pay will go directly into my savings account not to be touched (that’s spending money on food and gas).

So I’m asking, is it morally wrong of me to draw out my project so that I keep getting paid?

tl;dr – I work for a big company that needs a small task completed.  It’s not urgent, they just need to meet an audit requirement.  I like coming to work, I like getting paid, I can very much use the money.

I’d be happy to answer any further questions.
"
91i3p,0,2009-07-15,AskReddit: if exposed to the vacuum of outer space what would happen?,c0da,AskReddit,https://www.reddit.com/r/AskReddit/comments/91i3p/askreddit_if_exposed_to_the_vacuum_of_outer_space/,"Me and my fellow interns at NASA have been discussing this for the past couple of days. Also, please tell DarkkirA that recycling isn't a conspiracy."
91o0f,0,2009-07-16,My email to Glenn Beck,[deleted],politics,https://www.reddit.com/r/politics/comments/91o0f/my_email_to_glenn_beck/,"hey glenn,

I must admit I've had my eye on you. I know you're paying an intern who doesn't give a shit what you think or whether you're right or not to read this, but I thought I'd drop you a line anyways.

How can I put this lightly? You're a fucking douchebag. I must assure you that I mean that in the nicest way possible. You see Glenn, I heard you flip out on the health care caller, you know the one who served you on France's system?, and I have to say I was delighted. Your steady fall from semi-relevant center-left commentator to complete whack job is now complete. Congratulations! I hope you lose your health care soon! :) :). I know I'm straying off message (you don't mind do you?) but I'd like you to know that on my lunch break I walk the two blocks to the Barnes and Noble (that's a bookstore!) and turn around all of the copies of your book so they're facing backwards! Sometimes, just for fun, I put them in the religion section, or maybe even the spanish language section (doesn't that burn your ass?). Fuck you Glenn Beck, go do some research before you run your fucking idiot mouth. By the way Glenn, I have more degrees than you :).

Love,
Cole"
92c7y,2,2009-07-18,"Reddit, I'm sorry, I love you, but Redditjobs kinda sucks. Many of us are unemployed, and there are only a handful of positions listed, and from a while ago. I would love to work for a place that appreciates Reddit -- can someone at Reddit kick up the outreach?",snoosnoo,reddit.com,https://www.reddit.com/r/reddit.com/comments/92c7y/reddit_im_sorry_i_love_you_but_redditjobs_kinda/,"Once when I was an intern I was part of a new media company's attempt to start a job board as well. They had me emailing hundreds of recruiting officers, following leads from job-postings and Craigslist, offering incentives like featured placement of a job in ad space, etc. Even if I only got back a dozen responses to 100s of emails per day, that was still a dozen potential jobs.

I think Redditjobs is a great idea, especially in these times. I keep hungrily returning to it, only to see the same stale postings from a month ago. There are currently 19 jobs posted (most of which are probably taken by now), and 500,000+ people are losing their jobs every month. Do we see the disparity?

I know there are jobs out there -- especially, and luckily, for people of the computer-savvy mindset. It would be much appreciated if Reddit could maybe set a hapless intern or two in pursuit of finding more companies that want to be considered by Reddit's considerable talent pool.

I'll be happy to do it, if you're hiring."
92hby,11,2009-07-18,Weed in San Jose?,myotheraccount,Marijuana,https://www.reddit.com/r/Marijuana/comments/92hby/weed_in_san_jose/,"I'm in San Jose for the summer, on a tech related internship.  I have pretty bad chronic insomnia (ba-dum-tish), and the only thing that does the trick is marijuana.  Lack of sleep has been effecting my work lately, so I've been trying to get some.  Not to mention I love programming while high.

If I were to be in CA longer I'd get a medical card.  I've managed to get small amounts from street dealers a couple of times, but I just hate dealing with the shady people around here.  You can only stretch a dime so far.

Today I was on the prowl for some, and as I was turning the corner onto a fairly prime area, I saw five police cars drive up, and pull their guns on two black dudes.  They proceed to shove them to the ground, cuff, and frisk them.  Fucking racists.  I don't know the full context, but I'm sure it was drug (and probably weed) related, and that firearms and general roughness certainly wasn't necessary.

Anyway, this scared the shit out of me.  I'm not going to try to get any in any kind of public setting again, at least until I'm back where I'm from.  For the police there it's essentially decriminalized.

What's a good, safe, unsketchy way of obtaining some?  The friends that I have made here so far are pretty unchill regarding this topic, categorizing weed smokers as ""druggies""."
935dk,5,2009-07-21,It's my first day of work. Any suggestions?,bearbait,reddit.com,https://www.reddit.com/r/reddit.com/comments/935dk/its_my_first_day_of_work_any_suggestions/,"It's my first day at my summer internship and I'm working with the sales department. I have no idea what to expect and my boss is going to show up in about an hour. Any tips or pointers, Reddit?"
9397i,5,2009-07-21,Could use some advice.,just_a_girl,relationship_advice,https://www.reddit.com/r/relationship_advice/comments/9397i/could_use_some_advice/,"I had been dating my boyfriend for four years.  We had been long distance for the past two years, and not-so-coincidentally have broken up twice in the past two years.  We were both finishing up our junior years in college and were planning on living together this summer to the West Coast (we're from the East Coast).  We decided this back sometime in February; I had been looking for internships for months with no success.  My dad offered to hand in my resume to his company in the Midwest and I figured it couldn't hurt.  The boy finds an internship with great ease (naturally) and immediately takes it.

See, last summer, he got an internship in the DC area and I, who wasn't thinking about the post-college world yet, didn't have any better prospects than a cashier job, so I went down with him, which caused huge fights between me and my parents, including threats of withholding payment for school and estrangement.  I did end up getting a job down in DC, and at the time I believed my parents to be strongly overreacting, but I wasn't in a good spot financially and hated fighting with them constantly, so naturally, it wasn't exactly something I didn't want to repeat again.

Come April, I still didn't have anything in LA (where the boy got his internship) and I was getting nervous.  Come May, I didn't have anything in LA, but an interview with my dad's company, and, being a jobless worried person, I took the interview and got the job.  So my parents are like 'You should take it!' and my boyfriend is like 'You promised you would come out with me to California!' because, in his words, California was going to be the best and greatest thing for our relationship and was going to fix everything and put us on the right track, etc.  So naturally a lot of fighting occurs - I want a job, but I also desperately want to be in California, for it had been a personal dream of mine and I was just getting out of a pretty deep depression and thought that if I could live a dream of mine, if I could achieve a goal that I set for myself, it would be a sign that I had control over my life and that I could do what I wanted to do, etc.  So, long story short, my parents yell at me and make me feel worthless and I make my mother cry and she says that my father won't speak to me if I go gallavanting off again, while me and the boy are driving to California, and I tell the boy that I have to go to the Midwest and he drops me off at the airport in Denver and drives off.  And he's *angry.*  And, given the way he had been talking about this trip, and given how angry he was when he just decided to leave me at the airport (about 15 minutes passed inbetween me talking to my crying mother and me being left alone at the airport), I figure that our relationship is over and I'm bawling in the airport, my parents pay for a flight home, etc.

OK.  So fast forward a few months.  I dig myself out of yet another depressive state that I immediately spiraled into from the moment I step into the Denver airport and I have a quarter-life crisis, of sorts.  I believe I have to sort things out and figure out issues between me and my parents and stabilize my own personal and emotional state and really figure out who I am after all of this and all of that.  And the whole time, the boy keeps on calling me and calling me and calling me, saying that he doesn't understand what he did wrong and how could I ever feel abandoned in Denver and how could I ever think that me not going to California = me leaving him and why I don't deal with how 'emotionally abusive' my parents are and so on and so forth.  I've told him that this whole thing has been really hurtful and that I'm very confused and need time to figure things out, but the most I got was three or four days without contact.  I just really need some space, and he doesn't understand it.  He doesn't understand that at this point, I really just want to be alone and by myself so that I can sort my life out and get back on track.  At this point, I'm not getting back with him.  You reach a breaking point, you know?  And he says I'm taking my anger out on the wrong person and everything, but I really just want to be alone.  It's not like I don't care about him and it's not like I don't love him, but I really just need to be alone, sans contact, and it is so hard to do.  How do I go about this without hurting him (as though such a thing were possible)?

**tl;dr** (and you don't have to tell me twice about the tl part, sorry...): I have a lot of personal issues involving my psychological well-being and emotional relationships and want to be alone for them but the boy won't leave me be.  How can I convey any clearer that he needs to let it be?"
93jak,210,2009-07-22,My whopping FREE emergency room visit in a land of socialized medicine,carlgorn,politics,https://www.reddit.com/r/politics/comments/93jak/my_whopping_free_emergency_room_visit_in_a_land/,"It seems to be ""oh the horrors of socialized medicine!"" story time!

Yeah, so last spring I was studying abroad in Ecuador and I was interning at an orchid reserve in a cloud forest by Quito. I was doing what foreign interns love to pay money to do; manual slave labor. So I was lifting some rocks and I felt a sharp pain on my finger which I thought was the rock poking me. Then I screamed ""Holy fuck shit cock damn oh my god fuck shit!"" and I ran to the nearest stream and threw my hand into the cool water hoping this would somehow ease the pain. My finger then started to turn red and swell and it doubled in width. I felt a little uneasy about the pain and swelling and gripping my hand I stumbled around a bit and sat down wondering if this was serious. I knew it wasn't a snake, since the only poisonous snake there is freaking huge. I thought it must have a been a spider or scorpion, which is still pretty bad. After minutes of contemplating my situation, my arm sunk into numbness and I started to feel a bit dizzy, probably from my anxiety attack.

I then realized this is potentially bad and I needed to get my ass out of the forest and to a hospital. I left the garden and went across the street to the reserve's restaurant, where I explained my situation in terrible spanish to the old crazy reserve owner, who told me it was probably a crab. I thought ""ummm, I think I'm going to go ask someone else now....."" Thankfully, some couple at the restaurant overheard me and offered to drive me to the nearest town's hospital about 10 minutes away. So they drove me to the small town of Nanegalito, which was the area's only hospital.

We then went into the emergency room where I waited about 1 minute to receive help. They promptly took some of my blood and shot me full of painkillers (Sweet!) and did some sort of test thing to it to determine if I needed an anti-venom. While waiting, they asked me questions about who I was and where I was from and why I was in Ecuador they didn't seem to care that I didn't have proof of any of what I was saying. After 10 minutes, they told me to come in 6 hours to make sure that the venom in me is not serious enough to warrant me to carry around a baggie full of anti venom. I came back 6 hours later, and everything was A-OK!

I'll admit, I was kind of afraid to go to hospital in the middle of nowhere in a developing country. But all the doctors seem well trained and had new needles and gloves and plenty of medical supplies and training. They also must have known of all the local poisonous animals since they told me it was a scorpion based on the symptoms and the blood testing thing.

How much did this all cost me? Nothing! Not once did they ask for money and they did not even care that I was foreigner! Their main concern was to make sure that I was not in any danger of harm and to make me comfortable and feel better. Oh socialism, so evil.

But no! The insurance companies here would have us all believe that because I was in a third world country with socialized medicine, I would surely not have received medical attention and would have died if the poison was lethal!
"
94x28,100,2009-07-27,"Hey Reddit, just so you know, I'm happy right now.",calantorntain,happy,https://www.reddit.com/r/happy/comments/94x28/hey_reddit_just_so_you_know_im_happy_right_now/,"I'm usually just content.  It isn't unpleasant, but it's just... contentment.

But I was driving back home, after visiting one of my best friends for the weekend, and realized that I was happy.  My internship is going alright (as far as I know).  I've got a good roommate.  My health is in order, and I've lost 10 pounds in about a month because I've started eating healthy and exercising.  I've found a cool place for atheists to hang out in Indianapolis.  I'm volunteering at least once a week at Planned Parenthood.  My parents are in good health, and I'm on good terms with my sister.  

Oh, and in a couple of weeks I'm going to have three people sleeping over (... including a random Reddit guy, so he doesn't have to waste money on a hotel), and it's going to be marvelously epic because it will involve midnight tacos, fruity pancakes, The Decemberists, and although the other two guests are cool, the third is one of the most awesome people I know and I can't wait to hang out with her again\*.

It's just... an unusual feeling, despite the fact that my life is usually pretty good anyway.

Are you happy today, Reddit?

-----------------------

\* I suppose I should put in the disclaimer that I'm female, and thus I'm looking forward to hanging out with her because she is hilarious, and not because I'm trying to do her.  I really should have picked a more gender-obvious name, I think."
