cytjx,2,2010-08-08,"8/7 opinions - So, what's all this going on behind the curtain?",FormerDittoHead,personsunknown,https://www.reddit.com/r/personsunknown/comments/cytjx/87_opinions_so_whats_all_this_going_on_behind_the/,"To follow up on my prior ""dropped like a stone"" post, the ""romance"" between Moira and Graham is totally... FORGOTTEN!  They didn't even sit next to each other at the table!

But finally we get to peek behind the curtain, A curtain, and my-oh-my these people are either understaffed or doing a lot of *other* things (like playing Solitaire or coordinating the explosive charges on the twin towers?)

It's almost as if ""the village"" is a distraction...  

""We're busy playing Team Deathmatch on the LAN, Jeeves.  *You're* in charge of the main project of everything we do!""  

All those TV cameras.  Did they give Halliburton the CCTV contract and then run out of money after they got the bill?  When Jeeves is at the front desk - no one is watching?  They should have thought about outsourcing or getting some interns!

What's the camera / viewer ratio?  1:1,000,000? Like, there was one camera looking sideways down the gutter at the top of the building?!  (cross shot shown as Joe was dangling Janet over the edge)  They want to keep track of the squirrels? ..  

OK, who's ""the chosen one""?  The next president, or the one to replace the doctor in charge?

OK jump to the father/reporter and editor.  Writing/acting still falls short for an otherwise noble effort in injecting some romance.  Some writers just don't do romance (David Mamet for one)

BUT, I had to write this post to begin with because toward the end, TWO MINUTES before the old priest got shot, I said to my wife, ""oh look, he'll get ready to tell them something very important but then get shot..""     HOWLS OF LAUGHTER ENSUED!  Do they really think we're that STUPID?

ARE WE?  FOUR MORE TO GO TO FIND OUT!"
cyvh5,15,2010-08-08,What are you doing to improve yourself as a person?,PPatBoyd,AskReddit,https://www.reddit.com/r/AskReddit/comments/cyvh5/what_are_you_doing_to_improve_yourself_as_a_person/,"I subscribe to the belief that if you're not making progress and moving forward, you're regressing.  What are other Redditors doing to improve themselves and work towards becoming the person they want to be?  How are you making the change?

For myself, I'm working to make myself smarter by studying Computer Science and Math at my university, working at internships over the summer, and reading reddit of course.  I've been hitting the gym hard this summer and will be working hard to keep it up over the semester (losing routine always made it harder for me to keep up going to the gym).  I cut out all sodas from my diet finally, and I'm eating a bit better too.  Another small thing that I'm working on is cutting out swearing, I wouldn't want any kids of mine picking that up from me."
cyx1n,9,2010-08-08,IWasA United States Senate Intern. AMAA,MrNecktie,IAmA,https://www.reddit.com/r/IAmA/comments/cyx1n/iwasa_united_states_senate_intern_amaa/,"The rules (because I know there's at least a few redditors in the office I was just in):

No names of my co-workers.
I will not mention my Senator, their state, or anything that could ID the office I was just at.
Anything else (within reason) is fine.

Some background:

* 10 weeks -- May until August
* I attend PSU, however, I didn't intern in either of PA's senate offices.
* I did a lot of stuff relating to the DWH disaster -- I started a little under a month after the rig went down and watched the whole thing unfold on the Capitol Hill side of things.

Okay -- a little tighter than the white house one, but I'm a paranoid nutjob to begin with. Have at it!

**EDIT:** Going to bed soon. Hope to answer more tomorrow -- they've been great so far! :-)"
cyzij,0,2010-08-09,"Reddit, I need your guidance. I have a strong passion to pick up and move from my beloved Washington State.",Xcountrymovin,AskReddit,https://www.reddit.com/r/AskReddit/comments/cyzij/reddit_i_need_your_guidance_i_have_a_strong/,"Suppose I should start with a condensed life story. 
I've grown up in a middle/upper class community all my life. I love my family, and I have the security of knowing they'll always be there for me and would have dinner on the table in a minute if I were to return home. There is nothing my parents have given me that I have ever taken for granted, so this isn't some rebellious FUCK YOU to them. My friends are wonderful and if it weren't for them I'd be gone already.

I am a 22yo male currently enrolled in community college to earn my AA degree in business before transferring to a university, but have only completed a few semesters so the pressure of knowing how much time/money I'll be spending at school is daunting. College is not something I'm passionate about at all; I've always been a hands-on learner, and everyday it feels like more time, opportunities, and potential are wasting away. Currently the biggest concern in my life is keeping good grades, and I feel selfish because of it.

I also intern for an online retailer, essentially running my out-of-state boss's business which he may or may not be interested in growing after my internship is completed which makes keeping my own interest in the business very hard. I pretty much browse reddit and FB chat with my friends all day in between processing orders.

I can say that I've worked several 9-5 jobs enough to know that am not interested in trading time for a paycheck, and am not motivated by money. I have a strong entrepreneurial spirit and know that I will own my own business one day serving the community somehow on a great scale... though getting there is another thing I've yet to figure out.

I want to start anew. Get out of my hometown and experience the true insecurity of being essentially on my own and not knowing what tomorrow will bring. The most important thing I've learned working in an office on my own is that I need to be surrounded by people; I'll bear the rest of the 2 months I signed up for in my contract, but I absolutely can't stand being barred in an office alone; it feels like a prison I need to escape from everyday.

Reddit I need your help. What kinds of resources are out there for someone like me that will help me start a life somewhere else? Do you know anyone who has done something similar who could give me some advice? Where the hell am I gonna go; where the hell am I gonna stay; where can I go that I could have the biggest affect on my countryman? I have no idea, but not knowing is far more exciting than my current 5 year plan.

I don't need to hear that I'm being a selfish prick for not taking advantage of the opportunities I have here, because I feel that my life has a greater purpose than just making money so that I can have it when I grow old. A wife and children will come someday, but for now I need to experience life. If you would like to know more about me, I am honest and open to questions.

And thank you beforehand whoever you may be, your opinion is valued.



"
cz3an,2,2010-08-09,Hey Reddit - I've been unemployed for over a year and a half and am now looking into how I can pay someone to find a job for me.  Any advice?,desperatejobseeker,AskReddit,https://www.reddit.com/r/AskReddit/comments/cz3an/hey_reddit_ive_been_unemployed_for_over_a_year/,"I have currently been unemployed for a year and a half and am desperate for help in finding a solid salaried position with a company in which I can grow.  I've had no luck after sending out about 600 resumes and landing over 50 interviews.  Do you have any advice on, or experience with, how I could go about paying someone to find me a job?  Most of the professional staffers and recruiters in my area only work with wage-seeking temps or people with executive level experience.  I'm looking for an entry-level foot-in-the-door position and am willing to part with my first paycheck or two.  I would be extremely grateful for any help you can offer.

To give you a little info about my background:

**Background:**

* 2008 Graduate of the University of Illinois at Urbana-Champaign 
* B.A. in Economics 
* One semester of post-baccalaureate/graduate courses
* Experience in Customer Service, Academic Research, Team Management, and Data Entry. 
* Two years as Undergraduate Research Assistant (For Credit - Not wage) 
* Knowledge of MS Excel and Access (and obviously MS Office Suite) * 109 words per minute typing speed. 
* I am authorized to work in this country - I do not have a criminal record and am a citizen of the United States (born and raised) 

**Type of Job I am looking for:**

* Anything in the financial sector 
* Statistical and data jobs 
* Analytical research positions 
* Internships okay

**Type of Job I am not looking for Assistance Finding (because I'm already looking for these on a full-time basis on my own):**

* Sales/Financial/Insurance sales services (including financial representative positions)

**Compensation I'm willing to give for help**

* I will give the value of my first paycheck or two to whoever can find me a job that I interview for and accept. 
* If the position is for an INTERNSHIP, I'm willing to negotiate a fixed price


Any help would be greatly appreciated.  I don't really know how to go about doing this.
"
cz46g,16,2010-08-09,I fucked up.,ididsomethingstupid,relationships,https://www.reddit.com/r/relationships/comments/cz46g/i_fucked_up/,"My girlfriend and I have been dating for about 9 months now. Me 21, her 20. We haven't been as sexually active as we used to be (weird to say after dating only 9 months). It used to be daily, then weekly, now monthly+ thing. I have mentioned numerous times in non-argumentative ways how I have wanted this to change i.e. ""Hey it is really important for me that we have a strong sexual connection in our relationship."" Her: ""I know, I like sex with you, we will have sex tomorrow because I am too tired tonight."" Story repeats all the time. I asked if it was performance and she said no as she comes easily.

Now, one of the new interns at my work (CIO's niece O_o) started to really have a thing for me. We have hung out a few times (did nothing out of line) as a group with other co-workers. Another time, she asked me to come hang with her and her friend at her Uncle's(the CIO) house where she was staying. Went there, played video games, and again nothing happened. Nothing ever came up about dating or if either of us had a boyfriend/girlfriend (as I didn't get the impression she felt that way about me). However, she did know I had a girlfriend.

Now comes Saturday night. She was going to the club with some of her friends and a bunch of people from work. She invited me and I accepted. I met up with her there and danced a bit and I had a drink or two. Then when we were dancing, she grabbed me and we made out. I am in no way blaming the alcohol for me making out with her. I knew what I was doing but I did it anyway. My girlfriend is NEVER forward like this which is a huge turn on for me and I have mentioned that to my girlfriend as well but nothing changed.

I have decided to tell my girlfriend for two reasons. I want to own up to my mistakes, even though she will most likely dump me. The second, I know she will find out in one way or another and if I want any chance at a continued relationship with her, I know I have to own up to it. However, I am starting to like this new girl a lot.

In you experience Reddit, should I try to salvage my relationship or is it time to move on to new opportunities?

TL;DR I have a girlfriend, made out with CIO's niece, salvage relationship or move on?"
cz59d,7,2010-08-09,"I'm making a presentation to defend the internship program at my job, any ideas for ""selling points""",llamaryder,AskReddit,https://www.reddit.com/r/AskReddit/comments/cz59d/im_making_a_presentation_to_defend_the_internship/,"I'm currently an engineering intern at a utilites company, and corporate is thinking about tossing the internship (summer help, as they call it) program out for next year.  My regional boss came to me to come up with a Powerpoint presentation defending the program, and I'm kind of at a loss.  

My thoughts keep circling around something to the tune of ""we do mind-numbing work for 1/3 of what you pay everyone else"", but that's all I've got so far (worded more nicely of course) 

What other ideas could I include to save my job for next summer?"
cz5kr,3,2010-08-09,"I am going to China (Shenzhen) for my internship, any advice?",jnothing,travel,https://www.reddit.com/r/travel/comments/cz5kr/i_am_going_to_china_shenzhen_for_my_internship/,"I am studying CS in Turkey and going to China for my internship. I will work in Shenzhen for 1 month. I only know English, no Chinese. I am kinda excited because I have never been abroad before. I would really appreciate any advice.

Note: I have tickets to Beijing which I'll stay for a few days, to see the city. Planing to take the train to go to Shenzhen from Beijing."
czb4l,5,2010-08-09,Ways to withdraw Canadian funds while in America?,itacky,canada,https://www.reddit.com/r/canada/comments/czb4l/ways_to_withdraw_canadian_funds_while_in_america/,"Hi /r/Canada,

I will be living in the USA for a short time this fall (4 months) and won't be earning any money while there (a volunteer internship position at a University). While I will be bringing funds with me, it is likely the case that I will need to get additional funds from Canada while there.

Thus my question: Know of ways cheap methods to transfer funds from Canada to the US?

One option I considered was opening a Scotiabank account. They have a partnership with Bank of America to waive fees when using their ABM's to withdraw cash. Thus I may withdraw American using the Scotia account and deposit it into an account I open there.

tl;dr: Need a cheap way to transfer Canadian funds to America (assuming you are in America)."
czcmj,3,2010-08-10,Help me find an IT job in Ottawa!,Vigil123,canada,https://www.reddit.com/r/canada/comments/czcmj/help_me_find_an_it_job_in_ottawa/,"I've basically graduated last semester in Comp Sci and had a small contract job for the summer while waiting for my application process to go through at the federal government (which I know to be a lengthy process). I have had good grades (A- average) but few work computer work experience outside school-run projects (some sort of internship partnership).

I learned about 2-3 months ago that I wasn't allowed to apply to the student program because I now am a graduate and not returning to full-time studies. So here I am about to re-apply on September 23rd for the good program this time (post-secondary one) when it opens. 

Most people I know that got gov jobs did it through friends/family members who were in for many years or agencies after a while (few months process to get security clearance and then get a job). 

So I was wondering if anyone got them connections or maybe know an agency that actually works as the ones I've tried barely take time to answer you if at all. **Looking for tips/suggestions or links to recruiting programs for junior positions**. 

I prefer a stable position over contracts so that's why I think the government would suit me the most. I'm bilingual (French first, English second), prefer web development (xhtml, css, javascript, php, mysql, bit of asp and .net), I also know java and c++."
czcmm,1,2010-08-10,"Mr. Reddit, is Political Science a useful or useless degree?",[deleted],reddit.com,https://www.reddit.com/r/reddit.com/comments/czcmm/mr_reddit_is_political_science_a_useful_or/,"I've been reading around the 'net and am finding little to no evidence as to how society treats poli. sci. majors. I know that most of them, like me, are aiming to go into law, but I'm not entirely sure if I made the right choice. I love studying how leaders make decisions on various factors in politics and take a general interest in how government works.

If anyone can advise me here, that would be awesome. Your reward will be the immense satisfaction of helping out a fellow redditor. Thank you!!

**FYI:** I am planning on law school, the reason for this post is to figure out what would happen if I went with only a bachelor's degree in political science and some internships?"
czfln,0,2010-08-10,Any investors or advisors able to help with a survey of current clean tech investment (please)?,LBC,business,https://www.reddit.com/r/business/comments/czfln/any_investors_or_advisors_able_to_help_with_a/,"I'm a long time redditor (started a new account for this) currently undertaking an internship at an independent advisory start up specialising in the clean tech sector. I've been tasked with a market research piece however getting hold of any prominent investors, especially during the holiday season is almost impossible let alone &gt; 100! If any investors or advisors (including lawyers and accountants) who operate in the clean tech field are able to help it would be greatly appreciated.

The survey can be found here: http://www.surveygizmo.com/s3/340410/db20853a78a0

The company website can be found here: http://www.londonbridgecapital.com

Or send me a PM and I can call you back."
czg7y,23,2010-08-10,Reddit?! How have you dealt with procrastination/your internet addiction? (seriously),aia_ta,AskReddit,https://www.reddit.com/r/AskReddit/comments/czg7y/reddit_how_have_you_dealt_with/,"Hi!

I know asking reddit how to deal with internet addiction is probably the same as going to a bar and ask for help with alcohlism.

But as reddit is a pretty diverse place I hope to find some advice by people who quit pissing away a ridiculus amount of time on reddit and the rest of the internet.

I just quit my studies and should apply for some internships and should do some stuff prepare for the thing I want to study but fuck I just procrastinate about all of this. I cant get anything started.

Its not like I dont go out with friends and stuff but everytime I have to do something worthwhile I get stuck at my PC wasting my time on the internet.

So has anyone some advice? A book to read or something else? I think Im not totally alone with that problem here.

Thank you!
"
czjl5,2,2010-08-10,"I am going to China (Shenzhen) for my internship, any advice? ",jnothing,AskReddit,https://www.reddit.com/r/AskReddit/comments/czjl5/i_am_going_to_china_shenzhen_for_my_internship/,"I am studying CS in Turkey and going to China for my internship. I will work in Shenzhen for 1 month. I only know English, no Chinese. I am kinda excited because I have never been abroad before. I would really appreciate any advice.

Note: I have tickets to Beijing which I'll stay for a few days, to see the city. Planing to take the train to go to Shenzhen from Beijing.
"
czmt8,16,2010-08-10,Anybody know of a place that's hiring? Or is anyone willing to hire a local redditor?,audiointern,toronto,https://www.reddit.com/r/toronto/comments/czmt8/anybody_know_of_a_place_thats_hiring_or_is_anyone/,"*Note: This is one of my throwaways, I've used it before, and I'm using it now, as I am friends with people at work on here. I'm a pretty active user in this subreddit, so please don't think this is spam! If you need proof, just PM me and I'll tell you my other username, with some kind of proof.

Job Bank, Monster, Kijiji, Craigslist, Resume Canvassing...

These things are getting me nowhere. I thought I'd turn to you guys to see if anyone knows of a place that's hiring.

3 years experience in retail sales (one of which is as an assistant manager), a year in Audio Engineering (along with a diploma from Metalworks).

Currently an intern at an audio studio, but that looks like it might be even longer until I get paid, I don't have that kind of money to burn anymore.

I'd prefer to keep doing one of those things, as I'm great with customers, and I'm even better with audio and artists, but at this point, I'm not picky.

Please don't shoo this off as spam, and I AM a good worker, and I'm good with interviews, but it's hard to get to that stage when people aren't hiring (especially in the audio industry).

I'm just looking to network through here to see what kind of options there are, and to work with a fellow redditor would be a lot of fun!

Would love to work in the audio industry still, but sales is fine too! And general labour is alright too, as long as it pays for the work put in.

PM me, or comment if you know of anything!"
czt12,0,2010-08-11,"I'm considering moving to Japan in a few years, any reason not to?",bobmeister258,AskReddit,https://www.reddit.com/r/AskReddit/comments/czt12/im_considering_moving_to_japan_in_a_few_years_any/,"Sounds like a cool place. Majority atheists, a culture thats chill with a healthy gaming habit. I'm trying to convince my girlfriend (we live together in an apartment in Washington) and she's having none of it so far. We've got two cats, but she says house cats are so rare they have petting zoos for them... :/

Don't mind learning another language and getting reintroduced into another culture. And it's tough to find a place that's more expensive to live than Downtown Seattle. Are there any reasons NOT to live in Japan?

Edit: A bit more about myself because I guess I didn't give enough details. Yes, I don't mind spending 2 years learning Japanese. Life's too short without trying something new. Both me and the girlfriend are white. I'm about to graduate in 2 years with a mathematics/computer algorithms degree. I have work experience now through an unpaid internship, but no real job lined up after college. I bet there's a market for a computer techie that knows English, right? I just want to do something cool with my life and get away, and every time I see pictures of Japan, hear stories, of course I'm into anime/manga, it just seems like such a homely place. And every time I turn around, America just seems to get uglier. Maybe I just have a negative viewpoint, though...

Edit 2: Well thanks for all the advice! I might study abroad over there for a few months, but I'm definitely not making plans about moving anymore. I might even try somewhere else as well, like Pooh_Bear and ChingShih suggested."
d05kc,4,2010-08-11,Calling Current UCD Undergrads!,fishykitty,UCDavis,https://www.reddit.com/r/UCDavis/comments/d05kc/calling_current_ucd_undergrads/,So I intern at a lab and we're looking for paid subjects. You need to be a current UCD undergraduate and be willing to come out to South Davis for an hour. We will pay you $10 for your time. It's a behavioral psychology lab and what we're asking you to navigate through a virtual environment and we will test your memory. Send me a message/comment if you're interested/have questions! 
d0e46,79,2010-08-12,I am a Microbiologist. AMA.,[deleted],IAmA,https://www.reddit.com/r/IAmA/comments/d0e46/i_am_a_microbiologist_ama/,"With the top article right now about antibiotic resistance, I thought people might have questions. I have a B.S. in Micro, and will be finishing my M.S. this year. I have done an internship in a hospital in Lima, Peru, and also helped study antibiotic resistance in a north-central Florida hospital. If y'all have any questions about how antibiotics work, how resistance develops, or what the implications might be, I'd love to try and answer them!"
