aj06r,2,2009-12-27,"Reddit, Internship or Co-Op advice?",dimitriA,AskReddit,https://www.reddit.com/r/AskReddit/comments/aj06r/reddit_internship_or_coop_advice/,"Hey, I'm an undergrad studying Mechanical Engineering at Purdue. I've got a decent GPA, and some work experience. 

I bow before the wise gurus of the Reddit community. Any advice on finding internships or co-ops in the aerospace field?"
ajbzr,6,2009-12-28,How does a lowly Brit get an internship in the US of Awesome?,doctorwut,AskReddit,https://www.reddit.com/r/AskReddit/comments/ajbzr/how_does_a_lowly_brit_get_an_internship_in_the_us/,"Dear Reddit, I am studying for a BSc in computer science, I'm in my second year now and I'd say this is what I'm meant for, I live in the UK and there doesn't seem to be many opportunities around here.
I have a place to stay in San Jose over the summer, and my amazing parents have agreed to pay to send me there if I can get any kind of relevant internship so, how can I do that? I hope I'm not starting too late."
ajphy,0,2009-12-29,Any Film Industry Redditors out there? Looking for job advice.,mirrorball789,AskReddit,https://www.reddit.com/r/AskReddit/comments/ajphy/any_film_industry_redditors_out_there_looking_for/,"I recently graduated as a film student and I have a Bachelors degree in visual arts media, film emphasis. However because of the economy, even though plenty of people are going to see movies nowadays, I'm  really struggling to find a paying job. I've been doing internships left and right in and out of school. I currently interning at a small production company in LA, but when I asked them, they said they couldn't afford to hire new people any time soon. I've made quite a few connects and I've asked them to keep me in mind if they have any openings or if they hear of any openings, but still no dice. Now I've got student loan payments coming up and I'm starting to panic because I have no job. I mean, what good were those student loans if I can't even get employed with my degree?

I understand that it's a very competitive job market, but I was just wondering if I'm doing anything wrong and if any redditors out there have any suggestions and advice on what else I should or could do to get a job in the industry. Any and all advice is welcome. I'm pretty desperate here. Thanks.  "
ak2d5,5,2009-12-30,Hello London redditors! Could you help a Swedish student/flash developer in need of a place to live in Feb/March?,gogoyubari,AskReddit,https://www.reddit.com/r/AskReddit/comments/ak2d5/hello_london_redditors_could_you_help_a_swedish/,"I've got an internship in London from Jan 25 to April 2. Yay! Now I need somewhere to live; a flat, room or cupboard under the stairs, for 2,5 months. I have a hard time finding a place since people generally want you to rent for at least 3 months.

I'm a 25 year-old girl, like movies, music and all kinds of pop culture. For more detailed nerdery, see my [blog](http://malinenestrom.com/blog) or [twitter](http://twitter.com/malinenestrom).

Help me, redditors! Do you know anywhere I can live?"
