afdy5,19,2009-12-16,How do I negotiate a starting salary when going from an internship to full-time position?,notliberal,AskReddit,https://www.reddit.com/r/AskReddit/comments/afdy5/how_do_i_negotiate_a_starting_salary_when_going/,"I have been in a part-time internship for the last 3 semesters of my undergraduate degree. I will be graduating and recently went through the interview process to convert my position from intern to full-time.

I am wondering what the protocol is for negotiating my starting salary? I have yet to interview anywhere else or receive any other offers. I really like the company and don't want to ruin my chances to work for them.

What steps should I take to make sure I get the salary I am worth?"
afeke,8,2009-12-16,Combating End-of-Internship-itis,kyew,Peptalk,https://www.reddit.com/r/Peptalk/comments/afeke/combating_endofinternshipitis/,"I'm wrapping up a six-month internship in two weeks, and I've begun setting records for unproductivity. I'm pretty much unsupervised, and work consists of me sitting in front of a computer, alone, in a windowless room, for eight hours a day. Reddit, how do you get off Reddit and get boring work done?"
affx0,7,2009-12-16,"Stuck in Corporate Hell. I have a BS in E-Commerce (PHP, MySQL, Javascript), but I'm spending my days spellchecking pages in Word and doing repetitive HTML/CSS edits. My brain is dieing.",helpmyjobsucks,needadvice,https://www.reddit.com/r/needadvice/comments/affx0/stuck_in_corporate_hell_i_have_a_bs_in_ecommerce/,"So I graduated from college with a BS in ""E-Commerce"" in 2007. I am fluent in PHP, getting started with OO programming... I can write SQL queries by hand, and have no problem implementing javascript or writing it from scratch.

I sat around the house for a few months looking for jobs, eventually broke down took one at a local kayak store. I thought this would be a lame job, but i was able to completely re-do their site including building a new CMS, migrating their forums, and upgrading their store software to a version that didn't critically fail every 12-24 hours. If it weren't for superiors that treated me like crap and openly mocked me, I'd still be there. If I wasn't the only technical/programmer person at the company it would have been a dream job. I worked there for a little over a year.

About 8-9 months ago, I got a new job at a company in New York City. I was brought in as a front end developer, and during my interview I was given a test where I had an image of a site, given some .jpgs and asked to reproduce the layout. I have not done this once since starting. Here are some of my day to day tasks:

""Customizing templates"" with directions given to account managers (not trained in web dev) by clients. Horrible usability decisions (having an excessive number (all) of non-necessary fields of a form be required, removing any listing of an address or location!) &amp; beyond hideous colors are not even questioned. Our account managers are incapable of telling clients that their baby is ugly.

Collecting Content - I was told we would be presented with cases (all the info, ready to set up) that had all the content within them. The reality is that with almost each site setup I do (70-80%), I have to go and download images, re-code HTML, and generally pull the content that the account managers were supposed to.

Checking Content - in addition to collecting the content, we need to make sure phone numbers and web addresses are not present in the content we put on our sites. The account managers never do this, and we are unofficially saddled with the task of watching videos for phone numbers, removing it from content. I am glorified bipedal CTRL + F.

Spellchecking pages with word. After we publish sites, because the account managers are too lazy to check the content given to them by clients, I have to spell check each page by copy/pasting into word. Manually. Our content repository is riddled with encoding bugs (A chars) and asking for these to be fixed is like trying to get a small child to go to the dentist.

Template errors - the templates we use to set these sites up are coded extremely inconsistent (some have an images folder, other an image folder, others img) and getting bugs fixed in these is another exercise in futility. The people who write these templates seem to be excused from the quality checks that each of our setups is held to.

If any of these errors (created by the account managers or template developers) slips through, there is no recourse for them but we get marked down and have to go fix the problems. The account managers/ template developers continue to make the same mistakes and management is oblivious to this, or just doesn't care.

Dealing with our monolithic, bug prone CMS - we are using a custom in-house built CMS that does all this work. In addition to forcing me to do all my HTML/CSS work inside web text boxes, there are tons of documented issues with the CMS that the team who works on it refuses to fix. Creating a domain name with uppercase letters will cause bugs. We have systems that are KNOWN to be not working properly, but management is content having us ""do the dance"" required to get the system to work… even if that means making us do 3-4 times as much clicking. Any suggestions to fix or improve the system is met with ""well our new system is coming!"" It was supposed to be out last july. New features are still being rolled out on the old CMS (unannounced, or at least not to me) despite any requests to get other things fixed.

These are a few of the things that drive me REALLY insane, but I'll leave it at that for now. I am trained in PHP, MySQL, and a bit of javascript as well. I get to use none of this at work, and it's like depriving my brain of oxygen to do the tasks presented to me. Each day I come in I want to give my two weeks notice, but I can't find another job in my geographic area (North Jersey) so my health insurance is in jeopardy if I take this path.

I commute about 2 1/2 hours each way to this job every day, via train &amp; car. In the morning i have to get up around 5:30 to get a 7am train... so I end up sleeping the entire ride. At the end of the day (I get out at 6) I am usually so frustrated from work that doing anything constructive is virtually impossible.

I don't know how to get out of this trap. I have been searching for jobs via cragislist and indeed.com, but I am having a lot of trouble finding jobs that fall between ""Superstar Lead Developer"" and ""HTML Bitch Monkey / Intern"". Right now I would take basically any opportunity that presented itself, and gave me a viable option to continue receiving health insurance. 

I am frustrated, lost, and don't know where to turn to get a leg up. I have sent my resume out as much as I can, but i haven't gotten a single response back. I feel trapped at my current job with no way out. I spent my 60m break toddy writing this up… I wanted to write my  2 weeks notice again today. Help."
ag6za,9,2009-12-18,Was it an allergic reaction or a panic attack?,[deleted],AskReddit,https://www.reddit.com/r/AskReddit/comments/ag6za/was_it_an_allergic_reaction_or_a_panic_attack/,"I will try to be as brief as possible what happened and also withhold some information about my medical history so you will be more inclined to give a less biased opinion.

Today my wife and I decided to go to the beach again, but that fun was cut short after I was stung on both my thighs, back and front, right arm and lower abdominal by a Bluebottle(Portuguese Man O' War).

I got stung around 2.30pm

After having some intense pain for a short while we decided to head home.

When I got home I felt a minor shortness of breath, but did not think much of it. That happened right after 4pm.

Around 10pm we decide to go to the ER as I learned that you can have an allergic reaction to a Bluebottle sting and my shortness of breath was getting slightly wrose/annoying.

After being poked with needles, x-rayed, questioned and given ventolin they found nothing wrong with me.

It is 2.30am and I am having minor shortness of breath and not sure if I should go back or not.

What annoys me the most though is that the intern doctor decided to give me the following diagnosis: panic attack.

All I did when we got home was to sit in front of my computer and relax.

So, reddit, what do you think? Did I get, or still have, an allergic reaction? Or did I get a panic attack by being lazy?

**Update**

It is now close to 4am and the shortness of breath is getting better.

I thank everyone for their input. I know I should not take any advice here as fact and I should of course consult a real life doctor. Regardless of that I have had my fair share of experiences with given a wrong diagnosis resulting in me having to go back again.

I am aware that some doctors work a lot more than they can handle and interns need to learn; but sometimes that bad decision can cost someone their life.

I had asthma when I was a kid. I have not had a asthma attack for the last 5-10 years. That I will suddenly out of no reason have a asthma attack out of the blue seems highly unlikely.

It seems too incidental that I get stung by a Bluebottle and get one of the typical symptoms of an allergic reaction.

As a psychologist will tell you; 'if you ever have had a panic attack, you will know if you get it again'; and the feeling I had was not a panic attack.

Again, thanks for your good feedback.

**Update2**

Thanks again for the additional info.

My wife had a talk with her mum, who is a well experienced nurse, and she had no doubts that I am having an allergic reaction to the Bluebottle venom. I might have a chat with my GP next week as I am considering to file a complaint on this intern. Next time her poor judgement might actually cost  a life."
aga4y,0,2009-12-18,"Dear Proggit, could a greenhorn get some help?",bobmeister258,programming,https://www.reddit.com/r/programming/comments/aga4y/dear_proggit_could_a_greenhorn_get_some_help/,"I'll try to keep this short. I'm a sophomore a university, want to be a CS major, taken two classes on Java, simple stuff like parsing, linked lists, binary search trees...

However, I just got a chance at an unpaid internship (to be a paid internship if I do well enough) at [a company] using (as far as I know) Microsoft Azure, C# and Python. However, I haven't done any coding (especially Python) in maybe 8-12 months...

This is my first real programming job, and I have to learn Python in about a week. Help? Resources?

**Edit**: My employer just called me back and specified that we are working with the newest version of python, 3.1.1, and that it is different from Python 2 in ways. I see that some commands were changed that break the code going from 2 to 3 (or vice-versa), so guides focusing on 3 would be great :)"
agkyr,0,2009-12-19,"Reddit, I'm looking for a summer internship. Can anyone help me?",spinache,AskReddit,https://www.reddit.com/r/AskReddit/comments/agkyr/reddit_im_looking_for_a_summer_internship_can/,"I'm a year and a half away from graduation and want an internship or seasonal job this summer, anywhere in the U.S. will do. I'm an English major, minoring in Environmental Studies and Philosophy. What I'd really like to do is intern for a non-profit, preferably in some sort of environmental field, but not necessarily. 

Has anyone had any experience interning? If so, how did you come about the opportunity? "
agulo,6,2009-12-20,I'm an atheist and i have to write 3 pages about my Jewish experience and emotional connection for an internship. I can't do it.,trogdor1134,AskReddit,https://www.reddit.com/r/AskReddit/comments/agulo/im_an_atheist_and_i_have_to_write_3_pages_about/,"I was born with jewish parents, but i quickly became atheist.  I hate everything about our jewish community and my jewish experience, but now my mother has found me an internship through a jewish organization and i has to write 3 pages all about my wonderful jewish experience and how it helps me in life and AAARRRRGH. i can't do this.

I probably jst man up and B.S. my way through this, but i feel like i can't. I can't sell out like that.

**EDIT:** here's what i've writen.  i think i'll have to start over.

I grew up in an extremely Jewish environment, where being Jewish put you in the majority.  My family was reformed, but my great grandmother was orthodox and my uncle Gregg kept kosher in his household.  This put me in a little Jewish bubble.  I can’t say I minded this little bubble for a few years.  If everyone is like you, then what is there to hate, right?  Of course being from Beachwood, I and all others that would eventually make it off to college would be told numerous times that “This isn’t the real world” and “People might not like you just because you’re Jewish” or even “Some people will think you have horns,” but it appears that I’m jumping the gun a bit in my biography.  


From a very early age I had a connection to the Greater Cleveland Area.  I remember one of my first baseball games.  When we got past a certain street we would lock our car doors.  I loved that sense of “tiers of civility.”  After a certain street, those who lingered in that bubble were worse people, evil people, who would like nothing more than to car-jack a mother, father, and two little children’s car for no reason.  Cleveland is predominantly Christian, so I was given the sense that outside of the Jewish bubble of Beachwood were terrible Christian people.  It was an interesting blend to say the least.  


From that point on, I knew that Cleveland was nothing more than a cesspool of crime and grime with nothing beneficial or worthwhile to come out of going there, especially in an unlocked car.  As for the suburbs of Cleveland, I never bothered to know any of the other children from cities such as Orange and Mayfield and so on.  I met them a bit while I was playing Middle School soccer, but that meeting consisted of me picking out a fat kid to guard and dribble past so I wouldn’t have to put much effort into the game.  Beyond this I never cared for and never will bother with the Greater Cleveland Area.


So anyway let’s hop back on the topic of Judaism.   I remember in 9th grade being told the story of Martin Luther and the protestant movement in Christianity.  Now I know this wasn’t the only reason for the separation, but the people were frustrated with the fact that mass was held all in Latin.  You see, there was already colloquial English and at that point no one understood Latin except the priests for obvious reasons.  So the people sat in church listening to a bunch of gibberish for an hour or so and then left feeling somehow hollow and unfulfilled.  How can they show interest and passion for something they know nothing about?  They can’t.  So what have I done for the past 18 years?  I’ve sat through a bunch of Hebrew gibberish for a few hours every service and then leave dissatisfied.  Sure they tried to teach me how to read Hebrew in Hebrew School, but then never taught me what it means.  What good is a language that you can read but don’t understand the meaning of what you read?  Right now you feel as though I have once again gone on a tangent and need to focus, but patience is something that I have grown to appreciate and so should others.  The point I’m making is that I felt like Martin Luther.  I needed to separate myself from this ignorant system.  I however broke off in a different manner.  I became an Atheist.  I first defined myself as thus in about 8th grade.  That means I wasted about 13 years with religion, just long enough for a Bar Mitzvah.  I’ve grown to despise the thought of god and I’ve come to understand the great amount of ignorance floating around in this world, and refuse to take part.


So why on earth would I apply to a Jewish internship?  Well, you’re going to pay me.  I hate jobs for the youth.  They consist of stocking and cleaning things.  That’s it.  So if I can get 2500 bucks and not need to work at a two-bit restaurant, I’ll do it.  The main reason however is because my family is Jewish and thus they found this internship, not me.  They are practically forcing me to apply, and thus I write these ramblings.  I hope you appreciate the 20 minutes I put in to write for your little Internship.  I don’t expect that I’ll hear from you.


**EDIT: Alright, I completely rewrote the essay in a formal and kind manner.  I don't think i'll post it here in case they find it here somehow and see this magnificent piece of writing above.**

**I wrote the truth, just simply not in it's entirety.  My new essay paints me out to be the perfect Jewish child that just can't wait to get this wonderful internship.  I feel dirty.**"
agz7n,0,2009-12-21,"Proggit: I need your help, please. ",[deleted],programming,https://www.reddit.com/r/programming/comments/agz7n/proggit_i_need_your_help_please/,"I'm lost folks.

This past week was my last week of undergraduate study. The grades are in, and I've passed! I now hold a Bachelor of Science in Applied Mathematics. Woo hoo!

I had some pretty big plans up until about a month ago. I was going to move to San Francisco in February and apply to a few startups. I figured that I'd be able to flesh out my resume pretty well over a year or two. With a decent resume in hand, I'd then be able to apply to a respected tech company with a reputable research arm. It's hard to plan beyond that point. But I could (in this future) possibly go back to school for a Phd or perhaps return to Tokyo.

This plan has had a wrench thrown in it, however. A wrench I should have seen coming.

I have about $45,000 USD in student loans which I have to start repaying in May. As of next next month, I also lose my parents insurance. So, I've had to rethink how I want to approach the next stage in my life. I was hoping I could get some input from those of you who have been in my position.

First thing is first: I need a job. My resume is completely empty. I have a couple interesting items I can list, like working as an English teach in Japan, being a Teaching Assistant for Japanese 101, or conducting undergraduate software development research under an NIH grant for a semester.

But that's it. I have zero industry experience in any field beyond those three items above. I really should have used my summers off in school to work as an intern.

So how do I work around this problem? Do I start contributing to open source projects? Should I start my own open source projects? Should I offer to work for free at a company so that I can display my competence in a given area?

I'm located in Loveland, Colorado right now. If I had to though, I'd move anywhere in the world (let alone US), to get myself back on track.

Thanks for any advice.
"
ah3sp,2,2009-12-21,"AskReddit, what are some decent holiday gifts ideas for the workplace?",drexhex,AskReddit,https://www.reddit.com/r/AskReddit/comments/ah3sp/askreddit_what_are_some_decent_holiday_gifts/,I'm a paid intern currently working in the Security and Risk Management department for a consulting company. For the holiday I was just given boyscout popcorn by one of my managers and a giant tower of chocolates by the CISO. I have to do shopping at lunch anyway... what are some relatively cheap gifts I could get for them? Thanks in advance.
ah7ty,0,2009-12-21,"Hey /r/photography ; I'm spending three months to work on my art, and I'm looking for help with exercises...",Nicholie,photography,https://www.reddit.com/r/photography/comments/ah7ty/hey_rphotography_im_spending_three_months_to_work/,"I got lucky this December. I traveled to Atlanta and interviewed with a fairly well known photographer there to intern with him. He accepted, and i'm set to move in the first part of January.

Outside of the massive amounts of time I plan on spending in studio and at his hip, I'm wanting to test myself with different exercises and drills to help me expand my knowledge of photography, and skill. 

That may be a little confusing, but hopefully this will clear it up. I'm currently breaking down these ideas by week.. .being I would dedicate myself to learning one thing, or practicing one thing per week. Here is some of the ideas I have already :

- Black &amp; White week : Where I set my camera to shoot monochrome only. Should help me not only learn a black and white eye, but to focus on content (by removing color). 

- Trey ""Stuck in Customs"" Ratcliff HDR Week : I love his crazy wild HDR style, and I thought a week dedicated to learning it and adopting it would be fun. 

- Point &amp; Shoot week 

- Portraits of Strangers week 

Etc, etc... Can you help out a aspiring photographer? What would you do with three months to hone your vision and purely work on photography? "
ahiaz,6,2009-12-22,Is it okay for me to omit my personal reference's address on an application?,BovineArmy,reddit.com,https://www.reddit.com/r/reddit.com/comments/ahiaz/is_it_okay_for_me_to_omit_my_personal_references/,"I'm applying for a few minimum wage jobs in between internships. It seems a ton of places want to know as much about my personal references as they do about me. Not only does it seem unnecessary, but I don't feel right giving out their addresses and stuff. Am I thinking incorrectly?"
airi8,13,2009-12-26,civil engineers; what is your job/what does your daily career life look like?,edlax,engineering,https://www.reddit.com/r/engineering/comments/airi8/civil_engineers_what_is_your_jobwhat_does_your/,"About two years from recieving my degree, am going into my first internship this summer. My question is, what does your job consist of? Does it keep you interested or is it monotonous? thanks!"
aisf2,57,2009-12-26,IAMA Person that suffers from anhidrosis. AMA.,FutureJohnson,IAmA,https://www.reddit.com/r/IAmA/comments/aisf2/iama_person_that_suffers_from_anhidrosis_ama/,"Hey there now. First post. So, I have anhidrosis. It's onset was slow, and started in my sophmore year of high school. I have now been unable to sweat for about 8 years. AMA.

Edit: Anyone else out there have the 'drosis?

Edit: Thank you all on the advice on how to sweat less. I shall take it into account.

Edit: Funny story. It took a year and a half for anyone to figure out what the problem was. Then they though that it might be the 'drosis. What was the test you ask? Well, I was led to a room. The male doctor told me to strip down to my boxers. He then proceeded to put powdered iodine (very reacitve to moisture) all over me, and then put a plastic heat blanket one me. Very uncomfortable situation. I was 16. What could make this better? A couple of minutes in, he had two interns (hot girls in their 20's) come observe. Easily one of the most uncomfortable situations that I have ever been in. Even through all this I DID NOT SWEAT IT. Literally. He then says that we have to be sure so he hooks me up to a wire, and says he is going to start shocking me at random intervals. All in all, it was pretty sweet."
aisnm,2,2009-12-26,"IAMA engineering grad student and TA at a top ten school, AMA",tramast,IAmA,https://www.reddit.com/r/IAmA/comments/aisnm/iama_engineering_grad_student_and_ta_at_a_top_ten/,"I'm an ECE master's student at a large public school in the midwest and originally from the USA (something that seems to becoming less and less common in this field).  I'm a graduate TA for an undergrad ECE course as well.  I absolutely love being a TA and put a lot of time into it.  Even though it's a pain in the ass and sometimes I just want to quit (as I'm sure many of you do as well).  I've also been lucky enough to be three-time summer intern and plan on staying with that company when I graduate.  If you have any questions about engineering, admissions, grad school life, internships, teaching, how TAs view students, I hope I can answer your questions.  AMA!"
aiyjr,29,2009-12-27,I help run the internship program at one of the largest natural history museums in the world.  I also help with and observe our general hiring process.  AMAA,HRintern,IAmA,https://www.reddit.com/r/IAmA/comments/aiyjr/i_help_run_the_internship_program_at_one_of_the/,"Since last summer, I've been an intern in the Human Resources office at one of the largest natural history museums in the world.  We have some of the biggest and best dinosaurs anywhere; our DNA lab is tops; we have a huge educational program, and we have a lot (and I mean a lot) of random things in the basement: millions of shells and squid, basins from Pompeii, a lot of (dead) fish from the Amazon, canoes, and a lot of stuff that Iraq might like back if only they could be sure it wouldn't be stolen.  

Last summer we had over 175 interns in 20 departments, including zoology, geology, anthropology, environmental conservation, Public Relations, Education, Exhibits, the DNA lab, and Events.  I arranged behind-the-scenes tours for the interns, and conducted their exit interviews.  So, I know how almost all of those interns got their jobs--and there's a lot of different ways to get an internship at a Museum, it turns out.

I also sit in on a lot of interviews for a lot of different hiring decisions, and I call references on the phone.  (Now that we only have about 40 interns in the building, and most part-time, I mostly file things.  I work part-time also, while going to school in the city.)

Ask me about how you can get an internship at a museum like mine, or about the hiring process in general.  I'll happily tell you anything I'd tell an acquaintance at school.

HR disclaimers:  I'm only discussing my personal experiences, observations and opinions about the Museum.  I'm not going to talk about which museum that is, and even though it might be pretty easy to figure out, please-please don't put your guesses here.  I'm well within our ""Internet and Blogs Policy,"" but I'd like to keep things fairly anonymous anyway.  "
