95cyx,33,2009-07-28,I'm a Brazilian [AMA],Resilience,IAmA,https://www.reddit.com/r/IAmA/comments/95cyx/im_a_brazilian_ama/,"Ask away.

Mostly, it sucks.


I'm a male 23 year old, Graphic Design student.

Living in Rio de Janeiro with my mother, have a 23 year old girlfriend.

Work as an intern in a state bank, my salary is way higher than the avarage intern and I work 4 hours a day. I think I need another internship with less pay and more tasks.

I'm into politics, national and international.

I'm caucasian, as well my girlfriend, my grandad was portuguese and somebody in my family was black beacause my mom is a bit dark in some features, but my dad was blondish (I don't speak to him anymore).

I hate the beach and carnaval.

"
95vu7,1,2009-07-30,Any biomedical researchers here? What is your day to day work like?,benjaminteeeee,AskReddit,https://www.reddit.com/r/AskReddit/comments/95vu7/any_biomedical_researchers_here_what_is_your_day/,"I'm considering doing some form of research after I finish college, and it's too early in my course for me to pick research subjects yet, so I'm looking for an insight into the work. 

I'm planning on getting an internship some time, but it'd be great to hear from some Reddit researchers! What field are you in, and what do you get up to in your work? Is it rewarding? Do you interact with many other people?"
