d1z9k,9,2010-08-16,Another whiny post. Sorry.,ffoffail,depression,https://www.reddit.com/r/depression/comments/d1z9k/another_whiny_post_sorry/,"I hate doing this. I'm sorry, I'm sure you read posts like this all the time. I just would like some anonymous advice coming from an anonymous person. 

My family has a history of depression, alcoholism, and other serious mental disorders. I've accepted that I am very prone to receiving them, and more so accept that I have one. 

When I was 15 my depression started. I was accepting my sexual orientation (gay), getting a fresh new start in High School, and continuing a rocky relationship with my parents (we are very passionate people who refuse to admit when we are wrong). This made me feel very lonely and upset. I started drinking almost nightly to help deal with it. One night I was about to kill myself when one of my friends came to my house and forced me to stay alive. Ironically my parents never let me speak to this person again because they believe that she made me gay (they don't believe this anymore) and that she made me have depression. 

I started going to therapy after my parents found cut marks on my arm. My first therapist literally gave me an internet test and diagnosed me with bipolar disorder and wanted to prescribe me some sort of anti bipolar medication. We didn't take it because it was too early to say that I have depression. Later we found out that she was getting paid by the company that makes those medicines and she lost her license. None the less, this gave me a complete distrust towards psychiatrists.

I went to another therapist later on but did not enjoy it. I faked my way threw it because I didn't appreciate his attitude and the way he treated me and my religion/activities (running, I hated it, he loved it). I kept on going to him because my parents liked him and I figured I could give an hour of my week if it eases their mind. I convinced him, my parents, and I now think myself that I was okay and over my depression.

During the rest of high school I devoted myself to extracurricular activities, mostly Speech and Debate and our Green Club. I have never been the best student for some reason or another, but activities have been my forte. 

Fast forward to college/present day. I moved 4 hours away from home to go to college because I strongly disliked my hometown and felt that I needed a break from my parents. During college I decided to follow up on the same path that I left in High School. I devoted myself to extra curricular activities (College Democrats (which I'm the president of), Alliance (Activism and Communications chair), and I was part of my hall government before I moved out). My schoolwork hasn't been the best, but it hasn't been the worst. I changed my major from Computer Science to Politicial Science. 

I love politics so much that I applied for an internship working for the 2010 elections. This also gave me a chance to get a head start on our 2010 GOTV plan for our campus.

During college I've met some of the best people that I could imagine, including my best friend/boyfriend. I've been in two long relationships before (neither ended on bad terms, but just happened to end) and can honestly say that I have told him more about myself and opened up more to him than anyone else, and I know that he has done the same to me. My parents and my relationship has gotten much better. 

Despite everything going right for me I still feel like the biggest failure on the planet. I feel that I will never be able to move forward or make any sort of small difference in society. Despite me being in a relationship with an amazing guy who I trust more than anything I feel more alone than ever. For some reason I can't bare to tell him how depressed I have become because I fear that he will view me as whiny and spoiled (he comes from a much more difficult background than mine which is obviously a very lucky background with a few small kinks) and him leaving me. 

I have never felt more empty in my life. Despite finding the best friends, doing exactly what I want, having a great relationship, having a better relationship with my parents, an extremely fun internship where I've met a lot of great people and learned a lot about my interests. 

What am I doing wrong?"
d1zmv,6,2010-08-16,I'm losing a lot of weight.,Baseburn,Fitness,https://www.reddit.com/r/Fitness/comments/d1zmv/im_losing_a_lot_of_weight/,"A little background: I've just moved to Boston (one month ago) from Phoenix. In Phoenix, the last time I weighed myself (End of June), I tipped the scales at 250. I am now 230 pounds.

In Phoenix, you have to drive EVERYWHERE. Even down the street to a friend's house cause it's so goddamn hot. In Boston, you can walk EVERYWHERE. Twice a week I go out to Wellesley on the T, get off the subway car and walk to my internship. I end up walking around 5 miles each time I go out there.

I also do not have a paying job yet so the grocery bill is being cut. I am not getting as much protein as I used to. On the positive side, I'm not drinking soda or eating fast food. I have no funds to join a gym. I walk at least a mile every day (besides going out to my Internship) between going to the library or walking a friend to work.

I am afraid that most of what I'm losing is muscle. In fact, I'm almost certain of it.

What can I do now, with no liquid funds, to reverse this trend? I want to lose fat, not weight (fittit has taught me so). Should I try cutting the carbs in my diet and putting more protein back into it?

What can I do in the future, after I earn an income stream, to continue the reversed trend? I am slightly skeptical that as soon as I have money I'll be out buying cigarettes and soda again, so I guess this is more of a question of motivation than anything else. 

TL;DR: Losing muscle, not fat. Help me fittit."
d1zqa,0,2010-08-17,So what happens if I do Beginner's Stronglift 5x5 without a significant calorie increase?,captainsensible-,Fitness,https://www.reddit.com/r/Fitness/comments/d1zqa/so_what_happens_if_i_do_beginners_stronglift_5x5/,"Hi Fittit,
Frequent Fittit lurker here, and first-time poster.  Been through the FAQ but it doesn't specifically address my issue.


Background: I'm 19 years old, 5'10"", 155lbs.  A bit on the scrawny side and my goal is to get stronger and whatever growth comes about naturally as a result of that.


For several reasons, I'm in a situation at the moment where I can't really be eating the amount of protein/calories that Fittit recommends.  I usually eat two boiled eggs and a banana for breakfast, then two more bananas before lunch, and then lunch (which isn't especially nutritious or voluminous due to it being a free meal at the staff canteen of my summer internship company) and dinner (also at staff canteen, unless I go pay up for a Subway sandwich).  


However, I'm currently on week 3 of [Stronglifts 5x5](http://stronglifts.com/stronglifts-5x5-beginner-strength-training-program/) and things seem to be going great.  I started with mostly empty bars (20kg) to get my form right, but each workout feels like palpable progress and I'm feeling great about the whole thing.


My question is, what can I expect from possibly not having my diet match up to workouts?  Is it alright, since I'm a beginner?  Are plateaus inevitable without sufficient intake?  Is it okay to start eating more *once I hit those plateaus*?  Right now I seem to be getting more toned and losing the slight belly flab I usually have, so I'm cautiously optimistic.


Thanks, and please let me know if there are more details I can provide."
d1zu0,12,2010-08-17,"Been going out for over a year, but still won't have sex",wargarblwargarbl,relationship_advice,https://www.reddit.com/r/relationship_advice/comments/d1zu0/been_going_out_for_over_a_year_but_still_wont/,"throw(this.account, ""Away"");

Stats:  
Me:  23, m, graduated, employed
My lady:  22, f, finishing school, will be employed at my employer by summer '11 (but not nearly in the same part as me, so consider it another company)

Reddit, I'm frustrated/scared/etc.  I've been going out with this woman for over a year.  I met her while we worked here on an internship, we had a great summer, and proceeded to do the long distance thing.  We made it about 7 months and it broke down with about 6 more weeks to go before another summer together.  During this time, nothing of note really happened, other than we weren't officially together. This last summer, we got back together, and it was pretty great.  She just flew out to finish school and will be back here for good come mid-next year and here we go with the long distance thing again.  

Well, pretty great, save for one thing.  She won't have sex with me at all.  She says it just doesn't make her comfortable, which really hurts, as I've expressed to her.  She's told me (and shown) that she's physically attracted to me (hangs on me all the time, squeezes my arm because she likes that I work out, etc).  She's told me that she eventually wants to have sex, but she's just not comfortable with it now.  After a year of devotion, why wouldn't she feel this way?  It's frustrating and it really hurts, like she doesn't trust me (despite her claims to the contrary, of course).  

It also scares me since I really do love her, but I'm now getting fed up.  I'm a 23 year old man.  I'm a physical being and not having sex just doesn't really feel right to me.  Part of me says to just stick it out.  But, now, a much larger portion is telling me to just give up on the whole thing and end the relationship.  I'm just scared I won't find a woman this supportive (in everything else) or caring.  I'm not exactly the most outgoing person, meeting women is hard for me, and she really is the best thing that's happened to me.  I feel like she might be testing me.  A way of saying, ""If we make it through this, then we can make it through anything.  But until then, no.""  Well, then we aren't exactly in a fully committed relationship, in my eyes.  Unless I'm reading this totally wrong.

And when I say no sex, I mean no sex.  No oral of any kind (she doesn't feel it's safe, despite both of us having clean STD panels and very few partners with safe sex always employed).  She feels uncomfortable with her clothes off, even.  We do, when we are together, sleep together.  

I just want to hear your takes.  I'm not going to do what the majority nor minority say just because I can, but I need some input, especially from some of the ladies here.

Also, before you ask, no, neither of us are virgins.  

TL;DR:  Two non-virgins, she won't have sex after over a year together, despite mutual physical and emotional attraction

EDIT: I'm reading everything, even the stuff I don't like and stuff that I don't reply to.  I appreciate everyones' comments.  I plan to confront her about this, but not in an angry way.  I don't want to threaten her with leaving because of no sex, but I'm not sure I'm able to see my way around it.  "
d22el,4,2010-08-17,Boyfriend is heading off to college. I'm a mess.,collegebound,relationships,https://www.reddit.com/r/relationships/comments/d22el/boyfriend_is_heading_off_to_college_im_a_mess/,"Lovely Reddt-ers, I realize this is a fairly typical story. All the same, I would appreciate the advice. 

My boyfriend of ""3 years"" is heading off to college next Sunday. I am 20 (F), and will be a senior in the fall. We have always been long distance. I addressed the length of our relationship so conspicuously for various reasons. The BF had broken things off three times in the past year. The first as a semi-mutual ""break,"" the second, over aim on my birthday, and the last, as I headed off to a new city for a summer internship. Luckily, we were in the same city this summer, and worked things through. We are both very happy and in love. He says that he had never taken advantage of our short ""breaks,"" and conducted himself in a sexual nature with any other person. He has a history of lieing to me, and it is difficult to develop trust once again.

After three years, and a messy past year, I realize that it is difficult to read everything properly. 

Now, to the advice....I am nervous as hell. I can't exactly pinpoint why, which makes it more difficult to deal with. I guess I am fearful that he will look for a more convenient relationship, or I don't even know what...I love him with all that I am, and I don't want to ever experience what I did this past year again. I have truly learned to forgive, and I am (finally) able to begin to trust him again. He is working so hard to be a better person. He has grown in so many ways this summer.....I know we will be okay, it's just SO intimidating....

I know this is a mess....It's late (or early) and I am finishing a paper for my summer course (No, I didn't fail anything, I'm graduating a year early, and had to finish my gen-eds.)

I guess I am just under a lot of stress, with senior year upon me, law school and grad school apps., (retaking) the LSAT, taking the GRE, Senior thesis, working two jobs, etc.

I don't know what I'm asking...I guess (maybe) I just needed to unload and analyze what, exactly, I am getting myself into. 

He is worth everything, seriously. I don't want to loose him because I am needy or worrisome....I know he needs space...But I am seriously freaking out. Help?"
d25ld,10,2010-08-17,I just don't know,quiet_night,SuicideWatch,https://www.reddit.com/r/SuicideWatch/comments/d25ld/i_just_dont_know/,"She was my first girlfriend.  At the end of high school we found ourselves drawn to each other and through a month or more of intense flirtation we found ourselves falling in love.  At the end of the summer she had plans to be in Virginia and I in Germany.  We had planned to not be together- that our relationship was an end of high school experiment.  But it wasn't so.  We stayed together- the separation was painful and we deeply missed each other.

She was sexually harassed at school.  The aftermath tore my heart out but we lived through it.  Then through the next few years we lived through starry nights and early mornings.  We were different but we were the same.  She was my love, my best friend, and my alter ego.  Of course there were fights and differences.  But we always found a way through and around.

This summer she went to California.  An internship.  Partly because of Virginia I was worried.  But I was supportive.  A few hours ago she said that she needed to talk and that she didn't think we were going to make it.

There is no definite conclusion on where we are.  We may not be together anymore.  Everything may be fine and I may be blowing everything out of proportion.

The thing is my heart is in my throat.  If we break up I don't know if I'd make it.  I've never thought I'd be the kind of person to say that.  I've been there for friends during hard times and never really understood.  But it's irrational and crazy but I'm just not sure.

I'm just not sure...

I'm not this kind of guy.  I feel a bit silly posting through the tunnel of the internet but this is embarrassing.  I'm not the kind of guy to feel like this, I'm not the kind of guy that wonders if life is worth it.

If anyone has anything to keep me going, I'd appreciate it.

It looks like things might be decided Wednesday morning.  Then either I'll feel very silly or things will be even worse.

I just don't know..."
d269r,0,2010-08-17,College Minors - Any Benefit for me?,[deleted],AskReddit,https://www.reddit.com/r/AskReddit/comments/d269r/college_minors_any_benefit_for_me/,"So for some background on me... I'm two semesters away from a degree in IT Management (specialized in Applications Development), although all I really want to do upon graduating is be a software developer (for a few years at least).  Thanks to internships, I've got two years worth of experience as a software developer.

Ive' realized that I have room for about three more classes to put towards a minor.  If I take three more communications classes, I can finish with a minor in Business Communications.  Alternatively, I could take classes of slightly more benefit (as a programmer, I'm thinking math classes), but finish without that minor in Communications.

I've boiled my options down to the following:

* Stats II
* Business Calculus (cant do standard Calc II through the math dept)
* Linear Algebra

or

* Interpersonal Communication
* Intercultural Communication
* Visual Communication


That got me to thinking... just how important *are* minors, anyways?"
d29fp,0,2010-08-17,"Fuckin' Treadmills, You don't go anywhere.",[deleted],depression,https://www.reddit.com/r/depression/comments/d29fp/fuckin_treadmills_you_dont_go_anywhere/,"Okay I'm not sure how I should write this. I want to be over the top and funny and offbeat because that is what I do when I'm stressed. I make the thing I'm worried about ridiculous. After all, it is very hard to take life's problems seriously when you put clown pants on them.

But, I think I should do this as a stream of thought instead. So here goes. **WARNING: INCOMING GAME**

Fuuuck me! What the fuck is it going to take? Okay, here's my life, it's not glamorous and it's a little bit cry moar emo kid but this is the low down: My parents make a decent amount of money, but they've always had something in the way of that, I had cancer for a long time (whooole other post) so there were bills when I was young. We lost our home in the start of the recession, 2007 part of Wave 1 of homeowners losing a place that had decades of memories wrapped up in it. They are still paying that off. 

Right now I'm in a strange situation as far as college goes. My family makes too much to qualify for needs based scholarships, nobody gives a fuck what you made in high school when you are 20 so there goes my academic funds. My family can't help me out because they're still paying off what they owe on their old home (life remains life all around I guess). Additionally, my mom hasn't been filing her taxes on time since...okay I'm not sure she's ever filed on time. This makes my FAFSA late and rejected every year going on three years now. Any schooling I take MUST be out of pocket. And when CC is 500 (well that includes a textbook which I didn't buy so 400) for one class that adds up. To date I've taken one class, loved it, but I don't have the money to attend this fall.

So why don't I find another path? Well I had a mini-stroke (don't know the latin name) when I was very young, my hand-eye as a result is maaaybe as good as a sixth grader, perhaps worse. In High School I was never allowed to turn in hand written assignments because they were unreadable to anyone but me. I've always loved playing sports and working with my hands but I've never been any good at it. The trades are a no-no, I just do have the precision of hand. Fuck me.

The military is not a fan of cancer survivors, or at least they weren't when I tried to enlist. Medical waiver denied. Fuck me.

I've been saving my money up, being frugal and wise with my spending these past years but every time I think I'm good something terrible happens. A fender bender due to air in my brake lines is leaving me without any money at all and a serious worry that I'll be unable to pay rent. Fucking, fuck me.

At this point I just feel lost, I wanted earlier to pursue a career teaching high school but recent legistlation looks like the profession is just going to get worse. I'm making enough to get by doing data entry but I feel like I'm going to be stuck here...well not forever, that would be being melodramatic, but for a long time, 25 at the earliest as I can't seem to keep money in the bank, just random life shit gets in my way.

All this has made me just weary, not depressed, or maybe depressed but I'm okay most days. Just in general I am tired of trying so hard only to have it blow up. My friends make is seem so effortless. I've got one who just scored a high paying internship, another who is doing really well in state school, another at MIT and another living at home, being able to put every cent he makes in savings and then go to an expensive private school his grandparents are paying for until he figures out what his major will be. 

I'd be lying if I didn't say I felt some resentment. I know it's wrong and I don't stew in it, in fact I banish the thought every time it arises. Lifes not fair and it's not their fault they got the long staw. 

So here I am, two years closing on three out of high school and not a cent, and only 4 credit hours to show for it. I feel proud for surviving the shit I've gone through but at the end of the day, I'm swiming through rough waters being proud of myself for keeping my head above water, and not choking to death while everyone around me *surfs away.* My title refers to a treadmill because that is how I feel. You run and you run and you don't get anywhere and you are left wondering ""Why the fuck was I running in the first place?""

Fuck it, even with a dead end job I'm still doing better than most people in the world. I shouldn't even be complaining. Though I do feel a little better now.

TL;DR Life's not fair so cry moar emo kid. "
d29lb,1,2010-08-17,Entering the marketing career?,get_it,marketing,https://www.reddit.com/r/marketing/comments/d29lb/entering_the_marketing_career/,"What tips could you professionals give a recent graduate who has a B.S. in Advertising &amp; PR, a few internships, but not that much real world experience? Where do I start? It seems like every company that wants an interview is a scam/pyramid scheme, and the good companies only want people with 3-5 years experience. "
d2d2s,0,2010-08-17,"Looking for bud is gulf shores, AL",pwnewman,Marijuana,https://www.reddit.com/r/Marijuana/comments/d2d2s/looking_for_bud_is_gulf_shores_al/,I am currently on an internship in gulf shores and am having trouble finding bud.  I have been dry for a few days and have looked everywhere i can think of but have failed to do so.  Anyone know where i could get some?
d2d8s,2,2010-08-17,"Is my boss an asshole? Probably, but I need reassurance.",Nycest,AskReddit,https://www.reddit.com/r/AskReddit/comments/d2d8s/is_my_boss_an_asshole_probably_but_i_need/,"Ok, so I work as an IT Technician for a small consulting company. Literally, a SMALL company, it's just the owner (my boss) and myself. We also have an intern who comes in once a week (he's the son of one of our clients).

I'm getting to the point where I hate my job. Not because of the job itself, but because of my boss. He's a dick. He's pretentious and at times speaks to me like a child. 

For example, he'll start giving me instructions on what to do, so I start jotting them down. Whenever he's not clear on something and I ask him to explain, he'll respond, ""OK. GO....INTO...THE....SERVER...ROOM...GOT THAT?"" And I don't know how to respond when he talks to me like that.

Or sometimes he'll give me clear instructions, but assume I know something that I don't. For example, ""There's a new Dexis x-ray sensor that needs to be installed. Call Dexis support and ask for 'Imaging Support' for instructions."" Ok, I call them, they give me instructions. I follow them and install x-ray perfectly. Call him back to tell him I'm done, and then he says, ""They don't use Dexis software, they use Dentrix."" So I have to start all over again because he forgot to mention that small piece of information and he gets upset over it.

I'm getting fed up with him, but I can't tell if I'm just overreacting or he's really just an asshole. He recently told me he wants to get more business, so he told me to start a ""Marketing Campaign"". I was truly stumped with what I was supposed to do really. I understand that it's just us 2 and I occasionally have to do mundane things around the office (vacuuming and throwing out garbage) which is fine, but sometimes he'll ask me to call a big company and ask stupid questions because I feel like he doesn't want to call himself. Also, he says he only takes clients who are referred from our existing clients (which I've noticed have ties to his family).

He also doesn't understand why people hate Internet Explorer (he thinks we're just rebels who wanna hate collectively on Microsoft), and continues to recommend it to clients who are careless with their web browsing. He also makes me call him every hour to give him an update on what I'm doing, which is infuriating when I'm trying to work on something and I have to step aside and call him so he can ask me 100 questions on the process.

If anything, I just wanted to vent. "
d2exb,4,2010-08-17,I am looking for a temp home for my cat,eforemergency,Louisville,https://www.reddit.com/r/Louisville/comments/d2exb/i_am_looking_for_a_temp_home_for_my_cat/,"Hi all. So, here is the deal. I am moving to DC for 3 months for an internship. I have a cat who I love, but unfortunately, even after tons of searching, I can find no place that will let her come with me while I live there. My parents would watch her, but she has a hard time living with other cats. She is perfectly fine when living alone with me, but she cannot stand to be around other cats or use the same litter box as them. I have tried everything I can think of, but it looks like I might have to get rid of her if I can't find a place for her to stay for 3 months. None of my friends can take her in, as they are either in college dorms or apartments that don't allow pets, and I am at a total loss. I really can't lose her just because of 3 months. 

So please, if you would not mind housing a small black kitty for 3 months, let me know. I would be happy to help with food and litter, and she has toys, a litter box, and a little bed she likes to sleep in already. 

Even if you can't house her, if you have any advice or know anyone who would, let me know. Thanks guys. "
