d4pd0,8,2010-08-24,A game my friends and I play: What's the most WTF thing you've seen recently on High Street?,MiloMars,Columbus,https://www.reddit.com/r/Columbus/comments/d4pd0/a_game_my_friends_and_i_play_whats_the_most_wtf/,"I'll start: I was driving to my internship at the Riffe Center and I saw a man snort a line of coke off of his knee. This was in broad daylight.

Also, in the interest of trading more stories, let's make it ""most WTF thing you've seen around the city""."
d4qrc,3,2010-08-24,"Dear reddit, which internship offer should I take?",LEGEN_waitforit_DARY,needadvice,https://www.reddit.com/r/needadvice/comments/d4qrc/dear_reddit_which_internship_offer_should_i_take/,"Hi reddit, I'm a longtime lurker and occasional poster when. I need some insight on my current situation: I have two internship offers and I don't know which I should take.

The first one is for a well-known investment bank (Merrill Lynch). However, it's unpaid and involves a lot of administrative work, cold calling, and filing. The main con I see with this is that I've heard lots of negative feedback and I won't be learning as much. However, it's a big company and I think it'd be a good thing to put on my resume. Even though this is a field I want to pursue in the future I'm not exactly working in that department.

The second offer is for a small software company. It's a paid internship for a good 8 months and I'll be doing a lot of budgeting and accounting work. It's not strictly related to what I want to do but it will give me the accounting experience that's helpful. The only con for this is that it's not as well known as the other company.

So which one should I take? A big well-known company where I will be doing lots of paper pushing and not really learning or a smaller company where I'll learn about accounting and get paid.

Any insight would be very much appreciated. If it helps, I really want to get into the finance sector (hedge funds, equity, etc.). Thank you again in advance reddit!"
d4r3e,1,2010-08-24,"""Who knows, your idea might actually be the chosen
title for this Brat at the stadium!""",keep_flydrated,food,https://www.reddit.com/r/food/comments/d4r3e/who_knows_your_idea_might_actually_be_the_chosen/,"Recently received this email.. Ideas?

Hello everyone!

I need your help! I am a Design intern for the University of Minnesota
Marketing Office, &amp; TCF Bank Stadium Concessions will be offering a signature
brat this fall. If you have a great idea for a name please email me and let me
know asap (fabri015@umn.edu).

Signature Brat Description: Cheddar Cheese Bratwurst on Pumpernickel Bun topped
with Secret Sauce. We are trying to go for a name dealing w/Minnesota or the
University of Minnesota. Who knows, your idea might actually be the chosen
title for this Brat at the stadium!


Thanks guys!"
d4ufp,0,2010-08-24,"Reddit, who else's life is made miserable by the usage of the SI and English units system?",strikerpro10,AskReddit,https://www.reddit.com/r/AskReddit/comments/d4ufp/reddit_who_elses_life_is_made_miserable_by_the/,"So I am a mechanical engineer student but I am sure this applies to any science major or proffesion out there.

It seems like up until college there is an emphasis on learning the English/US system of units. They then teach you conversions and you start to get an idea of the SI system. In college, almost all of my problems are in SI units. To me, the SI system is so much better in every way, and it makes doing complicated problems much easier. Whenever I get a question with English units on a test I groan.

But now that I am doing internships in the industry, everything is back to English units! The only time I see SI units is if we are selling to Europe. Now, I am not dumb, but its annoying to have to figure out what the hell a BTU is all the time when I know exactly what components are in a Joule. 

Can we just stick to one system and make it standard across educational and proffesional platforms?"
d4v1q,5,2010-08-24,"Hey Reddit, I want to help my friend out.  How does someone with a degree but NO work experience get a job? ",redditgirl1,AskReddit,https://www.reddit.com/r/AskReddit/comments/d4v1q/hey_reddit_i_want_to_help_my_friend_out_how_does/,"My friend graduated in 09 with a degree in physics.  She's a super smart girl, gpa was 3.8.  But for some reason she never really worked, did any internships or anything in college.  She has been financially supporting her self since she graduated HS (got a full ride to college) so right after she graduated she had to get a job ASAP and ended up in retail.  She feels like she's stuck there and I feel kind of lame because as soon as I graduated I had the luxury of moving back home for 6 mos before I found work..
EDIT: I think the biggest obstacle for her is that she can't do internships/volunteer without money for rent and food. "
d4w4k,0,2010-08-24,Accounting Internship: Am I expected to know how to do everything or will I be trained?,device0867,self,https://www.reddit.com/r/self/comments/d4w4k/accounting_internship_am_i_expected_to_know_how/,"I'm an accounting major, and I've taken 4 accounting courses so far (Got 2 A's and 2 B's). Now my problem is, I can do the work in school, but I have no idea why I'm doing it. If someone were to tell me to do what I did in real life, I wouldn't know what to do. For one, the teachers just teach out of the book. Two: I forget what I learn if I don't constantly repeat whatever I'm learning.



So my question is, when I apply for accounting internships, do they expect me to know how to do things already or will they train me? 



The job interview I got wants me to do the following: 

Invoice Reconciliations

Vendor Bill Entry

Audits of Vendor Statements

Distribution of Electronic Invoices

Assisting Controller with various month end closing task



Help would be appreciated. Thanks."
d4wca,10,2010-08-24,Am I in the friend zone?,throwawayrarst,seduction,https://www.reddit.com/r/seduction/comments/d4wca/am_i_in_the_friend_zone/,"It's usually pretty clear to me if I've been LJBF'ed, but this situation is a little different.

I met this girl a couple years ago back when I was in a LTR.  We were friends, had the odd cup of coffee together, etc.  We stayed out of contact for the better part of a year (she was on an internship).  Shortly after she came back I was single.

It turns out she was unaware of my breakup the first couple times I saw her, but since she has found out I've been getting the impression that she's interested in me because she's gone from random coffee breaks, to dinners and drinks, etc.  In the latest case I had mentioned that I was going to a particular concert and within the week I got a message from her saying she had bought a ticket to it too.

I'm unsure how to proceed.  Mainly I'm trying to figure out how to get more kino in as I didn't touch her much before (remember, I was in a LTR) and it would seem kind of awkward to start doing that now.

Is there any easy way to tell if I've been LJBF'ed?  I don't ever hear from her about problems, ex-bfs, guys she's interested in, etc.

**EDIT**: Goddamn I'm dumb.  Everyone on the Internet is aware I'm not in the friendzone from a brief description of the situation.  I met her for coffee today and it suddenly turned into an hour and half long chit chat.  Meeting her at my place tomorrow morning and going for a run....not sure how to play that, but it's clear she's interested in me.  Time to get my touchy-touchy on."
d4y04,1,2010-08-24,"Hey /r/Atlanta, want to help bring the World Cup to ATL?",rej1587,Atlanta,https://www.reddit.com/r/Atlanta/comments/d4y04/hey_ratlanta_want_to_help_bring_the_world_cup_to/,"Hey guys,

I just started an internship after graduating from UGA and my first assignment is to help bring the World Cup to Atlanta. Awesome, right? I was here in '96 for the Olympics and I can only imagine what it would be like to have the World Cup here.

Anyway, we're currently competing with 17 other cities to be one of the 12 host cities. There is a leaderboard that is based on the number of people who have signed the petition. Atlanta is ranked number 8 right now and getting dominated by Houston, Miami, etc. We need all the help we can get to boost our ranking and secure a spot.

Here's how you can help:

**Most Important** [Sign the petition](http://www.gousabid.com/city/local/atlanta-ga) 

[Follow us on Twitter](http://www.twitter.com/AtlantaBid)

[Like us on Facebook](http://www.facebook.com/AtlantaBid)

And tell all of your friends!

We're going to start doing promotions soon on Twitter and Facebook.

Thanks! And I'll be happy to answer any questions."
d4z9b,5,2010-08-24,"Help, phillyreddit! I've been unemployed since Februrary and I'm desperately in need of a job!",[deleted],philadelphia,https://www.reddit.com/r/philadelphia/comments/d4z9b/help_phillyreddit_ive_been_unemployed_since/,"I got let go from a business to business telemarketing job back in February, and aside from part-time contract work at the Walnut Street Theatre, I've been searching since. I'm trying to find something, anything, that isn't another sales job, but I'm about desperate enough to say yes next time one comes up, just so I'll have something to do during the day.

I'd love to get something doing non-profit fundraising, as I've done fundraising calling for the Walnut, but applying for those jobs feels lately like throwing myself up against a brick wall, as I haven't had an internship or any development experience besides phone solicitation. I took the test for a Clerk Typist job with the state of PA, and scored 82, but nothing has come of that yet.

Extra complicating factors: I don't have a car, or a license, so that would make going to work outside of the city rather difficult.

[This is my basic rsum (.doc format)](http://dl.dropbox.com/u/502172/RAndersonResume.doc), though I've been sending a different, targeted version to the various non-profits I've applied with.

Jobs and areas of particular interest to me include:

* Writing/Editing
* Web design [(This is my website)](http://www.sanspoint.com)
* Non-profit fundraising
* General office/clerical
* Arts marketing

At this point, though, I'm up for almost anything that doesn't involve cold calling and selling things.

I'm at my wit's end. Help, please...

Edit to add: I haven't even *interviewed* in the last six months. That's how bad things are."
d50u9,6,2010-08-24,"I need your advice, fellow engineers.  2 job offers and I need to pick one. ",jdv25,engineering,https://www.reddit.com/r/engineering/comments/d50u9/i_need_your_advice_fellow_engineers_2_job_offers/,"I just graduated in May and was searching for full time jobs for several months.  I have had an internship in manufacturing for 4 years and my current internship is where I received the first job offer. 

The first job offer is in manufacturing.  It is with a fairly large (5,000-10,000 employee) company.  It would be a production engineer role.  The pay would be really good and job security great.  However, I want to get into design.  That is where the second job offer (probably) is from.  It is from a design firm that has been doing very well, has their hand in many different industries and needs a new Mechanical Engineer.  It is exactly what I think I want to do.  However, the pay would not be near as good and the job security working in the smaller firm would also not be as good. 

Any thoughts?  should I sell my dreams for a lot more money and job security or screw it and go with the job I want?

Edit:  Thank you everybody for your responses.  I am taking the night to think about it.  I have until Thursday morning to decide.  Every one of you has given me something to think about.  I am truly grateful for the internet strangers. :) I will continue to check this and send out responses to questions that you may have for me. 

Edit 2: I met with the smaller firm again today.  I got a really weird vibe from the entire experience.  Further, there were some dishonesty issues. They flipped my initial responsibilities from design engineering to a project management and manufacturing role, they were not clear on compensation reviews, not clear on vacation expectations, etc.  

I am going to tell the the first/larger employer that I will take their job.  This was based on my 5 and 10 year goals, the culture, the available resources, and a variety of other things.  If any of you have any questions regarding this, feel free to ask!

Thank you all very much for your thoughtful advice.  It was a tough couple of days for me and many of you gave me things to think about. "
d52y7,2,2010-08-24,Hey ya'll...feeling incredibly down about myself. Can I please get some advice or words of wisdom?,solosthatinglife,AskReddit,https://www.reddit.com/r/AskReddit/comments/d52y7/hey_yallfeeling_incredibly_down_about_myself_can/,"Hey everyone. I recently took a sales job. I took it because I couldn't really find anything else and it pays pretty well (salary + commission). It's only been a few days and I hate the job, hate everyone that works there, and hate myself for taking the job. I'm a college graduate with a telecommunications degree from Penn State, so I feel like I'm wasting my potential by working a job that is door-to-door sales, and reciting some dumb script to people who don't want to talk to me in the first place.

I need a job that is fulfilling. One that helps people, one that I feel good about. For a while I wanted to be a teacher, but I'm not sure why I didn't follow through with that. I've also wanted to do a few other things. Join the Air Force only because I don't know what to do with my life. I'd love to work in film, but have no idea how. I'd go back to school to become a middle or high school teacher but I only have a 2.8 gpa. I just feel so lost.

I live with my parents and they're upset that I'm quitting this job (even though it sucks and you only need a high school diploma to work there). I feel bad for letting them down.

I'm sorry that I'm rambling, but I need advice. I feel like I've never been good at anything, my self-esteem is at an all time low, I'm depressed right now, etc. Any way you guys could help me would be great. Job advice, job suggestions, internship advice or suggestions. I feel like I've made nothing but shitty decisions so far. I'd love it if someone told me what to do.

Again, sorry for rambling.

**bold** TL/DR **bold** - I'm quitting my job of a few days, feeling guilty about it although it sucks. Have no idea what to do now, kind of want to be a teacher, not sure of the steps I should take to do that. Any advice is appreciated."
d562k,3,2010-08-25,I want to learn how to sing,BackdoorDan,Music,https://www.reddit.com/r/Music/comments/d562k/i_want_to_learn_how_to_sing/,"I'm not sure why, but recently I've gotten the urge for a creative outlet(might have something to do with the fact that I am a month into an internship where i'm actually working full time as a programmer for the first time).
I don't know any instruments(tried guitar and was awful, mostly because I had no desire to practice.

I don't know why but singing kind of draws me; I love singing along to classic rock when I'm alone in the car(not that i have a good voice or anything).

I was wondering if anyone who sings could give me some pointers on how to start or if they could guide me to a lesson online or something that they would vouch for.
I'm really trying to do this as a hobby for fun so I don't plan on getting a teacher."
d5cu4,4,2010-08-25,"Dear Reddit, I'm a high schooler who can't find any motivation. How were you guys able to get out of your slacker phase?",[deleted],AskReddit,https://www.reddit.com/r/AskReddit/comments/d5cu4/dear_reddit_im_a_high_schooler_who_cant_find_any/,"  Well I'm going to be a Junior in 15 days. Everyone says this is the most important year and I understand this, but I can't motivate myself to work. 
I have summer homework for AP Chemistry, AP Bio, Precalculus Honors, and English 3 Honors that I haven't worked on. Some of it was already due, and some is to be handed in when school starts. I can't say I've done even up to 10% of it all.

 To be fair I was at an internship program up until last Friday. But I also told myself I'd start working on it this Monday and instead I've just watched movies, wasted time on reddit, watch porn, browsed some more and wasted it all. I really hate this and I'm at a loss.



**tl;dr I'm lazy and need help**"
d5fjg,1,2010-08-25,"Intern told he'll be getting a job offer, what can I expect?",InternallyGrateful,AskReddit,https://www.reddit.com/r/AskReddit/comments/d5fjg/intern_told_hell_be_getting_a_job_offer_what_can/,"I work at a manufacturer as an intern, and have been for the last year and a half. I'm currently in school on my way to a double degree in CSE/EE. School is going to take longer than I anticipated, for various reasons, so I had a sit down with my boss to talk about options for me with the company.

 Long story short, we decided on staying full time with a pay increase and going to school part time, while taking advantage of my company's tuition assistance program (reimburses you out of pocket expenses based on grades for the courses taken. A=100%, C=70% evenly distributed between them.)

We agreed that if we went this route it would not be just for a semester or a year, but more long term. 

He told me he would talk to HR and put together a package with an offer in it for me by the end of the week, so I'm hopeful I'll get it this Friday. 

My question basically is what can I expect? We're a fairly large business, we were recently bought by one of the top manufacturers in the world that is based out of Sweden, and business has been good. I currently make $12/hr. with as much overtime as I'd like. 

What do you guys think is in store for me as far as benefits/pay goes?"
d5fkj,2,2010-08-25,I'm a junior in computer engineering. What should I do with my life?,LtArson,AskReddit,https://www.reddit.com/r/AskReddit/comments/d5fkj/im_a_junior_in_computer_engineering_what_should_i/,"Hey guys. I'm a junior in Computer Engineering at a top 10-ish private university in good-ol' US of A, and I don't know what I want to do after I graduate, but I need to figure it out pretty soon.

I'm taking a heavily software-oriented track in computer engineering, and I'm very good at it and I find it really interesting. The only problem is that I don't enjoy actually doing software development or computer engineering, I just love learning about it. I couldn't picture myself being a software developer at all, and judging from my summer internship I wouldn't enjoy it. Some of my friends were recently hired as software developers for Google and Microsft and Disney but that's not something I can picture myself doing.

There's two things I'm considering, at this point, that I think I WOULD like to do.

I'd like to be a lawyer, but I'm not really sure that's a good idea - I mean, there are a lot of lawyers in this country as-is, and even if I'd like being a lawyer I wouldn't like being an unemployed guy with a JD and a bunch of student loans. Do you guys think that's a bad idea?

I'd also like managing other software developers, I think. I don't know what a job title for something like this would be, though. Product manager? Project manager? Team lead? And I'm not sure what sort of classes I could take that would benefit from something like this, or even if companies will hire new graduates for these positions - I've already taken a software project management course, but I'm not sure if there are any other sorts of classes that would work out for this. I have a decent amount of management experience. I'm working on a web startup with some people I met through a class (planning to push out a beta release in a few weeks), and I have an administrative role in the university's student-run IT department (we employ 40-50 students during the year, and me and a few other people are responsible for hiring, firing, performance reviews, raises, pretty much everything in the day-to-day operations).

I guess what it comes down to is that I like the ""solving problems"" aspect of programming, in the sense that I like to look at a problem and say ""okay, we'd go about solving it this way"", and I tend to be pretty good at that, but I don't like actually solving it (that is to say, writing the code that implements a solution I've laid out). So is there any kind of job that would let me do that?"
d5g8k,500,2010-08-25,I lied about having a college degree. And now have a career. AMA,dropoutliar,IAmA,https://www.reddit.com/r/IAmA/comments/d5g8k/i_lied_about_having_a_college_degree_and_now_have/,"I currently work as a project manager at a fairly large ad agency. I've been working for 4 years. I dropped out of college sophomore year and started going on interviews for paid internships. Constantly getting rejected for not having a degree (not even reaching the interview stage), I eventually started just writing that I had a Marketing BS on my resume. I eventually obtained a paid internship which evolved into a full time position, and have since moved to another agency.

I've been going back to school for night classes for the past 3 semesters. It's becoming increasingly difficult to keep this secret, so I just this moment decided to not go this fall semester. I am fairly successful and figured I'd do this AMA to basically confess. It's not especially interesting, but over the past year or so, I've started feeling enormous amounts of shame. 

I don't think this is even that interesting compared to the great stuff that's usually found in this subreddit. I just thought I'd share. *And we need a confessional reddit. I'm only doing this because it's almost like group therapy.*

**********

*Update - 9:20 pm est time. I gotta go out, I'll be back to answer questions later tonight*

*Update - 11:00 pm* - Back. Jesus. Way too many comments. Seems like reddit is fairly split on this. Some think I'm the biggest douchebag around, others are commending me for ""beating the system."" 

*Update 1:00am* - Sleep time now. I'll answer a few in the morning. Good night reddit.

Quick points --
I'm going to go back to school. I will obtain a degree within 2 years.
I intend on moving once I get a degree so I can be in a fresh market.

See this [comment](http://www.reddit.com/r/IAmA/comments/d5g8k/i_lied_about_having_a_college_degree_and_now_have/c0xqd9n)



**Final Update - 1:00pm** - Lunch break. If you want to ask me specific questions, message me. I have gotten pretty lost in the huge wave of orangereds. Most replies to this post are either commending me or berating me. Any specific questions you may have, go ahead and private message me. I also though I'd like to let reddit know - I've gotten a bunch of messages from people telling me they too have lied on their resume and have obtained jobs from it."
d5gji,1,2010-08-25,Hey Reddit: Is CampusPoint.com legit?,funkyfresh1990,AskReddit,https://www.reddit.com/r/AskReddit/comments/d5gji/hey_reddit_is_campuspointcom_legit/,I just want to make sure because i got a phone call from a man named chris today about it for internships and i was thinking of making an account on the website and applying for some. 
d5qu1,6,2010-08-26,"I have had trouble finding job opportunities with my Marketing degree that aren't in sales, due to my lack of internships. Anyone have any advice on how to correct my path?",Cresponl,marketing,https://www.reddit.com/r/marketing/comments/d5qu1/i_have_had_trouble_finding_job_opportunities_with/,"I am 1 and a half years into my first post graduate job as an account rep. I graduated with a degree in Marketing, and have always been especially interested in E-marketing, but made the mistake of not having any internships while in college. Now when I search for new job opportunities, I find that any marketing specific roles require some sort of previous experience outside of schooling. Unfortunately, my only experience in the past year has involved sales and customer relations/support. 

Does anyone have any recommendations as to how I can better qualify myself for these marketing positions so that I can move away from sales (which I dislike) to what I actually am interested in?"
d5thu,2,2010-08-26,Should I Consultant or Contractor?,wuy3,AskReddit,https://www.reddit.com/r/AskReddit/comments/d5thu/should_i_consultant_or_contractor/,"Hi Reddit. I'm currently clueless on what to do, need helps! 

Just recently graduated from Masters in CS and had an undergrad in molecular bio. Got lucky with an bioinformatics internship at a big place. Now they want to keep me around (alright!) but there's catch. My boss can't open a permenant spot for me until next year (so he says) but he certainly seems sincere. The big wigs up above keep a cap on permenant employee numbers. 
Right now I got two options, either go through this staffing firm the company uses (named Yoh) for all its contract positions or sign on as an independent consultant. He said Yoh could potentially take 40% as overhead but they do offer benefits and ""stuff"". Independent consultant also means I'll have to spend a week filing my taxes next april (my dad has an LLC that I'm part of, maybe use that?). Either way the goal is to keep me around until that permenant spot can be opened (may take up to a year?).
I asked some friends of mine but no one really is knowledgable enough to help. So now I turn to the experts at reddit. Should I go consultant or contract? I'm sorry if there's lack of details, we just started the transition process. Maybe hints and suggestions on pros and cons of both choices?
Thanks for reading this long post :D

TL;DR Intern -&gt; Consultant or Contractor. Which is better.

If need more details please ask, I will edit post with them if possible."
