cvz9m,6,2010-07-31,"What do the college graduates of Reddit hold degrees in? Are you happy with the degree, and the opportunities it gave you access to?",GypsyPunk,AskReddit,https://www.reddit.com/r/AskReddit/comments/cvz9m/what_do_the_college_graduates_of_reddit_hold/,"For those of you without degrees, what do you plan on getting one in?

For those working, what are you doing now?

Edit: I think it's unfair I asked this question and didn't put myself in the mix. I'm an accounting student 2 years away from a masters. I just got an internship with a Big4 firm and plan to go full-time with them in the future. "
cvzcq,15,2010-07-31,"Hey WATM industry professionals, how did you get where you are now? I want in.",[deleted],WeAreTheMusicMakers,https://www.reddit.com/r/WeAreTheMusicMakers/comments/cvzcq/hey_watm_industry_professionals_how_did_you_get/,"I have heard a lot of mixed advice from folks on how to start a career working at a studio.

Some say to definitely go to school, others say school is a waste of time and money and to get an internship, work at the front desk of a studio.... the list goes on.

I have a pretty diverse musical background (lots of schooling but no degree to speak of), and no real studio experience. I have a blast fiddling around with pro tools and tweaking my own music (and friend's music too). I want to make a career of it! 

How did you get where you are now? Any advice to me and others with the same question?"
cw0mz,44,2010-08-01,My best friends are rich and I find it hard to spend less when around them,redplasticcup,Frugal,https://www.reddit.com/r/Frugal/comments/cw0mz/my_best_friends_are_rich_and_i_find_it_hard_to/,"We're all students and make good money through our various internships but...my best friends have parental backup, something I choose not to have (I pay for my own tuition, rent, etc.).
We hang out together a lot and they're my best friends -- but how do I draw the line between being frugal and maintaining a good social relationship with them?
"
cw3vb,0,2010-08-01,Looking for tips on a girl that may not respond to traditional PUA techniques.,guest_account,seduction,https://www.reddit.com/r/seduction/comments/cw3vb/looking_for_tips_on_a_girl_that_may_not_respond/,"Hello people of the Internet,

I recently met a girl during my internship that I fancy. She's gorgeous, cute, very tall, blonde =). Looking for tips to get more more attracted to me as I haven't really been able to.

Here's the first thing - she doesn't seem to respond to traditional PUA techniques. She met a guy during the beginning of the internship. They were hanging out and watching a movie. When he tried to escalate things with her (kino and all that), she got creeped out and it seems like she tries to avoid him.

Another snag ... only have about 2 weeks to really try things. From what I hear she is introverted and doesn't really like going out, so I am not sure what I can do here.

Any tips? Thanks..."
cw5eu,4,2010-08-01,"22M Moving to Burnaby(BC) in September, looking for friends",Setheron,r4r,https://www.reddit.com/r/r4r/comments/cw5eu/22m_moving_to_burnabybc_in_september_looking_for/,"Text pretty much says it all.

I'm moving to Vancouver/Burnaby BC area in September for an internship for 4 months at a Video Game study (as a video game programmer).

Won't know anyone so I figured i'd see if I could meet people through reddit.

I've made friends before through POF so why not here as well :)"
cw7xk,7,2010-08-01,A recent development,[deleted],SuicideWatch,https://www.reddit.com/r/SuicideWatch/comments/cw7xk/a_recent_development/,"I've been searching for some answers to cut to the core of my dysthymia.  I decided to start reading some of the entries from my journal, which I started writing when I was 18 (I'm 24 now). I realized that back then, I was wrestling with a lot of the same issues that I am now. I didn't know what to do with my life, I didn't know why I was sad and upset all the time (though I understand it more now), and I had an extremely low level of self-esteem/confidence. I started to put the pieces together and I realized that, for the better part of my life, I've been going through the motions, and I never really asked myself ""what do you want to be when you grow up?"". I simply never had an answer. I was asked that a few years ago when I was at a stupid orientation for the second time at Starbucks, the guy was asking everyone ""what did you want to be when you were growing up?"" and I was the only one that stopped and said ""I don't know... I never had an answer"" and he made some stupid quip about how it's ""always good to dream"". I never put much thought to that. When I graduated college almost 2 years ago I was so depressed, and now I realize it was because I hated my major, and I did it because everyone said I was ""good at it"" and ""I could make a lot of money"". I really tried hard to like it. I tried a few jobs and an internship related to my major, and I just got fired from the one I had because my boss said I didn't like my job enough. I look at all my friends who have jobs that they like, they work hard and party after, and all I can think about is how I wasted a whole day at work and now I have to catch up on the things I like to do, not get totally wasted and celebrate. 

What this triggers in me is really negative, suicidal thoughts. Thoughts that I will never figure out what I want in life, and that all of these ""interests"" (music, audio engineering, film, photography, art in general, skating, social issues, whatever) are just hobbies that I will never be that great at, and that I could never possibly be able to survive on. The major that I chose (Info Systems) completely destroyed my love for science, because it reduced it to a service industry, just like my job right now, delivering pizzas. I worked with computers my whole life, but don't think I ever thought to myself ""I want to be a Database Admin/System Admin/Project Manager/Programmer when I grow up""...and yet I wasted 4 1/2 years learning how to do that. I moped around for the last 18 months wondering what happened to my life.  I think a lot of it goes back to depression, because a lot of times, I can't tell what makes me happy anymore.. nothing does, not even the things I like doing, so how can I decide on one thing to do? I wonder what if I chose to do one of these things, and then I wake up in 5 years and wonder why I'm doing this all over again? What the fuck is the point? I don't even know where to begin now. I feel like I was robbed of the past 10 years of my life because of depression and now I have to start all over again, with no direction, no support, no one to relate to. Everyone is off reaping the benefits of a life of hard work, traveling, working jobs they love, getting married, and I feel like I'm 14 all over again. Has anyone else gone through this? Can anyone tell me what to do? I almost don't even care anymore. I feel like just dying at like 32 or something, so I can at least live out my 20's and give up when it's over. It's incredibly short sighted, but that's the story of my life I guess."
cwew9,91,2010-08-02,DEA find their office job to be soul-crushing,llamaryder,DoesAnybodyElse,https://www.reddit.com/r/DoesAnybodyElse/comments/cwew9/dea_find_their_office_job_to_be_soulcrushing/,"Granted I'm only an intern, but I've worked in an office for the past 10 weeks and I die a little inside every time I come to work.  I'm used to jobs where I can work outside (snowboard instructor, lifeguard, ect.).  I know I can't work those jobs forever, but I don't think I can work in an office the rest of my life either.  Does anyone else feel this way?"
cwg93,0,2010-08-02,TIME-SENSITIVE: Fullscreen iframed Flash - Apparently MSIE 7 [xp] could do me in today,cbdotcomintern,web_design,https://www.reddit.com/r/web_design/comments/cwg93/timesensitive_fullscreen_iframed_flash_apparently/,"http://www.clevelandbrowns.com/

Throwaway account from an intern with the question from hell: How do I get external full page Flash to load in a fullscreen iframe in IE 7 without ruining the currently correct rendering in all modern browsers?

I have Firefox 4, IE 8, Chrome 5, and Opera 10.6 looking good [Win7]. IE 7 is showing the iframe in a small scrollable div as far as browsershots.org shows me.

This could be my fallback but it's terrible:
http://www.clevelandbrowns.com/index-tc.html

If you guys can help me I'd really appreciate it. I'm responsible for coding this regardless of the design and predicament."
cwhge,12,2010-08-02,Why do some women refuse to reveal their age?,Partisan5417,TwoXChromosomes,https://www.reddit.com/r/TwoXChromosomes/comments/cwhge/why_do_some_women_refuse_to_reveal_their_age/,"While at lunch with some friends I was introduced to a new intern, Darlene. I tried to make good conversation, which was well received until one of my friends asked how old she was. Darlene replied by saying ""I'd rather not disclose that information."" Why?"
cwkk1,3,2010-08-02,Can an American get an engineering job in the Norwegian offshore oil industry?,tjl2015,Norway,https://www.reddit.com/r/Norway/comments/cwkk1/can_an_american_get_an_engineering_job_in_the/,"This is kind of a specific topic, so I'm not sure if anyone here will have any information. I am a graduate student about to finish my masters in structural engineering. The US-school I have attended is well known for its petroleum and offshore oil-industry links. I have internship experience in the offshore oil industry, and I'm currently seeking a full-time position for after my December graduation.

Anyway, I'm conducting a broad search, and I'm not limiting myself to domestic positions. I know Norway has a large offshore oil industry and may need qualified technical people. I am fluent in only English, but I could certainly learn another language. I'm interested in Norway because it seems to be strong in the offshore oil industry, and I do have a fair amount of ancestors from Norway (though this was several generations ago, too far back to have an impact on immigration.)

Basically I'm wondering if anyone has any experience on this. Does anyone know anything about the Norwegian offshore oil industry? Is there a need for technical people from abroad? How does one go about finding such a position?"
cwkp4,5,2010-08-02,Can an American get an engineering job in the Norwegian offshore oil industry?,tjl2015,IWantOut,https://www.reddit.com/r/IWantOut/comments/cwkp4/can_an_american_get_an_engineering_job_in_the/,"This is kind of a specific topic, so I'm not sure if anyone here will have any information. I am a graduate student about to finish my masters in structural engineering. The US-school I have attended is well known for its petroleum and offshore oil-industry links. I have internship experience in the offshore oil industry, and I'm currently seeking a full-time position for after my December graduation.

Anyway, I'm conducting a broad search, and I'm not limiting myself to domestic positions. I know Norway has a large offshore oil industry and may need qualified technical people. I am fluent in only English, but I could certainly learn another language. I'm interested in Norway because it seems to be strong in the offshore oil industry, and I do have a fair amount of ancestors from Norway (though this was several generations ago, too far back to have an impact on immigration.)

Basically I'm wondering if anyone has any experience on this. Does anyone know anything about the Norwegian offshore oil industry? Is there a need for technical people from abroad? How does one go about finding such a position?

This is a crosspost with r/Norway. I'm also wondering about similar technical positions in Germany and other Northern European countries."
cwlbt,4,2010-08-02,"I'm an MIT senior trying to decide if I should apply to medical school this year... premed redditors, any advice? Or school suggestions?",nojokeshere,AskReddit,https://www.reddit.com/r/AskReddit/comments/cwlbt/im_an_mit_senior_trying_to_decide_if_i_should/,"Hey I'm trying out this reddit thing because it seems like some good advice usually comes out of this. 

So here's the deal - MIT usually wants us to put in our applications for medical school by the end of June, but I had my doubts at the time and wasn't even 100% sure I wanted to apply, so I didn't submit an app. I did some major thinking over the course of the last month and have definitely decided I want to do med for sure, but now don't know if I should apply this late or where to apply.

I'm not a shoe in by any means - average grades/average MCAT. (although I'm retaking the MCAT this month). I've been told I'll have better chances if I apply next summer (because applying as a senior shows maturity?) But if I pursue that route I have no idea what I'd then do with the next year. I keep hearing there are temporary jobs that take you on knowing you'll only stick around for a year; but so far the only things I've found have been either minimum wage sort of gigs or internships. (Even lab tech's usually require a two year commitment!) I've also been told that I should just apply to a masters program, but it seems silly to accumulate an additional 50k in debt if I won't use it at all. 

So reddit, what do I do? Will it really hurt my chances to apply this late? And if it does what the heck do I do with myself next year? "
cwltq,8,2010-08-02,"Auckland Redditors, advice please?",Naly_D,newzealand,https://www.reddit.com/r/newzealand/comments/cwltq/auckland_redditors_advice_please/,"Hey you lot. I'm moving up from Wellington to Auckland in the next 3 weeks to take on an unpaid internship for 2 months. I've lived in Wellington most of my life but spent a year in Avondale for 6th form.

I don't have a license [never sat my learners] and I asked my employer of 2 1/2 years to transfer me to our Auckland office but had that declined. I need to take this internship for my future career.

It's based in Eden Terrace, in the vicinity of the New North Road/Mt Eden Rd intersection. I'm looking at flats on Trade Me in Kingsland, Eden Tce and Mt Eden for $150 or less, not including expenses, but nothing is coming up within the price range or the dates that I'm looking for [I'll be moving up Aug 22nd ish and start the internship on Sept 2.]

Can any of you recommend me other areas I should look at living? Also jobs i should look at? 'Cause TM isn't helpful on that front either. My current job is with a media company and I have a background in bar work [don't really wanna go back to hospo] and consumer electronics administration.

Thanks for any help you can offer!"
cwmc3,0,2010-08-02,"Reddit, I'm calling it quits for now, but maybe we can make a fun experiment out of this?",[deleted],reddit.com,https://www.reddit.com/r/reddit.com/comments/cwmc3/reddit_im_calling_it_quits_for_now_but_maybe_we/,"I am seventeen years old, doing poorly in school, and have completely forgotten what having a social life is about. I've been online too much. On the other hand, I'm very optimistic and believe that I can still turn things around. I'm going to keep things simple: I've spent a lot of time on Reddit, time  which I could have made better use of, but I've also acquired quite a bit of comment karma in the process.

Most of you, if you have seen my comments, know that my comments are usually absolutely useless and add nothing to any discussion except for maybe a cheap laugh or two. As of right now, I have *31,000 comment karma* and I am more than happy to trade that karma for some in real-life karma.

I've decided that if I can lose 1,000 comment karma in **the next few days** I will donate $1000 to any charity of your choice. (I'm leaning towards donating to St. Jude Children's Research Hospital, though)

I have absolutely no savings, and I'm about to start school in a new high school after moving into a new home. A lot of my old classmate have already had jobs at my age (17), and a few have managed to start internships, but I currently have nothing on my resume. I am willing to start over in my new high school (I'll try to make new friends), get a part time job (I'll try to earn some money) and give back in any way I can (I've battled depression for the last few years and my parents have been very supportive in helping me overcome it) As a way of improving my life I'm going to stop wasting my time online, and start spending more of it offline. I need your help Reddit, give me that push.

**TL;DR: if you've never liked my comments, downvote them now. if you've liked some of my comments but not all of them, downvote me now. If you don't even know who I am and already don't like me, downvote me now. Cunt.**

**EDIT** *I'll post a picture of me donating the check in a few months (because that's probably how long it's going to take me to save that much) if you think I'm just trolling, I'm going to prove you wrong. I've always loved Reddit and still do, but both you and I know it would be a better use of my time if I were to actually doing something productive with my life rather than hating on a nobody.*

**EDIT NUMBER TWO** *Extended time period to a few days.*"
cwnqv,15,2010-08-02,Any advice for those who don't deal well with change?,pactrina,AskReddit,https://www.reddit.com/r/AskReddit/comments/cwnqv/any_advice_for_those_who_dont_deal_well_with/,"It seems like whenever I make a change in my life, even a small one (like moving to an apartment on the other side of town or taking a three month internship), I temporarily fall apart.  I get anxious and/or depressed, cry a lot, and perpetually question my judgement.  Its pretty miserable. Fortunately,  I've had a pretty stable life for the past few years though.

However, in a couple weeks, I'm going to be moving to a new state (from a college town to a big city), taking a new job (leaving my job of over 3 years), and moving in with my boyfriend (we've never lived in the same town).  I'm super excited about many of these changes, but I'm afraid I'm going to not handle it well.

Has anyone else had problems adapting to changes?  Any advice for how to get better at handling change gracefully?

Edit:  Thank you for all of the kind words and advice.  And even the bad puns are making me smile."
cwqmb,0,2010-08-03,Friends and business do not mix,osamabinlaidinawhile,AskReddit,https://www.reddit.com/r/AskReddit/comments/cwqmb/friends_and_business_do_not_mix/,"So heres the thing. I went to high school with this guy, never really talked to him then, then we ended up going to the same college. We have a lot of the same friends and soon we become friends. He's a pretty typical geek - into video games, building computers, and doing web start-ups. So he did have some experience with start-ups and he and a buddy of his started up a web design firm. I ""applied"" to be an ""intern"" at this company and I use this term loosely. So I talk to his buddy and he said he has a project for me. To essentially make a hot or not site. His partner (lets call him Chuck) offers to help me out and I being a proud person, decline and just start coding away in php. The deadline comes, and I'm not finished and I meet up with Chuck and give him what I have and apologize for not finishing. My friend (lets call him Alex) calls me a couple days later - bitches me out on the phone saying things like ""I knew we should have never hired you (btw I was never paid nor offered anything) and we lost a big contract because of you and you really disappointed us and don't ever bother talking to me again"" - I never said anything to him (nor saw him again) since then. A couple of weeks ago while I was back home with the parents, he apparently came over with his brother after hanging out with my roommate. My roommate allows him into my room and he starts to mess with my computer (thankfully I'm running OS X and have a bunch of extra security installed and he isn't as smart as he thinks and wasn't able to do much more then log into the guest account) but it still really pissed me off. You'd think my roommate would stand up for my privacy and not let other people into my room. 

Everytime I see something about him on facebook or someone mentions him - I feel guilty for letting a friend down (when really that much responsibility shouldn't have been put on an ""intern"") and angry that he is a douche for yelling at me w/o letting me respond and then messing with my computer later.  

What do you think reddit?"
cws4v,18,2010-08-03,IAmA strategy consultant. AMA.,dieukulele,IAmA,https://www.reddit.com/r/IAmA/comments/cws4v/iama_strategy_consultant_ama/,"I've seen into the soul of the industry and while it doesn't chomp as much money as banks do, I have rarely seen such darkness.
Combining my internships and my current job, I've been doing it for about two years."
cx1xo,1,2010-08-03,"Hi Reddit!  I'm thinking of going back to school to learn programming, any advice?",[deleted],AskReddit,https://www.reddit.com/r/AskReddit/comments/cx1xo/hi_reddit_im_thinking_of_going_back_to_school_to/,"I graduated with a BS in Marketing back in 2005 and since then I have jumped around a few companies and realized that I hate the marketing world.  The money does not align with the demands and I'm just over the advertising industry - it's not remotely what I thought it would be like when I was in college.  I probably would have benefited from doing an internship, oh well.  

That said, I have noticed a lot of demand for programmers of a wide range of languages and disciplines and some pretty phenomenal pay scales.  I wouldn't think of doing this strictly for the money, but it's an impressive increase over what I'm used to seeing for the typical advertising job.  So, my thought is to go back to school and learn programming.

My questions are,

Do you think the trend in more and more employers seeking programming professionals will continue?  I imagine it can only increase as people spend more and more time on their computers...

What would be a good approach to the educational aspect?  I was thinking something like a post-baccalaureate certificate, but I am thinking that wouldn't be taken seriously by employers?  This leads to a full-on masters in CompSci or something of the like, right?

Clearly I need a bit of direction, haha, and I'm hoping you programming wizards of Reddit can give me a bit of it.  Thanks!!"
cx573,3,2010-08-04,"The Expats of Reddit, I need your advice! ",BeijingDude,AskReddit,https://www.reddit.com/r/AskReddit/comments/cx573/the_expats_of_reddit_i_need_your_advice/,"Hello, fellow redditors! I am at a crossroad in my life and I need your infinite wisdom. I am a recent university graduate that is torn apart between choosing to start my career in Asia or Canada.

A little bit of my background: I was born in China and immigrated to Canada when I was 14, so I am fluent in Chinese and English. I graduated from a pretty good university in Canada (very well-known in Canada but little to none recognition in Asia) with three internships with three different multinationals under my belt. All three of them are corporate finance-related positions in various industries and it is my goal to break into the finance industry in Asia. I am enrolled in the CFA program and will be taking my level one exam in December.

So I'd love to hear your advices on starting a career in Asia. My goal is to find a job where I can fully utilize my bilingualism and understanding of both cultures. It does not have to be finance-centric, as long as it offers great career potentials.

Where do you start? Any good websites? Any of you have the similar experiences?   

Many thanks! 

tl;dr: A recent Canadian graduate with extensive internship experience but no ""real"" job experience trying to find a fitting job in Asia. Any advices are welcome!    "
cx57a,9,2010-08-04,"Hey Nightshift, I've been having trouble sleeping lately",fromcj,Nightshift,https://www.reddit.com/r/Nightshift/comments/cx57a/hey_nightshift_ive_been_having_trouble_sleeping/,"I've had a lot on my mind between my internship over the summer and school coming up and not having as much money as I need right now. I'm 500 miles from home and have been since May, I'm lonely and I just want to go back home and have some summer before school starts, but if I don't stay until August 31st then I won't have enough money to go to school and buy books."
cxa2g,0,2010-08-04,How does a degree-less 21 year old like me find a better IT job?,[deleted],AskReddit,https://www.reddit.com/r/AskReddit/comments/cxa2g/how_does_a_degreeless_21_year_old_like_me_find_a/,"I live in Atlanta, Georgia and i've been working as a Tier 1 helpdesk employee at a corporate company for 3 years now. I started as an intern and they offered me a job so i took it!

Everything was awesome when i came on board but then we got bought out by a larger company and things got mundane. I'm currently the most experienced best helpdesk tech they have but i'm still Tier 1!! This is like stuff you see on TV. 

My resume would look unimpressive because i haven't lived long enough to fill it with anything useful, how do i get a better job? Or appropriately leverage my situation here?

Any input is much appreciated"
