ad9m9,7,2009-12-10,"Any filmmakers on reddit? I'm looking for some advice on promotion, marketing, etc. ",mmarc,movies,https://www.reddit.com/r/movies/comments/ad9m9/any_filmmakers_on_reddit_im_looking_for_some/,"I've been working on feature-length film with my friend for a few years now, and the movie should be complete in a couple of months. It's a surreal comedy about a computer hacker and his team of interns as they stuggle to complete a big project on time. 

I feel like I'm really behind the game in terms of marketing and promotion of the film (getting the film into the public's consciousness) because it's just the two of us and we spend so much time working on the actual film. I'd really like to take the film as far as it can go after its done, in terms of festivals, distributors, and press. 

Anyone here have any experience with all that, either as a filmmaker working with publicists, festival strategists, etc., or as someone in one of these fields? I would really love to talk to some people about this stuff.

"
adcby,2,2009-12-10,"so i'm a smartass, is that good or bad?",tommyschoolbruh,seduction,https://www.reddit.com/r/seduction/comments/adcby/so_im_a_smartass_is_that_good_or_bad/,"so today at work we had a bday party. i left and i was making fun of how much icing was on the cake. when i shut the door i realized i forgot something and opened back up.

the girl was saying 'he's such a smartass' while laughing. i said 'me? no way!' and laughed it off.

any insight?

**edit**
she also said this in front of four of my co-workers, one of which is a really hot intern lol. this office is crawling with hot girls. anyway, social status, up or down from this?"
adpt9,0,2009-12-11,I really don't see anything wrong with Wall Street Bonuses.,saobi,reddit.com,https://www.reddit.com/r/reddit.com/comments/adpt9/i_really_dont_see_anything_wrong_with_wall_street/,"A senior trader/investment banker on Wall Street, even a managing director, even in a profitable group, the annual bonus is about 5-10 million. Only a few superstars get 10+ million.

Now think about it: In Manhattan, a very average, entry-level condo near Central Park starts at $10 million. Then you'd need at least one maid. Need to get a new car at least every 2-3 years: probably a new Bently or Maserati or Ferrari. Now your children need to go to some private prep school like Dalton or Trinity. And once the school finds out you work on Wall Street, then you'd have to shell out a lot for school donation every year. Then your wife needs to spend on jewelery, clothing, cosmetics, spas, vacations to Europe, etc just keep up with her social circle.  Then you'd need to maintain a summer house on Long Island or in Connecticut to keep up with your colleagues and friends. After all that, the bonus is really not that much.

Think about how hard they work: a senior managing director in Wall Street wakes up at around 6:30 AM, arrives in the office no later than 7:30AM. Then the rest of the day, every nerve is tightly wound for every second of the day, watching over 5 screens of constantly changing data/index/trends, answerering phones from customers, designing trading strategies. Lunch is just an egg salad sandwich brought to your desk by an intern, as you have zero time to step out even for lunch. You unwind at at 8,9,or even 10pm, then you call a cab home, falling asleep in the car. Once at home, you are too tired to even make love to your wife.

For 150K a year, who would do this job?????

Don't under-estimate those people."
adqq9,62,2009-12-11,How Not To Conduct a Relationship: A cautionary tale,[deleted],relationship_advice,https://www.reddit.com/r/relationship_advice/comments/adqq9/how_not_to_conduct_a_relationship_a_cautionary/,"First, although I'm not sure it's actually relevant, I'm a 32-year-old female.

Secondly, I am currently ""on a break"" from an off-and-on six-year relationship. He's 30, and almost completely blameless. 

Briefly, when we began dating, I was a 26-year-old with a fantastic job that brought me both a sense of fulfillment and a nice salary. In addition, I was about to embark on a solo trip to Germany to spend a month with friends I made through my university's exchange program (including a German man I was in a relationship with until I met my current boyfriend; the German confessed to me that he met a girl closer to home, too, so we ended our involvement mutually and amicably). I had so much going on in my life at that time that I felt good about, that I didn't feel I needed a partner. The physical contact and companionship were great, but not something I was focused on. I left for Germany after this guy and I -- we'll call him D -- had been seeing each other for a month. I came back a month later, and he was so enamored with me that he formally asked me to be his girlfriend. As in, he took me to dinner, took my hand in his, and said, ""Would you be my girl?"" I had never had that happen before, and the gesture was off the charts in terms of its romanticism. Finally, I was experiencing the kind of love I no longer believed existed.

About three months later, the unexpected happened: I lost my job. I had been in my position for seven years by that point, which started out as an unpaid internship and progressed rather quickly to my running the department after I had seriously impressed the owners of the company. Because I had focused so much on my career, the job loss was devastating to me. For as long as I live, I will never forget how hollow I felt as my boss told me he was going to have to let me go. He sent me on my merry way with a mere two weeks' salary and a letter of reference. I lost it. D was right there, and he did everything a fantastic boyfriend would do to cheer me up. I gave myself a day to grieve and then hit the pavement. Everything I applied to, I was turned down for. The first week, I had four interviews. Then two the following week. Then one. Then none. Fast forward another three months and I lost everything I owned. Apartment, car, furniture... all of it. In four months' time, my world was turned upside down. I moved back in with my mother and had to face the tumultuous relationship with her I had avoided for many years by that point. 

I'm giving a lot of information here, and I should probably zoom out a bit. In the interest of brevity (too late), I'll say that it took me eight months from the time I was let go to find a crappy stop-gap job that paid me less than half of what I was making before. My debts accumulated, my credit score plunged, and I was utterly and completely without a way out of the hole I found myself in. I moved in with D at that point, but by then, I had become an entirely different person than the dynamic girl he had fallen in love with: I was fixated, utterly and completely, on him and our relationship. Where I had once simply enjoyed his presence in my life, I now *needed* him, and when he wasn't right there, I freaked the fuck out. Almost immediately, the pressure became too much for him, and I ended up back at my mother's (after a brief stint in a mental institution following a total breakdown). We didn't speak for a few months, and I eventually began dating other people. D was there to listen to me as I told him about the guy who showed up to our date and proceeded to tell me all the ways he'd like to defile Britney Spears, and the other guy who strung me along for several weeks before admitting that I was his ""side project."" Many months later, D and I were back together, but the damage had been done: I had a crappy, low-paying job, no ability to return to or pay for school, nothing else in my life from which I could derive even the most remote sense of satisfaction, and the moment we were together again, he became my world. 

This cycle would repeat itself a few times. I eventually got back into my own place, but it was too expensive for me. There were entire weeks I wouldn't have eaten if not for D. My father died recently and it affected me deeply; of my two parents, even though my father was two states away, I had the vastly less dysfunctional relationship with him. I repaid D for his kindness by fixating on the mistakes he made, no matter how big or small, rather than by appreciating him for all the wonderful things he did for me. And most recently, I had become consumed by the kind of jealousy I had only heard about from my guy friends whose girlfriends were utter psychos. Any female he talked to heralded the imminent end of our relationship; they were young, fun, attractive, and going places... all things I could no longer claim for myself. In my struggle to be his number one, I lost sight of myself, and became someone with whom he always felt on edge. His every move was under constant scrutiny as I looked for signs that he was about to leave me. On some level, I knew I brought nothing to the table, yet that wasn't enough to knock some sense into myself. And although he may not yet have left for good, I have to face the possibility that maybe he has. It destroys me, because we had some amazing times together, and I have dated enough to know that he's rare... but I know I have only myself to blame if this is truly the end.

Even as I sit and think of the things he did that weren't exactly helpful, I have to believe that if I had brushed myself off and continued being the focused, personally satisfied individual he met, I wouldn't be writing this. I've been so content to believe all this time that he caused these reactions in me, when it was really the other way around. 

Today, I registered for classes. It's the first time I've been back in school since before we met, and the act of paying off my old debt to the university and signing off on the classes I needed brought about a feeling I haven't felt in years: pride. I was proud of myself for taking this step, and it suddenly doesn't matter if he's surrounded by adorable college-aged girls anymore. I had an idea that it would do this for me, but I really didn't know for sure until I actually made the move. But as I picked up my cell phone to call him and share the good news, I stopped myself: we're not speaking at the moment. At least for a few weeks, maybe for good. I did send him a short email, but I immediately regretted it. I deserve what I'm getting right now and I know it. Still, knowing he's proud of me is important, and I'm having trouble deciding whether that's a good thing. I think it is; who among us doesn't like knowing we're special to someone? 

**Here's the tl;dr**: If you have love, honor it. Honor it by loving yourself. It's bandied about quite a bit, the old saying that you can't love anyone until you love yourself, but it's absolutely true. So for those of you who are smothering your significant other because of an underlying lack of personal satisfaction (and you know who you are), take a step back. Take stock of what is important to *you*, create fulfillment for yourself, and then enjoy your relationship for the ways it enhances your life. And for those of you who are being smothered, show your significant other this post. There's not much I wouldn't do right now to tell my boyfriend how sorry I am, but I have to sit quietly with this for a while and let my actions sink in. I had love, and I killed it. 

Thanks for being my catharsis, Reddit, and I'm sorry for the wall of text. 

"
adqw6,0,2009-12-11,dear reddit: i love you. can you help me?,lifeisshort,reddit.com,https://www.reddit.com/r/reddit.com/comments/adqw6/dear_reddit_i_love_you_can_you_help_me/,"So I created this throwaway account because I need some help.

I'm a freshman in college, commuting from my parent's house, and I'm working on moving out. I need a job in order to do this, and have applied to 20+ places - no callbacks. 

I've been doing photography and selling my work since sophomore year of high school, but the places that used to buy my work are no longer able to afford it. I'm in an art department that's supposed to be amazing, but the professors I've talked to are as clueless as I am in terms of internship opportunities, places to go and sell, etc... So I turn to you, Reddit. What do I do?! I'm clueless here..."
ae3j7,20,2009-12-13,Can someone help me create a resume?,hitmeup,Favors,https://www.reddit.com/r/Favors/comments/ae3j7/can_someone_help_me_create_a_resume/,"I have no experience in making a resume, so I was hoping someone could help me. I don't have a lot of working experience, so I thought one that emphasizes on my education is better. I need one so that I can get letters of recommendation to get accepted into a study program at my school. Also, one that can help me get an internship as a laboratory technician to build experience. Thanks alot Things about me:

-Sophomore year
-3.6+ GPA
-Completed 2 years of general chemistry and chemistry laboratory
-Completed 2 years of Biology and biology laboratory
-Completed all general education courses
-Knows 2 languages fluently, and one in progress
-Quick-learning
-Steady hands
-Keen eyes for details
-Follow procedures to a Tee.

"
ae3lc,8,2009-12-13,College Undergrad for hire as an intern in Richmond VA.,hitmeup,forhire,https://www.reddit.com/r/forhire/comments/ae3lc/college_undergrad_for_hire_as_an_intern_in/,"I have very few working experiences, except for general service like McDonalds and such, but I am studying to become a Laboratory Technician. So I'm looking for an internship at a laboratory so that I can build experience. Thank you"
ae4a3,0,2009-12-13,Can you do anything about a chronically late SO?,nimby_con,relationship_advice,https://www.reddit.com/r/relationship_advice/comments/ae4a3/can_you_do_anything_about_a_chronically_late_so/,"I've been dating this guy for about 3-4 years so basically we've been together through college and I adore him ridiculously and the sex is still spectacular. The only problem is that he's always late to everything and I do mean everything. It's actually completely shocking to me or any of his friends when he shows up to anything on time on his own. He sleeps through classes, comes at least an half hour late to our dates that don't involve movies (forget about him showing up before noon), and has shown up at least a day after he said he would when he came to visit and I had to call him to find this out. 

At first this didn't bother me so much but it's really starting to get to me now that I'm doing an internship. We're really starting to align less with our schedules so I have a lot less flexibility. The constant lateness is also beginning to feel like he's ignoring me until it's convenient to him to see me. 

Of course I've talked this over with him and he has a variety of reasons. He oversleeps because he stays up late so he can talk with people in other places over IRC. He can't email them because it would loose spontaneity besides he's a night owl that thinks best late. He can't wake up when I call because the bed's too warm and comfortable and he also doesn't really wake up so going back to bed is ""unavoidable"". He shows up late because he gets distracted easily either talking or programming (he really does have fully diagnosed ADHD).

So I guess my question is when does this become hopeless? As I said I'm still rather attached though my patience is wearing thin. I'd love to save this but I can't keep this up and obviously it's starting to really bother me. What can I suggest that might actually help? Should I just do myself a favor and break up with him before I start hating his guts for this frustrating behavior?

Sorry for terrible grammar, etc."
ae951,9,2009-12-13,"It's a longshot, but I'm looking for an internship in West Michigan so I can graduate in May.",[deleted],Favors,https://www.reddit.com/r/Favors/comments/ae951/its_a_longshot_but_im_looking_for_an_internship/,"I'm currently a senior working towards my Computer Science degree at Grand Valley State University in Allendale, Michigan. It has been quite difficult finding a company that doesn't yet have someone interning, or that isn't a two hour drive from campus. I need to finish up classes next semester while working (minimum) 16 hours at a professional internship. I am a hard worker and love being a part of a team. If anyone can help directly or indirectly, I would be so very grateful. 

I have my résumé ready to go if anyone is interested."
aeddn,3,2009-12-14,"I am currently living in the U.S. and I have become an ""illegal"" immigrant. (Expired passport, came here on a temporary Visa). I am a mechanical engineering student with high aspirations. If you have any legal expertise please give me some insight on my options.",importantquestion,AskReddit,https://www.reddit.com/r/AskReddit/comments/aeddn/i_am_currently_living_in_the_us_and_i_have_become/,"Greetings Reddit!

I have been battling with this problem by myself for a while but it has not affected my life drastically until now. I need advice and any information I can get. I feel as if my dreams and goals are getting further and further out of my reach. Here is my story (kind of lengthy but necessary) 

Let me start from the beginning.

I moved to the U.S. with my family when I was around six. We came legally on a temporary Visa, trying to get a break from some political pressure my mom was going through. She worked as an accountant for the Mexican government, some embezzlement ordeal began, and they tried to frame her / pull her into the mess. The issue never settled so we decided to stay in the U.S. for a bit, hoping to be able to relocate to another country (Spain) by selling all our properties and withdrawing our savings. It ended up that our savings had been locked as part of an investigation and all we had left were a few houses my mom owned. After selling the properties, we arranged to transfer the money here little by little (10,000-dollar cap for transferring money). Long story short we were not able to transfer enough money to relocate.

All this happened pre-9/11, so immigration laws were not so strict. 

My family decided to start a new life here in the U.S. My mother and father both were very successful in Mexico but had to resort to cleaning houses in order to get by. My family of six lived in one room in my uncle’s house for a few years. My sisters and I began to attend elementary school here while my parents continued to clean houses. My dad also jumped around as a handy man; pool clear, painter, truck driver, etc. (Pretty much anything he could do to make money). My mother worked magic with money so we were able to finally get our own apartment after almost 3 years of living in one room. (mind you, still only a 2 bedroom) With the help and good will of some of the most amazing people in our lives, we finally were able to rent a house. Again, my mother worked our numbers right and we were able to buy a house years later after a few loans from friends. We are now very stable and have come a long way from where we were. We own a home, 3 cars, and lived relatively well. (small house, standard cars, and we at least have food) We have always been a very humble family and do not have luxuries of awesome Christmas/birthday/graduation gifts, vacations, etc. Our income is around 15,000 a year. Nevertheless, we enjoy life. 

My siblings and I have always excelled in school and in our passions. I am bilingual, (no accent in English, accent when speaking Spanish), straight A student, and have many accomplishments to my name. I have excelled in robotics competitions, winning a few world championship titles when I was younger. Love working out and am an athlete (varsity swimming and wrestling). Enjoy music (symphonic band, marching band, jazz band, know how to play trombone, baritone, flute, guitar, and love drumming) Certified computer technician, enjoy programming/web design. I could keep going (not gloating) but basically, I am an all around person who enjoys learning new things and mastering what I focus on. 

Since I was little my dream was to become a Mechanical Engineer. I worked hard in school to accomplish my goal. I also have my own little workshop in our garage where I take on projects from time to time. Currently working on ""green"" a four-seater quad cycle project with the help a few friends.


Here's the problem
	

 I am currently in college studying mechanical engineering. I am on a full ride thanks to various private scholarships I was able to obtain. As you can figure my parents cannot pay for school, and since I have no legal status I cannot get financial aid. The only reason I was admitted into college in the first place was because of a new bill that was passed: House Bill 1403. Before this bill was passed, I was in a deep depression knowing all my hard work had gone to waste. 	When you are a kid, these restrictions do not affect you too much. However, when you grow older and realize you cannot get a driver's license like your friends, you cannot get a ""real"" job. You CANNOT apply to the school of your dreams even though you are qualified. That you MUST lie to people close to you (friends) about why you cannot drive nor do certain things that are usually not an issue. These things all hit me during my high school years. I pushed through regardless and excelled hoping that a new development would give me opportunities. 
	
 As a college student, I am very involved, and many doors are opening for me. Unfortunately, I am in a very stressful position. I have been offered/applied/accepted to a few internships. I have also been offered to go to a few conferences related to school, along with job offers. I would love nothing more than to be able to have these experiences but I cannot. Since I have no legal status, I do not have a federal I.D. to allow me to fly to these locations. I would use my passport, but it is expired. I would renew it but I cannot go back to Mexico without having to physically return. If I did that, I would not be able to come back into the U.S.
 Things are getting tough without the proper paper work. After I turned 18, a lot of pressure was set on me. I take the bus to school in the mornings when I cannot get a ride from my dad or a friend. I used to drive but sold my car after I was re-ended and went through a horrible experience dealing with the law. (realized just how quickly everything could dismantle even if someone else caused the accident- deportation)


I have looked into a lot of law in order to be able to find something that may be able to help me, but my efforts have been futile. My parents were able to gained residency / SSN # after my oldest sister got married and applied for them. (Took about 5 years, even with a few connections). They have applied for me but the process will still take about 8 years at least.


If I could somehow obtain a legitimate federal ID than I could apply for a TIN (taxpayer identification number). Which would allow me to get a job and fulfill my true potential.

Please help me. I live in Texas. If you need any more information PM me but remember, I can only disclose so much information.

-- this is of course a throw away account.
"
aeed3,2,2009-12-14,Give a third year college student majoring in Marketing and Global Business Studies an Internship in NYC.,norwegianrich,Favors,https://www.reddit.com/r/Favors/comments/aeed3/give_a_third_year_college_student_majoring_in/,"this post reeks of desperation but I thought along with my normal job/internship hunting I might throw myself out here as well. It can't hurt really. I would really prefer a paid internship but I am open to slave labor. 

resume is available upon request. 
"
aemks,0,2009-12-14,CS internship opportunities (preferably) in Europe,biosHazard,programming,https://www.reddit.com/r/programming/comments/aemks/cs_internship_opportunities_preferably_in_europe/,"Hi all, I am currently researching some software engineering internship opportunities for this summer. (never did an internship before). I am a CS student and fairly knowledgeable in all aspects and technologies and had done project-based commercial work for some local software contractors (mostly done .NET and had my fair share of C++, but I am no stranger of Java, Python and Linux environments and algorithms). 

There are a lot of local internship opportunities here (Cluj, Romania), but I want to go abroad and experience living on my own somewhere.
I don't want to make a heap of money, just to support myself once I get there, and to work on something cool and meet some interesting professionals.

So, Reddit, my question is, have any ides of such internships here in Europe?, besides the obvious Google and Microsoft (for which I will try my luck and apply). Where have you completed your internship, how was it? Any tips? 

If you have any suggestions for the US, they are great too, please don't  hesitate to mention them, but my initial thought was for something closer to home."
aezfa,5,2009-12-15,[---] Job hunt ideas!,howiez,Favors,https://www.reddit.com/r/Favors/comments/aezfa/job_hunt_ideas/,My friend is looking for an internship or something over this summer with an Architecture firm.  Any ideas where?  Locations kind of limited to NYC/Boston/Georgia. Big or small!
af07l,7,2009-12-15,(---)Trying to learn something new/Looking for an internship in the NY/Westchester areas.,Robin420,Favors,https://www.reddit.com/r/Favors/comments/af07l/trying_to_learn_something_newlooking_for_an/,"Hey Reddit... I recently lost my job as a production manager for a renovation company and, can't seem to find work anywhere... (about to start receiving unemployment actually) I figure it'll be the first time since college i can afford to learn something new... Anyway i come to my fellow redditors in search of a favor... Are you in a position where you can hire an intern? [resume](http://newyork.craigslist.org/wch/res/1509584761.html)... If so please consider me :)"
