i6h7e,1,2011-06-22,How to prepare for applying for an internship in a few months?,[deleted],web_design,https://www.reddit.com/r/web_design/comments/i6h7e/how_to_prepare_for_applying_for_an_internship_in/,"Hi r/web_design

This year, I have really gotten into web design on my own and am still working a bit on my [first site](http://www.fifaencyclopedia.com) to make it as best as possible. I know it's not all that impressive, but I tried to make it as much of a learning experience as possible, meaning I tried and am trying to implement things I would like to use in the future.

From this, I have gotten quite good at what I would classify ""intermediate"" HTML and CSS. I'm going to start learning some PHP and possibly MySQL (would it be needed?) My next point of action would be to begin working on some more self-owned sites and do as much freelancing as possible, but I'm not so sure I'm experienced enough to do freelancing yet.

In my town, there is a small local web design business that is a popular choice for a lot of local businesses. Looking at their Facebook page, the working environment seems awesome. Mostly younger, less serious guys who still work hard it seems. They have an employees page, and it says a few of the guys worked as interns before being hired full time, but most of them are in or have graduated from college already. 

Meanwhile, I'm only 16 and will be nearly 17 by the time I would be applying (after soccer season as it would be impossible to work during that time). I posted a question to their formspring page (what I'd be like at the time of applying, hopefully):

**Say a 17 year old with some experience in web design (namely HTML, CSS, PHP, and MySQL) had a decent resume of self-owned sites and some freelancing work, would you consider hiring them as an intern despite age?**

*OF COURSE WE WOULD! The younger the better! We would hire an 8 year old if they knew php WELL and they could CLOSE PROJECTS OUT! Really though, don't be shy! Apply!*

Should I apply for summer work now even if I'm not that experienced yet? What do you think of all this? I really just want a nice environment to get good experience in web design and possibly even be hired somewhere down the line."
i6fxk,2,2011-06-22,How to deal with a break up?,IxiusRoulee,relationships,https://www.reddit.com/r/relationships/comments/i6fxk/how_to_deal_with_a_break_up/,"A little background:

M:21 F:21, I'm the male.

We've been dating for 2 years and 4 months. Over that period of time, we've had our ups and downs and have gotten through them. Recently (Past few months) we've been arguing a lot. Sometimes she says that she isn't attracted to me anymore and wants me to build muscle on my upper body. I'm not fat or overweight at all, I'm a little on the skinny side but I'm not lanky and I find myself to be quite attractive.

This past semester, my grades weren't up to my parent's standards and since I borrow a car from them, my privileges to use the car have been taken away. My girlfriend finds the lack of independence to be very unattractive and she says she doesn't want to be dating a kid and can't respect me. Also she is two months older than me and always makes it seem like I am younger than her by a large margin. She diminishes me in front of my friends and her friends as well. She thinks I'm an idiot and have no common sense or logic, which is completely false. She does get better grades than me (she is one of the best in her class) but I still get pretty good grades, I just have a very strict family (not of asian descent) We decided to take a break until I buy my own car to be able to visit her or get my car privileges back and get my life in order. We still talk a lot and still say 'I love you' back and forth but we've been on the break awhile now and I'm just on the verge of getting my car back. I am also saving money from my internship right now to buy a car and get an apartment for the next year. 

Today, we had a misunderstanding and a fight emerged because of it. She thought I was going to call her to wake up but I was going to call her after she woke up so that I would keep her from going back to sleep. She has insomnia so when she sleeps well it is a big deal, and she didn't have work today so she could sleep in. She said she was going to wake up around 9:30 am, so I texted her at that time to say good morning and see if she was up. She didn't respond so I figured she was able to sleep well so I let her sleep instead of calling and waking her up. Lunch time rolls around and I decided to give her a call. She picks up and gets mad at me for not calling her, I asked her if the alarm went off and she said yes, and she got my text but didn't wake up, respond or call back whatsoever. She says continues to say how dumb I am and have no logic etc. etc. Usually she gets this way just because she is mad so I throw back the counter-arguments ""It was a misunderstanding"" etc. She then says that her friends see my lack of common sense and logic too but I think she points it out to them and amplifies the situation every time something goes wrong. I try to be a wonderful boyfriend, be understanding. I am very patient and have put up with her short fuse and frustration for a long time, but this has gone too far. She's made it clear that she doesn't respect me, and finds me unattractive. 

I know break-ups are tough for almost all situations but I'm not a very assertive person. I still love this girl very much but it needs to end before it goes too far. I can't be in a relationship with a girl who treats me like this. Any words of advice about breaking it off would be greatly appreciated.

TL;DR my girlfriend doesn't respect me, and finds me unattractive after 2 and a half years relationship, but continues to string me along. Need help with the mental hurdles of breaking up with a girl who I am still very much in love with.

edit: This is way longer than I expected it to be, ask any questions about anything I may have left out and I will include them in replies and further edits."
i6erc,0,2011-06-22,[for hire] Accounting/Finance MBA graduate looking for an exciting company,freeridstylee,chicagojobs,https://www.reddit.com/r/chicagojobs/comments/i6erc/for_hire_accountingfinance_mba_graduate_looking/,"I'm about to finish up my MBA at the University of Detroit Mercy this coming August, and would like to make the move from The Detroit Area to Chicago.

I have 3 years experience in public accounting.  Tax (individual, partnership, and corporation), Auditing, Compilations, Reviews, Bookkeeping, etc.  I also had an accounting internship at The Kalamazoo County Court System.

I will graduate with a 3.76 GPA, a finance concentration, and have been working as a graduate student assistant.  My duties included grading, setting up courses, running 4 websites, and office and administrative functions.  I have been an active member of Alpha Iota Delta IT and Decision Sciences Honor Society and Alpha Sigma Nu Jesuit Honor Society.  I am also tutoring students for a graduate level spreadsheet analysis class.

I would prefer working in corporate finance, auditing (especially systems auditing), or anything involving ERPs (I have a strong desire to learn SAP).  I'm not looking to go back into tax.  

Any tips on how to better market myself or leads would be greatly appreciated!  Thanks for your time."
i6aq8,0,2011-06-22,Does Reddit Hire Interns?,[deleted],jobs,https://www.reddit.com/r/jobs/comments/i6aq8/does_reddit_hire_interns/,"I recently graduated White High School in Memphis, TN and will be attending Rhodes College. I was wondering If Reddit hired interns. I have experience in Python, Fortran90, and Java. And I am learning Objective-C. I have worked with Dr. Gerrit Verschuur, been to Tennessee Governor's School for Computational Physics, done research work at Pari Observatory. I also know Android Programming and am learning iOS programming. I currently work for Lunaweb as a developer. 

I would very much like to intern at Reddit, and see and learn from the work that goes into making this site. 

Thank you for taking time out of your day to read this.  "
i5zo0,24,2011-06-22,How many programming languages am I expected to know by the time I graduate as a Computer Engineer?,Oryzae,learnprogramming,https://www.reddit.com/r/learnprogramming/comments/i5zo0/how_many_programming_languages_am_i_expected_to/,"Hey Reddit,

I'm entering my senior year in a Computer Engineering program. I know a good chunk of C++, I vaguely remember basic Java, and I know some introductory assembly language. The internships I am applying for require me to know a bunch of languages varying from HTML, CSS and JavaScript to shell scripting to python/perl to LAMP to networking. I feel like I'll never catch up with the industry (at least not the proficiency level I'd like to achieve). 

What can I do? 
Or am I just being paranoid? 

I don't honestly want to do a LOT of programming (I would've been a Computer Science major if I loved it *that* much), since I'm trying to focus on chip design or computer hardware in general. 

I would also like to learn how to be a good unix admin, I'm running crunchbang (which is basically just a version of debian squeeze) so I should have all the tools at my disposal. How would I go about setting up a nice ""network test sandbox""? 

I have so many more questions in my mind that's kind of bringing me down so any help is much appreciated!

Thanks!"
i5vgf,7,2011-06-21,"My ex gf is currently in the hospital for a suicide attempt, I'm having trouble knowing what to do.",Throwaway32174,SuicideWatch,https://www.reddit.com/r/SuicideWatch/comments/i5vgf/my_ex_gf_is_currently_in_the_hospital_for_a/,"Backstory here: http://redd.it/i44yi

The updated information is they admitted her to the hospital, and she has an actual room now, and may be there 4-7 days.

A little info I forgot to include in the other post: She usually lives about 30-45 min away from me, depending on traffic. She actually was just visiting this past weekend, as she has an internship 4 hours away, where her parents live.

I hope this doesn't sound selfish, but right now I seem to be having trouble figuring out what *I* am supposed to be doing. She wants me to come visit her, and I feel bad since she has no one else here. I know she was finally calling both her parents (they don't live together) tonight after I talked to her, but I'm not sure if they're coming or anything.

First of all, I'm not sure me being there is a good thing. At some point I'd think she will go from thinking I'm this great guy she's in love with, to thinking about how she's there because I called 911. She already said today she wished I had just come myself, and taken her to the E.R. so she would be there voluntarily. I told her maybe it's a good thing they are keeping her there. The Craigslist post was incredibly fucked up, and so was reading the notes.

Sorry for rambling, but I guess the advice is, what can I do for her, and what can I do for myself? I do not have any desire to get back together with her, but I'm pretty sure she still does. Another reason I'm not sure if her seeing me is good or not. I did promise her I would bring her some stuff from her apartment, so I am going to see her at least one more time, unless there's an unexpected twist."
i7mfs,1,2011-06-23,Grandpa Wiggly's Original Mayonnaise AMA [Restored],grandpawiggly,grandpawiggly,https://www.reddit.com/r/grandpawiggly/comments/i7mfs/grandpa_wigglys_original_mayonnaise_ama_restored/,"*The following is a restoration.  An IAmA moderator deleted the [original post](http://www.reddit.com/r/IAmA/comments/c9iq1/i_am_a_failed_entrepreneur_a_little_guy_who_lost/); comments, questions and answers remain.  It is the policy of /r/IAmA to remove fake AMAs not explicitly presented as works of fiction if moderators determine the subject matter is intended to be taken seriously and within the realm of believability, possibility or logic, such as a hip, internet savvy 80-year-old man who makes bathtub mayonnaise and is married to an ill-tempered, one-armed, crazy cat lady who lost her arm in an unfortunate bathtub mayonnaise related incident.  Conversely, fake AMAs not explicitly presented as works of fiction but which are obvious works of fiction set up as a joke and therefore not intended to be taken seriously are perfectly acceptable and allowed to stay up if the moderators deem the subject matter completely impossible and/or illogical, such as a [time traveler from the future](http://www.reddit.com/r/IAmA/comments/9z4d5/10_years_from_now_i_am_a_scientist_working_at_the/), or if the fake AMA happens to be a [favorite of 32bites](http://www.reddit.com/r/IAmA/comments/just3/i_am_that_asshole_all_of_you_hate_so_much_32bites/c2fasqa).*  
    



  
____  
  
**[I am a failed entrepreneur. A little guy who lost to the big corporate bullies of the free market. Ask Me Anything.](http://www.reddit.com/r/IAmA/comments/c9iq1/i_am_a_failed_entrepreneur_a_little_guy_who_lost/)**  
  

Many years ago I created, developed, perfected and marketed Wiggly Brand Mayonnaise -- the richest, creamiest, wiggliest mayonnaise in the south.   
  

I made the mayonnaise myself; the first experimental batch I made in the bathtub turned out chunky and too yellow.  After that (and following my wife's accident), I was forced to move my mayonnaise lab down to the basement.  It was trial and error for the first couple of months as I tried to find new and exciting ways to improve and invigorate mayonnaise.  But once I perfected it and got it just right it was beautiful.  So thick you could lay on it.  I knew I had created a mayonnaise that would go far beyond being a condiment for food.  The applications of Wiggly Brand Mayonnaise would be endless...
  
I bottled it in mason jars and sold it out of my home.  Once word of mouth about my mouthwatering mayonnaise spread all around town, I started selling it at the farmer's market.  Soon I had the grocers and druggists begging me to let them sell my mayonnaise.  That meant I had to make much more mayonnaise.  
  
During the summer months I recruited some strapping young interns from the schoolhouse.  I couldn't pay those young lads much (a dollar a day plus all the mayonnaise they could carry home in their pockets) but I was able to give them the one thing they wanted most: Sense of Accomplishment.  For me, it was more than just male bonding and mayonnaise in my sweltering hot basement.  That was probably the best summer of their lives.  
  

Soon I worked out a distribution deal with Piggly Wiggly supermarkets to test out Wiggly Brand Mayonnaise at half a dozen of their stores in Tennessee and Kentucky.  They were even going to let me slather advertisements all over their stores from the windows to the walls.  Unfortunately, the Big Boys of Mayonnaise -- Hellmann's, Blueplate, Duke's, Zippy's, Gold Medal and, of course, the behemoth of them all: Kraft and their vile Miracle Whip* -- ran me out of town.  
  

The big food companies pretty much dictate how much supermarket shelf space is made available for all products, not just their own.  Especially mayonnaise!  I got about six inches on the bottom shelf, barely enough space for a single jar-wide row, and close enough to the floor where the cleaning crew's floor scrubbers and waxers would dirty up my mayonnaise mason jars on a nightly basis.  
  
I never had a fighting chance.  I only sold a few cases and after just three months Piggly Wiggly sent me packing.  That was the beginning of the end.  The dark days of mayonnaise had come.   
  

I still make mayonnaise for my own consumption and for gifts (look out Secret Santa!) but I'm out of the mayonnaise selling business for good.  Too many bad mayonnaise memories.  
  
Those were the golden days of mayonnaise, long before mayonnaise culture was sullied by cheap gimmicks like light mayonnaise, vegenaise (who could love you?), and wide-mouth jars.  Back then it was about the mayonnaise.  
  
Ask me anything about my mayonnaise business or about mayonnaise in general.  I consider myself an expert on the subject.  I'll even share my mayonnaise inclusive recipes (like my triple fudge mayonnaise cake made with real mayonnaise!).  Mayonnaise has limitless uses beyond food.  Ask me about what mayonnaise can do for you.
  
  
________
*Miracle Whip is not mayonnaise!  It's salad dressing or, more specifically, a modified and disturbingly unnatural variation of salad cream.*  
  
________  
**UPDATE:** I will be going to bed shortly.  It is way past my usual bedtime.  I normally would be getting up in a few hours.  I have gotten so much enjoyment answering all of your curiosities about mayonnaise.  Many of you are so eager to learn about mayonnaise!  I'll be back in the morning...  
  
________
**Make your own Wiggly Mayonnaise at home.**  
(Although it's not authentically Wiggly without Grandpa Wiggly!)  

  

**INGREDIENTS**  

* half a cup of peanut oil (or a favorite flavorful nut oil of your choosing)
* half a cup one cup of corn oil
* one tablespoon of sesame oil (optional)
* two egg yolks (one egg yolk for every half cup of oil)
* one tablespoon of honey Dijon mustard
* one tablespoon of fresh lemon juice or white wine vinegar (or half of both)
* one small squeeze of indigenous honey
* one garlic clove, crushed (optional)
* a pinch of salt
* a pinch of pepper
* a pinch of paprika (optional)
* a pinch of cayenne pepper (optional)
* a pinch of onion powder (optional)
* a pinch of tarragon (optional)  



  
**INSTRUCTIONS**  
  
* All of your ingredients should be at room temperature before you begin.  I prefer right at 21 degrees Celsius (70 degrees Fahrenheit).  
* Add the eggs and half of the lemon juice and vinegar together in a bowl and lightly mix together.
* Slowly add your half of your oil mixture while whisking (not folding) everything together.  It will start to thicken nicely, forming mayonnaise.  
* Add the remaining half of your lemon juice and vinegar.  Whisk.
* Add the remaining half of your oil.  Whisk.  The more you whisk, the thicker your mayonnaise will be.
* Add the honey Dijon mustard, honey and lard.  Incorporate them into the mixture.
* Add the salt, pepper and other spices.  Whisk.  Whisk.  Whisk.
* You now have Mayonnaise in its simplest form!  Resist the urge to eat it.  Your mayonnaise will have more of a creamy light yellow color than store bought mayonnaise.  That's how you know its homemade mayonnaise!
* Refrigerate your mayonnaise for at least two hours, allowing it to cool completely.  If you're planning on bottling your mayonnaise in mason jars still allow it to cool first. 
* Once your mayonnaise has cooled you can enjoy your mayonnaise.  But save Grandpa Wiggly some!
  

Some mayonnaise recipes call for sugar, not Wiggly Mayonnaise.  I prefer to add a little sweetness to my mayonnaise using a sweet honey Dijon mustard and a dash of honey.  Always use indigenous honey!  You should buy local honey and only eat honey that is indigenous to your area and climate.  No sugar means a healthier mayonnaise!  
  
Olive oil, especially EVOO (Extra Virgin Olive Oil) will make your mayonnaise tangy and too heavy.  Eventually the weight of the olive oil will cause it to separate from the egg and that's not mayonnaise. If you truly desire the taste of olive oil in your mayonnaise then substitute it for one-fourth (but no more than a half) of your corn oil.  
  
For extra EXTRA thick mayonnaise: Freeze your eggs over night and then allow them to thaw.  Make sure they cool to room temperature before you begin to make your mayonnaise.  
  
For a thinner mayonnaise: Add in heavy whipping cream, half and half, or milk.  The more you add, the thinner your mayonnaise will be.
  
If you want your mayonnaise to be extra rich use only egg yolks.  
  
Mayonnaise with just white wine vinegar and no lemon juice will have a longer shelf life.  Ideal if you're making mayonnaise for the season or for holiday/birthday gifts.  
  
________  
**[Share your Mayonnaise Stories!](http://www.reddit.com/r/mayonnaise/)**"
i7i17,1,2011-06-23,Adding another screen to a laptop,X019,AskReddit,https://www.reddit.com/r/AskReddit/comments/i7i17/adding_another_screen_to_a_laptop/,"I'm an IT intern, and my boss has an interesting request. He wants another screen attached to his laptop. Now this isn't just an additional monitor sitting off to the side of it, he wants one actually attached to it like on a [W700DS](http://shop.lenovo.com/us/notebooks/thinkpad/w-series/w700ds). From what I know of laptops, This would be a quite difficult mod to perform, so I figured I'd ask the all knowing Reddit to see if anyone has some kind of solution to this."
i7fdy,1,2011-06-23,Looking for feedback on some logo designs,grimtrigger,Design,https://www.reddit.com/r/Design/comments/i7fdy/looking_for_feedback_on_some_logo_designs/,"http://grimtrigger.imgur.com/gradloop_logos#i2Gd6

Its for a site which matches employes with interns. Please let me know which you like better and what can be improved.

Much appreciated,
gt"
