hti1x,0,2011-06-07,The whole thing sucks. A down to earth view from a downtrodden college student.,Newtonsenigma,reddit.com,https://www.reddit.com/r/reddit.com/comments/hti1x/the_whole_thing_sucks_a_down_to_earth_view_from_a/,"So this is my dilemma. I'm a 25 y/o college student my major is in physics and there seems to be no end to the hoops I have to go through just to be enrolled. I am a white male so I don't get as many breaks when it comes to funding. Financial Aid is monitoring my grades for 2 semesters this is the last week of the 2nd semester and it's finals week so a lot rests on my shoulders to get better than 'c's. At the beginning of the semester there was a glitch in the system and I was put up for academic dismissal even though I got straight 'A's. That got ironed out and I was able to continue my education.

That's just the beginning of my troubles. I don't have a job, car, place of my own. Currently I'm staying with my mom but things are getting a little dicey. I still love my mom but I need to get out. The job market in my area is little to none, I get bitched at for not having a job. My mom still thinks that you can just walk up to a business and get hired. It's not the 80's anymore. I've tried to calmly explain why the job market is lousy, but according to ""Fox New's"" every word that comes out of my mouth is liberal.

To be honest I really need a job. I put my search on hold during this last semester. I had a very full course load. I was/am taking AC theory, Tech Math II (there was no pre-reqs but it's equivalent would be trigonometry with basic calculus. I took Tech Math I last semester which I would liken to College Algebra. Other than that I haven't taken a math class since I was in High School), Real Estate Economics, and a survey of rock and roll class.

I have multiple skills, I've worked at a lot of different places and have accrued a lot of different skills. Everything from customer service to defusing altercations. So why is it so hard for a white male in his mid-20's to get a job? If I can't find one soon I'll be living out of my backpack. It's nothing new to me, 2 years ago I was homeless and living on the streets in Anchorage and then Seattle for close to year. To be honest it wasn't the proudest time of my life, there are things I've done and never wish to do again; but, if put back in a survival situation I would do it all over.

I have 2 more years of 12+ units to be able to transfer to Cal-Poly. What good is that? It's not like it's everyday somebody has aspirations to be a physicist. Math and science have always come easy to me and I enjoy figuring out puzzles. What better puzzle to solve than our universe. Who else is going to rebuild the world or find us a new one when SHTF? The main areas I want to focus in are Nanotechnology and Artificial Life Programming. Not your everyday goals. This isn't some random idea that I had. I had to think about it for a long time. I've come to the realization that I am going to spend the next 10-12 years taking classes and attending symposiums before I am done with school. It doesn't end there; I hope to be learning something new for the rest of my life.

In closing, I would like to know if there is any way I can get an internship that would pay me and help me continue to go to school? Like I said there isn't much left for me where I'm at, and I am willing to work for what I want.

TLDR: I'm going to college to be a physicist and the man keeps putting me down.
I need a job but there are none to be had. I bet if I was Mexican..."
htdyp,1,2011-06-06,Hate cubicle desk jobs. What is wrong with me?,f0rfun,AskReddit,https://www.reddit.com/r/AskReddit/comments/htdyp/hate_cubicle_desk_jobs_what_is_wrong_with_me/,"Programming intern here, hates the cubicle style seating arrangement in office. Been trying to adapt for five fking months already. I try to get something done while in office but am actually just killing time so I can get back home to code on my pc in the comfort of my living room. I did suggest working from home to my boss but was denied due to company policy or maybe he's afraid of me setting a precedence for future interns. I can also be ultra productive coding at coffee chains like Starbucks.

Is there something wrong with me? I'm beginning to dread going to work and cannot ever see myself working in individual cubicles which is pretty common for offices where I live. Do I have a disorder or phobia I do not know of? Everyone around me seems to have no problem with this style. Is it just me?! I'm going crazy. Help!
P.S sorry for my English, not my native language."
huyby,2,2011-06-08,Does Apple offer internships or student positions?,[deleted],apple,https://www.reddit.com/r/apple/comments/huyby/does_apple_offer_internships_or_student_positions/,"A little backstory: I will be attending university for the first time this September, and I plan to study computer science. While my ultimate goal is to go to grad school and eventually earn a doctorate, I would like to acquire some real world experience during the summer break (May-September) or possibly sign up for a co-op placement midway through my studies.
I know the Apple corporate offices are in Markham, Canada, and that is not very far from my current residence and soon-to-be university (about 2 hours driving). My question is, does Apple offer short-term internships at all? If so, how do I get my foot in the door?"
huy89,7,2011-06-08,"Aussie student redditors, I'd like some of your advice on student rooms in Melbourne",cappelmans,melbourne,https://www.reddit.com/r/melbourne/comments/huy89/aussie_student_redditors_id_like_some_of_your/,"Hi all,

I'm a Dutch student from Holland and plan on starting my graduation internship in Melbourne. At the moment I am trying to figure out where I should look to find cheap and simple student rooms in Melbourne.

I already found a couple of student accomodation company's but the prices are a bit too high for my monthly budget. The pricerange I am looking for is around $480 a month. Is it even possible to find a student room around this price in Melbourne, or is it just wishfull thinking? I don't mind sharing the house or room at all, I live that way in Holland at the moment too.

If you have any tips or advice on where I should look, like websites, or organisations, then please let me know. I would really appreciate that.

Thanks for your time!

Regards, Jan-Willem
"
huwdc,0,2011-06-08,"Aussie students redditors, I'd like some of your advice on student rooms in Melbourne",[deleted],AskReddit,https://www.reddit.com/r/AskReddit/comments/huwdc/aussie_students_redditors_id_like_some_of_your/,"Hi all,

I'm a Dutch student from Holland and plan on starting my graduation internship in Melbourne. At the moment I am trying to figure out where I should look to find cheap and simple student rooms in Melbourne.

I already found a couple of student accomodation company's but the prices are a bit too high for my monthly budget. The pricerange I am looking for is around $480 a month. Is it even possible to find a student room around this price in Melbourne, or am is it just wishfull thinking?

If you have any tips or advice on where I should look, like websites, or organisations, then please let me know. I would really appreciate that.

Thank's for your time!

Regards, 
Jan-Willem





"
huqvt,24,2011-06-08,"Had an interview yesterday. They kept me waiting for forty minutes before I left. They still want to interview, should I?",computertechnik,jobs,https://www.reddit.com/r/jobs/comments/huqvt/had_an_interview_yesterday_they_kept_me_waiting/,"They stuck me in a room and some guys poked their heads in for about twenty minutes saying someone would be coming shortly. After about forty minutes I left because I got to a point where I felt like I wouldn't take the interview seriously and I didn't want to waste my time interviewing if I just didn't care. Apparently the guy I was supposed to interview with was stuck in a meeting. I'm not really upset or angry, I understand that these things happen and they were pretty apologetic. The thing is, I wasn't even that interested in the company in first place. I haven't had any interviews in awhile, but I am three days from graduating with a degree in CS and I currently have an internship, so theoretically I shouldn't have too much trouble find a job anyway. So what do you think? Would you go back for an interview?"
hunxi,3,2011-06-08,"Reddit, around $15,000+/- was stolen from my mothers house..what else do we need to do?",[deleted],AskReddit,https://www.reddit.com/r/AskReddit/comments/hunxi/reddit_around_15000_was_stolen_from_my_mothers/,"I'm just a lurker but the time has come and I may need some advice.

First I would like to apologize if this ends up being rather long, but I would like to cover as much info as I can.  Also I am sorry for any typos or confusion, my mind has been racing since this happened and I am furious.  I am sure I missed some parts of the story as all of this has been very frustrating.

**Background info:**  My mothers house was robbed on Saturday 6/4, did not find out until Monday 6/6.  Police were notified and are conducting a investigation.

**The Incident:**  My entire family was at a wedding reception (6/4) and sometime between 4:30pm and 8:30pm our house was robbed.  The worst part of it is it was my cousin, a drug addict (heroin and crack).  She has not been around the family for ~1 year and while everyone was away at the reception she had two friends drive her to the house.  I had spoken with one of the individuals who was in the vehicle with her and his side of the story was that my cousin asked for a ride to her fathers house to get money from an insurance claim from her vehicle that was stolen and wrecked (drug deal related).  He claims that they dropped her off on the side of the road up past our house (we live in the country).  After she was done doing gathering up the valuables she called one of the two individuals in the vehicle and said to come back down the road and that she was ready. They picked her up in front of the house and he said she came out with two large bags and two shoe boxes.  He claims he did not know what was in them and that he wasn't involved (obviously doesn't want in trouble). After that he claims they gave her a ride into town, which is where she pawned off roughly 6k worth of my mothers jewelery.

Fast forward to Monday.  My mother could not find her laptop and thought she misplaced it (she is very forgetful).  I am away during the week doing my internship and I was on the phone with her, I mentioned that I could not find the shoebox which contained my xbox 360 (I recently moved back from college and a majority of my belongings were still in boxes in one of our rooms).  I suspected that something was fishy and that it was a good idea to go double check a few places for the laptop and xbox.  She had called me back later, already in tears, as she realized we had been robbed.  She  checked places where she had valuable items hidden (jewelry) and that was the giveaway.  Police were notified, came out and took our information and tried gathering some prints which came up with nothing.  We had suspected it was my cousin, as she has been on drugs for the past year and isn't welcome around the family for numerous reasons (several minor thefts of many family members) and that the time of the reception would have been an excellent window for her to commit the crime.  The police said they would work with what information they had.  Supposedly they check pawn stores/jewelry shops for events like this, however they only do it once a month, which of course everything would be gone by then.  Soon as the cop leaves my mom rushes into town to check some shops.  The second jewelry store she went had a majority of jewelry, therefore my mother had called the cops.  This was a huge sigh of relief, as they keep records of everyone they buy from and had a copy of her identification, as well as pictures of all the jewelry she sold to them. By this time the mall was already closing and we would have to wait until the following day to do anything else.

The next day a police officer went to the mall and acquired the jewelry.  My mother and I went around to several other places looking for more jewelry as well as the laptops and xbox, which came up with nothing.  After some personal investigation and several phone calls later, we found out she had been staying at a hotel for the previous two days where she was smoking crack with some other people.  By the time the police had arrived they had already checked out, the room was in her ex-boyfriends name.

Later in the evening, my mother went back to the mall to look for my items, she had found some watches at one of the jewelry stores, but the owner was rather rude, he already yelled at my mom for calling the cops and said she should have left them out of it.  He told her if she paid $1600 he would have gave her everything back. She called the police again, but they would not send anyone out because the officer dealing with the case was off-duty.

A second jewelry store, which the female driver of the vehicle just so happens to work at, may have had some items as well, that the female had sold to the store herself (it was in their books). It was dated prior to the incident, however I suspect she wrote a prior date to save her ass.  The story was that she came in with her father to sell the jewelry, however my uncle is really good friends with her father and had talked to him and he said that she was lying and he was never with her. She barely stays at home and her dad said he knows she does drugs already.  The owner was also rather rude to my mother and said there is nothing she can do, as he already shipped the jewelry away to be melted.

This is where I am looking for any advice, it has been a stressful last two days, and I think we handled everything properly although you never know.  We already contacted our home owners insurance and opened a claim.  We are still busy trying to identify which items are missing and making a detailed list for both the police and insurance company.  We are not worried about the remaining items as insurance will cover it, however what we want to make sure is done is justice to be served.  There has been a huge drug problem in the county for years now (Indiana, Pennsylvania).  It seems every time an arrest is made, charges never stick and people are let go or given very minor charges.  I wouldn't be surprised if the other two individuals who gave her a ride are not charged with anything.  Supposedly the one girl, who owned the vehicle already spoke with the police earlier this morning and said she did not know the items that my cousin came out with were stolen. I had personally spoke with the other individual that was along for the ride in the car and he said he knew it was suspicious but didn't want to know what was in the bag or whom it belonged to, however he does know our house so I am sure it was just a line of bull as he does not want to get in trouble.  He also has a history of crimes and drug use.  Is there anyway they can charge the individuals in the vehicle with any type of crime, such as being an accomplice even though they claim they had nothing to do with it? I mean they gave her a ride for a insurance check, yet she came back with 15,000 worth of stolen items.  

**TL;DR** Mothers house was robbed by drug addict cousin (roughly 15k worth of items) It seems like very little is being done, and we wouldn't have even recovered the items we did or gained information if it wasnt for our own personal investigation, which we relayed all information to the police."
humex,25,2011-06-08,Thinking of switching from PS3 to PC gaming for BF3 and Elder Scrolls V. Advice?,mikenike192,gaming,https://www.reddit.com/r/gaming/comments/humex/thinking_of_switching_from_ps3_to_pc_gaming_for/,"I've been playing ps3 since its release back in 2006 and I had a ps2 before that.I love shooter games on ps3, I'm a big fan of using a controller with COD. I have a couple games on PC (L4D 2 and Portal 2) that I think are fantastic and really enjoy. However the pc style of controls mouse/keyboard are still challenging for me though I am getting better. Before playing these games this year I hadn't really played any shooters on PC since the days of Metal of Honor Allied Assault and Rainbow Six. I feel superior playing shooters on the ps3 because I am very fluent with the controller and everybody likes doing well in matches.

I imagine myself still playing a lot of games on the ps3 in the future like FIFA as well as 3rd person games like Assassins Creed as I feel dual analog sticks are superior for navigating a 3d world. 

But with games coming out this fall like Battlefield 3 and Elder Scrolls V, I am thinking about switching to PC because the experience I feel will be superior. I have Battlefield 2 for PS2 and loved it and Elder Scrolls IV for PS3 and also loved that. But for these games I feel they are better suited for playing on a PC as the graphics and gameplay will be better with a mouse and keyboard.

I have a macbook pro 2.8ghz core 2 duo 4gb ram and discrete graphics card which I play games on right now and its okay, no where near stellar in terms of performance as the OSX implementation of steam and the half life engine is not of the same quality as the Win 7 version. I've always wanted to build a pc as I think it'll be a very rewarding experience and being a CS major I like tinkering. 

I like the idea of consoles as every game will run perfectly smooth and there is no need to worry about whether it'll run a new game. However  PC's have the capabilities of having better graphics than a PS3. What should I be looking to spend on a custom machine that will run BF3 and Elder Scrolls V smoothly at 1920x1200 which is what my monitor is. How long do pc components stay relevant, how long before you typically need to upgrade your system? Should I go all out with something like an i7 to future proof myself or is that unnecessary? I am also interested in being able to add OSX to the machine (hackintosh) as I really like Xcode and if I have a pc that is more powerful that my MBP why not use that to develop on, though at my internship this summer I'm using Visual Studio which is also a phenomenal IDE as I am working with VB net. Any one have any other advice?"
hu923,0,2011-06-07,I told a girl I'd call her tonight to schedule a 'hang out' session.  Need some general tips please.  A little more info inside.,[deleted],askseddit,https://www.reddit.com/r/askseddit/comments/hu923/i_told_a_girl_id_call_her_tonight_to_schedule_a/,"My wife and I have been trying to get a third for some time now (we've been in an open marriage for some time, but neither of us has actually had sex outside the marriage yet).  A really cute girl at school has been flirting like crazy with me.  I have my FB status set to where no one can see my relationship status, and I recently set it so that only she can see it (and it says 'open relationship').  After I did that, she contacted me saying we should 'hang out.'  That was over a week ago, (we had to leave town for a week).  I don't know if she wants to get together only to hang out, or if she's down for some fun, but I figure the only way to find out is to have her come over (the plan is for me, her, and my wife to all hang out).  I told her something like ""I'd say we should have some drinks, but you're probably a lightweight,"" to which she responded ""I'll drink you under the table.""

So, it could go either way.

I need immediate advice on two things:

1.  General tips on calling her tonight (to schedule a Fri. or Sat. night evening at our house).  Things to make sure to do.  Things to avoid.  (this one is the most prescient, b/c I have to call her soon).  I don't have AA or anything, but she is kind of the shy type and (1) I'm afraid of an awkward lull in conversation, and (2) don't want to just call her, schedule and then by all like 'bye, talk to you later.'  It seems like I should make sure to have at least a little bit of banter or something.  I guess I could talk about her internship she's doing right now or the American Constitution Society Convention in DC I'm going to next week, but I just wanted to fish for some general and/or specific thoughts here before I call.

2.  Any additional thoughts you have on how to approach her and/or conduct myself, (or basically any tips you can think of) on the actual night when she comes over.  So far, we're thinking we'll have dinner ready at 8pm when she gets here, put the 2 yr old to bed at 9pm, hang out, bust out the drinks and then see where the night takes us.

THANK YOU EVERYBODY!"
hu7qk,2,2011-06-07,"Getting a new laptop, what's a better investment, processor or RAM?",carpe228,computing,https://www.reddit.com/r/computing/comments/hu7qk/getting_a_new_laptop_whats_a_better_investment/,"So I am going to get the XPS 15 but I have just one question about what upgrade I should get.  I am getting the model with the Intel i7, so do you think it would be better to get the upgraded version (2nd generation Intel Core i7-2620M processor 2.70 GHz with Turbo Boost 2.0 up to 3.40 GHz) as opposed to the regular i7 (2nd generation Intel Core i7-2630QM processor 2.00 GHz with Turbo Boost 2.0 up to 2.90 GHz).  Or would it be a better investment to upgrade from 6GB to 8GB of ram.  I am a computer science student so I will be using this laptop for some development at school and my internship.  But I also like to play Starcraft a lot.  I'm pretty sure either way SC2 will run fine, but which will give me more bang for my buck?"
