hzngv,5,2011-06-14,Information on getting internships at the Big4 as an junior undergraduate (a Q&amp;A session with Potatogun),spacekillers,Accounting,https://www.reddit.com/r/Accounting/comments/hzngv/information_on_getting_internships_at_the_big4_as/,"Below are some questions that I asked Potatogun and he was kind enough to reply back with detailed responses. If you are looking for internships at the Big4, I'm sure you'll find this information useful. 
All credits to Potatogun, he is an awesome guy!! 

Consider reading the [Big4 AMA](http://www.reddit.com/r/Accounting/comments/glvzt/big_4_public_accounting_ama_qa_through_the_weekend/) for more information about the Big4. 


Question 1:

I will be a junior next year and will be taking intermediate accounting during the Fall semester (which is when I'm be applying). Is it common for juniors to get Big4 internships? B/c I heard from someone that you usually work for a mid-tier firm your junior yr, then a big4 in your senior year because Big4 wants to see accounting experience.

&gt;In the US if you aren't in a specific masters program (5 year), then during the 3rd year is normally when you apply for Big4 internships. The internship being the summer before your 4th year.
&gt;It is unnecessary to have prior accounting experience to land a Big4 internship. Rather you need the grades, and whatever varied life experiences and/or involvement. That could mean leadership, volunteering, part time work help pay the bills, or even sports/music hobbies that you're really involved in. It also is very dependent on your networking, because honestly internships are the hardest thing to land (compared to full time hiring). Big4 now probably source about 60-80% of their full time start classes via the internships. That means that these are the very best candidates in the eyes of the firm.

Question 2: 

Do you mind describing what interns do on a daily bases during the summer term? If I got an internship in assurance/audit, what would I be doing?

&gt;Interns usually have a couple weeks of training to introduce them to whatever audit/tax/advisory work they are going to be working in. Generally the idea is to expose you to as much client service work as possible. Time at the client site or client-facing roles will obviously differ from audit to tax to advisory.
&gt;You generally will help an engagement team by doing all sorts of misc tasks. This can range from help organizing data, copying, picking up food, 'rolling' forward documentation for the next review or audit or helping do some basic test work. This might not sound very exciting, and honestly the actual work part might not be, but you will feel the stress of wanting to do the best you can to make the best impression on your team. So it's your own little set of challenges. Talking to a client seems incredibly daunting of a task. It can be even as a first year starting out (okay, it definitely is at times). Even as an intern you will most likely feel out of your comfort zone. That's a good thing.

Question 3:

I know there are 2 interviews, the on-campus and the office. To get the on-campus interview, it's all based on how well the interviewers knows you and your resume. Do you remember how the interview goes? Is it like: I sit down, and the interviewer starts asking questions after question, then after he is finished, I walk out and calls on the next guy? Is the interview very structured or friendly conversation-like? Do you have any tips on how to do well on the interviews, specifically the behavior questions?

&gt;The interview process is generally what you mentioned. One on campus and 'one' in office. The in office may be multiple interviews but back to that in a bit. For on campus, it generally means you've gotten this interview because you meet the basic grade/experiences (remember not necessarily WORK experience) requirements and have probably networked a bit. If you are not the most stellar candidate then the networking plays a huge role in getting an interview. You want to interact with as many professionals you can where you can establish relationships. This doesn't just mean talking to EVERY single person. You want each person to remember a bit about you. Aside from the generic work questions, please don't start asking about accounting topics. Be a person. Talk about social life or activities out of work that might pique the interest of the professionals you're talking to. We take notes and compile them on candidates, but try to just keep it as conversation; professional with some slight touch of humor.
&gt;The on-campus interview interview is probably 30m with 1 or 2 people. Probably a Manager, sometimes a Partner or even recruiter if things are short staffed. Generally these questions are behavioral and more specific to your resume. Know what you have on your resume; be able to talk about whatever you've mentioned in any writing. I would say the structure depends on the person. However, it is generally more structured than an office interview with a partner. You will likely have a greeter who is an associate. They are there to break the ice. When you meet your interviewer, have a firm handshake and look them in the eye (or at their nose). Be confident but not arrogant. If at any point you are tripped up on a question just ask to think about it a moment. Do some research about your office location of interest. What's the industry there? What are some major clients? How big is the office? Know some about the firms' community service focus or programs such as sending people abroad. Show interest in how the firm develops its people and gives back to the community, etc.
&gt;The general advice I can give about behavioral questions is to think about all the scenarios you've been tired, worked hard, and accomplished something. Be very self reflective because there are probably a lot of things you don't think are impressive at all. They can be examples from school, to family, to work, to self projects. You always want to try to convey that you can be responsible, take charge, be a team player, be communicative, caring, innovative, and willing to push yourself and better yourself. Because remember the goal of the behavioral questions are to find if you fit the qualities of person who can work hard and long hours being an associate at a Big4 firm. If your time goes over the allotment or you go on a stretch one a single topic that you and your interviewer are passionate about, then you know things are going well.
&gt;When your interview ends, reiterate your interest in the internship and the firm after having spoken to the interviewer.


Question 4:

Is the office interview still all behavior questions? Is it round-robin style where you interview with the managers and HR people? I heard from people that the office interview is just to see if you have a good personality and are nice and not about your GPA/resume stats. So should my main goal be: smiling, be friendly, and just have a good time?


&gt;The office interviews are more like a day or two program/event. They generally have you stay the night before so you can go out to dinner with some fellow interviewees and some professionals. This helps ease you in and break the ice. You will likely have presentations and some group discussion/Q&amp;A with other students interviewing. Then you will probably interview with 2-3 people. At least a partner and probably a Sr. Manager or two. These are much more like conversations. But they are really behavioral in how you act and respond. You want to be calm, friendly, and likable. Get the person to talk about herself. Career, family, interests, travel experiences, etc. Try to find some common ground.
&gt;I highly doubt you'd interview with HR. Generally this isn't the process for college recruits. That might be more for experienced people trying to negotiate.
&gt;After all interviews send thank you emails.

Please share this with your friends, if it was helpful--Potatogun"
hzn6y,3,2011-06-14,Advices on buying a new mouse,lvcas,Design,https://www.reddit.com/r/Design/comments/hzn6y/advices_on_buying_a_new_mouse/,"Hey /r/design.

I'm an advertising student, trying to focus on art direction / design.
I was used to use a Microsoft Wheel Mouse for 6, 7 years, but now it is dead and I am using my Mac's trackpad.
I am also starting to use a Wacom basic tablet to do more natural tracing, but I think a mouse is still better to paths and stuff.

That being said, what mouse do you recommend me to buy?
I use the old Apple Mouse at my internship, and I think it's nice. I'm thinking about getting the Apple Magic Mouse, because I love the gestures that I'm used to do in the trackpad, and also, not having to use one of my USB ports is a great benefit.


**tl;dr: Mouse is dead, need a new one. Need advice.**"
hzlsq,79,2011-06-14,Hey reddit...I just got the email of a lifetime and wanted to share the moment with you fine group of people.,holm0682,lgbt,https://www.reddit.com/r/lgbt/comments/hzlsq/hey_redditi_just_got_the_email_of_a_lifetime_and/,"Little back history on this, I was closeted until I was 20...and I really struggled in high school and early college because I was trying to hide who I was and live up to standards to be a doctor (pressure from parents) and going to a university they wanted me to go to.  After I hit my final straw, I came out and changed my major to Public Health Education, AND transferred to the school I wanted to go to.  I cut myself off financially from them and went out on my own.  I recently graduated from the University of Minnesota Duluth with my public health degree, WITH honors, the top graduating student award, and after receiving a full ride scholarship.  After applying to a million different internships and jobs, feeling defeated, and reading r/lgbt posts on people who have fought diversity and become successful (which kept me chugging along), I just got the final email today that I got a PHENOMENAL job at Boston Medical Center and will be moving there in September.  Coming out was the beginning to the best part of my life.  I am now successful and happy with who I am and where I am going.  Thanks Reddit for keepin' on the lgbt positive and giving me the motivation to keep on keepin' on :)

TL;DR: Came out, went out on my own, graduated and got my dream job. "
hzk17,2,2011-06-14,"Reddit, have you ever had to give up a pet?",nekoshii,Pets,https://www.reddit.com/r/Pets/comments/hzk17/reddit_have_you_ever_had_to_give_up_a_pet/,"Hey Reddit,

So a little background:  I have a parrotlet named Cielo and I've had him since he was 5 weeks old.  He's 11 months old now, and recently started talking and can say, ""Kisses!"", ""Step up!"", and ""Hey, bird!"".

It goes without saying that we share a special bond;  I love my little guy!

The trouble is, however, I'm a recent college graduate.  I haven't been able to find any jobs or internships in the area and plan on moving wherever I find one.  It'd be difficult to take little Cielo with me because it's at least $100 to fly him with me one way, don't have a car, and plan on moving wherever I can find a job.  And there, the worry is whether I can find a place that would allow pets.

Having him during the year was a bit difficult, too, and I often gave up precious study time to come home and take him out of the cage to play.

I feel like at this life stage, I'm not exactly ready to have a pet.  I feel that I *should* give him to a family so that he could have a more stable life (not that I don't take great care of him!) and also 

But at the same time, I feel that I know him best and would love him best (cliche, I know).  He's also bonded to me, so I'm wondering how it would affect him.

In an ideal situation, I could find a fellow bird-lover who's experienced with parrots and is willing to take another bird under his wing.  So far, I've had no luck finding anyone :(

So what should I do, Reddit?  To be completely honest, I don't feel as though I have the time to devote to a pet and would love to find him a happy new home.  I think I'd just have trouble letting go and believing that others would take care of him as well as I did.

What's your opinion of the situation?  Have you ever had any similar experiences?


**TL;DR - Life circumstances are giving me doubts about my ability to keep my bird.  What should I do?  What are your opinions/experiences?**


Here are some photos of my little guy!  I just can't resist showing him off :)

[Playing outside](http://i.imgur.com/oBNyt.jpg)

[Being a badass](http://i.imgur.com/hFCGe.jpg)

[Being a cutie!](http://i.imgur.com/rNiBG.jpg)



"
hzihv,0,2011-06-14,Forced to take about a month and a half off.  I lost almost 10 lbs.  How can I gain it back?,[deleted],Fitness,https://www.reddit.com/r/Fitness/comments/hzihv/forced_to_take_about_a_month_and_a_half_off_i/,"So, due to a brief 2 week internship I was unable to hit the gym in any significant capacity and continue with SL 5x5.  The next week I had my wisdom teeth out and got dry socket.  This left me unable to eat anything harder than mush for a week and I couldn't work out due to the pain (I was in that 1% after surgery that is in a huge amount of pain and I was essentially bed-ridden).  My appetite has also receded (I was doing Gomad a couple months ago to get used to taking in a few thousand calories a day)

I went down from 152lbs at 5'11'  (big arms, solid quads, great shape) to 143 (I look skinny again).

How can I gain it back?  Should I just do my best at Stronglifts and try to get as close back to where I was?  GOMAD again?  

Thanks fittit!  You helped me before, I'm sure you can help me again. "
hzhla,2,2011-06-14,Looking for a lounge/loft to host an event,maradonuts,nyc,https://www.reddit.com/r/nyc/comments/hzhla/looking_for_a_loungeloft_to_host_an_event/,"As part of my internship for the summer, I am planning a launch party for my company's new product (a contact management program for computers, iPads, and iPhones), and need to find a lounge or loft to host the party. Any suggestions? It's gonna be under 100 people and the only special thing we would need is a table to have some laptops, iPads and maybe a projector to do some demos."
hzdbf,0,2011-06-14,I'm Marrying My High School Sweetheart and This is Our Story,[deleted],self,https://www.reddit.com/r/self/comments/hzdbf/im_marrying_my_high_school_sweetheart_and_this_is/,"I'm getting married to my high school sweetheart this Saturday. We did not write our own vows and I'm not really the type to put my emotions in words or really speak them for that matter but this morning I started to think about our long journey. I thought getting it out in writing would help me remember it better and figured I would share it with you guys.

WALL OF TEXT

The first time I noticed you was in a class we had together our junior year . You were sitting there leaning on the desk not really paying attention and you seemed like you were deep in thought. I knew who you were because we had been in the same grade since middle school but I never really noticed you until that day. I could stop thinking about you and talked to my best friend how hot I thought you were and he took that as a challenge. He gave you my number in home room and you gave him your number for me. He told you to call me but you told him if I wanted to talk to you I would have to call you. I never ended up calling you but we did meet in the hall way before our respective sports practices. Over the next few days we talked to each other in the hall and that weekend I asked you on our first date. We saw a movie and got a drink at the fast food restaurant next door afterward. I was so nervous when I paid that I accidentally ripped the money in half before paying. You traded me the ripped money for a fresh bill. I was nervous and didnt make a lot of eye contact but we sat and talked about whatever for a while and we parted ways. Over the next few weeks we started to hang out more, mostly watching movies and either of our parents houses. We had live less than ten minutes apart from each other most of our lives but never knew it. This made seeing each other much easier.  I eventually officially asked you out and that began the real start to our relationship and ultimately our friendship. We spent the next year enjoying our senior year together and you were there for my victories and loses. We graduated that year. You were heading off to a local private college to study to be a nurse and I had gotten a job as an apprentice electrician with a local company. We tried to spend as much time together but college takes up a lot of time and some days I would just go to sleep early out of exhaustion but we made it work. I eventually decided I wanted to go to college and you supported me in my decision. I chose a local college that one of my high school buddies was attending so we would still be close to each other. I finally got an apartment with a few roommates and we were able to spend much more quality time together, well as alone as you could be with roommates. You cooked me meals and you helped me with the shopping and my laundry.  The next year we moved into a duplex and you live in the top apartment and I lived in the bottom. This way we appeased our parents but it gave us the chance to sort of live together. I was able to get an internship with a great company and started with them full time after I graduated. I vividly remember when they called me in to tell me they wanted to hire me full time. As soon as they told be the first thing that came to my mind was that I wanted to marry you. On the way home I stopped at Meijers and picked out the largest gaudiest fake ring I could find. That day in the car to your parents you kept pestering me about how it went at work and I couldnt tell you because I wanted to surprise you.  While I was fixing your parents computer, you went into your room to get something.  I told you I had a surprise for you and told you to come over and close your eyes. My heart was going a mile a minute and in one breath without pauses I told you about the job and asked you to marry me. At first you thought I was kidding but then realized I wasnt. We both had moved in with our parents to save money and you had one more year of school left. It was a tough year going from being able to spend so much time alone to have to be together with our parents but we made it though. We moved into an apartment together this past weekend and you are going to finally move in after we get married Saturday. Over the last six and a half years we have had good times and bad, we have lived, love, laughed, learned and grows together. I cant imagine a life without you by my side and could not think of anyone I would rather grow old with. You were my first for, well everything and now you are just my everything and I cant wait for this Saturday to start the next chapter in our lives together.


;TLDR  Pick them  young and grow them the way you want


"
hz5k6,1,2011-06-14,[Hiring] Junior java developers (San Diego area),[deleted],forhire,https://www.reddit.com/r/forhire/comments/hz5k6/hiring_junior_java_developers_san_diego_area/,"Promptlink Communications is an innovative company with a focus on the development and deployment of software tools for broadband cable service providers. Paid and unpaid internships are available.
Jobdescription: Internships with Promptlink will make practical use of your skills in software engineering and development. Internships will focus on specific software engineering tasks to include: 
- code design, writing, porting 
- testing and debugging 
- interface design 
system and network administration that supports the software development process

Required skill set to include the following at a minimum
- Understanding TCP/IP v4 protocol and communications
- Java 
- multithread development
- JDBC
servlet / JSP

Candidates with the following skill set will be given primary consideration
JUnit
Understanding of code versioning systems CVS/SVN. 
Familiarity with TCP/IP and network programming. 
6 months or more of team-based working experience.
open source project development 
strong communication, analytical, and programming skills (C/C++, scripting etc...)

Ideal candidates should be currently pursuing a BS, MS or PhD degrees in fields related to Information Technology (for example, computer science, computer engineering, software engineering). Positions are available in Oceanside California. Positions may be also available for different seasons and durations (for example, Summer / Fall, Summer only).
Promptlink Communications is committed to creating a diverse environment and is proud to be an equal opportunity employer. All qualified applicants will receive consideration for employment without regard to race, color, religion, gender, gender identity or expression, sexual orientation, national origin, genetics, disability, age, or veteran status.

To apply: Please email your completed resume/CV to Jobs@Promptlink.com. For more information about Promptlink communications please visit www.promptlink.com"
