hpapz,1,2011-06-01,"Help, just lost my internship for the summer.",[deleted],atljobs,https://www.reddit.com/r/atljobs/comments/hpapz/help_just_lost_my_internship_for_the_summer/,"I just finished my freshman year at college (southern polytechnic), and had an internship lined up at a company. Anyway, they called me today and told me that the position they were ""holding for me"" is no longer being offered. This was all i had planned for the summer, and my only means of paying for anything next semester. If anyone in the atlanta area is looking for interns please let me know.

oh, im a computer science major"
hp9zl,2,2011-06-01,Looking for a web development intern in Dallas,[deleted],Dallas,https://www.reddit.com/r/Dallas/comments/hp9zl/looking_for_a_web_development_intern_in_dallas/,"My company is currently seeking an intern for general web dev work in Dallas, looking for the following skill set:

 * HTML &amp; CSS (Implementing &amp; updating designs from .PSD)

 * Javascript (jQuery, Prototype, or comparable library exposure)

 * PHP (Bonus for work with MVC such as CakePHP or Zend)


If this position interests you, please personal message me links to your resume &amp; samples of previous work."
hp3fs,29,2011-06-01,"Response to "" Volunteer to get a job"", how many have experience but no job?",engineeringisnoteasy,AskReddit,https://www.reddit.com/r/AskReddit/comments/hp3fs/response_to_volunteer_to_get_a_job_how_many_have/,"I graduated with an engineering degree and have had 4 paid internships during that time. There are jobs that I am EXACTLY qualified for but I still don't get them. The company doesnt even bother telling me I'm out of the interview phase. I have a 2.91 gpa but my technical gpa is 3.23. So how many of you are getting screwed over AND at the same time being pissed at this ""volunteer to get a job"" bullshit? Come on! you know it's true that volunteering looks bad also ( hey they didnt pay you so you weren't technically working! har har har!)
--------------------------------------------------------------------------------------------------
EDIT:  OK a lot of you say I dont deserve the 60k starting that I aimed for but you dont realize that the average nationwide for ENTRY level e engineering is right about that. I am not the only the one looking for this number and if you read other reddits posts regarding employment you you agree. Also, according to BLS this is accurate.

Reddit trends I noticed:
1) The comments go with one trend and it usually follows the guy with the top votes. The reason for this post was to let put frustration that it's not as easy as ""volunteering"". Most of the comments say it doesnt even matter. Then what the hell does?

2) When something is acceptable in one thread it goes the complete opposite in the other. Many reddit posts say that they DONT even work as much as they anticipated and hence reddit during work( I'm not in today ). A lot of other redditors say the gpa doesn't even matter and that experience does. From what i'm reading in the replies, a good number of you think the opposite. Some guy said it's average for people to have internships ( multiple at fortune 500). 

3) From the comments:  Low gpa is bad, High gpa doesn't matter as much. No experience is bad, 4 internships are average. Basically anything you do is useless ( all according to what I've read so far). I'm not winning this one.

Okay I wont argue with anyone over the internet. Thanks to those who gave me good information.I'm sorry if I came off as an asshole ( it was never my intention to piss anyone off )"
how9u,0,2011-06-01,"Hey Reddit, rap and dubstep party tonight in midtown! We got REAL 4Loko.",WhatDidntDiddyDo,nyc,https://www.reddit.com/r/nyc/comments/how9u/hey_reddit_rap_and_dubstep_party_tonight_in/,"Hey all, so my best friend is putting on a charity show for the Red Cross. Would really appreciate it if redditors came out and had a good time, got drunk on the cheap, all while raising some money for a good cause.

Tix are 10 bucks (1 drink included)

Show starts at 9. 

Location: 
NICU Spoon Theater
38 W. 38th St. 5th Floor (between 5th and 6th ave)
New York, NY

Artists featured: [Party Supplies](http://youtu.be/1_ZSP_oFZQc], up and coming dj/remixer/producer he makes awesome tracks even awesomer [BK Friendly](http://youtu.be/YUU0cuUrPlE) the cool cat from philly mixing dubstep with triphop and makin it sound pretty, and headlining we got the New York native [Jkila](http://youtu.be/evlZLIZzlD4) performing songs off his album ""The Internship"" DL it free [here](http://www.mediafire.com/?2ivwaznuwhs8z8y)."
hosv2,1,2011-06-01,"Recent College Grad - Help getting into being a Project Manager, anyone?",[deleted],AskReddit,https://www.reddit.com/r/AskReddit/comments/hosv2/recent_college_grad_help_getting_into_being_a/,"Alright so, I need some advice. I am not really a ""recent' college grad anymore, as applying for jobs since last December (2009) hasn't turned up anything. I'm at a total loss right now. I don't know what direction to go in. I didn't know where to go for advice so I figured here I could get some help.

There's very few Project Manager jobs around for entry level, and my internship, while helpful, isn't enough. Most Project Manager job offers around here may as well be internal postings with the requirements for previous experience in the company or crazy requirements I could never fill without at least two other Project Manager jobs.

I don't know what I should be focusing on to help my cause, or if I should be going for certifications (though they don't look like anything practical in a real world experience.)

Please, if anyone even reads this, no insults on my part for not being able to find a real job. I feel bad enough. I may not have been trying my extreme hardest, but I've been trying pretty hard. It's not easy to look at a job list full of door to door salesmen offers, go to backdoor interviews for going door to door selling cable packages on cold contact, and phone calls that go nowhere, and placement companies that sabotage you for no explainable reason.

I just want some help. Or some direction. Please?"
hq78h,2,2011-06-02,I really need a Web Internship in here in Wichita.,NastyBigPointyTeeth,wichita,https://www.reddit.com/r/wichita/comments/hq78h/i_really_need_a_web_internship_in_here_in_wichita/,"I attend John Brown University majoring in Web Design and in order to graduate I need an internship this summer. I know I should have figured this stuff out sooner, but I thought I had something worked out and that fell through. I have been going around to different places, but I cannot seem to do anything but drop my resume off with empty promises to be called. If you have anything available or know of anything available that would be fantastic. 

I am pretty confident with HTML/CSS, Photoshop, and Illustrator. I have some background with Python and am learning PHP and Javascript

Thanks in advance. "
hq2jw,9,2011-06-02,"[for hire] Operations Management Graduate looking for work in the Huntsville, AL area",Torqz,forhire,https://www.reddit.com/r/forhire/comments/hq2jw/for_hire_operations_management_graduate_looking/,"[Resume](http://www.linkedin.com/profile/view?id=91150255&amp;locale=en_US&amp;trk=tab_pro)

I am looking for anything entry level.
I have graduated from the University of Alabama with a degree in Operations Management and have been on the job hunt for awhile now. My skills include profieciency in all Microsoft Office Suite products as well as experience with many statistical production software products such as: Arena, Lekin, Lingo, Storm, Minitab, SPSS.
My most recent job was at GAF, a roofing plant, as a project intern. We utilized raw materials and the project will save GAF up to $120,000 a year. I also have two years experience in customer service as a Desk Assistant for an on-campus dorm. PM me for a formatted resume."
hpxu2,7,2011-06-02,Redditors I need to know if I'm justified...,archetypical,AskReddit,https://www.reddit.com/r/AskReddit/comments/hpxu2/redditors_i_need_to_know_if_im_justified/,"Recently I just got an internship at a radio station (which is what I am going to school for) and was hired after my 100 hours were up for my internship. My girlfriend was right behind me, wanting me to succeed and knowing that the two of us would be seeing a lot less of one another because I worked from 8pm-4am (sometimes 8am) and had to sleep during the day.

It's been almost a month of me working and I've seen her as much as I can (maybe 8 times in the past month? So 2 times a week) and she has started getting angry when I say I can't see her because I need to sleep due to working that night. She just doesn't understand that seeing her means I have to sacrifice my sleep and stay up for 22+ hours in a day, then go to work on little to no sleep. On top of it, she has become increasingly clingy and I've noticed myself getting short tempered with her because of it.

I want to take a break from each other but I found out after her last ex broke up with her (she wasn't even devoted to the relationship at the end of it because he broke up with her for drugs) she stepped infront of a bus and tried to kill herself. She is head-over-heals in love with me, but I think some space might be good, I'm just afraid she will try to hurt herself and I'm not sure how to go about doing it. Clearly my attitude has changed towards her since I haven't really talked with her much in the last two weeks.

Reddit, what should I do?

TL;DR: New job that forces me to work nights. Seeing my girlfriend means I don't get sleep. She is becoming a little overwhelming. Should I end it with her?"
hpr9e,1,2011-06-02,"Hi Reddit, it's not often I ask for help, but I feel this is a good place to ask.",situational412,AskReddit,https://www.reddit.com/r/AskReddit/comments/hpr9e/hi_reddit_its_not_often_i_ask_for_help_but_i_feel/,"The recent negative threads about job searching and the like has, as I know with perhaps many others, hit home with me. Right now my thoughts on what to do, where to go, how to do it, in my life are jumbled and all over the place, and even my thoughts as of at the moment are scattered as I struggle to make this post coherent to have some semblance of flow to it.

I graduated last year from the University of California, San Diego (yay, go Tritons, I suppose) with a B.S in Physiology and Neuroscience. It was supposed to be a stepping stone to medical school. Coming from a decently traditional Asian background, my entire life I had the concept of ""YOU are an Asian male, you are going to be either an engineer or a doctor"" drilled into me. It wasn't something I ever particularly enjoyed doing - I would take my courses to graduate on time just because I had to do it. At the time, I didn't even consider other opportunities. And these classes were especially difficult. Compounding with the fact that I didn't really care or have a passion for the material I was learning, I was content with getting by with average grades (overall 3.04 GPA), and just going to class and immediately going back to my apartment if it was possible. 

I graduated, studied to take the MCAT (30R), and at some point afterwards, I simply said ""Fuck it."" Fuck me for spending my college education doing something not for me, but for others. How can I even consider going to medical school when I don't have the academics to get my foot in the door in the first place? I was angry mostly at myself that I had been blindly trying to fulfill not my own ambitions and goals, but someone else's. 

But what do I do now, then? I didn't take the time to take courses of my choosing during college; I never got to find out what I would really enjoy doing for a career. 

Morale and self-confidence was/is at an all-time low; I couldn't find a job for the past year - I got about two interviews total. I am living at home with my parents with no income to call my own.

I have several random options that I have considered at the moment. I have no idea what they'll turn into or how I'm going to reach those goals, but I'll try to lay it out the best I can. 

1) I lied to you earlier. I actually did find the time to take a year of Japanese language my final year in college, and I had very much enjoyed it, being it the only non-science courses I've taken in years. I applied to JET this past year, but I didn't make it to the interview stage. I plan to reapply this year, so I was looking for ways to see whether or not I liked to actually teach, as I had never really done it before. I began volunteering once a week for an ESL position. Turns out, I love it. I was given several students to work with week after week; these ladies, several of whom had never had a formal education in their entire lives, could eventually read simple stories, write simple sentences, and converse with me in English. It's a great thing to be able to see where your work and effort become in the progress of others. I really hope I get accepted into JET this coming year. Unfortunately, I don't know what would become of me if I get in, go abroad, and come back after a year or two.

2) As mentioned in the prior paragraph, I discovered I really enjoy working closely with several individuals, and seeing my efforts through their progress. I did a little research and I came to the decision that perhaps physical therapy would be best suited for someone of my nature, with it involving science as a plus, since I had graduated with a similar degree. Also, it seems like a more viable career path than going abroad for a couple years (which, to be honest, is a farfetched idea. I don't think I'm qualified at all). I immediately ran into issues.

There was no way I was going to be able to apply on time this year. I have to volunteer about 150 hours minimum with hands on experience, three letters of recommendation from physical therapists, and I have to go back to school to take even more courses. On top of that, coincidentally, because of my degree, I had already completed a good portion of the courses (with the low grades), so I have a bunch of courses I cannot retake for a higher grade, putting my prerequisite GPA at about a 3.0, whereas most applicants get in with a 3.5+. To top things off, if everything went completely smoothly (yeah, right) with no problems, the earliest I could expect to enter the program would be 2013 - two years from now. At the earliest. While I did manage to be accepted into a good hospital internship, I don't know if my efforts will yield results in the end - everything seems to go wrong for me at some point or another. 

I don't know what else to say. I have no idea where I'll end up, no idea what I'll end up doing, and I feel I keep backtracking because I am afraid that more failures would set me back even more years - I feel awful that I wasted a year doing pretty much nothing. I just feel that others out there are/were perhaps in the same position as me, and have found a way to make themselves happy and successful in their lives. I would appreciate any input anyone has to offer.

TLDR: I fail at life, need advice."
hpjoz,0,2011-06-01,In Desperate Need of Help,inadarkplace,self,https://www.reddit.com/r/self/comments/hpjoz/in_desperate_need_of_help/,"Dear brothers and sisters of reddit,

I am a 22 year old college student, and I am calling out to the beautiful community of reddit for help. I am currently being assaulted by debt collectors over a sum that I was led to believe that I was paying off via monthly payments, but instead was only paying to extend payments. I have no money, I am not able to work a sufficient job to pay back this amount right now because I am busy working at an internship and applying for medical school, and my parents cannot help because my father recently lost his job and is having a hard time just getting by at the moment. 

I am not one to typically ask for help as I try to solve my problems myself, and I have never been one to beg for anything, but I am desperate at this point. I have seen amazing stories on here before describing people helping out their fellow redditors, and I am hoping that this can become one of them. Of course, any sort of contribution at all would be a huge help to me, and of course I would pay anyone back as soon as I am able. 

If you are interested in helping just send me a message and we can work out the details. 

Thank you so much my fellow redditors."
hr5lk,4,2011-06-03,"I'm pretty smart, but also lazy, unmotivated and incompetent, what do ppl like this do?",derpsmasher5,Advice,https://www.reddit.com/r/Advice/comments/hr5lk/im_pretty_smart_but_also_lazy_unmotivated_and/,"I've been lazy my whole life (I'm 20), but consider myself pretty intelligent/and or good at school (4.5+ HS gpa, 35 ACT score, 3.7 college GPA after 3 yrs). A lot of this I attribute to studying my ass off up until middle school, giving me the tools to basically blow off my high school and college courses so far with little effort, using logic and common sense to bullshit my way through hw, tests, essays, etc. . . However, throughout this time, I have had little direction and have have no dreams or aspirations, and honestly, after everything, I really don't know that much since I just blew through everything. Now, I'm getting into the real world and I can't just blow shit off and be highly regarded. I started a tech / major related internship this summer and it has really hit me-- I am lazy, don't enjoy my work, and most of all, I'm woefully incompetent in my field, leading to great levels of anxiety. I'm at a point where I honestly feel I could be fired at any point (pretty sure my blood pressure is rising too lol). I can't understand or even remember my bosses tech briefs and I feel like I am just not in the right place.

Its not like I never saw this coming either--In the back of my head, I always knew something like this would happen. Through my years of laziness and isolation, I have developed none of the skills necessary to succeed. Sure, I've dealt with depression and drug use, but I don't think those are the sole factors in my aimless disposition. I've always expected to eventually become successful and happy, but I never really lived life. . .

Right now, I'd rather just drop out of everything and get some mindless job that requires no effort then continue to punch myself every day. Why bust my ass working all day on something I hate and is causing me to feel so feel stupid. It isn't that I don't want to be good at whatever I do. I would love to have an easy job and kill the hell out of it every day than have a hard job and struggle everyday and end up doing a mediocre job that disappoints others. On the other hand, I fear if I go that route, I'll feel forever ashamed and guilty of being a worthless pos.

I know I'm not the only lazy asshole out there, so does anyone else have similar experiences or advice? Sorry this was long, but thanks for any replies! (Throwaway account)


TL:DR: I'm lazy, breezed through school earning top marks, have no skills, suck at/loathe work. Want general advice."
hr4a6,14,2011-06-03,Help... What do you do when you have a crazy and racist mother?,throwaway1419,relationships,https://www.reddit.com/r/relationships/comments/hr4a6/help_what_do_you_do_when_you_have_a_crazy_and/,"So this is what has been happening these past 3 weeks. I am 21 years old, currently on an internship. 

My mom found out I had a boyfriend 3 weeks ago. He is pakistani, I am chinese. I convinced her it was only a four month relationship, whereas it was actually 1.5 years so far. 

My dad freaked out and disowned me. His mother is now praying that I marry him soon so that I will get cheated on because he will for sure marry multiple wives and I will come crying back to my father in defeat. This isn't too much of a change for me because my dad has never really had much of a relationship with me, so it's like nothing happened between us basically. We just never talk to each other anymore. 

My mom is cursing my dad's mom for saying that, wanted to find a place to buy a gun so she could kill her and then herself so I won't be 'cursed'. Hopefully, this has passed and she isn't thinking about that anymore. At the time, she was threatening to also take my cat to a shelter, and I was so angry I said if she did that, I was going to move out. This prompted the following deal, where I agreed to her conditions of being ""open-minded"" and going out on dates secretly if a guy asks me out (behind my bf's back). She claims that she knows me so well and that I won't ever break up with him unless he breaks up with me, which is when he gets married. She says that women are disadvantaged because as they get older, they have a smaller pool of men to choose from so I better start now and not just fixate on one guy. I tell her I will date more guys eventually, she refuses to believe me. 

She continues to worry and cry over the fact that I was going to leave and then writes me a long email saying 'this is my last piece of advice for you, whenever you think of me, please read this'. She says she's going to leave the house so I don't leave because if I leave, I will most definitely get raped and killed living on my own. I tell her I was only going to leave because of a fit of madness and she was all relieved and glad to be able to stay and that I wasn't going to leave. But she still keeps saying that she's scared I'll leave to this day. 

Now, even though I agree to her conditions, she keeps lecturing me every day, about how pakistanis are bad, because they're poor and have large families and don't respect women etc etc. They have a law in which polygamy is okay, so he's going to have many wives and I will live a miserable life if I stay with him. She claims I've become a terrorist. This happens every day. She asks me when I come home where I've been, who I've been with. If I was with my bf, she will freak out and start lecturing me even further. She says she's researched assassins and knows how much they cost. However, she's been not working, has gotten a warning from her superiors to work because all she does is cry at work all day long. I thought she had stopped when I agreed to the conditions awhile back, but apparently she hasn't. She's lost weight, can't sleep properly... 

Then along with that, she's been monitoring my phone bill to see who I've been talking to etc and claims I've been ""webcamming"" with him at night. And that he will eventually make me ""take off my clothes"" for his base desires and then my life will be RUINED because they will get onto the internet and everyone will find out and my employers will fire me and nobody will ever hire me again.

Basically, she's controlled my entire life and these past few years, I've been trying to break out of it, quite unsuccessfully.

She said that because I've been ""webcamming"" with him, that she will HAVE to sleep in my room at night every night from now on. She will even sleep on the floor. At this point, I was just so angry from all the pent-up frustration of constraint from the past couple of weeks, I completely ignored her and slept on the couch while she waited in my room. She completely went nuts and started accusing my bf of putting me up to this. I wrote her a super long email about how she ruined my life (long story, basically she's cheap and overworked me, I turned out bad-tempered, cheap, self-conscious, no ambition, low self-esteem for a multitude of reasons that I don't feel like going into) and she should see a therapist/psychologist because of her irrational desire to control my life and my brother's life (she hovers over his shoulder all night to make sure he's working and not gaming or something. And he's almost finished Grade 10).

She reacted very negatively. Cried a lot, wrote me a response because she couldn't say it out loud or else she'd start crying. Basically her response blamed my boyfriend for everything. I told her about how good he was to me, how he is smart and caring, how he made me a better person, how he gave me confidence, self esteem, a goal in life. She shat on all of it, somehow twisting everything into a bad thing, and then additionally saying that he is poor.

She basically spent her entire life scrounging up money for me and my brother to go to med school. I broke out of that path like a year ago, which was ALSO a huge deal, with lots of crying and emotions. I told her it was all for naught and that she puts too big of an emphasis on money, and that relationships and happiness are more important. She just keeps saying that money is important and because he has a large family and they're poorer than us, I will just end up having to use all my money supporting his family.

I begged her to see things my way and to see that she was way overreacting for something like a boyfriend. It isn't working. She's about to lose her job. She says she doesn't care about her job anymore because she's lost her daughter.

I don't know what to do. The right thing to do would be to break up with him wouldn't it? But I've already made her miserable by telling her all that stuff about her ruining my life and being overly controlling. Even if I break up with him, she may still be miserable and still lose her job.

I also don't want her to win yet again. I really truly want her to see a therapist so she can stop worrying so much. She has more white hairs than her own mother because she worries so much. 

Please help, I'm just so confused and frustrated and cornered and I feel helpless. "
