b7rfz,0,2010-03-01,Feeling lost career wise. Where to?,domlebo70,programming,https://www.reddit.com/r/programming/comments/b7rfz/feeling_lost_career_wise_where_to/,"So I'm 2nd year B.Sc IT in Australia, majoring in Software Arch. I've done a 3 month internship at a web startup. Grades are average.

I LOVE programming, but I'm starting to wonder what step to take next, and where I might be in 3 years. I will be applying for grad programs when I'm able to. I clicked on [Sergeys Brins](http://www.reddit.com/r/programming/comments/b7qng/sergey_brins_resume_pregoogle/) resume in proggit, and it's depressing, because mine is nothing like that. No Phd's, no cutting edge research into obscure fields. So what I'm looking for, is some tangible suggestions on what I can do NOW to further my prospects. "
b8aab,3,2010-03-02,"Reddit, I want to learn how to program using a popular programming language.",enigmatic_anomaly,reddit.com,https://www.reddit.com/r/reddit.com/comments/b8aab/reddit_i_want_to_learn_how_to_program_using_a/,"Background on me:
I am an Information Systems student in my Junior year of college. I know plenty of things about business but not as much about programming as I'd like to. I got an 'A' in my Visual Basic class last semester but I want to learn a programming language that I will use in my future.

I have an internship with the Information Technology sector of a top 5 Fortune 500 company this Summer and it would be nice to impress them so that they offer me a full-time position.

It seems that most of Reddit knows how to program and I'd like to know an easy way to learn a new language."
b8m9w,1,2010-03-03,Cultural differences,1-2-3-throwaway,relationship_advice,https://www.reddit.com/r/relationship_advice/comments/b8m9w/cultural_differences/,"European male here! My girlfriend is from an Asian country. We're both in our early twenties.

She's doing an intern-ship in my country, primarily so she has the means and opportunity to stay here with me longer (we met when she was on her uni exchange). I love her and think she is both beautiful, has a wonderful personality, and that we complement each other well. However, while I'm trying to be a cultural relativist most of the way some things do irk me. Specifically, her approach to work.

Most of the people in the company she works in are from her home country and so is her boss. She tells me that it is customary never to question the boss where she is from and therefore she always does  overtime in the office - often many hours more and for no extra pay - and pretends that it's not happening. She doesn't like doing it, but she doesn't want to do anything about it either.

I've tried voicing my concern that she's letting her boss control her life outside of her contract, but of course she gets angry and says that ""I don't get it"" and that I shouldn't solve her problems for her. And then, after telling me how tough it is to work these long hours for no pay, she tells me that she doesn't really mind doing it. From what she tells me, they have a big budget and can easily hire more workers, they just choose not to (and it's easy to see why, when they have an employee willing to work for free). She has also postponed and cancelled existing dates we had because her boss needed her somewhere else, so it also sometimes has a direct effect on our life together.

My latest suggestion is that she just casually brings it up (""soooo, about those extra hours I worked yesterday...?"") and see what he has to say about it. IMO there's nothing wrong with being curious and exploring your options, but even this she won't do out of fear of repercussions. Keep in mind, this is her first 9-5 job so she has no prior experience with how a workplace is supposed to be in her own country, only hearsay.

I find this resignation in her attitude incredibly unattractive, much more so than if she were to get fat or some other superficial change. And even though there's this golden rule that you're not supposed to fix your girlfriend's problems for her, it's also makes me angry when she deems the situation hopeless and doesn't do anything about it herself.

What should I do?



**tl;dr:** Asian girlfriend doesn't know how to say no to her Asian boss and blames it on culture. This frustrates me because I don't want her to be a pushover and he has no right to make her work for free."
b8qho,84,2010-03-03,How many hours of pure work do you put in a day?,tmbridge,programming,https://www.reddit.com/r/programming/comments/b8qho/how_many_hours_of_pure_work_do_you_put_in_a_day/,"I am a web developer at a start up company.  This is my first full time position out of college.  I've had two summer internships and bigger corporations.

 I am in the office from 10am - 6:45pm.  I average about 5.5 hours of pure work a day after factoring lunch,  stretch/walk breaks, and reading the latest news and an article or two about some of the technologies I'm currently working with or will be working with.  

Is this normal?  Is it expected to put in 8 hours of pure programming/software design each day?  On the days where I need to get something done and I work closer to 8 hours straight, by the end of the day and the next day, I am completely burnt.

You?"
b8v59,0,2010-03-03,Looking for Junoir PHP developer for minimum wage,LordGluttony,Portland,https://www.reddit.com/r/Portland/comments/b8v59/looking_for_junoir_php_developer_for_minimum_wage/,"Uncool, right? Minimum wage php gig. I'm sorry. Its my budget. Its more like an intern position.

This position is more for people who dabbled in it a little bit and are looking for a career in it. Hunger to become a php scriptor is greater then ability in my eyes. We posted a craigslist ad, but we didn't get the results we were hoping for.

Javascript and mysql a plus.

email me at jessedictor@mditv.com or call me at 971-227-8256

This would be working within MDiTV, where I already hired another redditor."
b9015,2,2010-03-03,Dear Proggit: Do you have any advice for a soon-to-be software development intern?,ucsdrake,programming,https://www.reddit.com/r/programming/comments/b9015/dear_proggit_do_you_have_any_advice_for_a/,"Here's the deal, in May I'm going to start working at an enterprise class software company for 16 months.  I'm in a 3rd year computer engineering program and the company does most of their work in C and C++.  Essentially I want to make sure I go above and beyond the regular intern (not just make good coffee, make GREAT coffee :P) and was looking for any type of advice from professional programmers.


I've been looking at Project Euler and CodeKata to enhance my programming skills, but this isn't just about programming.  Any advice on stepping into a work environment from academia, or things to expect would be greatly appreciated as well!"
b9ak3,9,2010-03-04,"Reddit, I am crushed right now, I just need some help to move on.",wgr1344,relationship_advice,https://www.reddit.com/r/relationship_advice/comments/b9ak3/reddit_i_am_crushed_right_now_i_just_need_some/,"Just a little (it’s not little at all) background…

I met a girl back in my first year of college in a big city. When I met her I had already put through all the plans and paper work to transfer out of this said big city to another more tropical location. So she knew from the start that I wasn’t going to be around for long. We hit it off big time, and next thing I knew, I had to leave. I took a while back home to prep to make the big move, and kept in touch with her every day and night. She visited and I visited. Things were amazing. Then I asked her, partially joking because of the absurdness of it, to move with me. It would be easy we were going to the same school and it was simply a transfer. Surprisingly she said yes. 

We were in separate apartments at this college, but you could say we lived in 2 rooms together. I mean it was amazing, we got along perfectly. We ended up with some seriously shitty roommates, and all the drama they brought on ended up making us want to get out. Knowing absolutely no one in this new place, we decided to get an apartment together. I guess reflecting back it was a big decision, but it was so fluid, it felt perfect. I didn’t even realize I lived with her until maybe a month or 2 into it. All the little things that people complain about when they move in together, they never happened with me and her. I was in love for the first time in my life.

The economy tanked late 07, and I was working at a Real Estate agency, just as a paid intern. So you can assume what happened next. I got laid off. Not those bills were an issue, but I had to cut back on any extra spending. Things were still going very well in the relationship, so I went on finding another job. It didn’t happen for maybe 3 months. Strangely enough I talked my old boss at the place I was laid off into bringing me back on for fewer hours. It was perfect; I had a ton of time for school and just enough to pay the bills, although I didn’t have much money for other things…

Looking back on it, this is where the change happened. She started to look at me differently about then, I feel like she thought I wasn’t worth what I used to be.  School also was getting extreme, and taking up my time. She knew because I had made it perfectly clear that school was my priority. I felt like things were different because I still seen here every day. It wasn’t like I seen her once a week should I have not been living with her.

She did get a job, and worked a ton of hours; she would spend her entire paycheck on clothes and makeup. It just continued to get worse. This was a new thing she did, and I assumed it was just a phase. I would try to help her with school but she hated school more and more. I ended up sounding like a parent sometimes, trying to get her not to skip. Honestly I know most people will say I shouldn’t of done that, but she was on the verge of failing classes she didn’t want to attend, and unlike her BFF’s who say “Lame just skip it” I actually cared about her well being.

We were on our last quarter, and we both set up our classes so we could go back to the big city to do our internships. She missed family and so did I. Plus there was better work there, or so we thought. I got an internship early on, because I knew it would be tough. She didn’t, and she didn’t really try. When we moved back, I got my own place because she didn’t save up enough money to live with me and help pay anything. I even told her she could live with me any way since I have to pay rent regardless…(wonder how that would of turned out). So she lived about a 40 min bus/train ride from me. I visited a ton it was great at first but things started to get weird. 

We both are having an awful time finding jobs, and she has yet to do an internship so she hasn’t graduated. She didn’t want to visit me anymore. She wanted me to come there, and I was getting pissed at her inability to meet half way. She told me she didn’t want to get married, which is acceptable, but didn’t match what she said previously in our relationship. I was already strained because she told me she never wanted children. It’s not like I knew if I did, and I definitely didn’t right now or in the next few years.  I mean I feel like I want to have one kid later in life, I want to do something that selfless. So it was a diverging path. 

I broke up with her on Valentine’s Day (fucked up right?). I made the cut, and I FEEL LIKE A BOWL OF SHIT! So here I am 3 weeks later still ultra depressed, more than I ever have been in my life. I will be fine, maybe even optimistic, then I will get hit with the most horrible wave of depression that I can feel ripple through  my body (never had that before). I am still friends with her on facebook, and I stalk my fair share, I CANT HELP IT. She is partying with her friends who she told me she didn’t really like, and now she is talking to hideously ugly guy (no bias here, he really is ugly). She still hasn’t finished her internship class, so she hasn’t graduated. 
The whole thing is killing me because she acts like I didn’t just spend 3 years with her, and that I didn’t take care of her, and I never hurt her. I am over here dying and she seems like she is having an ok time. I need to know reddit, (those of you who have read this far) what I can do to feel better. Keep in mind I am still broke right now, so bars are out of the question until I have something fulltime. I am not looking to just bang some random chick (I wouldn’t turn it down) . I just need to stop this horrible feeling of depression.

**TLDR: I am depressed because I think I did the right thing in breaking it off with my girlfriend of 3 years who I lived with. She on the other hand is doing a little better, and already talking to new people. HELP ME UNDERSTAND HOW TO NOT FEEL SO SHITTY!**

Fuck I don’t even type this much for homework…
"
b9g0f,19,2010-03-04,Dear Chemistry Reddit: What to do about Computational Chemistry as a future?,speckledlemon,chemistry,https://www.reddit.com/r/chemistry/comments/b9g0f/dear_chemistry_reddit_what_to_do_about/,"Through reading what lots of people say in comments, I've figured out that a large proportion of you are quantum or computational chemists, which I'm very interested in becoming. This is difficult though, since there isn't a lot of guidance from my uni's department (which is medchem/synth-oriented). There are also a very limited number of internships or co-ops available in modeling, comp. chem, or even informatics.

I decided to try and dual major with CS to develop my theoretical and practical programming skills, but that hasn't really come to fruition yet.

While I'm sure I have to wait and see how things go in PChem 2 (which for us is quantum mechanics), I was wondering if anyone could give me any advice or more of a direction, since no one at school has been able to help much.

For the record, I've done passably in GenChem, OChem, and Bioanalytical, and I'm doing ok in PChem 1 right now, and I love programming though it doesn't always come naturally. My math could certainly use work but it's not bad. I'm more well-rounded than exceptional in any one area.

EDIT: Thank you all for your advice. It seems to be too late to apply to most of the REU colleges for this upcoming summer, but I'm glad I finally know something like this exists so I can get a jump start on it for next year. I should also go back to doing work for the professor on campus whose research I was remotely interested in."
bb92u,9,2010-03-09,I would work for free,[deleted],offmychest,https://www.reddit.com/r/offmychest/comments/bb92u/i_would_work_for_free/,"Because of the economy I can't find a job that uses my degree (Business Administration, Information Systems) without several years of work experience.  I am so desperate to use the knowledge I gained in college that I would work for free, but I cannot find an unpaid post-graduate internship within 1000 miles for my field."
bbd8b,9,2010-03-09,How do I get into UI or UX or whatever?,NastyBigPointyTeeth,web_design,https://www.reddit.com/r/web_design/comments/bbd8b/how_do_i_get_into_ui_or_ux_or_whatever/,"I am a sophomore majoring in Web Design.  

How would I go about starting down that path? Does anyone ever offer internships or entry jobs for UI or do I need to build up my portfolio with web sites and web application stuff before I get an actual UI job?

What are some good books or web sites to learn from?  

 Any other advice? "
bc32t,5,2010-03-11,I think I want to grow a little!,jifpeanutbutter,trees,https://www.reddit.com/r/trees/comments/bc32t/i_think_i_want_to_grow_a_little/,"Hey ents, I'll be spending my summer in my roommateless college apartment. My girlfriend will be gone for the summer, and I got an amazing internship in IT that  pays $20. Besides from smoking the copious amounts of marijuana that this summer's opportunity will provide, I wanted to experiment with growing. I do live in an apartment so smell is SLIGHTLY an issue (the my neighbors smell like pot and curry all the time).

Here's the details.

I want to put a self-contained grow unit inside my closet. I've heard about PC grow boxes, and they seem cool. Do they yield much? How much should I spend on the setup if I'd like to produce no more than a few ounces of dried bud? What say you trees? Could I realistically grow all my own, high quality weed?"
bc6o9,5,2010-03-11,"Hi Swedish Reddit: I am a student from Singapore and am coming to Stockholm in August for a year-long internship, can you help me look for an ideal company?",nubela,sweden,https://www.reddit.com/r/sweden/comments/bc6o9/hi_swedish_reddit_i_am_a_student_from_singapore/,"So we've long heard about the awesomeness of Sweden and its insane bbb 10mbit up/downstream internets (is it upgraded now?) and the beautiful nature (by nature, I really mean girls) that Sweden has, and I'm excited about coming over!

I am a student from Singapore coming over to Sweden for a year long academic work/study exchange programme and I'm having a hard time finding an ideal company to intern in, so I thought perhaps you guys could help me out :)

A little background about mysellf:

I am a computer science student who is extremely passionate with coding, and I've been a freelance web developer for 5 years now.

As a freelance web developer, I've moved from PHP -&gt; Django(Python) for all projects now, and as an experienced web developer, I am extremely familiar with relevant technologies such as CSS, JS, HTML, etc. I could go on whole day about this, about the frameworks I use, django pluggables, etc. But lets just keep it as such first.

My recent portfolio includes tuttobelo.com , www.ocbc.cyclesingapore.com.sg , amongst others. 

As a programmer, I'd like to think I'm pretty robust, and am in fact now working on http://code.google.com/p/subsynct right now.

Having mentioned the above, I'm looking for a company (preferably a startup) in Sweden that might need an experienced developer not to be a hardcore coder to an existing solution, but as a craftsman for solutions. That is to say, I'd hope to be able to contribute to the company with my expertise, and not just be a regular code monkey.

As such, there are really 2 spectrums of companies I'm looking at:

1) Web Startups such as Spotify which are really technologically driven and am focused and powered by technology itself.

2) Marketing companies that focused or open towards the direction of producing creative solutions to the internet aspect of marketing :)

---

I'd really appreciate any direction you guys can throw me, and if need be, I'd be more than willing to substantiate myself with a CV, code-review, or an interview :)

Thanks for your help guys! I look forward to seeing your beautiful country in 4 months!

-----"
bd47f,5,2010-03-13,"Dear r/Design, I need some help figuring out some things.",lalinoir,Design,https://www.reddit.com/r/Design/comments/bd47f/dear_rdesign_i_need_some_help_figuring_out_some/,"I feel lost.  I recently finished up my undergrad in visual communications, and I've been spending a lot of time right now looking for jobs.  These jobs have ranged from full on graphic design positions, internships, to barely related jobs like clerical positions in media companies.  I've applied to non-profits, for-profits, government, etc.  I've even tried freelancing, but no one is taking me seriously.  I'm riding on roughly a ~$20k school loan debt right now, and this month is when repayment started.  It really isn't bad, but without gainful employment it's starting to hurt.

I'm debating on grad school right now.  It's up in the air because I'm not sure if it's beneficial for a designer (ie. I'm told things like an MFA is best for teaching, and the like), but I do want to go for personal reasons.  Part of my desire to get into grad school, also, is to also hide behind academia for a little bit to ride out this economic climate.  Most deadlines have passed, but the Academy of Art University in San Francisco has rolling deadlines, but I haven't heard the most savory things about it (ie. no portfolio requirement for admissions, no real standard for grad admissions).  Not a lot of schools have spring admissions, so it looks like I'm gonna have to wait a while.  I just don't know if I should wait and try for the programs I want, or just to go to grad school the moment I can, ok quality or not.

To fill this gap year, I'm debating portfolio schools.  I don't really know much about them, and I don't know if they're a good direction for me to take.  I'm not sure if they're a good intermediate step between now and a grad program or a job, or if it can take the place of a graduate education, but I'm anxious for things to happen.  I feel incredibly stagnant, very intimidated by my financial situation, and nothing really affirming my abilities.  If I had to assess myself, I think that my work as well as my work history should land me squarely in junior or, at least, entry-level, but now I don't know.

Short of it all, I feel very lost.  I'm still applying to jobs, I know I want to go to grad school, but I feel like neither are within reach, and I don't know if the in-between steps will help or just end up costing me more.  Thoughts?"
bho60,124,2010-03-24,How to get away from web programming?,Minishark,programming,https://www.reddit.com/r/programming/comments/bho60/how_to_get_away_from_web_programming/,"I'm looking for some career advice. Basically, I'm sick of making boring corporate web sites and lame web apps. I need a change. Problem is, all my professional programming experience so far has been on the web in some form or another. I've done CRM work in ASP.NET, ""Web 2.0"" apps in Ruby on Rails, and front-end development in HTML/CSS/Jquery. 

My first introduction to programming was a course in C++ about 10 years ago. I went to college for Computer Science and did some pretty fun projects. I started doing web programming because it was something new, and something they didn't teach me in school. It's what I did during summer internships, and what I did for work after graduating. Now that I've been doing it for a few years, it's no longer new. It's boring; I feel like I've been solving the same exact problem over and over again. The technology just doesn't excite me any more. 

I originally got into computers because I thought they could make the world a better place, but I feel like I've lost my way towards that goal. None of my past web development work was done because it was an interesting problem to solve, or because it would make the world a better place; it was all done because it seemed like the easiest way to make somebody some money. I want to get back to those computer science-y problems that got me excited about programming in the first place, problems that have some scientific or social value. My question is: How do I do that? 

I've been looking around for jobs that might interest me, but it seems all I can find are either (a) lame web programming jobs, or (b) ""senior"" positions requiring 5-10 years in some language or technology that I have no professional experience with. Don't get me wrong, I've done plenty of C++/Java/Python programming for school projects or for my own projects, but nothing on the job. 

Do I just keep working on my own pet projects and hope an interesting company hires me based on these? Do I accept a crappy job at one of these companies with the hopes of moving up someday? Do I go to grad school and do Computer Science research? 

I'm leaning more towards the last option, but I don't know. I'm still young (in my 20s). What advice would you give for someone in my position? "
