dsvia,27,2010-10-18,Reddit @ Grooveshark - A Scavenger Hunt,TAMumbles,geek,https://www.reddit.com/r/geek/comments/dsvia/reddit_grooveshark_a_scavenger_hunt/,"It goes without saying that a lot of people around the Grooveshark offices use Reddit to stay informed. When you sit in front of a computer for upwards of eight hours a day, you find the best of the web pretty quickly.

Yesterday, I wandered over to the desk of one of our friendly system administrators, Nate. I wanted to know if he could tell me how many people around the office were surfing Reddit at any given time. Apparently sysadmins are busy guys and all he offered me at first was a death glare, but Nate’s a Redditor and I could tell he was amused by the idea. He told me that six people around the office had visited Reddit in the past half-hour, but it was up to me to find them.

* Our Head of Community Development, [Graham](http://flic.kr/p/8L8Upd) stuck out like a sore thumb. He appeared to be in lurker mode, but he's a huge fan of [XX](http://www.reddit.com/r/TwoXChromosomes/)

* I just missed snapping up a picture of [Peter](http://flic.kr/p/8L5PR8), one of our Web Developers, checking out LOOKATMYGIRLFRIEND — he decided to switch over to WTF instead.

* [Pavle](http://flic.kr/p/8L8TpL) is our resident fragger. When he's not herding interns or giving interviews, he's probably knifing you in the back.

* [Jen’s](http://flic.kr/p/8L5PTa) usually trying to keep the Sales team focused, and she's also a frequent contibutor to AskReddit.

Then I wandered into the Dev Cave. It's a dark, windowless room, and the only sound to be heard (aside from the bats leaving at dusk) is the click of fingertips on keyboards.

* Now that [Mike](http://flic.kr/p/8L8TVu) has wrapped up preliminary work on the new iPhone application, he’s got time to check out Programming.

* [Skyler](http://flic.kr/p/8L5PZ4) keeps an eye on reviews for our ‘Droid app on the Android subreddit.

"
dty6k,47,2010-10-20,"I had my first experience being strong armed by the law today, and I thought I would share it for those who are interested.",[deleted],photography,https://www.reddit.com/r/photography/comments/dty6k/i_had_my_first_experience_being_strong_armed_by/,"I'm a reporter for a local paper in New Jersey. Technically, I'm an intern, but it's really just a title they give to me because they can't afford to pay me a full salary. Anyway, sometimes when the
photographers are tied up they'll send me out on photo assignments.
Today, it happened that they needed me to meet up with one of our
senior reporters who was at a public school waiting for the kids to be
let out. Yesterday, a food fight erupted that turned into a full scale
riot. It appears to have been racially motivated--every cop in Jersey
City responded and several people were taken to the hospital.

Anyhow, I got to the school and met up with my reporter, who was
shooting the shit with one of the city detectives (a really nice guy
who is sympathetic to the press).Cops had the entire school surrounded and were all over the premises in case violence was to erupt again.

Everything was going fine, until the bell rang. Kids started pouring
out of the school, and I stepped up on the sidewalk by the fence to
snap a few pictures. Suddenly, a female security guard starts power
walking towards me shouting that I was breaking the law on school
property.

Obviously, I knew I wasn't, so I tried to explain to her that the
sidewalk is public property that I was well within my rights, but a
statement like that just goes nowhere. She was getting in my face,
trying to force me off the sidewalk, and telling me to give her my
camera (which belongs to me, not the paper). I refused, and she didn't
try anything as I'm a big guy compared to her. I started to think that
maybe I could be wrong, and that I couldn't take pictures on the
sidewalk after all.

At this point I was pretty mad, so I took a step off the curb onto the street and took a picture of her. I don't have to tell you that this angered her. I know I shouldn't have provoked her. But I inherited my dad's temper, and I have this unnaturally strong need to smack the beehive sometimes (I guess I'm a troll).

So she's shrieking at me at this point and gets on her radio to call
the school's administration. I told her that she could go get the
police if she wanted. She did. While she left I used the opportunity
to get my shots, but then was approached by her, a JC cop, and the
school's principal. The cop asked me to leave, and the reporter I was
with (he's older and more experienced, and I'm 24 and graduated from Rutgers with a degree in journalism in May) told him that we would cross the street to be nice, but that the sidewalk was public property.

They were satisfied enough with that. But then, we got what we needed and left, and I noticed that I was being followed by the school's security truck down Montgomery Ave, and they were on the phone presumably feeding information about my car to the police or
something.

I'm not worried about action being taken against me, but it's very
unnerving to be placed in that position against your will--I really
didn't know what I was getting into.

Anyhow, that's my first experience with something like that and it
definitely wasn't fun. I know I would have been arrested had I pursued
my rights on the spot, with no recourse."
du901,3,2010-10-21,I'm not sure what to do anymore...,dilemmasquared,relationship_advice,https://www.reddit.com/r/relationship_advice/comments/du901/im_not_sure_what_to_do_anymore/,"Hey RA, throwaway account here. I found this subreddit via r/random one day, and I feel like I could use your suggestions right about now.

Here's some background:

I'm an Asian 20F in a respected, Caucasian male-dominated tech school. I can count the number of people I've dated on one hand, and recount every kiss I've ever had. I've honestly never had a boyfriend. While I enjoy being alone, I still love to go out and party with friends - I'm very much in the partying phase of my life. I do wish I had someone to cuddle and hold hands with sometimes.

Anyways, in my freshman year of college, I got involved in one of the clubs on campus. I happened to notice that the club's president (who is a year ahead) was pretty cute. Fast forward to middle of my sophomore year, I got asked by the president (I'll just refer to him as the boy now) himself to join as a club officer, since one of the officers was away on foreign exchange. I accepted, and joined a whole new social circle of friends, all of whom I love to just chill and party with.

A few weeks later (just before this spring), I just upped and asked him out. I knew he was going across the country for half a year for some pretty important internships, and I figured better late than never. He accepted and we had a date, but it was awkward and stiff. He let me know after that he wasn't looking for a relationship at the moment - I was alright with that, and let it go.

A few weeks after that, I was over at his place for an after-party for a concert that happened that night. I had a few friends from another campus with me, and they needed to make a long drive back, but their stuff was in my room. I gave them my keys and partied on - I had the green light to crash on the sofa at the boy's house. A group of us took a stroll later on, and when him and I got back to the house, we realized that the couches already had people passed out on them. Sucking it up, we decided to share the bed. Emboldened by I-don't-even-know-what (and partially sleeplessness), I asked him if he turned me down because he was not interested, or just because he was busy. He said it was because he was busy, and wasn't willing to start a relationship that was long-distance right off the bat. We got talking, and agreed to try and see how it would go in the remaining time we had left together (2-3 weeks approximately?). We ended up hooking up, but didn't go all the way.

After the weekend passed and hearing no word from him, I texted and called him, and received reluctant responses. What probably hurt the most was the feeling of being ignored and avoided, but I didn't want to bother him since I knew he was busy. The day before he was supposed to leave, he went around and visited everybody, including some friends that lived in the same building as me. He knew I lived there, but he didn't visit me.

I eventually managed to corner him, and got an answer I suspected: no, and that he would be back in the winter.

Fast forward to this past weekend - he came back for a short visit, and of course held a party. He's 21, and like myself, also very much into his partying phase of life. I more or less got over him, and just went up, shook his hand, and was like, ""let's be friends."" We were chill and had a great time at the party. Up until this point, very few people knew that we went out before. Partly out of drunkeness and partly out of residual underlying interest, we somehow ended up kissing in front of everyone. No big, the night went on.

A whole group of us went out for pizza with a sober D. Afterwards, we all got dropped off at our respective places. As the boy was exiting, he gave me this look, but I just stared back and ignored it. When I got dropped off at my place, I received a message from him. We talked back and forth, and eventually he walked over to my place to pick me up. Just walking over to his place and holding his hand, I felt like I was on the top of the world. I was vehement that I wasn't into one night stands, and he said the same. I ended up sleeping with him - it was my first time, and I'm near certain it was his as well. I don't regret it at all; the sex wasn't perfect, but it was fun. Were we drunk? Yes. But not enough that we weren't aware of what we were doing.

The next morning, we just lazed about together and slept together again. I left his place mid-afternoon - we both had work to do. I called him the next day and asked if he wanted to meet up again. He said he was going to show up at an event the club was holding, the night before he was going to leave. He showed up late, and talked to a few people. I didn't get more than a passing glance and a ""hi."" I've invited him to hang out with me a few times, but every time he had other plans. It was understandable, since he was here for a very short time and made plans beforehand. Regardless, I felt that he could've spared half an hour to just relax together, work and other people aside.

I'm confused, RA. I feel like I've gone back to being ignored. I'm not sure what he wants from me, and tbh, I'm not sure what I want from him.

I like him, but I'm very much a realist. I can't make him like me, and I can't make him start a relationship with me. In all reality, he comes back to finish school this winter, before he graduates. Then, he'll most likely be back on the other side of the country working, while I still have another year of school to finish. Should I even bother to pursue him when he comes back?

I'm not sure what to do anymore, I feel as if I'm a fish floundering out of water. Help, RA?"
dvds6,3,2010-10-23,Help me pick a computer?,mack_a,computers,https://www.reddit.com/r/computers/comments/dvds6/help_me_pick_a_computer/,"Hello,

is it ok to ask for help with buiding machines in here? If so, thanks in advance?

Below are two setups that are available to me as packages from respected stores in my country, at about equal price.

* Will there be any difference in gaming performance between these two?

* Is there any difference in upgradeability?

* Will there be any difference in *noise levels* while gaming?


**Setup 1**

* Cooler Master CM 690 II Advanced Svart Fläktar: 1x 120mm Front, 1x 140mm Topp, 1x 120mm Bak, Blå LEDs, 19 dBA

* Chieftec Super Series 650W PSU ATX 12V V2.3, 80 Plus, Modular, 1x 6pin+1x 6+2pin PCIe, 6x SATA, 140mm Fan

* SUS P7P55D-E LX, P55, Socket-1156 DDR3, SATA 6Gb/s, USB3.0, ATX, GbLAN, PCI-Ex(2.0)x16

* Intel Core™ i5 Quad Processor i5-760 Quad Core, 2.80Ghz, Socket 1156, 8MB, 95W, Boxed w/fan

* Kingston ValueR. DDR3 1333MHz 4GB, CL9 Kit w/two matched ValueRAM 2GB DDR3 

* Gainward GeForce GTX 460 1GB PhysX CUDA PCI-Express 2.0,""Golden Sample - GS"", GDDR5, 2xDVI, native-HDMI, 700MHz

* Western Digital Caviar SE16 500GB SATA2 16MB 7200RPM

* Sony Optiarc DVD±RW burner AD-5240S DVDRW 24x, DL, SATA, Bulk, Black


**Setup 2**

* Fractal Design Define R3 - Svart (none PSU)

* OCZ PowerSupply (PSU) 600W ModXStream Pro

* Intel Core i5 760 2.80GHz / 8MB / Socket 1156 (Boxed)

* Asus - Socket 1156 - ATX Intel P55 (P7P55D)

* Corsair XMS3 4096MB DDR3 PC3-12800 1600MHz (2X2048MB) (CL9) (CMX4GX3M2A1600C9)

* Samsung Spinpoint F3 1TB (7200RPM / 32MB Cache / SATA II)

* Gigabyte GeForce GTX 460 1GB (GV-N460OC-1GI) - PCI-E / 2xDVI

* Samsung Intern SATA DVD±RW 22x - Black (Dual-Layer) (SH-S223C) (Bulk)"
dvnvc,0,2010-10-24,[request]  Computer/Software Engineering Internship in Europe,Squirrl,Favors,https://www.reddit.com/r/Favors/comments/dvnvc/request_computersoftware_engineering_internship/,"Hey Reddit,

As a long time lurker (on various accounts), I've seen the power of the reddit network and the huge number of obscure connections and coincidences it brings.

I am posting today to try and exercise this network to find a Computer or Software engineering internship / work experience in Europe, from January-May, 2011 - prior to me beginning a Masters degree in August.


-----------------------------


A bit of background on me and my plans:

* I am 23 and an Australian citizen.  I am eligible for any working holiday visas offered to Australians (Belgium, Denmark, Estonia, Finland, Germany, Italy, Netherlands, Norway, Sweden).  Furthermore, I should not have a problem getting visas for other countries if sponsored - I am single, university educated and I have no criminal record, no medical problems and no dependents.  I will be traveling to Europe on a German working holiday visa, so I can also search for jobs while I am there.

* In three weeks, I am traveling to Europe as part of an Australian sporting team, representing Australia in a world championships sporting event.  If at all possible, I do not intend to return to Australia

* I graduated university at the end of 2009 with the double degree:  BEng(Computer Engineering)(Hons 1C) + BSci(Computer Science)

* I am hoping to start a Masters degree in Europe (location based on which degree I am accepted for).  I am hoping for Zurich or Munich.

* I have worked since the beginning of the year in technology consulting, but did not enjoy it as much as the various research projects that I was involved with during my 5 years at uni.  I am looking to move into the R&amp;D field and am hoping that a masters degree will help me with this.

* I am enthusiastic, independent and very capable of learning new technologies and concepts

* I am a native English speaker and have been learning German at night-school for a year, but having never immersed myself, I would not say I am by any means fluent - I can read and write conversational German with much more confidence than I can speak and understand it - but I am keen to learn and plan to make full use of being surrounded by language and culture!



My current plan, assuming everything works out is:


* Nov: Sport

* Dec: Sport

* Jan: Work

* Feb: Work

* Mar: Work

* Apr: Work

* May: Work, then start to travel towards the end of May

* Jun: Travel

* July: Travel

* Aug: Finish up with travel and start to study

* Onwards:  Masters degree until 2013.




If you are interested in reading more about me, I have uploaded a resume (with most identifying information rescinded) **[here](http://dl.dropbox.com/u/200153/Squirrl%20-%20Resume%20%28blanked%29.pdf)**


**If you are interested in my full resume - PM me and I will link you to my complete resume, contact details and references if required.**




I'm happy to answer any questions you may have, but would prefer not to publicly announce my identity.

Cheers,
Squirrl


-----------------------------


**TL;DR:** As I am over in Europe at the end of 2010 for sport, but do not begin a Masters degree until August, I am hoping to find some computer/software engineering work experience to help pay cost of living and allow me to stay in Europe during this transition time


-----------------------------


*EDIT:  Also, if anyone could suggest some other subreddits where I could cross post this, it would be much appreciated.  I thought about /r/Germany and /r/Europe, but they seem to be more news related.*"
dw7ts,1,2010-10-25,Can't bring myself to hurt her.,sometimesacoward,relationship_advice,https://www.reddit.com/r/relationship_advice/comments/dw7ts/cant_bring_myself_to_hurt_her/,"I'm 21, she's 22. We've been together for about a year now, and have been really close, rarely leaving each others side. I stay at her place 6/7 nights a week, we split groceries and all the works. I love being with her, we make each other laugh constantly. I've never had so much fun just hanging out with someone.

On to the bad parts. Sex life sucks. Maybe once a week, and there is no flexibility no blowjobs, no adventures, no regularity. I think it stems from her low self esteem (she is pretty overweight) but it makes things sometimes frustrating for me. We've talked about it and she agrees to work on it, but never with results. Also she is very temperamental and subject to mood swings. I've never been with another girl this seriously so I don't know if it's normal. When I leave she is much less functional and gets depressed. I left for a week to my place to study and she quit attending class. She is very dependant on me. I've been contemplating breaking up with her but have always found the thought of hurting her too revolting. I really do love her.

So I got offered a great internship with a well known company 1000km away. I want to take it, but it'll crush her. She'll fall into a slump if I leave. I have been considering taking a lesser job locally to make her happy. She spent a lot of last night crying, thinking I might be leaving. She can't come because she still attends school for the first 4 months of my job. But it's only an 8 month internship.

Does anyone have any advice for how I can put myself first without feeling shitty for hurting her? I know the right thing to do is break up with her and take the job, but I can't bring myself to put her through that. The thought of making her cry is almost enough for me to lower my career goals and stay here. I just need advice on how to get over it and do the right thing for myself."
dx0l4,5,2010-10-27,"I just got a job, how much is ok to spend on myself?",IGotAJobby,Frugal,https://www.reddit.com/r/Frugal/comments/dx0l4/i_just_got_a_job_how_much_is_ok_to_spend_on_myself/,"After making barely enough money to survive on for the past few years, I just got my dream job offered to me at the place where I intern. I am about to make 800 a week, where before I was making 220. I am also about to move into a friends house who is going to let me stay there for free. So my question is this, I want to buy about $100 worth of clothes, and a ~$200 computer monitor, among some other small purchases. Are these merited purchases? 

tl;dr I got a job, should I buy a bunch of stuff?"
dx9ie,0,2010-10-27,"Reddit, we promised our intern an Avatar Fleshlight if his app ""Shotgun Free for Android"" got 1 mil downloads. Help him out?",rothmic,reddit.com,https://www.reddit.com/r/reddit.com/comments/dx9ie/reddit_we_promised_our_intern_an_avatar/,"Our bearded intern Aaron spent about a month working on a port of our popular iPhone app ""Shotgun Free"" to Android, and it went live on the Android Market yesterday. Around the time he was getting started we saw the [Avatar Fleshlight](http://gizmodo.com/5651323/the-avatar-fleshlight-actually-happened) and, on a whim, promised him one if the app topped 1 mil downloads. Aaron is a strapping young man, and what strapping young man couldn't use an Avatar Fleshlight? I thought perhaps Reddit could help."
dxaju,4,2010-10-27,She says she wishes she'd met me later in life. What now?,throw54321away,relationship_advice,https://www.reddit.com/r/relationship_advice/comments/dxaju/she_says_she_wishes_shed_met_me_later_in_life/,"I figure I'll just try and write down all the relevant info I can think of here, and I kind of need to get the whole story out there for my own sake, so I apologize in advance for rambling.

I'm 22 and she's 23, and we've been dating for almost exactly 1 year now. When we first met, things were going really well. She was finishing up college (business communication major) and I was in my 1st (and most grueling) year of grad school. She had originally gone to college as part of a specialized acting program, but had dropped out without finishing after feeling fed-up with the people and being concerned about the pragmatics of being a career actress. Before meeting her, I had never had a serious girlfriend but a few flings here and there. To be honest I was a little inexperienced, having lost my virginity only around a year before we met. Either way, we met at a bar and had a great ""official"" first date a few days later. 

Towards the beginning of the summer, she started getting anxious about what she'd do after graduating. She had had a few PR internships, but when we talked about them she seemed unsatisfied. Around that time, I asked her what she'd really truly want to do with her life (ignoring money) and she said she wanted to act, so I encouraged her to follow her passion. For a little while after, she was considering heading to L.A., where she thought she had to be to pursue acting. This would mean essentially breaking up, as I live and go to school on the east coast. We talked seriously about it for weeks, and in the end she decided to stay where she was, and even moved to an apartment in my neighborhood and got a waitressing job there, too. Throughout all of this our relationship remained strong, and I would say it get even stronger with her deciding to move a little closer by. 

Throughout our relationship I feel like I've gone out of my way to be a source of support and advice for this girl. It seems like the majority of our conversations would inevitably turn towards her: her anxieties about her coworkers, her insecurities about acting, etc. Most of the time I was okay with this, seeing as how I was in a relatively stable position in my life (in school) and she was going through this crazy transition. I wanted to be there for her, I sort of felt that it was my duty.  

Anyway, last weekend I went out of state with my mother and sister to visit my grandmother. My granny doesn't have much time left, and I hadn't seen her for too long so I considered it a family obligation. Suffice it to say that this trip was a little depressing for me. Before leaving and during the trip, I noticed that my GF seemed a lot more distant when I talked to her over the phone. I was often bored during the trip, and would call her and not receive a response, or have a brief, rushed conversation with her. When I got back, I noticed that she was still acting like this, so I asked her about it. At first she told me she was just maybe a little depressed and stressed out (she worked hard over the weekend). 

She was still acting this way last night, and so I asked her about it again. I told her she seemed distant and could tell me if there was anything on her mind. She started to cry and told me that she was feeling weird about being in a relationship at this stage of her life. She told me she thought I was perfect, but she gets the feeling sometimes of missing out on life because she's in a serious relationship. She said she wished she had met me later in life when she wouldn't feel this way. 

As you can imagine, hearing this was hard. I told her I'd be lying if I didn't feel the same way sometimes, but the stability of a serious girlfriend was something I'd grown to appreciate. I suggested we consider taking some time away from one another for a little while. She wanted to know what the terms of some ""time away"" would be, and I told her I wasn't sure. We agreed to keep talking about it. 

I'd like to hear an outside perspective on this, reddit. Being that close to somebody for the first time is an eye-opening experience, and I wonder if my willingness to give advice and put her before myself has made me seem weak or dependent. It might sound awful, but I'm afraid of resenting her for all the effort I put into the relationship. 

Whaddyya think?

**Edit:** TL;DR - She says she feels like she's missing out on life because of our serious relationship, but thinks I'm great. I try to be super supportive, and I suggested some time apart. What are your suggestions?"
