d3lqh,0,2010-08-20,Canadian Student looking for Software development companies in Scotland!,puttputt,Scotland,https://www.reddit.com/r/Scotland/comments/d3lqh/canadian_student_looking_for_software_development/,"Hey r/Scotland!

I am a 21 year old, 3rd year Software Engineering student from Canada looking for a job/adventure during the Winter 2011 semester (January-April).


The engineering program I'm in features co-op study program so essentially I'm in class for 4 months, then off working for 4 months and it alternates until graduation. I would love to take one of my work co-ops internationally in the United Kingdom (preferably Scotland :) ).


Now I have browsed the University of Edinburgh's career center for student jobs but it seems that the general idea is that most student internships are unpaid, this would pose a problem. Here in Canada thats considered illegal-ish but it is common in the United States because it is more of a ""learning experience"". 


Now I don't want to give up on my search just yet so I wanted to ask all of you if you have heard of temporary paid student positions before? I also wanted to know if you have heard of any software development or related companies that are successful enough to warrant a junior developer, I have heard that there are some big game development companies, any big names?


Just to give you an idea, I have a decent background in web development but I am more interested in control systems and automation. Not that I would be picky of course because if I wanted another work-term in a field I was interested in I could just stay in Canada... but I would like a change of scenery to something new and exciting. I'm really looking for anything as long as its related enough to my field of study so that it can count toward my degree.

Thanks for your help!"
d468d,1,2010-08-22,Ideas on how to green computing and electronics?,[deleted],environment,https://www.reddit.com/r/environment/comments/d468d/ideas_on_how_to_green_computing_and_electronics/,"Hello all,

*So I've always wanted to make a comprehensive list of ways to make people's computer use as green as possible.  I understand this is a mammoth task, but here's the ideas I have so far:

*Conserve.  Don't leave your computer plugged in if it's at 100% battery or off.  Print double-sided when possible.  Use your computer as long as possible before buying a new one.  Try replacing hardware to keep up as long as you can.

*Conserve (sort of).  This one is more abstract: Use the appropriate service for your needs.  YouTube is not a music site; do not use it as one.  You get low quality audio (usually less than 128 cbr, which is very noticeable on good speakers) at high bit rate (the video stream, even if it's a static image, puts the bit rate over 300 cbr for most videos; it goes much higher for higher resolution videos).  This wastes a lot of data, which is moved about by electricity.  Use dedicated music services for streaming like Pandora or Grooveshark.  Better yet, if you plan to listen to a song a lot, just buy it.  Downloading a 4mb song that you listen to twenty times uses less resources than streaming that same song at 1mb per completion, twenty times.  (As for that, I don't know what to say about methods of data transfer . . . torrenting eliminates the need for server farms, but ratio needs at private trackers cause many to leave their computers on for extra periods of time in opes of seeding.)

*Volunteer your unused e-resources.  This is my fave: Let your computer use your extra CPU to perform calculations on a climate model through [BOINC](http://boinc.berkeley.edu/) (Berkeley Open Interface Network Computing).  I have mine limited to only running when my laptop is plugged in and to not use more than 60% CPU (to avoid overheating and slow down).  So if I'm writing a paper (and thus only using like 5% of my CPU), I donated half of my computer's power to improving UC Berkeley's climate models.

*Donate or recycle your computer and hardware.  If you want to donate it, but are afraid people will find a way to steal your personal info, either remove the hard drive or have it wiped by a licensed professional.  If you recycle, do it through a legitimate agency.  Unfortunately, I don't think there is a way to verify this in the US.

*Demand respect for the environment.  Many computer companies have only started recycling programs and environmentally-friendly design programs because the market has shown that those things are desired.  Make sure that you let companies know what you want by sending a message as a consumer.

Does anyone else have any ideas?  I hope to make a guide/presentation on this topic when I start my internship with my school's environmental office this fall."
d4wca,10,2010-08-24,Am I in the friend zone?,throwawayrarst,seduction,https://www.reddit.com/r/seduction/comments/d4wca/am_i_in_the_friend_zone/,"It's usually pretty clear to me if I've been LJBF'ed, but this situation is a little different.

I met this girl a couple years ago back when I was in a LTR.  We were friends, had the odd cup of coffee together, etc.  We stayed out of contact for the better part of a year (she was on an internship).  Shortly after she came back I was single.

It turns out she was unaware of my breakup the first couple times I saw her, but since she has found out I've been getting the impression that she's interested in me because she's gone from random coffee breaks, to dinners and drinks, etc.  In the latest case I had mentioned that I was going to a particular concert and within the week I got a message from her saying she had bought a ticket to it too.

I'm unsure how to proceed.  Mainly I'm trying to figure out how to get more kino in as I didn't touch her much before (remember, I was in a LTR) and it would seem kind of awkward to start doing that now.

Is there any easy way to tell if I've been LJBF'ed?  I don't ever hear from her about problems, ex-bfs, guys she's interested in, etc.

**EDIT**: Goddamn I'm dumb.  Everyone on the Internet is aware I'm not in the friendzone from a brief description of the situation.  I met her for coffee today and it suddenly turned into an hour and half long chit chat.  Meeting her at my place tomorrow morning and going for a run....not sure how to play that, but it's clear she's interested in me.  Time to get my touchy-touchy on."
d6x8c,0,2010-08-29,Help me Reddit - you're my only hope. Need IT career advice,mediapyre,reddit.com,https://www.reddit.com/r/reddit.com/comments/d6x8c/help_me_reddit_youre_my_only_hope_need_it_career/,"Here's the deal. I'm a programmer. (web, thank you very much) and my significant other is an admin/net admin. Some years ago, we decided that he could go back to school to teach college in the area he loved (not IT) and to be frank -- insert economy F$ck up here -- so how best to catch up on 3 lost years? Anyone need an overqualified intern in the DFW metroplex?"
d6yfw,26,2010-08-29,Depressed girlfriend making me depressed,fdsa1,relationship_advice,https://www.reddit.com/r/relationship_advice/comments/d6yfw/depressed_girlfriend_making_me_depressed/,"1. Ages: Recent college graduates, she is a little younger than me.

2. Relationship type: Met in college and we've been together for nearly 1 year. Because of my housing situation, we actually lived together for about 4-5 months (we had been together for about 4-5 months beforehand). We have each since both finished college and moved back home to our parent's house, we now live about a  40min car ride away. We used to hang out together 24/7, but since moving back home we now only able to see each other a few times a week. While I do miss being with her daily, I am okay with this but she has not taken it so well. It has been about 3 months in this situation and my love for her has not changed due to the drop in time spent together.
3. I have talked to her about this, and she knows I am upset, but I don't think she truely understand how unhappy it makes me feel. I don't think I can ever tell her everything I'm feeling (not good with expressing my emotions in the first place), but more so I feel like she will not be able to handle how unhappy I am. For the last few months, I have not been able to sleep very well, which has led me to stay up very late at night because my mind is always 100mph before bed. She has been to a school counselor before our relationship, and also went to a few sessions while we were still in school. Also, she is currently working at a temporary internship, in a very bad environment where she feels overworked and under appreciated. I feel like this environment is 10x worse for her than it would be for anyone else in that situation.
She has talked to her mother, and is planning to speak with a professional soon.
4. Problem: She has occurances, about once a week, where she feels anxious and depressed but doesn't know why. I try to lift her mood by telling her I love her and that everything will be okay, but it does not ever seem to help much. She  also sometimes feels like I don't care or love her enough, and misses me so much even when we just recently hung out for the entire day. She gets very sad when I have to, whether it is off the phone or home.

5. Her past: she has been through a lot, especially with her parents, family, and past boyfriends. Talking to her, it seems that she has never lived up to her father's expectations. She has a better and good relationship with her mother. Despite this, I can tell that everyone in the family really does love her, even though their way of displaying affection is different or not the ""norm"" (i love you, hugs etc). A few years ago she found out her dad was cheating on her mom, a little after that time, she found out that her boyfriend was planning, or already (i'm not sure) cheating on her. I am definitely not planning or thinking about cheating on her, I love her too much. I don't think she is afraid I am going to cheat on her, but the thought still affects her because of her experiences.

6. I am not a psychologist nor do I think I am qualified to diagnose her, but I believe she possibly is codepedent, manic depressive, or bipolar. Not all these things, but I feel she displays many of these symtpoms.

tl;dr: I think my gf has mental illness; some sort of depression. I try my best to help her through it but I am now it has caused me to feel very depressed myself. I can't tell her how I truely feel because i think it will just exaccerbate her situation, and make her feel more depressed. I have told her that I really think that she needs to seek help, she has agreed and has taken a few steps to do this.

Please help me, I love her so much, but I don't know how much more this I can handle :( I know this is A LOT, but please let me know if I missed anything or if you need anymore additional information. thank you for taking the time to read all this."
d717r,0,2010-08-29,"Reddit, my love life is currently non-existent.  Can you possibly help me out?",TescoValueThrowaway,reddit.com,https://www.reddit.com/r/reddit.com/comments/d717r/reddit_my_love_life_is_currently_nonexistent_can/,"Hey reddit, I've got a problem and you guys always seem so good at sorting things out so I'd like some advice.  Obvious throwaway account because I do not want to personally identify myself.  I'm going to offer a bit of backstory and some of the problems I seem to be faced with.  Apologies in advance for the length of this post and thanks for reading.

I'm a 22 year old guy and turning 23 in December, and I graduated from University in early June and am starting a Masters degree in October.  All summer, I have done nothing of note apart from a one week family holiday because there are very few jobs or internships available where I live (south West England).

Essentially, my love life is non-existent.  While I was at University I feel like I worked too hard and as a result I didn't socialize as much as I probably should have done which ruined the experience somewhat.  At the grand old age of 22 I have *never had a girlfriend*.  Sounds weird but it's true, and to be honest it's starting to wear me down and make me feel inadequate and feeble.

My first kiss was aged 19 towards the end of my second year at University and since then I have only pulled about six girls.  I have done lots of groping, spooning, kissing and heavy petting but never anything naked, and I have never had foreplay and am still a virgin.  All of my activity with girls has involved at least a small amount of alcohol as I am a bit shy and lacking in confidence, and there are a number of girls I grew pretty close to and them to me (some of them were definitely interested with some even texting me like girls do when they're interested).

This is hardly anything considering my friends are all screwing like rabbits on viagra whereas I have nothing, and I really feel like life has passed me by.  I can't turn the clock back and it feels like such a waste.  I've only been on three sort of half-dates which was nice although I didn't ask any of the girls out - I went to a show with a girl and her friend and I met up with the girl before the other guy turned up and we had a drink (I liked that girl) and the second one was with a girl I lived with at University as we were meant to be going out as a group, but the others decided they didn't want to so we went on our own.  It was also quite nice, we had a nice chat and a quiet cozy drink in a pub together but we fell out weeks later when it turned out she thought I was coming on to her, so she began to shun me which made me very angry and upset because I could see no clear reason for it.  In December 2008, I got hopelessly drunk and came within 10 minutes of having a one night stand and losign my virginity.  We got back to the girl's (not one of the aforementioned girls) flat but she suddenly changed her mind and asked me to leave despite she had been leading me on basically all night previous to this, and I still can't work out why.  I have several long term close female friends who have rated me as an 7.5 or 8 out of 10 on the looks scale (sorry, no pics) and they have tried very hard to encourage me and cheer me up.  I have had problems with unrequited love on a small number of occasions and I think I'm getting too hung up on looks as there was one girl who obviously really took to me and I liked her personality, but she just wasn't good looking enough somehow.  There was another girl who texted me for the whole of Summer 2009 because I met her in a club and kissed her, but again it was my fault that we never dated or made anything of it.

I was teased and picked on at school whenever I showed an interest in anything at all, including girls so I think this has damaged me because even now I'm conscious of what my old school peers might think if I were to ever enter a relationship.  My sense of humour isn't what it was (I used to really make people laugh but now I can barely crack a smile) and I think I subconscioulsy push people away when they try to get close which makes relationships difficult so I do wonder if I'm suffering from a form of depression.  I can't really relate to other peoples feelings beside my own (this is quite a recent change)

I basically have one more crack at University to get all this sorted out, but I'm worried that I'm going to be far too busy to socialize enough to make it happen.  At this rate I can honestly see myself hiring escorts and using online dating, sad and pathetic as it is, next October as I leave University for good and any opportunities I had will be gone forever.  Society says I'm screwed and destined to live alone and miserable forever because I didn't get my first girlfriend aged 12 or have sex at 14.  My lack of sexual experience at age 22 is embarrassing and it would be really obvious if I ever slept with a girl properly.

I realize most of what I have written here is self pity and I've probably brought some of it on myself, albeit involuntarily, but I do genuinely want to put it right and I need some help in doing so.

Thank you for reading.  I'll answer any questions as best as I can and all comments and suggestions are welcome."
