dmlpf,8,2010-10-04,I've been underemployed for a year now. Am I dead?,superunderemployed,actuary,https://www.reddit.com/r/actuary/comments/dmlpf/ive_been_underemployed_for_a_year_now_am_i_dead/,"I know that I and thousands of others have similar stories and questions, but I was hoping this subreddit could offer some (actuarial) specific advice to me and those like me.

Last December (Dec. '09), I graduated with a degree in Mathematics, but I was basically an actuarial science major. I would have been an actuarial science major, but I had a poor GPA throughout college, and those three numbers still haunt me today.

Besides my poor GPA, I have no internships under my belt nor do I have any programming skills. If you were to look at my resume, all you would see is a poor GPA at a great university, a layman work history, and minimum computer skills (relative to the actuarial profession).

Since graduation, I've worked hard to pass actuarial exams. I had passed P while in college. Last May I passed FM, and this November I will be taking MFE.

I, myself, know that I am hard-working and that I would succeed given the chance, but that's the catch: given my resume, how do I get my foot in the door?

Who has been in a similar situation and what was the outcome? What advice can you offer to people in my situation?

Thanks reddit!"
dn7yl,0,2010-10-05,IAE frustrated with how society has changed?,seriouslysociety,DoesAnybodyElse,https://www.reddit.com/r/DoesAnybodyElse/comments/dn7yl/iae_frustrated_with_how_society_has_changed/,"If everyone thinks the same, then nobody thinks at all.

Spoken by the late Roger Nickles (my grandfather), this idea has been engrained in my mind for the past 21 years of my life. Just think about it for a second… if we are all thinking the same way (doing the same things, following the same trends, committing the same actions, etc.) then no one is really thinking at all. How can people go their whole lives living exactly like everyone else? Wearing the same trends, shopping at the most popular stores, buying what everyone else has, striving to be like “the Jones’”, speaking the way everyone else speaks, traveling to places because they are the “it” spots, teasing people and making fun of them because everyone else does it, etc. How will our country succeed if no one thinks for themselves? Will we always just follow whatever our friends, family members, teachers, co-workers, politicians, etc. tell us to do?

I currently attend Iowa State University in Ames, Iowa majoring in History and minoring in Sociology. When I was younger my family moved around a lot which meant that we became each other’s friends. My brother and I are still close today, even though he is 25 and lives three hours away with his wife, while I also talk to my parents all the time. Through the years of us moving it was always interesting for me to experience all different kinds of people and a new way of life. I always made good friends wherever I moved and I still keep in touch with some of them today. It has also made me a stronger and more independent young woman and helped me cope with the numerous types of people I met while in college. I spent the first three years of college living in the dorms, and that opened my eyes to the lives of young people my age. I grew up in a very family oriented atmosphere where respect was the key to our everyday lives, and I was absolutely appalled by the amount of disrespect from the people around me. This ranged from swearing to drinking to drugs to vandalism to just plain outright disrespect and lack of common courtesy. Now, trust me, I am not naïve to the world around me. Just because I grew up in a well-mannered, respectful, and family oriented atmosphere does not mean that my family did not make sure I knew what the world was like around me. I knew what I was getting into when I came to college, but it still bothered me a lot when I went to school and saw so much disrespect.

I am now in my 4th and final year at school. I have a great group of friends, a demanding yet rewarding internship, and a new outlook on life and my future. I feel like it is finally time to take a stand on what is going on in this country. Our young people are out of control with their amount of disrespect and I want to show them that just because you are young does not make it right. I am 21 and have never used a swear word or an illegal drug and never even tasted a drop of alcohol until weeks after my 21st birthday. Most people are probably reading this and thinking “this girl is crazy”, but I want to show young people that you do not have to drink, do drugs, use profanity, or be disrespectful to go places in this world. I hope that all of you can read this and find encouragement that a young person is standing up and saying something. I am taking a stand and fighting back against the disrespect and lack of manners in this country, and I hope that all of you out there that agree with me will also stand up and not accept what has happened to the world around us.

TL DR: Trying to get the youth of our country to think more about the way they treat others. Please let me know your opinions.
"
dntnv,11,2010-10-06,I'm a CS Alumni looking for CS/SE/Math interns for Summer 2011 at Boeing in Seattle,BoeKnows,rit,https://www.reddit.com/r/rit/comments/dntnv/im_a_cs_alumni_looking_for_cssemath_interns_for/,"Hi everyone. 

I'm a 2009 CS grad and I've been working at The Boeing Company since graduation.  My boss has asked me to find us an intern for next summer (I did 2 co-op blocks here before joining full time).


I figured I'd come to Reddit first before Job Zone or whatever weird thing they're using now, because I'm more likely to find the kind of people we're looking for here.

So, we're looking for someone studying computer science or software engineering, but math works too if you have good programming skills.  We develop primarily in C++, but I personally do a lot of Python as well (though it's unlikely you'll get to see a lot of Python. Maybe some?).


We do R&amp;D in artificial intelligence/optimization - mostly route planning and decision making tools - a lot of traveling-salesman type problems. You should know some AI, definitely some graph theory, have a good working knowledge of ""big o"" notation, those sorts of things.

You should also have really strong communication skills. Our interns have had a good share of independence (that is: I won't be micromanaging you, though I'm always super happy to help tackle a hard problem), so it'll be crucial that you can explain to me what you've done with the problem we've given you.  I really look for this and I know my manager does too.


A few examples of the kinds of things we do:

* We're going out to Oregon to fly a [ScanEagle UAV](http://i.imgur.com/cs9hs.jpg) with some of the routing software we've written for it
* We're developing some ship routing software for large cargo ships, and we've had to ride the ships with our software while we tested it
* I worked on a smartphone app to help emergency responders deal with large scale disaster scenarios ([I got to ride around on a police boat](http://i.imgur.com/MX2pD.jpg) while we tested it in a mock scenario)


Boeing is an extremely cool company - we do so many more things than just commercial airplanes (in fact, I've never had anything to do with our commercial airplanes... go figure). 
Our internships are excellent - they pay competitively, and they typically pay to help you relocate.

My group is great and I really love what I do - I'm legitimately excited to go to work on most days.

Also, summer in Seattle is the best. It's sunny and 75 degrees every day. I love it here.

So, if you're interested (or know someone who is)... here's the **[job requisition](https://jobs.boeing.com/JobSeeker/JobView?reqcode=10-1016435)**. Ignore the position description because it's just a generic one they make for us. 

**If you're going to apply**, you should PM me your name first so that I can watch for your resume when it comes. If you're uncomfortable giving out your name over Reddit, just create an alt or ask me for my Boeing email address and you can send it there.

If anyone has any questions (about me, the job, Seattle, anything at all), just leave them in the comments or PM me and we can talk more.

Thanks Reddit!


**Edit:** I forgot, one of the cool things I should mention is that I'm actually starting work on my first patent application this month. Boeing definitely encourages that kind of thing (and pays a bonus for it, too :-D )"
doi3i,4,2010-10-08,Yet Another 'Hey anyone hiring IT Support or Dev',captaindh00m,Seattle,https://www.reddit.com/r/Seattle/comments/doi3i/yet_another_hey_anyone_hiring_it_support_or_dev/,"Hey /r/Seattle, I'm moving to the area in January (when I graduate with a BS in CS) to go live with awesome boyfriend who is awesomely employed in your great city and lives in the city (think next to the Space Needle in the city). I'm looking for a Support or Dev job and thought I'd see if anyone knows anyone who's hiring.  

:D Thanks /r/Seattle, sorry to annoy you, insert obligatory 'Seattle Rocks!'. 

*EDIT: I'm looking specifically to deal with java/c++ on dev side , or really anything support side (I've worked Exchange for like 8 mo as an intern)."
dpggy,2,2010-10-10,Did I make the right choice? I'm having second thoughts...,needadvice88,relationships,https://www.reddit.com/r/relationships/comments/dpggy/did_i_make_the_right_choice_im_having_second/,"Hey everyone, I could really use some advice here, not sure if I made a mistake with my girlfriend... Basically, I am 21, and we have been dating for 6 months, about 3 weeks ago we had a talk on if we should end it or not, we gave it a go for another 3 weeks, and a few days ago we ended it...

Here is the back story: I met this girl through a friend who I thought was cute, although very shy, and I decided to ask my friend her story, and she decided to go out with me. Thing about her is that she's never had a boyfriend before, and I was her first everything (except for sex, that was one of the issues..). We dated for 4 months, and the lack of us doing sexual stuff was a problem, but I was on an internship during this time, so focused on that, that the lack of sex didn't bother me, I was willing to wait at that time. I went off for 2 months and we decided to stay together despite me not being happy about the lack of sex.. We talked a decent amount, but while away for 2 months I really started having doubts, about whether or not we were right for each other... See, the thing is she was raised in a very strict home with religious parents, and while she is religious, she doesn't care that I don't believe in God, she is actually a very smart girl who likes to debate about it with me. She also doesn't drink, which I didn't like at all because I like to go out and have fun once and a while, but I learned to accept it over time... What I did really enjoy about her is that she is a genuinely good person, shy but when it was just me and her we could talk for hours, about random stuff, but still be silly as well. I saw a lot of potential in her, but I felt like I just wasn't 100%. The main thing I think was that I wasn't always crazy about her... There were times when I couldn't wait to see her, and there were times where I wasn't very excited at all, and wondered if I would be better with someone else. When I came back from my two month away time, we got back together, and because she saw that I was willing to wait 2 months for her, she opened up a lot sexually, but without actually having sex (oral and anything else was fine).

At one point, I realized that there were some other girls that I met that I was more into, and that raised alarms for me... enough that it freaked me out enough that I wanted talk to her about whether or not we were right for each other. I just felt like I wasn't having enough fun in the relationship, and being only 21, I wasn't sure if I was ready for such a serious commitment when I felt like in my heart, I wasn't sure... See, she is very serious, and if we were going to have sex, she wanted to be sure that the person she is with is as crazy about her as she is about the person (she told me she loved me, and I'm sure if I said it genuinly back, the sex would not be a problem because we would be having it) But she is such a great girl, she is smart, logical, and we have had some great times in the past. I really truly care about her so much, I was willing to wait this long, but now I was just not sure if I was ready for such a commitment, to make her lost her virginity to me when I wasn't 100% about it... For me, this relationship has just grew progressively, and it came down to a point where sex was going to happen or not happen, and I would have liked it to happen, but knowing that sex would have meant a serious long term commitment really just freaked me out.

See, the thing is that its been bothering me a lot - enough that I feel like it has been effecting school and work. But this breakup hasn't made me better at all, if anything I feel a lot worse... Because I do care about her SO much. 

Reddit, do you think I made a mistake? I feel like there might be a lot I'm missing out here because I feel its pretty complicated, but go ahead and ask any questions you feel you need to ask."
dr7m2,18,2010-10-14,IAmA Person Who Has Been Forced Out of a Church (Twice),wstewart32,Christianity,https://www.reddit.com/r/Christianity/comments/dr7m2/iama_person_who_has_been_forced_out_of_a_church/,"**What Happened**

First Time:

Started out my church life as a pretty active member in the youth group, at my peak, I was planning a lot of the youth summer trips and preaching on a very regular basis. When my senior year of high school came around I started having an interest in writing satire, I would post them as Facebook notes and tag some friends, it was all in good fun. 

One particular note upset a couple of people, it was dealing with just life and relationships. I shrugged off a lot of the comments seeing as it was a pretty small minority. However, the wife of the youth minister decided to chime in, unfortunately due my laptop breaking, I do not have the note or the comments at my disposal, I might have them in some e-mail correspondance though. She basically insulted my writing ability, my religious views, and just many personal attacks. We never saw eye-to-eye on a lot of things so, like the other comments, I shrugged it off. However, through a weird chain of events, my parents got word of the particular comment (now they have Facebooks, oh well). After chatting up the Minister of Education, it was found out that every primary staff member had a copy of the note on their desk and was planning to hold a staff meeting over it. Needless to say, my parents weren't happy. The main staff had already decided that it wasn't as bad as the youth minister had made it out to be but the damage was already done.

After a couple of meetings, it was clear that the youth minister did not want anything to do with me, he basically said ""In my mind, you've already left us, I don't even see why we are having this conversation."" They actually thought I was trying to overthrow the youth ministry, I don't know how they came to that conclusion though. By this time, word had spread throughout the entire youth group, of course, a lot of it was just conjecture, people's assumptions ranged from drugs to trying to stir a revolution, either way, they made it clear the last time I went for a service that I should pack my bags and move away.

**tl;dr:** Facebook and subsequent rumors got me forced out of a ministry.

Second Time:

Same church, different story (not as much drama).

Up to this point, the old youth minister had tried to reconcile with me (it was obvious that it was a forced attempt). I accepted his apology and even continued to do some behind the scenes work with the ministry, although I never went there again for my time as an actual youth member. However, once I was ineligible to be in the youth, all contact ceased on his part. Shortly after that he was moved to a different ministry of the church and they promoted one of the associate pastors to be the head of the youth ministry.

After my first year in college, I was given the opportunity to become an unpaid intern (which is an important distinction). My job was to mainly form relationships with middle school boys and possibly form a discipleship group, bible studies, etc. I was also going to help with behind the scenes and sharing the preaching duties. 

For the first two weeks, everything was going great, I was forming some relationships, I had already preached on a Wednesday, in my mind, I had gotten out to a pretty good start. Then the first trip of the summer arrived, basic job was to make sure the kids wake up and go to sleep, other than that, myself and the other adults sat around the housing complex and ate food. This is where I really found my stride with some of the less active kids and being the unattainable twenty year old, I was the crush of many middle school girls. Either way, the trip, in my mind was a success. 

When I arrived back home, I had a plethora of plans to help get this ministry moving. The youth minister arranged a meeting with me, this was normal as we had creative meetings every week. However, it was just me and him this time which was strange, to say the least. He sat me down and basically said that my views do not line up with the views of the children's parents, they assumed Libertarian meant Liberal and that Calvinism was of the devil (even though the preacher was a pretty stout five-point Calvinist). A lot of parents thought that I was instilling my beliefs on to their children, I don't know why I would talk about politics and systematic theology with a 13 year old but whatever. 

I was told that I could no longer help with the ministry, I could continue to come but I was to not lead bible studies, discipleship groups, or anything of that nature. It was implied that I shouldn't really even talk to the children. The main thing that got me was the first incident, even when it's almost two years after the fact, there were still rumors and speculations on what happened. 

**tl;dr:** A false perception of my beliefs combined with my previous incident got my forced out of an internship with the same church.

**Why I'm Doing This**

First off, I'm not looking for any sort of pity or sympathy. I appreciate the sentiment though. It is mainly because I'm bored, honestly. However, most of the people who hear the story (it's become kind of a thing when my friends introduce me to someone ""Hey, meet my friend, he got kicked out of a church!!"") are very interested in it and a lot of them sympathize with me. Needless to say, this has altered my faith dramatically, I'm definitely not the same person I was three years ago.

Questions I won't answer would include the name of the church or the name of the people involved.

EDIT: This was meant to be an AMA, I forgot to put it in the title. I guess it's too late for that.

EDIT 2: Albeit, it was meant to be an AMA, I appreciate all the comments, I honestly didn't think it would get this many. I appreciate everyone's encouragement and advice."
drc0m,5,2010-10-14,Questions about internships,[deleted],computergraphics,https://www.reddit.com/r/computergraphics/comments/drc0m/questions_about_internships/,"Hey /r/computer graphics, as a student reaching for my BFA in 3D Digital Graphics, I was wondering if you guys had any tips or helpful advice when applying to internships. Obviously a good demo reel makes a big impact but is there anything else I should keep in mind when applying? Any suggestions are welcome!"
dryr0,19,2010-10-16,IAmA a guy who found the American Dream,akira_fmx,IAmA,https://www.reddit.com/r/IAmA/comments/dryr0/iama_a_guy_who_found_the_american_dream/,"Just to make clear right away, I am not rich and maybe I never will be. However, my life in US has been more fulfilling than I could ever imagine. I have good friends here and the future to look forward to.


Only 2 years ago, I moved to US with one suitcase and almost no money on my bank account. All I had was an acceptance and a partial scholarship for one of the most prestigious art colleges in US.


When I think about it now, the decision to come here was foolish. I knew very well that I couldn't afford to pay for the entire studies and I had no idea how to deal with it. Unlike US citizens, I was not eligible for financial aid and I had no one to help me get a loan. So I just decided to make the first step and hope for the best.


In only few months, I got into financial trouble but fortunately, my mother was able to borrow some money and send it to me. All this time I was looking for job opportunities and I worked on my academic goals very hard. I was motivated like never before, but at the same time I was afraid that I might not make it.


After the first quater, I got a part-time job at the college as a web developer. The job paid enough for housing and food. Then, something amazing happened... I got a paid internship with one of the biggest game development companies in the world! Holy shit... that was more than I believed was possible. My motivation exploded and the shit started to develop exponentially! My student work got published in the geekiest magazine! My scholarship was increased! I got another internship at the biggest computer animation studio in the world and several job offers pending for me after I graduate.


As I said... Im not rich and I probably never will be. I have one suitcase more than I had 2 years ago but my head is filled with amazing experiences that exceeded my dreams. I dont know what my future will be, but I feel it can be anything I imagine and more.
"
ds3vy,8,2010-10-16,Entry Level IT Jobs in Pittsburgh?,harryarei,pittsburgh,https://www.reddit.com/r/pittsburgh/comments/ds3vy/entry_level_it_jobs_in_pittsburgh/,"Hello Pittsburgh!


I'm going to be graduating from Penn State in the spring, and I've been looking for jobs after graduation. Pittsburgh is the city I have always wanted to live in (grew up in Central PA, Altoona area). However, there doesn't seem to be many postings on my schools job board for Pittsburgh area.


At a career fair I talked to UPMC, but they won't be looking to hire until 2 months before I graduate which seems a little late to me considering I have gotten a few interviews from other companies. I may just be being impatient because a few of my other friends have already gotten offers.


Anyway, I was just wondering how people see the IT job market in Pittsburgh. To do a quick summary of my skills, I mostly concentrated in development so most of the classes I took were on Software Engineering, mostly in Java. We went through usability, testing, UML, requirements, and of course coding. However, I have also taken classes in Networking and Network Security, and Databases (MySQL). I also have an internship at Penn State providing technical support for the College of Health and Human Development which covers several networks in several buildings across the campus. I have also developed a few web forms and am competent at HTML, CSS, and JavaScript.


Ok, enough with me pitching myself. If anyone has any hints at companies to apply for that would be wonderful. Also, any advice is greatly appreciated. Thanks guys!

EDIT: Just wanted to say thanks to everyone for the advice and leads. I got a lot of stuff to look into. If anything comes up I'll be sure to post an update. Thanks again!"
dsii6,28,2010-10-17,"It is with a heavy heart that I announce the death of Micheal ""Eyedea"" Larsen ",jeffhauck,twincitiesmusic,https://www.reddit.com/r/twincitiesmusic/comments/dsii6/it_is_with_a_heavy_heart_that_i_announce_the/,"The Twin Cities Music scene lost a friend and beloved entertainer today. Eyedea of Rhymesayers staple Eyedea &amp; Abilities has passed on, he was found this morning by his mother. 

As a long time fan, I will remember him as a uniquely talented musician who could spit honest and rapidfire lyrics that went straight to the heart. Last time I was able to catch him live was at Soundset 2010, wish I would've seen him in a more recent setting, and I will be buying his book of poetry that was recently released. 

 I met him once when I did brief stint as an intern with RSE, and he had an unforgettable presence about him that made him easy to connect with and talk to. He will be greatly missed by many. 


http://blogs.citypages.com/gimmenoise/2010/10/eyedea_dead_at.php"
