e8nmp,1,2010-11-19,Anyone looking to rent an awesome room barely off-campus for the Spring/Summer? ($675/mo),turlz,umass,https://www.reddit.com/r/umass/comments/e8nmp/anyone_looking_to_rent_an_awesome_room_barely/,"I'm taking the spring semester off to take an internship in Long Island, and I'm looking for someone to take over my lease.

I've posted [a listing for it on craigslist](http://westernmass.craigslist.org/apa/2068341487.html) as well as [a listing on the UMass Off-Campus Housing website](http://www.umoch.org/searchRentals.php?sec=view&amp;reVerID=18377).

It's a really nice, spacious (15' x 15') 2nd floor room with two windows and a huge closet with exclusive attic access.  I have a lease through August, which I could transfer to you if you're interested.  If I can't find anyone to take the whole lease, I'm up for subletters for the spring and summer only (but I really don't want to get stuck paying rent for a place I'm not living in).

The house is awesome, tucked right in some trees just south of the UMass campus, with a cozy kitchen, living room, etc.  High-speed internet is included, and other utilities run fairly cheap.  It really is a prime location, walk right to class from the house.

See the craigslist listing for more details.  I'll be putting up flyers on Monday.
If you don't need a place, feel free to help me spread the word and find someone... it'll save me thousands.

PM me or email me (through craigslist) for more info."
e9fgx,2,2010-11-21,We are really good at feeling powerless and frustrated. We should change this.,ationsong,politics,https://www.reddit.com/r/politics/comments/e9fgx/we_are_really_good_at_feeling_powerless_and/,"In my time browsing the more topical Reddits, I've seen a trend emerge. Redditors are really good at finding injustices, both glaring and obscure, and bringing attention to them. If you browse Reddit frequently, this can actually get rather depressing; In the past few months, we've learned that America's school teachers can't afford things like paper, soap, or even books for their classrooms. Just today we saw a video of a kid being strip searched at an airport. I don't care where you stand on any political spectrum—all citizens of this country can agree that things like this are simply unacceptable.


But Redditors do what they're good at—upvoting. Now don't get me wrong, Reddit can obviously do amazing things; as per above, just look for the section in future Reddit history books reading “Donor's Choice” or “Kathleen's Big Day”. The amazing thing about Reddit is that, when there's something that Redditors have the power to do, they usually do it.


Which brings me to these large, messy political issues that Redditors themselves don't really have any control over. Sure, occasionally an issue will get to the point that a submission such as “Angry about ___? Call your congressman” will boil up. But, having several friends who've interned for congressmen, calls and letters that they receive almost always get read or heard by an intern, never the representative.


Being an intelligent person, you've probably smelled where this post is going, and you're probably right. And you're also probably thinking about this: Around a year ago, a brave group of Redditors, partially in response to the Tea Party which was so vocal at the time, attempted to form a political party based on the views assumed to be held by most tech-savvy youth (end to corporate personhood, Public Option healthcare, etc.). Yes, they were the now infamous American Pirate Party, a concept that was so exciting when first hatched that it received over +4000 karma, and...now? The APP Reddit is averaging about a post a week at best, with only a handful of remaining survivors.


So, does it seem like a hopeless venture for me to propose another attempt to “galvanize” Redditors? Short answer: yes. Long answer: yesssssssssssssssss. (Paraphrased from Strong Bad). But I'm going to take my beliefs and throw them out there, anyway.

Why? Because I'm tired of feeling powerless (cliché alert). I'm tired of feeling like I have to choose between the lesser of two evils in politics. Quite frankly, I'm tired of how politics has become entirely about politicking.


I think (and hope) that these are feelings that a lot of Redditors share. And so, it must be asked, why did the American Pirate Party fail, if the desire for something like it was so great? Redditors were finally given an opportunity where they could have gotten a path to power. As crazy as the idea sounded, people were setting up websites, wikis, forums, and everything else you could imagine left and right. Where did all of that enthusiasm go?


One could say that whenever an exciting idea such as that is proposed, enthusiasm will peak briefly, and then slowly dip off to nothingness afterwards. But that's easily contradicted by the continued and even growing enthusiasm for the Rallies that we just experienced. I believe that this loss of enthusiasm for the APP was instead caused by two things: First, growth was made, but in the wrong dimension. Second, progress was made, but only linearly.


Of course, now I must explain what these arcane phrasings mean. In terms of growth, consider how the discussion regarding the Rally grew. First, it was simply an idea: wouldn't it be great if Stephen Colbert held a rally in Washington? Then its scope grew, and added a new dimension: How do we get his attention? And thus, a whole new crop of enthusiasm was born around Donors Choice. Then, as the Rally approached, more and more dimensions were added to it: We need to organize meet-ups! Now it's a game to find other Redditors! Check out this great sign I made! Etc. 


The American Pirate Party, on the other hand, started out with already a fairly confined proposal: Start a political party with some decided tenets. Then, instead of adding on new dimensions, I believe the focus on tightening and refining what already existed (deciding on more tenets, a constitution, and a million revotes on the name) stifled the enthusiasm, instead of finding more and more things to get excited about. Thus, the enthusiasm got caught in that one dimension, and slowly withered away. This also relates to the progress: Sure, things happened, websites got made, but it never got to the next level, so to speak. It was only discussions on a subreddit, never able to breakout and be anything more.


And so now, I have set this up for my [seemingly doomed] proposal. Hopefully, you can now understand where I am about to come from, and the mistakes that I think have been learned from the past, similar attempt to do this (being an avid fan of Braid, I firmly believe in the power of learning from mistakes to do things better the second time around).


As I collected my thoughts to write this, the first thing that came into my mind was this: as a community, we just came off of a tremendous success with our contributions to the Stewart/Colbert Rallies. Now is the time for us to catalyze this success and enthusiasm into something of lasting benefit. I know that the focus of Stewart's message at the end was largely about the lack of reason in the news, but I think it's not that far a leap to also be decrying the lack of reason in politics.


And so to make a long post continue to be endless, I now propose to you:

**The Stewards of Reason**

A political movement, or party, or what have you, for Redditors, or whoever else, who are frustrated and angered with what's happening in politics, and feel powerless to do anything about it.


How this is not the American Pirate Party:


The Stewards of Reason is not based on a constitution of positions on issues, or political goals, or any such restrictive documents. Instead, it is based off of a Pledge of Reason.


Simple put, the Stewards of Reason stand for nothing but the following:

**Politics should be grounded in fact, logic, and reason, and should be about the people, not the politicians.**


Do you remember two years ago how the word on Obama's and McCain's lips was “change?” Yep, that didn't seem to happen. You can blame whoever you want for this, but I think we need to stop deluding ourselves, **the issue with politics is that we're leaving it up to the politicians.** Democracy is supposed to be about the people (hence demos), but I think that most of us really feel powerless. I don't know what I want this to be exactly or why I'm writing this (and learning form the APP, I don't want to define it too narrowly), besides a way to try to get back some sort of power (and not in a Tea-Party-take-back-our-government-way, either). All I really want to know right now is if anybody else has feelings similar to me, and wishes they could do something about it.


This has been an exhausting post to write, and there's so much more I want to say, but I just don't have it in me right now, except for a tl;dr


**TL;DR**

1) Reddit is really good at finding things that should be better in government, politics, and society.

2) Reddit was really bad at organizing a political movement.

3) BUT Reddit was really good at organizing all kinds of activities related to the Rally.

4) I think Reddit could totally use the enthusiasm from the Rally to catalyze the start of a political movement, or something like that, solely grounded in bringing reason back to politics.


**TLDRwasTL;DR:** Does anybody else wish we could take the politics out of politics and replace it with reason?
"
ec05e,14,2010-11-26,I've made a huge mistake... ,mindfield,relationships,https://www.reddit.com/r/relationships/comments/ec05e/ive_made_a_huge_mistake/,"About 6 months ago, I broke up with my live-in girlfriend (let's call her Maria), ending an almost 5 year old relationship. We were each other's first love. We had been there for each other's high and low moments, gone together for a great trip in Europe, and gave each other a shoulder to lean on when things were rough. And things did occasionally get difficult for both of us, as we were both studying; I was studying for an English major (groan), and she was studying to become a physician. Obviously I had to make some sacrifices for her, as she did not always have time to spend on couple's stuff (read: intimacy). As some of you might know, studying becomes a huge part of your life when you want to be a doctor, and as exams came closer, some things had to be increasingly de-prioritized. Intimacy didn't use to be a problem, but it definitely became one for me in the last year of her doctorate.

Where things changed was around last October, where I met a younger girl (I'm 26, Maria is 23, and ""Evelyn"" is 21) at the call center where I work. Evelyn, who also had a boyfriend at the time, stirred something in me that had gone dormant for a while; call it passion, lust or whatever (mid-life crisis?). Something clicked between us, and we went from just friends to... well, I did some things with Evelyn that I'm not proud of today. Yes, I cheated on Maria. I rationalized it by telling myself I was getting something from Evelyn that I couldn't get from Maria, namely an escape from the tediousness of getting home from work and doing house chores while Maria studied intently. I kept all of this safely hidden from Maria, justifying everything by convincing myself Maria had enough stress to deal with (Trichotillomania, exam stress, psoriasis) without my needs getting in the way. And while I'm typing this, I fully realize how selfish, uncommunicative and twisted I must sound. If I could go back, I would have done things differently... but there's more.

Evelyn wanted to give her own relationship a shot, even after what we'd done, and left out of state to live with her boyfriend last December. We lost contact for several months, and during this time, I struggled with the decision to break up or not with Maria. On the one hand, Maria had motivation, intelligence, great chemistry with me and a long-established comfort level. On the other hand, I had cheated on her. Maria could feel me slowly withdrawing away from her, and when she had to make the decision of choosing where she would do her internship, I admitted I wouldn't come with her for the ride. This broke her heart, and I felt like shit, which is obviously fully justified. We both moved out when the lease ended, and kept in touch (first once a week, then once every two weeks, and now it's been more than a month since we spoke).

Fast forward to July. Evelyn came back to town, and after we became friends again, she broke up with her boyfriend. Now that we were both single, we decided to try dating seriously. However, I had the feeling from the very start of the relationship that it just wasn't going to work. Thoughts of regret returned again and again, while I was doing the dishes, taking a shower, walking to work... I wasn't happy. About two weeks ago, while surfing on Facebook, I glanced at Maria's photo. She had told me previously over the phone that she was dating someone, but it didn't really sink in until I saw her Facebook status updated (silly, I know). Coupled with seeing her beautiful smile in her Halloween costume, everything I felt bubbled to the surface and I sobbed for a while... that night, I squabbled with Evelyn over some petty crap, and broke up with her a few days later.

Now, I can't get Maria out of my head. We were great together, and I would *never* have imagined me doing anything like cheating on her before the last year of our relationship. I loved her, and I'm sure I still do, despite the fact that I betrayed her trust. I obviously don't deserve her (she's a **doctor**, I'm a *""/$%""?* supervisor in a call center with no clear career path), and I've taken her for granted. I've even considered writing a letter to gauge how well she would take the suggestion of trying to renew our relationship.

Be honest with me: am I a sick and twisted individual? And what the hell do I do now?

tl;dr: I thought the grass was greener on the other side, cheated and broke up with my first long-term girlfriend. 6 months later, I realize I fucked up the only **real** thing I had going in my entire life.

EDIT:  Thanks for your feedback everyone. I'll give it a single shot in person; we've been talking about me going to see her new place a few months ago, so I may take her up on that offer. At least I'll have closure if she doesn't want me back.
"
eckki,0,2010-11-27,IAmA 20 year old and my life sucks.,[deleted],IAmA,https://www.reddit.com/r/IAmA/comments/eckki/iama_20_year_old_and_my_life_sucks/,"I am Computer Science major at a community college in the Metro Boston area. My dad is dieing of leukemia, my parents are devoiced, and me and my friend are both employed as interns by my dad. My family has blue cross blue shield health insurance but my dad hasn't worked for about 1 or 2 years. He has been in and out of the hospital and can't work regularly. I'm not entirely sure how much my family is in debt right now. My mom, my brother and sister and me moved out of the house we owned since 2000 or so. We currently live in an apartment about 1/4 the size of our old house. My dad lives in his house about 2 miles away with his mom and new wife. My dad lends money to his brother and went to Disneyland last month but he does regularly send alimony and occasionally a little extra due to guilt (maybe). I don't have a girlfriend. My pay that comes from working for my dad is most likely borrowed and I don't take it because then less would go to my mom, my dad is pay my me and my friend out of his own pocket. Our internship is a sponsored (by him) FOSS project written entirely in Java which besides Python is the only language I know. The internship is good job experience but we aren't really working on it much due to classes. I feel trapped, in order to get a job that can support me it would be best to *at least* finish my associate's degree, but at the same time, I feel i need to get out of my mom's house and stop relying on her.

in short, my life sucks, be grateful you aren't in my situation.


**TL;DR** my life sucks, read for details "
ecmgt,8,2010-11-27,In NYC and I could really use a little bit of help.,velociraptorofdoom,Assistance,https://www.reddit.com/r/Assistance/comments/ecmgt/in_nyc_and_i_could_really_use_a_little_bit_of_help/,"I moved up to NYC to attend culinary school in July and am currently living in the school housing on Roosevelt Island. My parents are covering the housing and transportation, but other than that I am on my own. I had a little bit of money saved up, but as this is NYC that went out the window pretty quickly. With the help of my roommates I survived on ten dollars last month. And I'm fine with that. I don't need spending money.
The problem is my parents recently had a little bit of financial trouble, and this months check is running a week late. The housing is payed off but yesterday was the last day on my metrocard. I really don't know what to do. I've asked so much from my roommates I really can't bring myself to ask this too. I have school on monday, and they take points off my grade for every day that I miss. I just managed to land an internship at a restaurant that could make my career, and I have to be there on Tuesday. 
I hate asking for favors. I really do. But I feel that there is too much on the line to risk not asking. I really need a one week metrocard. That's it. It's 27 dollars that I don't have. If any New Yorkers have an extra one that they don't need it would really help me out. I can show you school id. I would let you keep my drivers license or virtually anything else that I own until I pay you back. I just need to get through this week. I can provide any proof that you want. Thank you for your time reddit. "
ecpqr,2,2010-11-27,Decline a job opportunity at Amazon in email.,NinjaYoda,Proofreading,https://www.reddit.com/r/Proofreading/comments/ecpqr/decline_a_job_opportunity_at_amazon_in_email/,"An HR from Amazon messaged me on Linked In for job opportunity. I want to decline it without burning down any bridges as I am also looking for internship in Comp. Security at Amazon.   

[Here's my response email](http://paste2.org/p/1114197) Also I just checked this offer message on Linked In and it was send to me a month ago.  

So, can I phrase it better?

http://paste2.org/p/1114197"
ecr1c,1,2010-11-28,Do you remember the name of this tank game from the late '90s?,maxsterbator,gaming,https://www.reddit.com/r/gaming/comments/ecr1c/do_you_remember_the_name_of_this_tank_game_from/,"I played it often when I was an intern at a dot-com in 1999. I can't remember if it was a PC download game, or Shockwave. It was a tank game where you were a chrome-colored tank and would drive around green hills and other sandbox environments finding and shooting other tanks.

Does anybody remember the name or where to find it? I'm usually pretty good with Google-Sleuthing, but I can't find anything that looks like it."
edkcp,1,2010-11-29,I need help moving on from an ex-gf,CantShake,relationships,https://www.reddit.com/r/relationships/comments/edkcp/i_need_help_moving_on_from_an_exgf/,"this semester has been very trying on us. She moved to another city for an internship and was very stressed about her work. I have had the roughest semester of my life. She would often try to talk to me about her emotions and stuff but it would really stress me out and I was stressed out as it was. Needless to say she felt neglected and decided we would be better off as friends. I can't blame her there.

Anyway, I am really broken up about it. I know that in the end it is for the best, she wasn't happy, and really in the midst of it all I wasn't very happy either, but we were inseparable for 2 years and getting used to the fact that she is no longer with me has been very difficult. I have had serious relationships before but this one was the most serious of my life, we lived together last semester. I don't know, you guys probably get a lot of these posts but I just don't know what to do with myself. Give me some advice please."
edl48,6,2010-11-29,what it job am I really doing?,labjobbs,answers,https://www.reddit.com/r/answers/comments/edl48/what_it_job_am_i_really_doing/,"Long time Redditor but first time poster so if I make a mistake I apologize in advance.
 I'm a college student on my last year and something has been bothering me. I've been working at my current job for about 2 years and 3 months now and now that I'm updating my resume, I believe my title doesn't accurately reflect what my job actually entails. My title is IT Support Intern, but I'm told to call myself an IT Specialist (because who listens to interns).

I am the only IT person at this local branch of the company so almost all IT related tasks fall to me. I do basic computer work like troubleshooting hardware, software, and networking problems. I am in charge of all the purchasing and set up of new equipment. We have 3 local servers, used mostly as file servers that I built and maintain. We also have a physical firewall which I update, and configure. We also make use of about 12 different machines with embedded windows xp computers in them which I am in charge of maintaining. The kicker is that I'm very loosely managed. I am submitted a list of problems and their perceived severity levels and I'm let loose to fix them in any way I deem pragmatic.

Does this all apply as Support or do my duties go beyond that? I'm trying to create the best resume I can for future jobs when I graduate and I would greatly appreciate any help on how to best represent the job I currently do in this format. Thank you for your time."
eds0h,4,2010-11-30,Internship to video game developers?,heylook113,Austin,https://www.reddit.com/r/Austin/comments/eds0h/internship_to_video_game_developers/,"Hey guys,

I'm an engineering freshman looking at about a 3.7 after my first semester. I'm in ECE and really want to purse software engineering so I can go into video game development. Does anybody know how I would go about seeking an internship to one of the companies with an office down here? I know a little bit of C, Java and Python. 

How would I go about doing this? I know I am probably looking too soon into my education."
edvtx,1,2010-11-30,Best Supplement for after a workout during a commute,slopolop,Fitness,https://www.reddit.com/r/Fitness/comments/edvtx/best_supplement_for_after_a_workout_during_a/,"Hi Fitit,

I'm a 20 year old college student who is going to have an internship this January and planning to Lift in the early morning before I drive right to work.  I am a rugby player and doing off-season general fitness lifting with high reps looking to drop some fat and add muscle.

I've never been one to use supplements, let alone a meal, but I want to make sure that I am maximizing my recovery and gains.  My typical post exercise breakfast is a breakfast burrito with two egg whites, two soy sausage patties and a bit of hummus on a whole wheat tortilla.  What are some good protein powders or supplements that will help me make the best gains?"
edz3q,17,2010-11-30,Crosspost from /r/jobs: Looking for Embedded Linux Developers and Support,NightChaos,linux,https://www.reddit.com/r/linux/comments/edz3q/crosspost_from_rjobs_looking_for_embedded_linux/,"Greetings Linux loving redditors,

We are looking for a couple competent hard working individuals who like embedded linux and want to work with it. The company is Timesys, we provide full embedded linux build systems, kernels, toolchains, filesystems, etc.

Basically if you like this stuff and are good at it, we want you. The location is Pittsburgh, PA. There are openings for experienced engineers, recent college grads, people with no degree but are very smart, even some internships.

The site to apply at is http://www.timesys.com/company/careers with more descriptions. 

Let me know if you have any questions about the job, the company, anything. I am just an engineer here, not a recruiter or anything, but we are growing and need good people, so I come to reddit :)"
ee5qm,1,2010-11-30,[Offer] Looking for programming interns in North Dallas.,frostbite7217,texasfavors,https://www.reddit.com/r/texasfavors/comments/ee5qm/offer_looking_for_programming_interns_in_north/,"I work for a mobile development company in Plano and we are looking for paid Java interns to work on android, blackberry, and various other small tasks.  Objective-C would be a bonus as well."
