s22g5,2,2012-04-10,"Short story: Edinburgh. Drunkenly written memories, am reading Less than Zero currently and thinking a lot on that text if that helps. Cheers.",irishbball49,LitWorkshop,https://www.reddit.com/r/LitWorkshop/comments/s22g5/short_story_edinburgh_drunkenly_written_memories/,"
Coming Home


I landed in PDX in my fancied suit smelling of day old sex, cigarettes, and a hangover. My mother was waiting for me in the arrivals terminal to hug and kiss my cheek. My father would’ve been there as well, but he passed nearly 3 years ago. I still think about him every now and again, sometimes when it feels it’s been too long since I have. Other times simply to ground and remind myself. It had been a long flight since I’d left Edinburgh. The French were on strike for some odd reason and I got stuck in Charles de Gaulle, more mad that I couldn’t have a smoke or continue drinking now that it was 8 or 9 am than being delayed really. It sounds like something they’d do anyways. They questioned why my growler smelt of alcohol. I wanted to say it’s because I forgot to wash it after polishing it off in the taxi around 4 am that morning in Edinburgh, but with my french I could only lie and say it was water. The ensuing pat down was firmer than the norm. 

I’d been drinking since 4 or 5 the day before, strategically filling up my growler from Brewdog earlier in the afternoon, I think it was the Trashy Blonde that day or maybe the Punk IPA, and saved it for the time between when the bars close and my taxi ride departs. I’d gone out with the remaining interns, only two or so at that point, and my Scottish coworkers. I skipped work that day, my last, wasn’t much going on in the Parliament on a Monday to be honest anyway and met up with Paul and Iain up the Royal Mile, a song or two away from my flat for the last night out. 

We sat and drank the first of many pints in a shadowy pub called the World’s End. As soon as I arrived Paul roared into a story of how Iain and another American intern, a breezy and aloof blonde from Utah, had hooked up last Friday night, Hannah’s last night here. Iain brought her back to his new flat to crash and they ended up making out and getting into it, as you do. It gets hot and he ends up inside her slowly penetrating her for a good thirty seconds until she gets flustered and admits that she’s a virgin and doesn’t know if she can continue. She heads into this minute or so monologue about whether she should or shouldn’t have sex, meanwhile Iain is plowing away at a soft and steady rate throughout the whole thing. She inevitably tells him she can’t, and he pulls out, and we all have a laugh at how many times she’s been in this situation still thinking she’s a virgin. The last of the interns Yassef arrives at the pub having missed the story and we number five now, Paul launches into the story once more for Yassef’s ears breaking for a smoke and a call from his girlfriend, a californian blonde who’d left two days before. I smoke one and we chat for a second about goodbyes and past lovers outside after the call. It’s wet, the cold december rain riding in on sharp breezes in stacatto-like fashion, but the pub is warm and inviting, the story continues. After pulling out, they make out and she starts to jerk him off. He’s about to finish and, in her grace, she apparently thinks it a brilliant one to shove a finger up his arse. He freaks out and comes all at once. The table cracks up and cheers to that non-mormon Utah girl long gone by now, Iain’s joyful smirk following the story was priceless. 

We move up the mile to the Tron tavern, smokes in hand, and we enjoy the first buzzes of our night, the nicotine hits like a missing drumbeat, the age old cobblestone beneath our feet encouraging us, the whole lot buzzing. Pints and food are ordered, WC’s visited, seats taken, and we proceed with jovial conversations and laughs. More friends join, the Seattle girl from my office and a cute Manchester girl, Tony the Scottish-Italian gay coworker who fancied me at first, Stuart a coworker and Yassef’s lover at some point, and I finally start to realize it’s my last night here. I text Camilla, a barmaid I’d asked out and gone out with for bottles of prosecco the night before, and drop a line.

To be continued...I'm too drunk and I have class in the morning, can't continue this chapter or what have you currently."
s21nv,3,2012-04-10,No reason for feeling like this,takeiteasyonme,MMFB,https://www.reddit.com/r/MMFB/comments/s21nv/no_reason_for_feeling_like_this/,"Where the hell do I begin?  I might get off subject and rant a bit but I'd appreciate your attention throughout. I'm a student at my second choice college, in my 4th year(will be staying for a 5th) in my dream internship working for my colleges football team.  After next year, I'm going to try getting a graduate assistant job to help pay for grad school and everything on the outside for me looks all good and well.  I was raised in a bible belt home by two strong christian parents and my entire childhood up until I was 18 leaves me with no choice but to believe in a higher power.  Fast forward 4 years later, I've gotten away from the church and have come to the conclusion that there is no God and that us as humans are incredibly ignorant to believe that from our small world surrounded by so much we know so little about, that we know exactly how we all got here.  This change has affected my whole outlook on life.  I now concentrate solely on being as good of a person as I can to anyone and everyone I meet.  If there is a God, I hope he sees that I did my best to be the best person I could be.  I think it's hypocritical to think we must be perfect in an imperfect world for the ultimate result in heaven.  I'm already ranting and this is branching off into other conversations for other threads so sorry about this.  I've dated two girls my whole life, both of them while I've been in college.  I was mr. popular in high school but i was never interested in dating, partly because no girls every really came across me as being interested in dating me.  The first girl I dated, we lost both of our virginities to each other and she fell head over heels for me.  A year into our relationship, I felt since I was young and had two more years ahead of me that my best years were yet to come.  This was also before I started this job with the football team in which all my time became dedicated to football.  Regardless, I didn't have the feelings for her that she had for me and there didn't seem there was a way to change that, so I broke up with her, ultimately breaking her heart.  Something I later apologized for as I was a real dick about the whole process.  A year and a half later, I met another girl, who went to my high school.  We'll call her ""B"".  What began as summer love turned into strong feelings for me, which I never felt before, even in the year I was dating the first girl.  She was younger than me and went to community college back home, forcing us into a long distance relationship.  After 3 months of skypeing every night, I finally asked her out and we dated for another 3 months.  I'd always been the type of person to poke fun at people who were in love so fast after beginning dating.  I was in my first season of my internship and wasn't traveling with the team, therefore anytime I got a weekend off, I was making my way back home to be with her.  By the third month, I knew my feelings were unlike anything i'd ever felt before so I automatically assumed I was in love.  For the whole year I dated the first girl, ""I Love You"" only came out when we were drunk and usually I realized what I said and would take it back.  I thought it was such a big step in saying something like that because I wanted it to be for real.  During Christmas break with B, I was laying down with her telling her everything I loved about her and eventually I said it, that I loved her.  It felt so right saying it because I knew the feelings I had inside me.  She said she loved me too and for the first time, I was the happy with every single aspect of my life, minus the fact she was still 200 miles away and i couldn't see her everyday, but just talk.  Eventually, she began getting the feelings I had for the first girl and broke up with me one weekend I came home to spend the weekend with just her.  It was literally the weekend before my 21st birthday.  The weekend of my 21st while celebrating my birthday, at some point while I was blacked out called her crying begging her back.  I have no recollection of the phone call but it almost certainly put the nail in our relationships coffin so to speak. It absolutely broke my heart and I had no clue how to handle it.  I begged her to come back almost to the point now looking back, I was boarderline crazy.  The week after my birthday was valentines day so I automatically felt jaded at the day, only to find out that same day that she had evidently been hanging out with her ex boyfriend who in the beginning tried to get her away from me, bringing me down even more.  Months passed and some things were forgiven and forgotten, we had our ups and downs, and summer finally came around which gave me a chance to go back home and rebuild our relationship once more.  I went to the first session of summer school and 3 days before I came back home, i caught wind that she had been hanging out with my then best friend.  By reading ""then best friend"", i'm assuming you can put 2 and 2 together.  The whole time she was talking to me, she was also talking to my best friend.  I asked both of them about it which they both of course denied so I had no choice but to let it go.  3 weeks after I come home, I'm at a party with my friend where he's talking to a girl about how he's found a new girl, yada yada, and then her name pops up.  He was talking about how he was talking to her and liking her literally 3 feet away from me.  This is all after he'd been telling me the whole time i needed to get over her.  Fuck him.  I called him out and he went off into a tangent about how he made me and I wouldn't have been popular without him.  Mind you, I didn't even start hanging out with the guy until my last semester of high school.  I'll say it again.  Fuck him.  Two days later, I packed my bags and came back to college just to get away from the drama.  For a little while things were getting back to normal and both of those people left my life.  Like that, I lost the girl I loved and my best friend all for a stupid reason.  The hurt and anger I had built up was numbed by my friends back at school.  Here I am, a year and a half after the breakup and approaching a year after all the drama.  I'm on the verge of completing this semester finally after a shit ton of work and I couldn't be more excited.  Truth is, deep down, I'm still hurt.  I'm over both of them and haven't really spoken to them except to close out everything (a kind way of me telling them fuck you).  Since then, I haven't really tried talking to any girls.  Again, no girls have really come across as being interested in me.  I'm the type of person that would rather have a girl come after me than I go after them.  It's so much more of a turn on to me to be wanted and for it to be so apparent it slaps me in the face.  I've never been the ""player type"" and usually end up coming back home from bars with my friends and just them.  I don't pull numbers, I don't really pull girls, but I'm still incredibly social with them.  There's the gap between acquaintences and fuck buddies or even getting to the relationship aspect I still don't understand.  I hate putting myself out there only to be rejected so i avoid the confrontation all together.  This strategy hasn't helped me either, hence me writing this to you.  I have so much frustration and hurt and anger built up inside and I don't really let anyone, not even my friends here know about it.  I'm at peace on the football field, but it seems the second I'm anywhere else, these feelings come back.  I feel like I'm wasting my life here and that I'm miserable.  I have so much fear for growing up and getting a real job if I can't stay in school as a graduate assistant.  More than anything, I just want someone here to care for and to come home to.  I have a great respect for women as I had two sisters growing up to show me how to be a man.  None of the things they told me really made sense until recently.  Like I said, I'm no player and I just want to give a girl what any girl deserves, just someone who will care for them.  I have so many friends who are girls who traditionally bitch and moan and complain about other guys that did them wrong and I'm too afraid to make an attempt to resurrect their faith in the male population.  I feel so different from anyone else because of the fact that I don't ""spit game"".  That's such a childish and immature thought process to refer to women as game as if they're a fucking deer I have to shoot at.  Again regardless of the fact, it never fails that the prettiest and most deserving girls end up with the biggest douches and wonder why they keep getting hurt, meanwhile, i'm on the sidelines with my helmet just waiting patiently to get in the game.  I feel like because I don't feel this way, that it's set me behind in social skills as well.  I don't always have the cool thing to say, and sometimes, I feel no urge to say anything at all.  I hate small talk which doesn't help either so just meeting and getting to know girls at social events is a marathon itself for me.  I'm not much of the hey i got your number from a friend lets have a full blown converstion despite the fact ive been to about 5 parties with you.  I've googled how to talk to girls and all that crap and it's all the same cliche ""be yourself"" bullshit.  Sorry internet, that doesn't help at all.  Like I said, I have a dream life and I wouldn't trade anything for it, but I want to get rid of this frustration.  I want to scream as loud as I can to get it all out but I know it won't be enough.  I'm so mad at the world for being the way it is.  I'm mad at things I have no way of controlling.  I have thoughts I shouldn't have.  I think to myself I'm of no use to the world and that I'm not meant to live in this time.  My family and friends keep me alive.  If I knew they wouldn't be effected at all, I would have ended myself a long time ago.  I think about suicide from time to time, nothing too serious though.  Just thoughts like well I wouldn't have to worry about whatever it is i'm worried about anymore. I know my life is of much importance and the entire scenario of my suicide would crush many people that are dear to my life so that takes it completely out of the question.  I just want relief.  The world despite how small in retrospect to everything else is still big to me and I don't have the first clue on how to live in it.  I want to get over the hump of being a good friend to everyone.  I want girls to want to be with me.  I feel like i'm an average looking guy, but regardless shouldn't have that hard of a time finding a good girl.  I know I'm young and have absolutely no business feeling like this.  I know this whole thing comes off as a frustration towards girls but in all honesty, there's a lot more behind my frustration.  Like I said earlier, I hate the way the world is today.  I feel like people are incredibly hypocritical which pisses me off more than anything.  I blame this fact alone for most of the feelings I have.  A few months ago, in conversation with a friend, I said I'd lost hope in humanity, something i never thought I'd say.  I'd like to think there's still hope but at the same time, there will always be dumbasses put on this earth solely to fuck with other people.  I'm hoping you're still reading this and for some of you, I hope we share the same unfortunate feelings.  I want to tell you just as I'm sure I will be told to keep your head up and that things will get better.  I dunno, maybe this is just a terrible case of the monday's and i'm just feeling sorry for myself."
s1vxm,1,2012-04-09,"Temporarily not smoking because of potential job interviews, could use some insight",[deleted],trees,https://www.reddit.com/r/trees/comments/s1vxm/temporarily_not_smoking_because_of_potential_job/,"Hey all,

First off, thanks to everybody that reads this. It means a lot. Here's my situation: I'm a senior undergraduate, about to graduate with a degree in Biology. I'm taking a year off before starting grad school, so I've been trying to find some internships or short-term jobs. I've applied to a bunch of places relevant to my field, but haven't heard back from any of them yet...of course, if I do hear from any of them, it's almost certain that I'd have to consent to a drug test.

On the other hand, I do have a job interview tomorrow for a job that's not related to my field. It would be good to have a source of income, but it would look better to graduate admission panels if I get a job related to my field; thus, if another opportunity arises from one of the jobs related to my field, I'm going to apply for them.

This leaves me in a strange position - I'll almost certainly get the job that I have an interview for tomorrow (one that doesn't drug test), but if I happen to hear back from any of the jobs that do drug test, I'll go for them and definitely need to be clean for potential drug tests. It's a shitty situation, because I haven't been smoking for about a week now and really want to (I have minor depression issues and weed helps a bunch). Thus, I'm not smoking for an indefinite amount of time, and I'm really disliking it.

Could somebody give me some advice, or offer any insight? I'm trying to tell myself that it's for the best and that if I get an interview for a bio-related job then I'll be clean. On the other hand, I hate not smoking just because there's a chance that I may get one of those interviews.

**TL;DR: Can't smoke weed on the off-chance that I'll get a job interview that drug tests. Have minor depression issues and weed helps.**"
s5839,5,2012-04-11,Want to break up with boyfriend; Moving into a house next week.,MsThrowAway404,relationships,https://www.reddit.com/r/relationships/comments/s5839/want_to_break_up_with_boyfriend_moving_into_a/,"That must sound horrible at first glance.

So, currently I'm in college. I'm entering my second year. I've landed a cool internship related directly to my major (Computer Science), working in a network admin's office. They pay very well, I love the job, and they have offered me to stay and work over the summer, 40 hours a week. When the summer is over, I will likely be promoted and get a decent pay raise.

My boyfriend of three years and I are planning to get a house or apartment with another couple we know very well. The other couple is very stable and well-off. We'll likely only be staying in the place for the summer, then we will all probably move to the on-campus housing. My current boyfriend has a decent amount saved up from his last job, PLENTY enough to pay for his share of rent.  He has already agreed to it, and said he'll do whatever it takes to stay with me.

Problem is, things aren't working between me and him anymore. I can't stand him sometimes. He annoys me. He pushes me around and hits me sometimes. He yells. He disrespects me, and is extremely immature and childish. Being around him feels like babysitting, because I have to monitor his behavior in public. He doesn't know what he's doing for his major, and he's used to his mother paying for all of his bills. He throws a hissy fit when people make him do things he doesn't want to do. When I bring these things up, he also throws a fit.
Overall, he's not who I want to be with long term.

He has also told me he really hates the house we're moving into and doesn't want to spend his savings on it. He'd rather go back home and live there with his mom for free, but he's renting this place with me and the other couple to stay with me.

We are due to sign the lease in a week or two. If I break up with him, he'll be out of the lease and we likely won't be able to afford the place comfortably. The other couple who is entering into the lease with us will likely also be very angry with me/us.
         
           
           
      

TL;DR: Boyfriend and I supposed to be renting a house with other couple. Want to break up with boyfriend for several reasons. See above.

Reddit, I really need your advice right now. You've helped me through a lot before, and I really need some input on this. What should I do? :[


EDIT: I understand I need to leave him. I just don't know when//how will be most convenient and cause the least amount of shit for everyone else. I don't want to screw up everything for everyone else, if there's another option. If I could tough it out for the summer, etc. I'm looking for ways to go about this, I already know what needs to be done.

Also, thank you all for all your concern &lt;3 Reddit is full of such amazing people. "
s4ua1,1,2012-04-11,"Hi Reddit, I have experience working as a Business Analyst.",[deleted],trianglejobs,https://www.reddit.com/r/trianglejobs/comments/s4ua1/hi_reddit_i_have_experience_working_as_a_business/,"I am currently working at one of the top 4 banks as a Business Analyst in NYC.  I am looking to move back to NC to be closer to my family.  I've applied to hundreds of jobs in the RTP area and never get any call backs.  I've been working full-time for 2 years and had a couple of internships.  Looking for a Full-time position in the IT field.  Feel free to send me any messages.

Thanks"
s4tha,0,2012-04-11,Computer and Electrical Engineering Undergrad looking for Summer internship. ,eRay121,newjersey,https://www.reddit.com/r/newjersey/comments/s4tha/computer_and_electrical_engineering_undergrad/,"I am a rising Junior at The College of New Jersey and am looking for a summer internship in the field of Computer Engineering, Electrical Engineering, Software Engineering, or Computer Science. PM and I will send my resume! Thank you very much."
s4l5x,22,2012-04-11,[Request] Basic Programming Guide?,Taylan2131,UniversityofReddit,https://www.reddit.com/r/UniversityofReddit/comments/s4l5x/request_basic_programming_guide/,"I have an academic internship coming shortly in which I will be programming for Stanley Consultants. This is excellent, or at least it would be if I knew how to program at all. I think that if I got a bit of a lowdown on basic programming in Powershell or something of the sort, it would assist greatly, and I'm sure it would interest others as well.

Any assistance would be greatly appreciated!"
