cw5eu,4,2010-08-01,"22M Moving to Burnaby(BC) in September, looking for friends",Setheron,r4r,https://www.reddit.com/r/r4r/comments/cw5eu/22m_moving_to_burnabybc_in_september_looking_for/,"Text pretty much says it all.

I'm moving to Vancouver/Burnaby BC area in September for an internship for 4 months at a Video Game study (as a video game programmer).

Won't know anyone so I figured i'd see if I could meet people through reddit.

I've made friends before through POF so why not here as well :)"
cwkk1,3,2010-08-02,Can an American get an engineering job in the Norwegian offshore oil industry?,tjl2015,Norway,https://www.reddit.com/r/Norway/comments/cwkk1/can_an_american_get_an_engineering_job_in_the/,"This is kind of a specific topic, so I'm not sure if anyone here will have any information. I am a graduate student about to finish my masters in structural engineering. The US-school I have attended is well known for its petroleum and offshore oil-industry links. I have internship experience in the offshore oil industry, and I'm currently seeking a full-time position for after my December graduation.

Anyway, I'm conducting a broad search, and I'm not limiting myself to domestic positions. I know Norway has a large offshore oil industry and may need qualified technical people. I am fluent in only English, but I could certainly learn another language. I'm interested in Norway because it seems to be strong in the offshore oil industry, and I do have a fair amount of ancestors from Norway (though this was several generations ago, too far back to have an impact on immigration.)

Basically I'm wondering if anyone has any experience on this. Does anyone know anything about the Norwegian offshore oil industry? Is there a need for technical people from abroad? How does one go about finding such a position?"
cz46g,16,2010-08-09,I fucked up.,ididsomethingstupid,relationships,https://www.reddit.com/r/relationships/comments/cz46g/i_fucked_up/,"My girlfriend and I have been dating for about 9 months now. Me 21, her 20. We haven't been as sexually active as we used to be (weird to say after dating only 9 months). It used to be daily, then weekly, now monthly+ thing. I have mentioned numerous times in non-argumentative ways how I have wanted this to change i.e. ""Hey it is really important for me that we have a strong sexual connection in our relationship."" Her: ""I know, I like sex with you, we will have sex tomorrow because I am too tired tonight."" Story repeats all the time. I asked if it was performance and she said no as she comes easily.

Now, one of the new interns at my work (CIO's niece O_o) started to really have a thing for me. We have hung out a few times (did nothing out of line) as a group with other co-workers. Another time, she asked me to come hang with her and her friend at her Uncle's(the CIO) house where she was staying. Went there, played video games, and again nothing happened. Nothing ever came up about dating or if either of us had a boyfriend/girlfriend (as I didn't get the impression she felt that way about me). However, she did know I had a girlfriend.

Now comes Saturday night. She was going to the club with some of her friends and a bunch of people from work. She invited me and I accepted. I met up with her there and danced a bit and I had a drink or two. Then when we were dancing, she grabbed me and we made out. I am in no way blaming the alcohol for me making out with her. I knew what I was doing but I did it anyway. My girlfriend is NEVER forward like this which is a huge turn on for me and I have mentioned that to my girlfriend as well but nothing changed.

I have decided to tell my girlfriend for two reasons. I want to own up to my mistakes, even though she will most likely dump me. The second, I know she will find out in one way or another and if I want any chance at a continued relationship with her, I know I have to own up to it. However, I am starting to like this new girl a lot.

In you experience Reddit, should I try to salvage my relationship or is it time to move on to new opportunities?

TL;DR I have a girlfriend, made out with CIO's niece, salvage relationship or move on?"
cz5kr,3,2010-08-09,"I am going to China (Shenzhen) for my internship, any advice?",jnothing,travel,https://www.reddit.com/r/travel/comments/cz5kr/i_am_going_to_china_shenzhen_for_my_internship/,"I am studying CS in Turkey and going to China for my internship. I will work in Shenzhen for 1 month. I only know English, no Chinese. I am kinda excited because I have never been abroad before. I would really appreciate any advice.

Note: I have tickets to Beijing which I'll stay for a few days, to see the city. Planing to take the train to go to Shenzhen from Beijing."
czcmj,3,2010-08-10,Help me find an IT job in Ottawa!,Vigil123,canada,https://www.reddit.com/r/canada/comments/czcmj/help_me_find_an_it_job_in_ottawa/,"I've basically graduated last semester in Comp Sci and had a small contract job for the summer while waiting for my application process to go through at the federal government (which I know to be a lengthy process). I have had good grades (A- average) but few work computer work experience outside school-run projects (some sort of internship partnership).

I learned about 2-3 months ago that I wasn't allowed to apply to the student program because I now am a graduate and not returning to full-time studies. So here I am about to re-apply on September 23rd for the good program this time (post-secondary one) when it opens. 

Most people I know that got gov jobs did it through friends/family members who were in for many years or agencies after a while (few months process to get security clearance and then get a job). 

So I was wondering if anyone got them connections or maybe know an agency that actually works as the ones I've tried barely take time to answer you if at all. **Looking for tips/suggestions or links to recruiting programs for junior positions**. 

I prefer a stable position over contracts so that's why I think the government would suit me the most. I'm bilingual (French first, English second), prefer web development (xhtml, css, javascript, php, mysql, bit of asp and .net), I also know java and c++."
d0ef3,5,2010-08-12,"Left after five years, I don't understand...",LostRightNow,relationships,https://www.reddit.com/r/relationships/comments/d0ef3/left_after_five_years_i_dont_understand/,"My ex-girlfriend and I had dated for five years, lived together for three.  We shared a house together, have two dogs, and until a few days ago, I thought everything was fine...

I'm finishing my doctoral degree in engineering (should be done in about a year), and took a summer internship which had me about 1000 miles away for three months.  She is a few years older and works for the government, so she obviously stayed in our home, no big deal, it was only three months. During that time, she expressed that she was unhappy that we are still in the area near my university (major metropolitan area, it's not like we're in the middle of nowhere) because she grew up in the area and didn't imagine we'd be still be here when she moved in with me three years ago.  We never talked about any of this at the time, it was just something that happened.  I told her I understood, and began to make plans so we could move to wherever we needed to be for her to be happy, I could finish my dissertation wherever and didn't need to be on campus.  The summer progressed, she visitted several times, and I made several trips to visit her.  Every single one of them was absolutely amazing.  During one of the trips we talked about marriage, looked at rings, and joked about getting married at some point in the future.  We've been talking about the future for a while, and I was taking the steps to make everything we both wanted happen.

Flash forward to my homecoming.  She says she doesn't feel well (in all fairness she had a terrible week of travel for work), but otherwise, everything is absolutely fine.  We had a nice dinner, played with our dogs, and went to bed.  The next day, we hung out at a baseball game, went to dinner with friends, and spent Sunday night like we spend most Sundays, watching True Blood on the coutch.  We go to bed, I lean over to kiss her good night, and I notice she is just kind of there and very diengaged.  I ask her if everything is alright, and she says ""No... I'm not alright... I'm not happy...""

She proceeds to tell me that she has been ""dreading me coming home every single day,"" and that she ""just wants to be alone right now.""  She thinks I'm ""an amazing, absolutely brilliant person who [she] has an amazing time with..."" but that she ""has a lot of amazing people in her life, and she doesn't want to be in a relationship with them either right now.""  She doesn't understand what after five years, she still doesn't want to be married, and she doesn't want to keep ""forcing it.""  To top it off, she added that ""you're not supposed to marry someone you can live with, you're supposed to marry someone you can't live without.. and there's no one [she] can't live without...""

After several hours of back and forth, we get down to the fact that we work well together, we have the same goals in life, we have the same interests, she is essentially the female version of me.  But... she is incapable of being happy with another person, because that would mean that she wouldn't be in 100% control over her future and herself, and that somehow makes her a weak person.  She is unwilling to be responsible for another person's feelings regardless of how much she enjoys being with that person, or how much that person loves her in return.

If there was a reason why things didn't work out, I could understand.  If we weren't good for each other, didn't enjoy our time together, or we wanted different things in life, I could understand. I just don't understand her, and I don't understand this.  I feel like I'm losing the person I am supposed to be with, and I can't do anything about it.  I have never met another person who understands me the way she does, or to whom I would give anything to keep from pain or hurt or to provide for.  We challenged each other, we supported each other being our own people and having our own lives, we had an amazing life together.  I don't understand how she just walks away...

I was completely blindsided.  I have no idea what to do right now, I feel like every plan I had made for my future is out of the window, and I am completely lost.  It's cliche as hell, but I feel like my heart has been ripped out, and I am missing out on the chance to spend my life with my soul mate.  This absolutely sucks."
d0s4f,0,2010-08-13,"I am a US government intern, AMAA",splishsplash,IAmA,https://www.reddit.com/r/IAmA/comments/d0s4f/i_am_a_us_government_intern_amaa/,"I pursued government work because I wanted to work in investigations involving digital media, so my aspirations were to someday work for the FBI's cyber-crime unit (so I can backtrace people and ensure that the consequences will never be the same). Now after maturing a lot I can say FBI isn't the way to go - there's a certain personality that you need to be an agent with the FBI.

A couple years ago I worked at homeland security, now I intern with the justice department. Ask me almost anything about what its like to do government work"
d18xu,3,2010-08-14,"I'm applying for PhD programs, and my boyfriend can't move because of his job.  Advice greatly appreciated.",grad_school_blues,relationship_advice,https://www.reddit.com/r/relationship_advice/comments/d18xu/im_applying_for_phd_programs_and_my_boyfriend/,"Hi Reddit, I'm a 22 year old female, currently dating a 25 year old guy.  We've been together for a year and a couple months.  (We don't live together; we live in the same neighborhood.)  Everything's been going great--but there's one big problem.  It seems that, at this point, our respective career choices are totally incompatible.  I want my PhD, and eventually a research position at a University, and he wants to be very active in the startup community in the city we currently live in.

We're both already more than on our way to our respective (career) goals.  He's currently working for a local startup, and absolutely loves his job.  I'm just finishing a research internship on the other side of the country (we live in the USA), and will be applying this fall for programs starting in Fall 2011. 

This across-country internship made us realize that 6 years of a long distance relationship isn't possible for us--2.5 months was hellish enough.  (We talked about it, and came to that consensus.)

So, it seems like the only option for me to pursue my PhD and for us to stay together would be for me to go to a University in the city we currently live in.  However, there's only one school in our city that I'd consider going to for grad school--and it's consistently ranked #1-3 for grad schools in my field.  So, if I get in, problem (temporarily) solved.  However, I obviously can't count on getting in.

So, it seems like my options are:

* If I don't get into the school in my city, say the relationship was nice while it lasted, and leave it at that.

* If I don't get into the school in my city, try to defer for a year for the schools I did get into (I think this is possible?), apply to said school again, and then make a final decision.

* Get into the school in my city, and then pretend this problem doesn't exist for the next 6 years.  (I can't really control where I get accepted for post-docs or research positions, either.)

So, any advice?  I just can't see how any of my options don't eventually make me choose between the career I want and a relationship I want."
d1ie8,2,2010-08-15,slippery slope or reading too much into the situation,throwmeaway2121,relationship_advice,https://www.reddit.com/r/relationship_advice/comments/d1ie8/slippery_slope_or_reading_too_much_into_the/,"I've been hanging out with my old roommate's girlfriend (let's call her Michelle) we are both in our early 20's. I recently graduated and moved out to a new city.

By coincidence we both ended up on the other side of the country. She landed a summer internship and I just landed a job.

Most of the interactions have been harmless and I would have no problem telling my old roommate.

This weekend we were at a club, Michelle was adamant about taking me back to her place.

Initially Michelle was going to share her bed with her friend Kelly who also spent the night out with us.  I got the twin bed in the other room. 

Next thing I know I find myself sharing the bed with Michelle who is trying to pull my pants off.  (most of you are probably facepalming at this point, but stay with me) 

Michelle knows I normally sleep in my boxers so I really can't tell if she was trying to make me comfortable or **comfortable**. I decline and decide to keep my clothes on.

There was some physical interaction not quite cuddling /spooning but she was lying on me. We ended up talking for a bit and then went to sleep.

Was it the alcohol making her extra friendly or did I miss an open invite?

Then there's the issue of man laws. Your roommate's girlfriend is off limits. Since I moved out I'm technically not roommates anymore and there's no ring on her finger. It still seems like a dick move though.

so reddit am I reading too much into the situation or do I have the opportunity to be the other guy?"
d1z9k,9,2010-08-16,Another whiny post. Sorry.,ffoffail,depression,https://www.reddit.com/r/depression/comments/d1z9k/another_whiny_post_sorry/,"I hate doing this. I'm sorry, I'm sure you read posts like this all the time. I just would like some anonymous advice coming from an anonymous person. 

My family has a history of depression, alcoholism, and other serious mental disorders. I've accepted that I am very prone to receiving them, and more so accept that I have one. 

When I was 15 my depression started. I was accepting my sexual orientation (gay), getting a fresh new start in High School, and continuing a rocky relationship with my parents (we are very passionate people who refuse to admit when we are wrong). This made me feel very lonely and upset. I started drinking almost nightly to help deal with it. One night I was about to kill myself when one of my friends came to my house and forced me to stay alive. Ironically my parents never let me speak to this person again because they believe that she made me gay (they don't believe this anymore) and that she made me have depression. 

I started going to therapy after my parents found cut marks on my arm. My first therapist literally gave me an internet test and diagnosed me with bipolar disorder and wanted to prescribe me some sort of anti bipolar medication. We didn't take it because it was too early to say that I have depression. Later we found out that she was getting paid by the company that makes those medicines and she lost her license. None the less, this gave me a complete distrust towards psychiatrists.

I went to another therapist later on but did not enjoy it. I faked my way threw it because I didn't appreciate his attitude and the way he treated me and my religion/activities (running, I hated it, he loved it). I kept on going to him because my parents liked him and I figured I could give an hour of my week if it eases their mind. I convinced him, my parents, and I now think myself that I was okay and over my depression.

During the rest of high school I devoted myself to extracurricular activities, mostly Speech and Debate and our Green Club. I have never been the best student for some reason or another, but activities have been my forte. 

Fast forward to college/present day. I moved 4 hours away from home to go to college because I strongly disliked my hometown and felt that I needed a break from my parents. During college I decided to follow up on the same path that I left in High School. I devoted myself to extra curricular activities (College Democrats (which I'm the president of), Alliance (Activism and Communications chair), and I was part of my hall government before I moved out). My schoolwork hasn't been the best, but it hasn't been the worst. I changed my major from Computer Science to Politicial Science. 

I love politics so much that I applied for an internship working for the 2010 elections. This also gave me a chance to get a head start on our 2010 GOTV plan for our campus.

During college I've met some of the best people that I could imagine, including my best friend/boyfriend. I've been in two long relationships before (neither ended on bad terms, but just happened to end) and can honestly say that I have told him more about myself and opened up more to him than anyone else, and I know that he has done the same to me. My parents and my relationship has gotten much better. 

Despite everything going right for me I still feel like the biggest failure on the planet. I feel that I will never be able to move forward or make any sort of small difference in society. Despite me being in a relationship with an amazing guy who I trust more than anything I feel more alone than ever. For some reason I can't bare to tell him how depressed I have become because I fear that he will view me as whiny and spoiled (he comes from a much more difficult background than mine which is obviously a very lucky background with a few small kinks) and him leaving me. 

I have never felt more empty in my life. Despite finding the best friends, doing exactly what I want, having a great relationship, having a better relationship with my parents, an extremely fun internship where I've met a lot of great people and learned a lot about my interests. 

What am I doing wrong?"
d1zmv,6,2010-08-16,I'm losing a lot of weight.,Baseburn,Fitness,https://www.reddit.com/r/Fitness/comments/d1zmv/im_losing_a_lot_of_weight/,"A little background: I've just moved to Boston (one month ago) from Phoenix. In Phoenix, the last time I weighed myself (End of June), I tipped the scales at 250. I am now 230 pounds.

In Phoenix, you have to drive EVERYWHERE. Even down the street to a friend's house cause it's so goddamn hot. In Boston, you can walk EVERYWHERE. Twice a week I go out to Wellesley on the T, get off the subway car and walk to my internship. I end up walking around 5 miles each time I go out there.

I also do not have a paying job yet so the grocery bill is being cut. I am not getting as much protein as I used to. On the positive side, I'm not drinking soda or eating fast food. I have no funds to join a gym. I walk at least a mile every day (besides going out to my Internship) between going to the library or walking a friend to work.

I am afraid that most of what I'm losing is muscle. In fact, I'm almost certain of it.

What can I do now, with no liquid funds, to reverse this trend? I want to lose fat, not weight (fittit has taught me so). Should I try cutting the carbs in my diet and putting more protein back into it?

What can I do in the future, after I earn an income stream, to continue the reversed trend? I am slightly skeptical that as soon as I have money I'll be out buying cigarettes and soda again, so I guess this is more of a question of motivation than anything else. 

TL;DR: Losing muscle, not fat. Help me fittit."
d1zqa,0,2010-08-17,So what happens if I do Beginner's Stronglift 5x5 without a significant calorie increase?,captainsensible-,Fitness,https://www.reddit.com/r/Fitness/comments/d1zqa/so_what_happens_if_i_do_beginners_stronglift_5x5/,"Hi Fittit,
Frequent Fittit lurker here, and first-time poster.  Been through the FAQ but it doesn't specifically address my issue.


Background: I'm 19 years old, 5'10"", 155lbs.  A bit on the scrawny side and my goal is to get stronger and whatever growth comes about naturally as a result of that.


For several reasons, I'm in a situation at the moment where I can't really be eating the amount of protein/calories that Fittit recommends.  I usually eat two boiled eggs and a banana for breakfast, then two more bananas before lunch, and then lunch (which isn't especially nutritious or voluminous due to it being a free meal at the staff canteen of my summer internship company) and dinner (also at staff canteen, unless I go pay up for a Subway sandwich).  


However, I'm currently on week 3 of [Stronglifts 5x5](http://stronglifts.com/stronglifts-5x5-beginner-strength-training-program/) and things seem to be going great.  I started with mostly empty bars (20kg) to get my form right, but each workout feels like palpable progress and I'm feeling great about the whole thing.


My question is, what can I expect from possibly not having my diet match up to workouts?  Is it alright, since I'm a beginner?  Are plateaus inevitable without sufficient intake?  Is it okay to start eating more *once I hit those plateaus*?  Right now I seem to be getting more toned and losing the slight belly flab I usually have, so I'm cautiously optimistic.


Thanks, and please let me know if there are more details I can provide."
d2exb,4,2010-08-17,I am looking for a temp home for my cat,eforemergency,Louisville,https://www.reddit.com/r/Louisville/comments/d2exb/i_am_looking_for_a_temp_home_for_my_cat/,"Hi all. So, here is the deal. I am moving to DC for 3 months for an internship. I have a cat who I love, but unfortunately, even after tons of searching, I can find no place that will let her come with me while I live there. My parents would watch her, but she has a hard time living with other cats. She is perfectly fine when living alone with me, but she cannot stand to be around other cats or use the same litter box as them. I have tried everything I can think of, but it looks like I might have to get rid of her if I can't find a place for her to stay for 3 months. None of my friends can take her in, as they are either in college dorms or apartments that don't allow pets, and I am at a total loss. I really can't lose her just because of 3 months. 

So please, if you would not mind housing a small black kitty for 3 months, let me know. I would be happy to help with food and litter, and she has toys, a litter box, and a little bed she likes to sleep in already. 

Even if you can't house her, if you have any advice or know anyone who would, let me know. Thanks guys. "
