rnn4p,3,2012-04-01,Some school/career advice from seasoned veterans?,kettlestreets,animation,https://www.reddit.com/r/animation/comments/rnn4p/some_schoolcareer_advice_from_seasoned_veterans/,"Hey folks, I'm about to finish up a BFA in studio art and I've been accepted to Ringling and SCAD for animation - I'm looking to get trained in computer animation. I can't seem to pick between the two. They each have their pros and cons.

Ringling has a top notch reputation as being a hub for talented animators; however, I will get zero financial aid (32k per year!) and they seem to 'force' their students into working in a Pixar/Disney style. While I have no qualms about working in the mainstream style, I kind of want to do my own thing too (at least in my free time) and I'm worried about the lack of creative freedom. SCAD doesn't seem to have as good of a reputation (and the student work is not quite on par with Ringling's) but I can probably graduate in three years with 60k of debt and the chance to study abroad. I've also heard that their career services is not as good since the program is so huge. However, I have to say that I am leaning towards SCAD because of their aid package.

Are any of you guys grads of either programs? If you are, how did your job searches start out? If you are professionally working, have you got any tips for this starry-eyed student, whether it be about schools, internships or jobs?

Cheers! Thanks a bunch!"
rnf70,1,2012-04-01,"I'm suddenly on my own and I don't know where to turn to, at all.",disowned999,self,https://www.reddit.com/r/self/comments/rnf70/im_suddenly_on_my_own_and_i_dont_know_where_to/,"Honestly I can't find support anywhere and I was wondering if anyone knew where I could find resources?

I just turned 20, I'm a female student attending a very good college, and I've just been disowned by family. The are crazy and intent on stripping me of everything I need to have a life because they feel that I am the source of all their conflicts and don't appreciate anything, when in reality they instigate many conflicts themselves.

I don't have a permanent place to live.
I don't have a permanent job.
They are canceling my health insurance.
They REFUSE to give me info to fill out my FAFSA so I can return to school after the two years I've spent here doing amazing work.

I've found a sublet, an internship, but I don't know what else to do. I've been to my school's counseling services and they don't do anything--just listen to me talk about my problems and nod their heads. I need to find support somewhere, I have absolutely no one.

Can anyone tell me a) How to talk to irrational, childish people who have absolutely no interest in the truth or logic
or b) Any kind of social services that might be available to someone who is not a minor but still a student with no familial support?

I'm so desperate.

Everything I've worked for is being taken from me, and nobody is on my side."
rndil,2,2012-04-01,"After a week of ""no contact,"" I've gone numb...",[deleted],BreakUps,https://www.reddit.com/r/BreakUps/comments/rndil/after_a_week_of_no_contact_ive_gone_numb/,"This is a long one so if you're not in it for the long haul, feel free to skip to the end where the question is...

So here's the story, my ex (22F) broke up with me (24M) almost 3 months ago.  We met about 8 years ago and became friends.  We lived in different states, but her father lived near me and we would see each other when she came out to visit him around holidays and over the summers.  We had various ""flings"" over the years and maintained a lighthearted ""flirty"" friendship.  Almost 2 years ago now, I decided to fly out and visit her.  Feelings resurfaced on both sides and after a hectic summer we both admitted that we had fallen in love.  She still had a year of college left and I was now entering a phase of jumping from internship to internship until someone would hopefully hire me. Over the next year and a half we carried on our long distance relationship.  She finished school and moved to a big city where she got a ""grown-up job,"" I continued to jump from internship to internship in various states.  We would spend a few hours on the phone together everyday and we would see each other in person over varying lengths of time.  In January, while I was spending one last visit with her shortly before i moved out of state for another 3 months, she told me she couldn't handle the distance anymore and that we had to break up.  She said that ""it never felt like a real relationship,"" that she was ""growing to resent"" me, and that she couldn't keep waiting for me anymore.

After I moved away again she would still call me on her drive home from work like she always did.  She told me that she couldn't just cut me out of her life because I was her best friend.   On a couple of relatively humiliating occasions, I broke down and told her how badly I wanted to be with her again but she always replied that she had to do what was best for her and that even though it doesn't seem like it, breaking things off now was the best choice in the long run.  

She seemed to be doing fine with everything, but over the next 2 and a half months I felt worse everyday. Every time I hung up the phone, after talking to her, I was on the verge of tears.  My self-confidence (something I've always struggled with) was at an absolute all-time low.  I couldn't tell her how miserable I was because I couldn't handle hearing her say ""this is best"" again.  She was still my ""best friend"" but I couldn't tell her what was on my mind anymore.  
Eventually I decided that my last chance at getting past anything would be to go into ""no contact.""  I sent her a long winded e-mail explaining everything I was feeling.  I told her how miserable I was, how angry I was with her, and how humiliated I was.  I told her she could call me that night if she wanted, but the next morning I would be cutting all lines of communication.
She called that night and we spent a long phone call and skype conversation just kinda spilling our feeling to each other. I was surprised that she admitted that she still loved me and that she stills wants to be with me, but once again, the distance made things impossible.  She didn't want to do no contact but she accepted that it was what I wanted and that she would give me all the time I needed.

That was a week ago, so where am I now?  Honestly, I feel numb.  I feel completely emotionless.  I don't really feel sad anymore, I don't feel happy anymore either.  I am completely disinterested in the world around me.  I don't talk to people unless or leave the house I have to. There's a couple people in my life encouraging me to get out and be social again but I just don't have any will to do so. 
If I had typed this post a week ago, I wouldn't have been able to see through me tears, and now as far as my emotions are concerned, I'm writing a lab report.
And the strangest thing? Two days ago I was asked to fly out to her city for a job interview.

So my question is this: After a week of ""no contact"" I went from being a crying, miserable, wreck to a completely numb, emotionless, anti-social shell.  Is this improvement or regression?"
rn2ly,4,2012-03-31,"""Whenever I go out, I feel like you need to be there. Everyone has their boyfriends and I need attention and you aren't here. What can we do to make it feel like we're still in this? "" Please help me find ways to comfort her Reddit, I could really use any advice. ",nolikedistance,LongDistance,https://www.reddit.com/r/LongDistance/comments/rn2ly/whenever_i_go_out_i_feel_like_you_need_to_be/,"I'm upset because the first part hurt, I'm hopeful because the second part shows that she hasn't given up yet.  

We've been in a long distance for 3 months now (1 yr total), ever since I took a very high paying job a few states over. The drive is doable, but not more than a few times a month. She is still in college.

She's been crying lately. It's most likely due to the semester and her job, but she's saying ""I want to feel better, and I'm not."" and ""I miss you and upset and almost angry you aren't here."" I've said everything in my vocabulary to make her feel better. She wants ways to make it feel like I'm still there. I suggested we skype again but I couldn't immediately suggest anything else. I feel like she's looking for the equivalent of me teleporting there. What can I suggest? 

Both of our hearts are riding on her getting an internship near me this summer. She's an econ major and wants a job anywhere in the NY area. If anyone knows a way I can seek other finance/econ internships in the NY/CT area, I will try anything. I will pay money for information on how to find her a job near me for the summer. She's so smart and deserves it.

Just seeing her every day again would make everything right. I know it will. "
rn2ee,3,2012-03-31,Should I end it or keep working on it?,teersofhops,relationship_advice,https://www.reddit.com/r/relationship_advice/comments/rn2ee/should_i_end_it_or_keep_working_on_it/,"Hopefully he doesn't see this as he is also a redditor, but I don't think he comes to this subreddit. Anyway, this is a little bit lengthy, but I hope you'll read it.

Firstly, some background- I am 23(F) and he is 28. 
We first met five years ago, but only started dating about a year and 10 months ago. Our relationship moved pretty fast- we were basically living together for a while and were fairly serious. He helped through some really tough times (I had PTSD and was recovering from an assault I had faced at the hands of a peer). He has been very supportive and protective of me in the while we stayed together. We had a fairly loving relationship, and were almost playing house I guess.

-

We've been LDR for the last 8 months. I was living across the country (or continent, rather, since we're Canadian but I was down in the States) from September to December for an internship opportunity. Then, by a twist of fate, we swapped places as he went down there raise capital for his startup while I came back to school.

-


Anyway, some problems we've faced: firstly, I'm of Indian origin and he isn't. My family wouldn't mind him, except that he has been utterly disdainful of them from the beginning, and now they don't like him. In addition to this, he sees Indian culture as backwards, never wants to go there, and scoffed at my vegetarianism until recently. He said he changed his mind recently, but only after he sensed I was pulling away. 

-


Secondly, he recently decided he wasn't going to finish his undergrad until an indefinite later date. He started his undergrad at the same time I did, but was obviously about four years older than I am. We were both in a fairly specialized (&gt; 4 years) electrical engineering program when he decided to drop out, then changed faculties a bunch of times before deciding to do his startup. He is a really smart guy, but this has left me feel super disappointed, as I am almost done. The one thing big thing here is that I will likely be working abroad full time once I am done, but won't be able to sponsor him, and he may not be able to get an appropriate visa without an undergrad. I also don't really know what to say to my family, who were already not too happy that he switched out of engineering. 

-

My future earning power is also much higher than his now and because of this, he would make me spend on tickets and hotels for him to come visit me even though I couldn't afford it due to school. He later told me he just wanted to see me and keep me company, and I understand that.

-


Those are the two main problems. Others have included the fact that being with him started to become isolating. He didn't like me hanging out and drinking with my male friends (even though they were my friends out of necessity, being in engineering). He accused me of cheating a few times over the last 8 months, though I convinced him I wasn't and he believed me. He would argue with me frequently over trivial things, like using Linux over OSX (he preferred the latter) and would often tell me to get out or make me sleep on the couch. He would frequently ask me to choose between my family and him, saying if he wanted a traditional Indian girl who wanted her family, he wouldn't have dated me. He is fairly argumentative in general, and has gotten up in my friends' faces for disagreeing with him in the past (he can pull it off because he is a big guy), and would also get upset at me for telling him to stop.

-

I don't know what to do. I've been unhappy for a while, but I love him. We talked recently and he cried profusely, saying he was willing to change if I gave him a chance. He says he loves me and asked me remember all the good times we've had. His startup recently received a lot of funding (a LOT), and I think he's been using that to try and reel me back in, but I don't know. I love him so much. I really do. But this relationship stresses me out to the point that I am no longer attracted to him and I am scared that I'll be isolated from my friends and family.

What do I do? I am so scared. He comes back from the States this Thursday and I have to give him an answer.

**TL;DR** BF doesn't like my family/culture, dropped out of undergrad, does other things to stress me out. What do?"
rq2rq,2,2012-04-02,[Seeking] Summer Intern Looking for Housing near San Mateo,[deleted],SFBayHousing,https://www.reddit.com/r/SFBayHousing/comments/rq2rq/seeking_summer_intern_looking_for_housing_near/,"I will be an intern at a company in San Mateo this summer and I'm looking for relatively close housing. Ideally I would find a place close enough for me to bike to work, but I'll take what I can get and drive if necessary. About me: I'm currently a second year computer engineer and will be working as a software engineer over the summer. I'm pretty relaxed and easy to get along with. I'm extremely clean but won't complain if others aren't. I'm pretty outdoorsy and I like to cook. I'm also 420 friendly and love all animals. I'm a guy and I'm happy to live with guys or girls. My internship starts June 25th and ends August 31st. Please let me know if I sound like a good match!"
rp3zl,1,2012-04-02,I messed up and i need help from anyone!!!,[deleted],relationship_advice,https://www.reddit.com/r/relationship_advice/comments/rp3zl/i_messed_up_and_i_need_help_from_anyone/,"Last year in the fall i was vying for the attention of a girl who didn't give me anything positive. i don't know why i was trying for the relationship but i was. after christmas break i decided to stop trying to date this girl, we'll call her A. 

in the spring i met the love of my life, we can call her M, in malibu. I go to school in texas. M took an internship where i lived for the summer and we lived together, things were great. we have had a few bumps in the road but she means everything to me and we love each other terribly. she has since taken a job near my school and drives three hours to visit me every weekend. i love this, she is amazing. this weekend when i was at my mcat class, M used my computer and saw that i had been messaging A (who had transferred away). 

I never once said anything inappropriate, nor did i say i missed A at all. i was not looking to keep her around, i was only talking to catch up.

M had told me she was uncomfortable with me talking to exs, and even though A and i never dated, i understand her anger. 

she says she can't trust me anymore and doesn't love me. she is saying i have ruined all of her memories and wishes me ""good luck"" with trying to win her back...

how can i fix this. I really need some help here. i love M to death and can't live without her in my life."
rorpy,0,2012-04-01,Looking into teaching English need some clarification. ,blackley1,japan,https://www.reddit.com/r/japan/comments/rorpy/looking_into_teaching_english_need_some/,"So my first and largest problem is that I only have an associates in computer science. I am continuing my education and will be getting a Bachelors in CS here in 2 years, if all goes as planned. 

I would love to spend a year or two in japan working and exploring but it seems that all the information I have collected is random at best.

I am a native English speaker who has lived in the pacific northwest for all of my life and have very clear and precise pronunciation. I am Germanic, tall, blond, blu-eyed and a male just about to turn 20.

My understanding is that I need to be 21 and have a 4 year bachelors degree? But it seems many have gotten in on an AS degree but its mainly luck.

Is it worth getting a teaching certificate and attempting to look for work? What will increase my chances of getting work?

I would like to be able to do this before I graduate so that I can spend my last summer with an internship at Microsoft and get my foot in the door there as that's where I would like to start my career. 

Anyone have experience or advice? Thanks in advance! "
rrmc7,10,2012-04-03,Need advice on an internship idea.,tk6215,Anthropology,https://www.reddit.com/r/Anthropology/comments/rrmc7/need_advice_on_an_internship_idea/,"So my major is anthropology and I love it, I find it fascinating but I have extensive experience with IT and landed a killer job with my Universities IT dept. My managers won't let me off to do a week day traditional internship so I'm trying to find a way to use my work here at the university in Tier II IT as an internship. 

What I've noticed while working here one cannot even function at the univ without a computer...there has to be something there I just don't know how to pitch or word it.

[Link 1](http://web3.cas.usf.edu/main/depts/ANT/cma/)
[Link 2](http://en.wikipedia.org/wiki/Anthropology_of_cyberspace)

Advice, thoughts and/or links would be great."
rrgzj,4,2012-04-03,Love the job-- But don't see a future. Help? (x post from KitchenConfidential),Dogwithrabiez,Chefit,https://www.reddit.com/r/Chefit/comments/rrgzj/love_the_job_but_dont_see_a_future_help_x_post/,"A bit ranty, I apologize.

I'm 19 years old, and went to culinary school directly after graduating high school. After an accelerated 6 month course, I worked as an intern at a one Michelin Star restaurant, and got hired after a couple months as garde manger.

I've been working at this place for a year now. The trouble is, I'm starting to realize that I don't see a future in doing this. No matter how much I love cooking and working the line, I just don't have a dream of running a kitchen of my own-- Not a real dream, anyway, if that makes sense. I realized that the want of running a kitchen as a chef was an ""expected"" dream that I sort of ran with because I figured that's what you did later on.

Don't get me wrong, I love my job. I work the station faster than anyone, can plate three station's stuff, and help out everyone else whenever I can. I'm not lazy, I bust my ass day in and day out, and don't have too much of a problem with any aspect of work as of the moment. I have a lot of passion for what I do, and always want to learn and always am excited to see new things.

It's hard though, to see myself really running a restaurant. Not because I don't want to do it, nor that I don't think I can do it a decade down the line, but just that it's not something I jump at. It's odd, and hard to explain, but... I just don't see a happy future as a chef. I've no trouble with long hours and low pay right now, but as I hear, hours only get longer and the pay doesn't get very much better later on(though money is honestly a non-issue). I guess what I'm most scared of is never seeing friends and family and regretting it later on in life.

Should I quit out while I'm ahead, go back to college for who-knows-what with the money I've saved from working, or should I push on and hope that I'll truly want to have a kitchen of my own someday, and that it'll turn out alright?

**tl;dr Love my job and being a cook, don't see a future as a chef. Should I go back to college or stick with culinary?**
"
rrgj1,3,2012-04-03,[Seeking] First Year MFA Creative Writing student with B.A.s in Psychology and Theatre. Looking for full-time employment.,jayobear,SFBayJobs,https://www.reddit.com/r/SFBayJobs/comments/rrgj1/seeking_first_year_mfa_creative_writing_student/,"- 3 Years as an IT Helpdesk Consultant.
- 1 Year as a Graduate Assistant in ResLife (Social Awareness focus).
- Currently at internships teaching with a High School, as well as writing for an art foundation."
rr8tp,0,2012-04-03,Studio Robbed. Need help finding out what gear we need.,[deleted],audioengineering,https://www.reddit.com/r/audioengineering/comments/rr8tp/studio_robbed_need_help_finding_out_what_gear_we/,"So long story short. I was recently taken on as an intern and the engineer up and left taking a bunch of gear. I'm suppose to get the studio up and running again while on a budget of sorts. 

We have the Avid HD I/O interface. What card do I need to purchase for this interface? HD1 or the Native? 

Is Avid forcing consumers to upgrade to the HDX series for future releases of pro tools? 

Thanks for any replies in advance.

I've tried researching this topic but I just want to be absolutely sure."
rr34t,6,2012-04-03,Looking for a job in Malmö,Knorkator,jobb,https://www.reddit.com/r/jobb/comments/rr34t/looking_for_a_job_in_malmö/,"I will start studying at Malmö University in September. Right now I'm doing an internship at the Swedish Arbetsförmedlingen, where I give presentation about working conditions in Germany to young Swedish unemployed.

I speak fluently German and English and am learning Swedish in language courses in Kalmar, where I live now until the end of April.

I've got some experience withe databases and software engineering (worked for Siemens in Germany and finished an apprenticeship in IT) but would practically do any job, that provides money to survive.

So, if you know about any job vacancies, that could match to the short description I gave you, I would be very thankful."
rqje6,11,2012-04-02,Question about formula 1 internships and co-ops for college students.,calinduff,formula1,https://www.reddit.com/r/formula1/comments/rqje6/question_about_formula_1_internships_and_coops/,"Hello F1 community!
I am finishing up my freshman year in college studying Computer Engineering at Clemson University. I was wondering if anyone knows if any f1 companies offer internships or co-op's. I know I am still early in my college career, but maybe there is something. 
I know this is a long shot, but any help or information would be greatly appreciated. 

Thanks!"
rqj44,37,2012-04-02,What Syfy SHOULD be...,[deleted],scifi,https://www.reddit.com/r/scifi/comments/rqj44/what_syfy_should_be/,"Hey Sci-Fi Fans!
I had previously started [this AmA](http://www.reddit.com/r/scifi//comments/ro21r/i_used_to_intern_for_syfy_amaa/) about when I used to intern for Syfy.

I wanted to start this thread to be a constructive discussion of what Syfy should be. I know most people (including me sometimes) are frustrated with the channel, but I want to concentrate on real solutions. What things can be done to make the channel what it SHOULD be.

I ask because I am in the television industry and am a huge Sci-Fi fan. I'd love to spend my career working on great science fiction programming and hopefully we can influence Syfy to be the channel we all want it to be. 

If we get good constructive suggestions, I will attempt to share them with my contacts at the network.

Thanks!

**[TL;DR]** What SHOULD Syfy be? What kinds of programming should the network carry?"
rtesb,2,2012-04-04,Looking for IT job on campus,MisterFaxSender,msu,https://www.reddit.com/r/msu/comments/rtesb/looking_for_it_job_on_campus/,"So I thought that this would be a good place to go for IT jobs on campus because... well... a lot or Redditors are in IT. 

Anyways, I am a Media and Information major with a specialization in IT, and I'm a junior. I want to get out of the cafeteria job and into something that applys to what I want to do. 

I looked at MSU's various websites for IT jobs to no avail. I was wondering if there was anyone on campus that knows of an opportunity for me to check out and get information on. 

I'm looking for a Summer internship, or even part time work during the regular school year. Really anything in IT or with computers. 

Any help would be greatly appreciated."
rs8wv,2,2012-04-03,Computer Engineering Undergraduate Seeking Internship,eRay121,newjersey,https://www.reddit.com/r/newjersey/comments/rs8wv/computer_engineering_undergraduate_seeking/,"I am a rising Junior at The College of New Jersey and am looking for a summer internship in the field of Computer Engineering, Electrical Engineering, Software Engineering, or Computer Science. PM and I will send my resume! Thank you very much."
