sd0rx,2,2012-04-16,"20, F, College is becoming more and more stressful, and it's hard to handle.",fmlaccount,ihaveissues,https://www.reddit.com/r/ihaveissues/comments/sd0rx/20_f_college_is_becoming_more_and_more_stressful/,"I'm currently a sophomore computer science major at a somewhat prestigious (but not Ivy) university. The first year while I was undecided and messing around with courses in the college of arts and sciences, I ended with a 3.86 GPA. 

Now that I'm in the engineering college pursuing a major in CS, I've been doing terribly. Last semester I dropped one of my two math courses, then got a D in the other. I also got a C in another class, dragging my GPA down to a 3.33. 

This semester it looks like I'm going to get a D in the CS weed-out class for my major (I need a C- to pass), and I'll probably have another C.

This is all so stressful and I don't know what to do. Currently I'm looking at having to take 5 classes per semester, and since I will most likely fail a class this semester, I'll have to take that one again (it will be with another professor who is really easy). 

I don't really want to switch majors. I *like* my major, and it's really the only thing I can say interest me, but it's just so damn hard. It's given me so many opportunities to travel, plus the program has 100% job placement rate. I'm just worried about graduating withing my 4 years. I can take this class I'm failing over the summer, but it costs money I really don't have. I'm already going to be spending thousands on going to Europe for an internship and taking the math course I got a D in once I get back. I was thinking, ""Well, my parents are going to kill me, but *maybe* I can convince them to let me dish out another $2440 to take another class this summer. Even with that I got screwed over. The class meets 4x a week, and one of the meeting times would interfere with the math class. 

I really don't know what to do. I can't take 6 classes one semester. It'd kill me. I can barely handle 5. I become so sleep deprived and lately have felt physically ill very often. I get frequent headaches, and this is just making it so much worse. I get so upset over my courses that I begin to feel nauseous. I've briefly considered staying one extra semester to lighten the load, but I really don't have that kind of cash. 

I was the perfect A+ student in high school and I feel like since being in college, and switching colleges (within my university), I'm slipping.

Note: I talk to my professors. In the class I think I'm going to fail, the professor told me today I need to get an 80% on the final to be on the border of a D+ and C-. I could study extremely hard, but realistically I doubt I'll near an 80% (I'd have to practically double my performance based on the past 2 exams) , especially since I'll have two other exams to study for before this one.

I don't really know what you can do. I don't know if anyone can really give me any guidance, or just a cheerful thought. I got back my exam grade today, so the reality is sinking in that I'll have to take this class again and I really don't have the time for it. I'll have to plan the rest of my college life (again, as far as my schedule goes), even though I did this already and said, ""Ok, but this will only work if I never fail a class.""

Tl;dr: I'm not doing great in college and it's becoming both physically and mentally exhausting."
sctbm,0,2012-04-16,I do wish someone can read it. The story of mine that I am ashamed of.,coconutyuan,self,https://www.reddit.com/r/self/comments/sctbm/i_do_wish_someone_can_read_it_the_story_of_mine/,"
Today I really didn't want to go to school because everything seemed so meaningless. The thought of cutting my veins kept occurring to me. I learned from an online post long ago that cutting your veins and soaking in a bathtub with warm water is the least painful way to die. I wish I do not need to live with the guilt and unbearable pain of loss. I wish death is the easy escape. However, I still managed to go to school with 15 min late, because I needed to turn in a take home exam; because I needed to get good grades from my class; because I needed good grades to get a good job; because I needed the money from the job to repay the tens of thousands of dollars my parents paid for my college, and make them happy the rest of their life. I still cannot let down the people that still love me.

 

But with the unbearable pain that I was afraid I was not the girl they thought I was. Yesterday I told my mom that my boyfriend proposed to me, my mom and I were both so excited and thrilled. From my mom's loving and happy expression, I suddenly felt I grew up and I was no longer a little girl, and I was a whole new fully matured woman capable to take responsibility in life. Yesterday at this moment I felt like the happiest woman in the world with my boyfriend getting me the perfect ring I wanted. It was like I finally found the meaning of life.

 

My boyfriend is the nicest guy in the world, even though at the beginning he was flaky; but later on, he fully devoted himself, and I never felt so good with a man. It was like my dream from my childhood came true. I was his princess and he was my prince. I never felt so secure and right with a man, and we could see our future together.

 

Forgive me for not being able to describe in full what happened that made me realize how sinful I was. Last night he checked my cellphone messages and found out I cheated on him when our relationship barely started.

 

I was different at that time and I had my dark side. When I felt depressed about relationships, I looked for attentions from some other guy, even it was just purely physical attention from the person. I was not confident about our relationship at that time, and I thought cheating without emotions involved did not count. Of course, it was just my own utilitarianism to justify my actions at that time. The worst part was not about cheating but lying. Later on in our relationship, he did ask me once if I ever slept with any other guy after we started sleeping together, and I gave him an affirmed ""no"". And I believed all my action convinced him that I would never cheat on him, because I never acted I was guilty. Yes, I never felt guilty about the short-lived affair, because I justified myself that I wholeheartedly loved him, and I was just being insecure at the beginning.

 

Life is so ironic that he found this out the day he gave me a ring. I realized how horrible I was at the beginning. I was not being sincere and I pretended I was someone more mature than I was at the moment. In reality, I was a childish and selfish bitch. Even though he was acting flaky and uncertain about us at the beginning, he was sincere to me and his feeling. However, I was not. I pretended to be the person I wanted to be and allowed myself to have the dark side. The worst, I lied. I was so afraid I would lose him so I lied. Now I realized being afraid of losing him was still a selfish reason to lie, because I was only considering my own feeling that I would lose him. 

I felt my sin. I felt my soul was contaminated. The worst, I never noticed this until now. When I was sitting in class, part of me tried to understand what the professor was talking about; and part of me felt so shameful that I should not even sit in here. I felt I did not deserve anything good in my life, such as my parents, my best-friends, my school, my internship, and of course my loving boyfriend and fiancé-going-to-be. I was too shameful and sinful to tell them I was a cheater and a liar. The easy way out of this mess was so tempting. So I was in class, picturing out the wounds and red streams in the water; somehow, I felt this was alleviating my sin. If I chose the extreme way to show my apology, would it purify my soul? I needed the compatible pain to purify my sin.

 

Then I thought about if I should leave a note and tell my parents and my boyfriend that I love them one more time, but then I could not picture them reading my note. I was already a damned soul and how I dared to add more pain to them? 

 

I should suck my pain up, and do more good in the world as I could. Not as if doing good is a way to wash off my sin, but as if a damned soul just wants to do good in rest of its damned life. How dare I to even think about purifying myself? Suicide was the wrong easy way out. Suicide would be as bad as cheating and lying. They are all the same easy routes that do not go anywhere. I really want to do something good to my boyfriend. But I do not know how. Maybe my disappearance in his life is better for him. Maybe he would take another chance to love me again. If he would, I would do as much as good to him. To love him as much as I can in the best way and the right way as a human can. Not for his forgiveness, but just because this is the thing what I wanted to do the most in the world to make things right. His forgiveness and acceptance would be too much luxury for a person who could never change the past and who could not undo his pain. 

 

I already told him that we could take a break and he could decide what would be the best for him. That was the only thing I could do.

 

Maybe I can start doing good to the other people that love me. My parents. I know that loving myself and being a decent person is the best way to make them happy. I pretended I was. I neither loved myself or being decent. I still do not know if I should tell my parents what happened. I would definitely upset them, and I do not know asking for their acceptance do any good to them.

 

I probably do not need my parents to go through this, because I already accepted myself. I accepted my past wrong-doing. What has been done has been done.  It is true that my own forgiveness was my ultimate reason not to kill myself. I should not punish myself for what was in the past and could not be redone. However, I do not ask for relive from my suffering. Maybe there is no relive. Now I see my suffering as a way to straight things up and being a noble person in the future. Because if I can live with my suffering and do things right, I live through it like a triumph. This is the meaning of my suffering.

 

""We must never forget that we may also find meaning in life even when confronted with a hopeless situation, when facing a fate that cannot be changed. For what then matters is to bear witness to the uniquely human potential at its best, which is to transform a personal tragedy into a triumph, to turn one's predicament into a human achievement. When we are no longer able to change a situation--just think of an incurable disease such as inoperable cancer--we are challenged to change ourselves."" - Victor Frankl



This is from the book my wonderful boyfriend let me read not long ago, because he noticed the saddes and depression and anger that happened to me sometime, which I tried really hard to manage. I never found a book so enlightening, and I believed it cured my depression where the psychologists did no help. This is just one of the numerous things I so deeply appreciate my boyfriend. I cannot find a reason not to love boyfriend now. Yes, even after what happened, even if I was damned."
sca9k,0,2012-04-16,I need your help,Sickdegenerate,Accounting,https://www.reddit.com/r/Accounting/comments/sca9k/i_need_your_help/,"Dear fellow accounting redditors,

I am currently a junior in college and in desperate need of a summer internship for this coming summer. I have tried my est and still have no luck. My gpa is currently a 2.8 and am Having a rather hard time raising it.  If anyone could give me some advice I would greatly appreciate it. 

Thanks, Sick"
sc4da,4,2012-04-16,Should I stay an extra year? ,anonymousperson12345,SBU,https://www.reddit.com/r/SBU/comments/sc4da/should_i_stay_an_extra_year/,"Okay so I am approaching the time when I have to decide what to do for the rest of my undergraduate time. I have the requirements to enroll in the health science program, which is necessary to complete my major. However, the conditions of getting into the program is that I have to graduate right after I complete the program. I cannot stay an extra semester (for this undergraduate degree) to take any more classes - that means no additional minors, majors, anything. (This is what the academic adviser told me. Correct me if I am wrong.) So now I have to think about whether I should delay my graduation for an entire year since the program begins in fall only. I just do not know if it is worth staying an entire year to finish recommended requirements for graduate school which I do not know if I even want to attend in the first place. However, I also feel like I am not emotionally prepared for graduation. On a professional level, I lack internships and job experience. On a personal level, I felt like I never got to truly enjoy college. I am a transfer student so my experience had been mostly stressful, from disliking my old school, the process of transferring schools, and the adjustment period to Stony Brook. Perhaps an additional year could give me some time to actually enjoy college. So in summary, the pros/cons list I came up with for staying an extra year is: 

pros 
- more time for internships/jobs 
- more time to enjoy college
- take the classes I possibly need for graduate school and maybe some other classes I want to take for myself 
- will be much more ready for graduation and the future in general
- can complete a minor

cons 
- $ (The financial aid adviser said I would qualify for a pell grant in my 5th year. However, I am not in EOP so I will not get TAP for my fifth year. I do have plans however to maybe find a place to live off-campus and of course, to get a job.) 
- time 

I am in a pretty tight spot now so any input would be greatly appreciated! Thank you for your time. "
sc0er,0,2012-04-16,LF A place for a couple to stay for the summer ($1800/month max OR us and a roommate friend for $3600/month),[deleted],NYCapartments,https://www.reddit.com/r/NYCapartments/comments/sc0er/lf_a_place_for_a_couple_to_stay_for_the_summer/,"My wife and I are looking for a place to stay for the summer from April 27th (we fly in that evening but we can crash somewhere until May 1st if needed) until about August 24th (we'd be willing to pay for all of August) for some summer internships we got.

We should be able to pay to entire 4 months rent up front and we're hoping to find a place that is either in Manhattan or in Brooklyn (with a relatively fast (30 mins or so) commute to Manhattan (Chelsea area).

If it's just for us, we'd prefer our own place (not sharing) and 1br is fine.

We'd be interested in a place for 3 people since we have a friend moving out for the same duration as us who we'd like to room with. 2br would the minimum in that case, otherwise, everything is the same.

I'd love to have any kind of contact, we're starting to get desperate.

Thanks Reddit."
sf0au,8,2012-04-17,SAS and SQL,upinatree,actuary,https://www.reddit.com/r/actuary/comments/sf0au/sas_and_sql/,"I graduated with a B.A. in Mathematics last May, and since then I've been working hard to start my career as an actuary. I've taken and passed P and FM, and I'm now applying to internships and entry-level positions. It seems a lot of companies would like me to have some working knowledge of SAS and SQL, and I was wondering if any of you knew of any good resources to learn these programs."
sepxq,14,2012-04-17,The Benefits of Personal Networking:  How I Got to Play with a Professional Laser-Effects System While Drunk,Chalcedon,MLPLounge,https://www.reddit.com/r/MLPLounge/comments/sepxq/the_benefits_of_personal_networking_how_i_got_to/,"*I actually emailed this story to my brother a day ago, and I've rewritten it for here (names obscured, mostly, some details added for background).  It's the story of how a good friend of mine roped me into going to a furcon, then introduced me to a really neat person while I was hammered.  [This](http://www.youtube.com/watch?v=1kEjHgFlJ9c) is the best clip I could find of the system I got to mess with, but it really only shows off 1 pattern of the 30 it was capable of, which is a shame.  It's kind of a long ramble, but I've tried to make it funny.  It's also a solid example of:  ""It's all in who you know.""*

It started inauspiciously.  After much gnashing of teeth and a bit of panic, I obtained a job for this summer in Farmington Hills, Michigan (basically Detroit).  The job itself was excellent, having a competitive salary and a generous housing stipend that was to cover the majority of a furnished apartment for myself and the two other interns I was to be rooming with.  The company I was interning with had recommended two apartment complexes to stay in.

I had resolved to go up to the Detroit area to see the apartments for myself before making any choices about where I was staying.  Enter one of my best friends, who I'll call Aestuo.  Aestuo, before transferring to a different college midway through Sophomore year, was my roommate.  After he found out I was going to Detroit, he immediately perked up and suggested a weekend.  When asked why, he simply said ""Oh, a group of us are going to a furcon up there.""

Now, while I love Aestuo to death, and after living with him for a year and a half am no stranger to the furry community, I had no intention of going to a furcon.  However, he won me over with a few simple concessions:

1)  The group would pay for my gas

2)  Staying with the group would drastically cut my hotel cost

3)  He'd pay for my badge

4)  FCN, the con we'd be attending, was well known for the quality of its Saturday night rave and light show

and most importantly 5)  The group would pay for any libations I desired that weekend.

At this point, despite my initial reluctance, what essentially amounted to a weekend in Detroit for $30+food and getting to chill with a good friend that I get to see maybe twice a year was enough to win me over.  I acquiesced and arranged my weekend plans around this con I was now going to.

I'll leave the details of the con itself to the imagination.  Let it simply be known that it was one of the more surreal experiences of my life and that some things, once seen, cannot be unseen. It wasn't a bad time overall, just... a strange one.  But I digress.

Saturday night began as expected.  For those unaware of general con culture, during 3-day cons Saturday tends to be the night things get a hair crazy, when any parties that might happen will happen.  I had begun my Saturday night in grand fashion:  After splitting a bottle of gin with another member of the con group I was with, we traveled over to the main con hotel and proceeded to make our way to a room party.

The room party did not excite... That is, until I found one of the most beautiful sights I have ever laid eyes on:  The was bathtub filled with ice and Killian's Irish Red.  I immediately set up camp and began my grim duty of emptying most of the tub.  About thirty minutes and an indeterminate but gratuitous amount of Killian's later, Aestuo, who is forever sober, came up to me and nudged me:  ""Chalc, we've gotta go.""

I had no intention of leaving this *gorgeous* monument to debauchery.  However, my somewhat-slurred objections died on my lips as he pointed out a rather irritated looking guy standing in the corner and whispered: ""That's the host.""  Said guy was giving me a glare which very clearly translated to:  ""You have 10 seconds to excuse yourself or be forcibly excused.""  After looking from him to the impressive collection of bottles I had created, I took the hint and abandoned ship with Aestuo.

Feeling a bit sheepish, a bit like an ass, and a bit too hammered to really continue drinking anyway, I quickly realized that I was being led to the elevators by Aestuo.  Upon inquiring where we were going, he simply responded ""We're going to meet Fizz.""

Over the course of the weekend, I had discovered something:  Aestuo spent most of his time at cons attempting to meet people he found interesting, or that were in senior positions at the con.  It was why he was able to get me into the con on the cheap (in with the administration), why he was on a first-name basis with Kage (who is apparently a big deal among furries), and why he was able to introduce me to ""Fizz,"" who was apparently in charge of lighting and effects for the rave currently thumping along in the main ballroom.  Fizz also apparently built custom laser and lighting show systems for places like Disney's park in California.

Down on the main floor, I was taken to the bar and lead to a built man with a blonde mohawk, who turned, cordially greeted Aestuo, and introduced himself to me as Fizz.  As we began talking, I quickly remembered two things about myself:  I really, REALLY like talking about things in my field, and alcohol makes me extremely chatty.  These two things combined led Fizz and I on a winding conversation covering topics from Fast Fourier Transforms of laser waveforms, efficient assembly for TI C6000 series DSPs, using Bezier curves to track paths for individual lasers in systems to follow, and all manner of technical jargon relevant to the design of the circuits and programs that comprise lighting systems.  I was actually fascinated that I was able to lucidly discuss things I hadn't dealt with in years while occasionally shaking my head to keep Fizz from completing the mitosis he appeared to be attempting.

After something around forty minutes, Fizz leaned in kind of close and said:  ""Do you want to go to the booth?""  My heart skipped a few beats:  ""What booth?""  Fizz leaned in a little closer:  ""The booth where laser system's control panel is.""  At this point, I held in a bieber-fan-esque squeal of joy and just nodded dumbly.  I was beginning to sober up, and as we wandered towards the sound of pumping bass it was difficult to suppress my mounting excitement.

Once inside, we quickly arrived at a simple control setup:  There was a touchscreen with about 30 different patterns displayed, and a basic control board with 8 sliders and a number of buttons.  Fizz explained that this was the previous version of the control software and upcoming versions would look better.  He then sat down and showed me how it worked:  Select a pattern, and the sliders automatically move to default locations on the board.  You could then modify things such as pattern size, speed, color, and intensity with the sliders, and using one specific button you could pause a pattern for effect.  After explaining the system and letting us watch him work, Fizz looked at me and said:  ""Hey, the next set is an Electro-House set.  I'm going to go back to the bar.  Do you want to take the system for it?""

My jaw dropped.  Yes.  Yes I did want to take the system.  I had sobered up enough to grasp it adequately, and as the set started, I settled in for what would become one of the best hours of my life.  I was pretty awful for about the first ten minutes, but I quickly got in the groove and made some effects I was extremely proud of.

As the set wore down, another person who was *actually* on the AV staff came and replaced me.  I wandered back to the bar where Fizz was, thanked him, found Aestuo, and retired back to my room.  Sunday rolled around, and after I felt well enough to be vertical I made sure to track down and thank Fizz while sober.  We had a short conversation involving swaps of contact information, then went our separate ways.

The rest of the weekend went down as expected:  I had to leave early and drag a few unwilling people from the con group to my car to leave.  I drove the 4 hours to drop them off, and then the 3 hours to get back home in time to make a meeting with a project group and client.

I don't really think I'll be able to top this past Saturday for a while.  It was an absolute ball.  Either way, that's the story of how a buddy of mine knew some people and got me an in to do some really cool stuff.
"
seatk,10,2012-04-17,Favorite city in Brazil,christ3ln,Brazil,https://www.reddit.com/r/Brazil/comments/seatk/favorite_city_in_brazil/,"I might be doing an internship in Brazil this summer but I'm not sure which city I should pick.  Most of my options are big cities: Santiago, Rio, Cao Carlos, Franca, Belo Horizonte, Joinville.
What are your favorite cities in Brazil?"
