bhuw7,9,2010-03-24,"Reddit, what advice do you have for a poor college student?",marylandication,self,https://www.reddit.com/r/self/comments/bhuw7/reddit_what_advice_do_you_have_for_a_poor_college/,"Welp, I'm feeling a little bit overwhelmed with my life lately, and I thought I might as well ask Reddit, since I'm kinda' running out of ideas.

Here is my situation:
I'm a full time student, aiming to graduate at the end of the Fall 2010.  The problem I've run into is that I'm soon going to be homeless and broke.  The context is that I've been living at home, paying (cheap) rent to my mom, who is also on harsh times.  She was told today that her job is being terminated in June.

I make about $120 a week working (during the semester).  I spend the rest of my time (except for one day a week that I take to myself) in class, doing homework, or sleeping (no girlfriend, gave up friend time about a month ago because I've been too busy).  Given my mom's situation (is it relevant that she's a widow?), I don't have a co-signer for any loans, as they won't accept her.  Most of my money has been going towards my mom, gas, bills, and the household that's going to disappear by the end of the summer at the latest, due to foreclosure (pretty sure this is inevitable at this point).

I've been working my dick off trying to get any kind of internship (computer science major, if that makes any difference) that might be able to offer me more than $10 over the summer (I guess it also needs to be local to be effective, unless they offer me a stipend), but if that doesn't happen, that's $400 a week over the summer, working full-time.

I will need at least $1700 for tuition in the Fall (this is after the Pell Grant and government loans I qualify for, that's also not including books).  I have (after paying bills that I currently owe) about $1000 to my name.

All those numbers put together, I came out with:
-Roughly $120 a week (probably less on some weeks, as I'll need more time for school once finals come around) for the next 8 weeks.
-Roughly $400 a week for about 13 weeks after that (that takes me to the end of summer, and the beginning of Fall semester; tuition will be due by this time)

Coming to a grand total of about $7160, with the money I have now.  Take away the $1700 for tuition, that's about $5460 total earned by September, assuming no emergencies.

Now, if everything goes 'okay', we'll be able to live the same for at least the next 8 weeks, so I can come to the beginning of June with about $1300 (the money I have now, added to the maximum money I'll earn each week, subtracting the minimum amount I contribute to the household and bills) at the start of summer.  At this point, I feel as though I need to be ready to be kicked to the street (but what about my mom and siblings (did I mention siblings?) you ask?  I have no freaking clue, but there won't be enough money from her retirement fund to support me).

Here is where I'm starting to feel screwed.  Walking into June with ~$1300 to my name, with a job paying $400 a week over the summer, I'm not sure how likely it is that I'll make enough money to last me until December.  I'll need to pay for rent, food, bills, and all of that crap by myself.  Assuming I can keep all that to ~$1000 a month (need to find somewhere to live that can make this possible) that leaves me with ~$2200+~1300= ~$3500 at the end of August.  After tuition, that leaves me walking into the Fall semester with ~$1800.

~$1800, with however much money I make each week (let's say ~$120 to be consistent?) to make it to December.  I don't know wtf I'm supposed to do.  Keep in mind, this is all best case scenario (aside from 2 things:  Being able to live in the house a little longer than June, and not getting an internship/better paying job) excluding any kind of emergency (I'll no longer have health insurance, car accidents, etc).

Other points of interest:



-Foreclosure has been creeping on since last year, I don't think we can we can keep it at bay much longer with this situation.

-I'm currently filed as a dependent on my mom for taxes (for some reason this makes my tuition less than if I were independent?  I looked into this a while ago, I'll check again with the new circumstances).

-I guess I could sell my car, that would cut down the cost of living with the gas and insurance bills gone, but its KBB value is only ~$1700, and I'm not optimistic about a buyer.  I could try anyway?

-Military isn't an option; don't meet qualifications, apparently.

-I could start pawning some of my belongings, but I don't have much.

-I can't work more hours during the semester; budget cuts or some bull crap.  Summer won't be a problem for work hours though.

-Maybe I could get a night job over the summer?

-Mom does not qualify for cobra (I think that's what it's called?  The health insurance thing?).  I'm giving up medication because of this, but I'm pretty sure I can get by without it.

-No rich uncles.



TL;DR:  I need to live from the start of September until mid December off of ~$1800  plus ~$120 a week.  How do I do it?

EDIT:  Thanks for all the advice, guys!  A lot of good tips on how to not go hungry...

"
bi3ed,0,2010-03-25,Networking Guru's Please Help!,swaink,programming,https://www.reddit.com/r/programming/comments/bi3ed/networking_gurus_please_help/,"Im a college student working as a programmer on an internship. I want to get my CCNA. I have no money, but a fair amount of free time.

What are some good FREE resources to help me prepare for the CCNA? And in your opinion will these resources be enough to pass the exam with some hard work and dedication?

I know torrents exist.
what books would you recommend?"
bj6tx,55,2010-03-27,"Reddit, I want to share my recent victory against rude cops with you!",bonesapart,reddit.com,https://www.reddit.com/r/reddit.com/comments/bj6tx/reddit_i_want_to_share_my_recent_victory_against/,"Here's how the story goes:

On Tuesday, I left my phone behind in a diner. I searched high and low before returning to the diner, where the waitstaff informed me that no one had seen it.

I have an iPhone (which I've always kept locked) and I'd enabled GPS tracking after reading an article in our local paper (the TBT) about a woman and daughter whose phones had been stolen and later retrieved using Mobile Me network and iPhone GPS. So I opened up the page, and there was my phone, way across town by the university in a place I had NEVER been before.

Fuck.

So I call my mother and ask her to escort me to the police station (it's in a BAD area and I'm a 115 lb 5'2'' woman). I walk in, explain everything to an incredibly bored looking female cop, and she interrupts me to say, ""We don't DO lost phones.""

We don't do? This isn't a fucking hair salon, it's the police. I held my tongue and informed her that I had the LOCATION of the phone, but she said, ""I'll get a supervisor, hang on."" I hear a brief interchange between her and another male cop, and he says, ""Isn't there, like, an intern for this?"" before they go off together.

Hour and a half, two hours go by, and I turn to my mother and say, ""I don't think that the supervisor is coming."" She agrees and we leave. I promptly lose my shit.

So I came home, wrote a polite-yet-angry letter to the TBT about the incident. [Here is the link](http://imgur.com/xV7tZ.jpg). I made it into an image so my name wouldn't be attached. They printed it on Friday.

At around 3:00PM Friday, my mother received an apology from a Major Someone (I'm sorry, I cannot remember his name for the life of me) and they assigned Detective H. to retrieve my phone.

I now have my phone in my possession. It was in a city two hours south, stolen by the girl who waited on my table. My phone was renamed ""Twan Phone."" I have no idea.

I really felt helpless after I left the station that night. When I wrote that letter, I wasn't even sure it'd be read. But thanks to the TBT bad behavior was corrected, and I've definitely learned that the pen is mightier than the sword.


TL;DR : My phone got stolen, the cops treated me like shit and refused to help though I had a GPS reading of its location, I wrote to a local paper, they published it, the cops apologized, I have my phone back now."
bjfpd,5,2010-03-28,"1st Gf, 4+ years together, help!",pompo,relationship_advice,https://www.reddit.com/r/relationship_advice/comments/bjfpd/1st_gf_4_years_together_help/,"22 male here.  I've been in a 4+ year relationship with my first girlfriend.  It's been a little weird from the beginning.  I liked her a lot in the first few years but she didn't want some people know about us.  We don't communicate very well because I think we are afraid of hurting each other's feelings (maybe it's just me).  It's gotten a bit better recently.  This year I went on an internship in another country.  Before going I broke up with her, but we got back together because I though I would not be able to meet someone who likes me as much as she does.  We actually broke up an got back together again not too long ago.  Long distance is killing it for me.  I'd like to meet other people. I think the fact that she is my first girlfriend is making it hard to decide what I want.  I don't want her to be my only girlfriend but on the flip side I still have feelings for her.

I think either way feelings are going to be hurt.  I think that is one of the reasons I got back together with her because I saw how sad she was when I broke up with her.

Anyway, I'm a little confused on what to do right now, any help would be grateful."
bjqhc,0,2010-03-29,I want to set up a NoSQL database...where to start?,knawlejj,programming,https://www.reddit.com/r/programming/comments/bjqhc/i_want_to_set_up_a_nosql_databasewhere_to_start/,"The small agency I intern at uses ColdFusion and MS SQL for everything and I want to write a few small programs for my own learning purposes.

Is there any way to incorporate ColdFusion + a NoSQL database yet? I just don't know where to get started."
bkggm,3,2010-03-30,IAMA new ibm intern AMA,ZZtop84,IAmA,https://www.reddit.com/r/IAmA/comments/bkggm/iama_new_ibm_intern_ama/,(except how much i'm getting paid). I've just been selected to work at IBM this summer as an intern and I'm very excited! Does anyone have any comments or wish to share some insight with me that I should know?
bku4t,12,2010-03-31,DAE in school get sick and tired of employers exploiting interns?,asdfqewr,DoesAnybodyElse,https://www.reddit.com/r/DoesAnybodyElse/comments/bku4t/dae_in_school_get_sick_and_tired_of_employers/,"Granted I've been in and out of school a lot, but the last 3 years it seems like thats all the work I can get. I've interned or, as I put it 'contracted as an intern' my last 4 jobs. I usually end-up leaving for all the same reasons, I finished the project I was hired for, there is nothing left to do, and they won't give me raise.

I'm about to graduate but I still think it's ridiculous how employers take advantage of students since I know the work I'm doing for them (mostly web development/design) is worth enough to make a living from, so it's like I'm stealing a job or contract from some future professional me with a degree only because I can only work 3 days a week, get labeled as a student, need more *experience*, and am apparently unqualified for my output since I lack a degree."
