sn4iv,1,2012-04-22,Summer Project,[deleted],LowtechLiving,https://www.reddit.com/r/LowtechLiving/comments/sn4iv/summer_project/,"I'm a programmer.  I spend all of my time on the computer.  I work on the computer, I play on the computer, my hobbies are on the computer.  Ugh.

I'm glad I stumbled on this subreddit, perhaps I've found some like minded people.  This summer I have a wonderful internship programming, so I'm going to spend all of my days programming.  It's a start up and those could be long days.  My plan is to leave my laptop at the office and not even have a computer at home anymore.

For me it's about forcing some boredom into your life. With the Internet and TV I feel hyper stimulated all the time. To find entertainment I merely collapse into my chair, click a few buttons, and begin passively consuming.

Without something neurotically occupying my attention (ie internet) I quickly become bored. When bored I then proceed to think through everything I could possibly do, prioritize the ideas, and choose one to act upon. Even if I end up watching a television show the important thing is that I chose to watch that specific show rather than passively accepting whatever was being played at the time. I have not had TV in a long time, so that's not a problem, but whenever I've momentarily had no internet I find I eat better, exercise more, have a cleaner house, and knock more things off of my to do lists.

So this is my summer project.  Does anyone have any similar plans?  I'd love to use this subreddit for updates and progress updates.  I will probably have to go to the library to access Reddit so I'll write my posts before hand.  Maybe we can make some collective goals?  I have books I want to read, cafes I want to lounge at, friends I want to connect with, and more.

I'd love to hear your summer plans below:"
smsac,3,2012-04-22,"Although anecdotal, here's my own success story (actually, a collection of mini-successes wrapped up in a series) to get you going.  I'm not a particularly talented individual, either.  (Long)",BranchedOut,GetMotivated,https://www.reddit.com/r/GetMotivated/comments/smsac/although_anecdotal_heres_my_own_success_story/,"I've gotten motivated over the past year, and I've had wondrous results.  I'll begin my story in November.

I was going to a friend's party.  I went to go put on one of my favorite shirts.  *It didn't fit*.  My weight rose to 250 lbs.  At that point, I said, ""Time to do something about this.  Now.""  

Instead of planning a weight loss routine, planning this, making schedules for that, I just started eating better at my next meal.  I didn't change what I ate, I just ate less.  I even went OUT to eat at a Mexican restaurant.  How did I eat healthier?  I just ate half of my meal.  That then made the most delicious, wonderful smelling lunch the next day.  I pretty much calorie counted.  Still ate terrible, but just a little less.  Surprisingly, the weight just melted off.  Over the course of 3 months, I had dropped 20 pounds.  Just from counting calories.

New Years came around.  I made the resolution to lose weight like normal, right?  

Wrong.  I decided the best to way derail my weight loss was to make it a goal.  People ask me, ""How many pounds are you trying to lose?""  I respond, ""Iunno.  I'm just trying to get fit.""  This nonspecific thing I was going toward (it may be a goal, but I'm not calling it one) was the key.  

I bought some new clothes from a thrift store.  Best purchase?  A suit.  For $5.  I then bought a host of nice button-up shirts, and slacks.  They do wonderful things for your appearance.  I'd imagine you could go five thousand miles in any direction from where any of you are, and you'd be hard-pressed to find a girl that doesn't appreciate a man that dresses nice.  

I took a ""Social Dance"" class at beginning winter quarter.  I wanted to be active.  Well, the class wasn't as physically intensive as I wanted it to be, but I did learn a few good dances.  *And* it wasn't that bad that there were lots of attractive gals in there.  I took this opportunity to shamelessly flirt for the sake of flirting.  Got some numbers.  But, I'd say take the class if you ever find one.  I haven't met a girl yet that didn't appreciate a fella who knows more than the ""bump and grind.""  

Spring quarter, I signed up for a swimming class.  It'd be more active than dance!  AND I WAS RIGHT.  Every day we swim until we're out of breath.  And if anyone ever tells you that you can't get muscles from swimming, **punch them in the throat.**  I'm toning up like a sonofagun, and I keep finding new muscles that are getting big enough to notice.  I'm now 210 lbs, 40 pounds lost, and a lotta muscle gained.  

Now, all the while this was happening, I had an internship opportunity going.  A company was at my school's career fair, and was looking for interns.  I'll make the story short, and let you know the company took a month and a half to get me to an interview, but never messaged me back or anything if I got the internship or not.  After realizing they didn't want me, I went to my school's career center website.  I applied to everything with the word, ""IT"" in it.  I just middle clicked everything, went to the tab, scrolled down, and hit ""apply.""  Days later, I get an email from a company that wanted to speak to me that day.  Long story short, I went from not getting an internship in a small town in Louisiana (where I'm from) with nothing to do, to a **Full time job, with really awesome benefits, and a higher pay, in *Washington, DC* **.  Higher pay, I get full insurance coverage, and it's in a city where I'll have a million things to do!

But it doesn't stop there.  From November, my confidence also rose because I decided I wanted to be confident.  Confidence is a really attractive trait, physically and mentally.  I thought I was awesome, acted like I was awesome, and you know what?  People thought I was awesome.  It's a self-feeding cycle.  I just got more and more confident, and looked and felt more and more awesome.  I was talking to very attractive women in a way that seemed I could get them easily.  Although I'm still quite flabby (I'm in an awkard stage between fat and fit.  There's big muscles showing, but most of it is covered by a layer of fat, so I just gotta burn it off and I'll be goooood), I talked like I was the most attractive man on the face of the earth.  And it works.  Next weekend, I visit my hometown.  There, I have a date with this Philipino gal, who's just ferociously good-looking.  And she's really sweet, too.  She can really get any man she wants, and she's a good person, so she deserves a really good guy.  Unfortunately, I'm moving, so I'm not doing anything to get tied to anywhere.  But dates are fun.

**Do you want to know how I did it all?**
As cliche as it is, I followed Nike's slogan of ""*Just Do It*""  Really.  I didn't worry about small details, or anything else that would slow me down.  I wanted to lose weight, so I did.  I wanted a date with a gal far prettier than most guys my appearence would date, so I did.  I wanted a job, so I got one (but luck was a major contributor to this one.)  I wanted to be confident, so I did.  Just do it.

**TL;DR**:  Lost weight, got a job in DC (I'm a country-bumpkin from Louisiana), became confident, got a date with a girl far prettier (and a good person, too) than guys my appearance would date.  If I want to do something, I do it.  "
smhvz,4,2012-04-22,"Gf is depressed, doesn't know it.  Do I stick it out or cut my losses?",NightWalker75,relationships,https://www.reddit.com/r/relationships/comments/smhvz/gf_is_depressed_doesnt_know_it_do_i_stick_it_out/,"TL;DR Gf probably needs to see a psychiatrist, but won't because she insists that she don't need it and that its for crazy people.  Her depression is ruining our relationship and draining the life out of me.   Idk what to do.  

GF Amber 25f and I 27m have been going out for almost 2 years. I used to love this girl alot, enough to tell her that I would be honored to marry her in the future and start a family as well.  She was everything I was looking for and appeared to be ""the one"".  But recently that girl serves only a figment of my imagination and has been replaced with what seems to be like a truer version of the ""real Amber"".    

We were connected in every which way.  Our sense of humors were almost identical and till this date she is still the coolest, most laid back, funniest chick I know.  Sexually we couldn't keep our hands off of each other.  Compliments were both common and easy to come by.  Expressing ourselves, feelings, and deepest thoughts couldn't have come any easier.  We were open about everything.

But now... now shes confused.  Idk what she expected to happen to her life after college, but all she really wanted to do was travel and see the world.  She got a chance to do that when she got to do a 4 month internship in Switzerland last summer.  Let me also mention that this was 4 months after I had moved back to Hawaii after living in California for the last 4 years, just so we could finally be together after doing long distance for 6 months.  So understanding this was something she had to do for herself, i agreed she should go and that I would stay with her parents for the time being.  I bit my tongue and endured the 4 months that she practically forgot about me and let the relationship fizzle away.  She would later admit to me that if I hadn't worked so hard at our LDR that it probably would have ended while she was in Switzerland.  

Well ever since shes gotten back from Switzerland, Nothing else ever seems to make her happy anymore.  She came back home weighing 20 lbs heavier and she lets that take a big toll on her self confidence.  Before you go off and determine the problem right there, I personally find her more attractive now, or at least don't find any less attractive.  I tell her I like it, I compliment her on her body at least a few times a week and would tell her more but I know when to draw the line of overdoing it.  We actively work out together.  I signed her up under my 24hour membership program, we go to sissy turbo kickboxing/yoga classes together.  I go hiking with her, we do crossfit training, we go on runs around her neighberhood, we go to the beach, and were even planning to go snowboarding in Canada in May.  So I do my part in trying to help her feel more confident about herself physically, even though I love her body as is. 

Shes worked 3 different jobs since being back home and quit one with a major career advancement within a month, allowing a well paying management position to slip right through her hands and opting to work for $12/hr insead of a 55k/year salary.  Her other job (I should also mention is her favorite) is buying back gold at a kiosk at a grocery store.  Its a dead end job, she knows it, but wants to put in full time hours here because she can just relax and not really do anything all day. This is all understandable to me though, finding the right job is no easy task and takes time.  Im also allowing her time to find her base and open her wings.  

But through all this she has lost sight of the girl she once was.  Or pretended to be for me, at this point im not really sure what to think.  

The only thing that is ever on her mind is how shitty life is.  How her schooling screwed her over with grant money going towards her masters degree (which she still cant make a decision if she would with or without the money).  Or how how bad her job is and how it makes her sick, to the point where shes gone to the ER only to have the doctors say shes perfectly fine.  Even after multiple visits to her regular doctor, they couldn't find anything. She was anxious and freaking about if she was termially ill and the doctors can't find out whats wrong with her.  Her father and I would eventually get around to her that she needed to calm her mind down, relax, and learn breathing exercises that would eventually eliminate all her heart problems.  

But weeks after quitting the job that made her sick in the first place, shes still feeling the after effects of the chemicals she had to work with.  She gets dizzy and nauzea spells daily.  Never to the point where she is throwing up or really ill, just on and off slight dizzyness.  But enough for her to tell me how irritating is... not at the time, but days later when I try to make passes at her and tells me how shes too sick to do anything.  When minutes before we could be playfighting and laughing it up like nothing was ever wrong. 

She is no longer physically attracted to me, nor has any desire or need to be please either of us sexually.  Her libido is now non existant.  I have talked to her about this numerous times and she says she will try to do better, but in the end she can't even fake it anymore.  Through this grueling process I have completely given up on trying to get physical with her.  I have come to terms and accepted that I will probably get laid once a month now if im lucky.  I have a strong libido and this was not something I wanted to do for any other reason but trying to make this relationship work.

After a recent fight she has even admitted that she does not put in her fair share of effort into making this relationship work.  

But heres the problem, This type of thing happens everytime we fight.  She will fix the problem for a few days or so, but will fall right back into her old ways shortly therafter.  Until we're back at square one.   IM tired of all the work im putting in and getting the run arounds.  She won't listen to me or take my advice on mostly anything.  She now makes me feel small and even worse about myself because she has become so condiscending.  Can I work with this girl or am I headed down a path going no where?"
smg3a,3,2012-04-22,[FOR HIRE] UCSD Computer Science Undergrad,[deleted],SanDiegoJobs,https://www.reddit.com/r/SanDiegoJobs/comments/smg3a/for_hire_ucsd_computer_science_undergrad/,"I'm a 21 year old Junior studying Computer Science at UCSD looking for an internship or summer job related to the field. I am most likely going to be located in La Jolla for the summer (and the next school year), but I'm willing to travel/locate for the position. For my complete resume visit http://CorbinLewis.com/resume. I'm skilled in Java, can work in C, C++, and Python, and have years of experience with Linux. If there are any questions please feel free to ask here or at CorbinLLewis@gmail.com"
smexf,1,2012-04-22,"broke up a few months ago, still feels like i lost a best friend, need some help",[deleted],relationship_advice,https://www.reddit.com/r/relationship_advice/comments/smexf/broke_up_a_few_months_ago_still_feels_like_i_lost/,"first time actually posting on reddit.  my parents and some family know most of what i went through, but i haven't really talked much with anyone else yet.  it might be a long read and i don't know if a lot of people can relate to it, but any advice/comments are appreciated.

so i (an american) met a girl while studying abroad last year in asia.  she's now 26 and i'm 23.  i found out she was dating an american guy who was an english teacher over there, and i was happy for her.  but after a while she starting asking me things like ""is it true in the US boyfriends don't have to buy anything for their girlfriend's birthday?"" and telling me he wouldn't let her hang out with certain people without his permission.  just an overall dick, and the thing is she's the type of incredibly kind person who didn't understand that she was being used.

so after talking with her some more, and hearing that it was kind of getting to physical abuse, she was convinced to break up with him.  i was so happy for her letting go of that situation, and even though at this point i started alluding to her being someone i would like to date and sensing that she possibly felt the same way, since i was going back to the US in two months pretty soon i didn't want to tell her anything.

in late august after getting back i finally asked her if she'd like to have a long-distance relationship with me, and it made her so happy.  normally i wouldn't recommend having a relationship like that, but for our personalities and future plans being so similar i think things can work.  and i hear stories about people cheating and stupid things like that but we were in love and i don't think either of us would ever be the type of people to even think about that.  i also wanted her to know i was serious about this since her last guy wasted her time, so i promised her that if things worked out that she would definitely be the type of person i would consider marrying.

so things were great for a few months.  i'd wake up every morning, talk with her online, chat on skype sometimes, sent letters/gifts back and forth occasionally.  we got to know each other pretty well this way, and i've never been so interested in hearing what a girl had to say every time we talked like i did with her.

but she also also went to school/work a total of 80 hours a week.  i was also pretty busy with school, upcoming graduation and an internship too.  and i didn't realize how difficult it would be not getting to be physically close to her, even when i studied abroad i gave her a hug maybe once since we were only good friend then.  i'm also a virgin, so i brought up the topic of sex sometimes which made her uncomfortable to talk about.  and looking back on things i could've easily waited to talk about some of that but i acted immaturely.

in late january, with all of those little stressful factors involved and a small misunderstanding of her thinking i talked with a mutual friend about some private stuff, which i didn't, but it's somewhat understandable she thought that.  she tells me it's better if we end the relationship.  i ask if we could work things out, saying id come visit her or vice versa in march, but she wasn't interested.  i'm pretty sad/upset at that point and i politely tell her that i can't stay friends and never want to talk with her again even though i respect her as a person.

and i thought that would be it, like i would just forget about her in a few weeks and move on.  but it's not that easy.  she was a pretty important person in my life for almost a year, and even the slightlest little things bring back memories of her that i can't really avoid.  i tried emailing occasionally without making myself look too desperate, but she didn't want to give me another chance.

in march i was back in asia for a week and while there i decided to go to her house and drop off a package.  hopefully i could at least talk with her in person again.  but because of an unknown law about not visiting a person's house after 9pm without prior approval, i was taken into a cop car right after i got to her house.  the cop goes into her house and talks with my ex's mom, who doesn't like me at this point, which only makes things worse.

at the police station i'm interrogated by two police officers, they couldn't speak english to add to that.  at this point i'm thinking i may go to jail so i'm trying to explain my side of things.  they ask to see the gift i brought her, a few small items and a letter i wrote.  at this point after my explanation he's more understanding but as soon as he reads the letter he starts crying, and i'm crying at this point too.  so he understands things a little better now and we work something out where he'll let me go without any questions asked if i just sign a piece of paper saying i won't contact her by email, in person, etc again.  he rips off a piece of notepad paper and i write that i won't contact her, sign my name, and put a fingerprint on it.  we say some sorrys, thank yous, and i go back to the US a few days later.

that's a condensed version, and i know it's a little long just for some context.  basically i'd still really love to see her, but i guess legally i'm not allowed to contact her, maybe indirectly through a friend but even then in her mind the way she thinks of me now she probably wouldn't be willing to meet.  i'm not even concerned about dating her or anything like that, just getting a chance to talk with her in person for a little bit would mean everything to me and it may help her too.  i'm not sure how else to deal with it other than talking with her.  i have plenty of money, let's say $10,000 i could somehow devote to this, free time, and my life in general is pretty good.  it's just this one thing that i'm having a really difficult time dealing with."
sm1z3,3,2012-04-21,Hardware for a custom desktop,link23,linux4noobs,https://www.reddit.com/r/linux4noobs/comments/sm1z3/hardware_for_a_custom_desktop/,"Hello all, 
I;m a CS major just finishing up my second year, and this summer I've got a lucrative internship, so I'm planning on building my own rig for fun with some extra cash. (I'm just finishing the intro Systems class, so that's probably why I'm so gung ho for this idea.) I will definitely be running linux (probably Ubuntu, although I'm open to suggestions) 99% of the time. So, my questions are thus:

* Are there any brands that are particularly linux friendly while performing well?
* Conversely, are there any brands I should steer clear of?
* How difficult is it to set up my linux so that I have all the boot/os stuff on an SSD, while all the data is on an HDD?
 

I think that's it for specfic questions- but any and all suggestions and comments are welcome!"
soord,2,2012-04-23,Pent up disappointment- released!,YumYumBlueGrapes,self,https://www.reddit.com/r/self/comments/soord/pent_up_disappointment_released/,"I have one goal.  After living through the grotesque transformation of the girl I loved into the controlling imitation of her mother, I decided to chase my dreams.  Family vacations to Utah and Colorado got me obsessed over the area, you could say.  Everything I love doing is out there- in addition people who shared my interests and were “like me”.  With a hollow heart I began striving for that destination.

Getting a degree in chemical engineering was the easy part.  I packed on internship after internship and sacrificed personal time for resume building projects.  I became the envy of my peers as I was not as intelligent but had a chip on my shoulder from having work experience.  I first decided that graduate school in Boulder would be a great option- but when a supervisor at one of my jobs failed to write a recommendation letter I dismissed the option of going for chemical engineering graduate school.  I wanted to work.  

I somehow became one of many people being considered for a job in Denver doing natural gas.  I put up with a two day interview process to finally be offered a job in Midland, TX while two of my classmates got jobs in Denver.  My jobs.  I tried going to Midland, and the socialite in me could not take the isolation.  It was good money, though, but the isolation got to me so I decided to not take the job.

Two more job options later, and I’m in a city only two and a half hours from my home town.  Things went well in my new field of Environmental Engineering- I grew to like the field.  However, the last four months of living in this area have gotten me bummed as I became less and less used at my job, more and more worthless.  Still no girlfriend, I had burned bridges with some friends and had failed to find enough more friends in this city, and most importantly, no Colorado.  I tend to think of the girl that started it all.  I tend to think about taking her back- as she is still single.  I would be miserable, but not as miserable as now.  I become angry at myself very quickly because I look at how my life is now and how I enabled it to become.  What if I had gotten the job in Denver?  Fuck that, out of my control.  My self-esteem has plummeted but yesterday I started applying for new jobs, out west.  The graduate school application for Denver is due in October- funding in July.  

It’s all a fucking game, hopefully I get lucky this next round.
"
