dzek4,4,2010-11-01,"Reddit, I've fluctuated with my weight and eating habits all my life. Can you help?",tazzgonzo,Fitness,https://www.reddit.com/r/Fitness/comments/dzek4/reddit_ive_fluctuated_with_my_weight_and_eating/,"First of all, hi! I’ve read up on the FAQ so I think I’m ready to post here for the first time.

I’m currently a 26 yr old male, 6’1”, and weigh about 235 lbs. 

Growing up, I was always on the bigger side of things. My parents basically let us eat whatever we wanted, whenever we wanted. When I was 17, I was 6’1” and weighed 255 lbs. But because of the clothes I wore and my general body frame, it never looked like I was that big. 

The year before I went to college, I decided to do something about it. My parents had bought a treadmill so I ran an hour per day (burning through complete seasons of Buffy and Angel) for about 6 months. I ate less and was able to bring my weight all the way down to about 180. 

I entered my freshman year of college at a healthy weight with semi-healthy eating habits. However, that’s when I started binge eating. I didn’t make many friends my freshman year so I stayed a lot in my dorm room playing video games and studying. I joined the campus gym, but was never really consistent about it. I always had a “new” workout to try out, which I’d quickly get bored of. Whenever I felt sad or just bored, I’d binge on fast food or whatever was available. I’d feel guilty about it the next stay, but then I’d just binge again. 

I guess my mental state was “f*ck it, I already lost, I’ll start fresh next Sunday” but we all know how that goes. I was either on full on eating like crap mode or hardly eating/ exercising a ton mode. 

This, obviously, caused my weight to fluctuate all throughout my freshman year. 

Ever since then I’ve been stuck in this all or nothing approach to healthy eating and exercising. Most recently, last year, I joined a Gold’s Gym near my work and ended up paying a personal trainer (it was the only way I remained consistent…knowing that I PAID for someone to hold me accountable) for 3x a week gym sessions. I lost a good amount of weight and looked and felt better for about 5 months. 

I had to stop the personal training due to, well, it being expensive, so I cut down to once a week sessions, which failed miserably. 

Around this time, I started to make a lot of unhealthy eating choices. I always put off exercising and eating right to “next week” or “next month” and gained back the weight I had lost and then some. 

Back in June of this year, I got fed up with being so unhealthy (this is a re-occurring theme, btw) and joined an all Paleo, all Crossfit gym. I thought that I had found a perfect fit for diet and exercise. I kept up with them for about 3 months. 

My job currently has me traveling a lot (you can see where this is going) so I would be out of the gym for maybe a week or two before I went back. During these trips, I would somehow justify that eating unhealthy was fine because I would make up for it when I got back. I even packed gym clothes that went ignored. 

When I got back to the gym after these trips, I’d feel ashamed and didn’t want to return the next session because I felt that everyone was judging me, or that my performance had slipped. I stopped going because I, for some reason, thought that I needed to eat healthy and get back into my normal habit before I went back to the gym. This didn’t happen, and I kept making unhealthy choices. 

During this time, my significant other’s sister had just returned after a summer internship in New York (she lives with us). When she returned, she was almost unrecognizable as she had dropped from 250 lbs to 195 within 10 weeks. She had taken up running every day (1 hr) in the streets of New York and stopped eating so much food. 

Inspired by this, I took to running the streets of San Francisco on a daily basis. I started on September 19th and ran almost every day until October 16th. During that period, I ran a total of 96 miles and lost some weight. I also threw in 100 daily crunches and a minimum of 20 push ups. I canceled the Crossfit gym membership, because I wanted to lose weight before going back. I realize that's a stupid excuse, but I'm incredibly self-conscious about how I look in a group fitness setting. 

Even with a week business trip, I managed to keep up the workouts (though I did slip on the healthy eating). 

Now I did mention the cyclical nature of my eating/working out and this is where I’m currently at. My brother and his family recently flew down to visit for two weeks. They stayed at my parents’s house in San Jose (I live and work near San Francisco). Almost every day and every weekend I spent going to go visit them and driving back to San Francisco to spend the night. 

In my head I thought, “ah well, their visiting, so I’m going to give up my workouts and eating healthy and make up for them when they leave”. So during those two weeks I ate. I ate a lot. I think I’ve gained all the weight I lost from running already.

Today I said goodbye to them (they leave tomorrow). Know what I did to celebrate this? Ate tons of Halloween candy because “tomorrow I’ll start the running and eating healthy again.”

Here’s where I come to all of you. 

When I get back “on the wagon” tomorrow, I want to be able to make it a permanent thing. I’ve never had a healthy relationship with food and dieting for a period of time longer than 6 months. I don’t want to stumble and fall into this cycle again, and I definitely don’t want to weigh 235 lbs. 

Any advice or tips? 
Also, should I focus on running, as I have been, and lose all the weight first and then look at getting back into crossfit?

Sorry for the length, but I just wanted to paint a better picture of my situation. Thanks in advance.

**TL; DR version:** I’ve fluctuated a lot in weight/eating habits throughout my entire life. I want to make a permanent healthy lifestyle choice. What is your advice?
"
e1e9q,10,2010-11-04,Hey Frugal - Will closing a credit card account hurt my credit?,hawt,Frugal,https://www.reddit.com/r/Frugal/comments/e1e9q/hey_frugal_will_closing_a_credit_card_account/,"Hey Frugal!

I'm 23 and I just graduated college last May. 

My spending got a little out of control when I was working a full-time unpaid internship my last year of college, and I currently have $2000 in CC debt (Card Limit is $5000). 

I figure Frugal knows best when it comes to paying off debt and living a simpler, more frugal lifestyle so I come to you for advice.

However, I recently started a full time job and should have that debt paid off in about three months.

I checked my credit report today because I want to buy a new car after the holidays, and I wanted to make sure everything was in order.

I noticed that I had an old Discover Card account open that was completely paid off. I thought that I closed it after I paid it off, but I guess I forgot.

I called today to cancel it and Discover told me that doing so could hurt my credit (since it had been open for about a year and 3 months with no balance).

I decided to hold off on closing it until I found out for sure. 

For the sake of simplicity, I'd like to only have one credit card, but not at the expense of a huge hit (Discover said ""like 50 points"") to my credit.

I don't mind if my score drops a bit because my score is already in the mid-700 range, and I figure it will go up a bit once I pay the $2000 off my main card.

Thanks for taking the time to read this, I'd appreciate some advice.

Edit: Thanks for the advice guys, I plan on have all of my debt paid off by the time I start looking for a car loan, so I am just going to close it since my debt-to-credit ratio would be 0% anyways"
e2o0q,0,2010-11-07,I really really want to intern at IDEO. Does anyone have any connections?,fireblade99,Design,https://www.reddit.com/r/Design/comments/e2o0q/i_really_really_want_to_intern_at_ideo_does/,I'm an computer engineering student in love with design. I took a user design course and now am really excited to work in this area. I really want to intern with IDEO or a similar design consulting firm. If you have any connections please help me out. 
e3ny8,7,2010-11-09,DAE Never use the right Ctrl/Alt keys?,dr3wster,DoesAnybodyElse,https://www.reddit.com/r/DoesAnybodyElse/comments/e3ny8/dae_never_use_the_right_ctrlalt_keys/,I'm a computer engineering major currently in an internship. I code all day and use all kinds of Control key shortcuts throughout the day.  I realized yesterday that I don't think I ever use the right Control and Alt keys.  Am I missing something? Is there a time when using them is more efficient?
e3ykm,4,2010-11-10,Is being hung up on your first--for years--normal?,dailymultivitamins,relationship_advice,https://www.reddit.com/r/relationship_advice/comments/e3ykm/is_being_hung_up_on_your_firstfor_yearsnormal/,"The question is trite, but reading answers directed at others and their particularities isn’t satisfying. Not that those particularities materially change the discussion.

So here's my story in a nutshell.

I fell hard for a girl in high school. While it took a long time for our feelings to synchronize, reminiscing about how it finally happened instantly brings a smile to my face. We got together senior year, and had a summer where I was convinced that the universe was composed of nothing more than warm smiles, fluttery embraces, and love. I wish such an experience on everyone.

Though we were accepted into the same universities, over several teary-eyed sessions, we responsibly chose to go to the ones we believed suited us best despite their geographic separation. That was smart of us. We also responsibly chose to take a break our first semester to not miss the college experience. That was mature of us. As evidence of our feelings, we got back together immediately afterwards.

Unfortunately, between our junior and senior year, the relationship began showing signs of the damage long-term long-distance can do. We both had academics as a top priority, and little money to spend on flights, so we were separated even during summers as we pursued internships and research positions elsewhere. Our relationship was constrained to the phone, a medium I've never liked, but did because it meant I could talk to her. It became clear that we were drifting apart. Our hearts spoke intimately, but our minds were drowning in the superficial, grasping for something new and concrete to relate by.

Nothing ever went to shit. We loved each other too much to do that. The stress of gradually losing someone I love, the resulting distraction from my workaholism, and most importantly, the impossibility of being geographically close in the future, rationally led me to suggest we take a break. Not long after, she told me we shouldn't get back together. It hurt. That marks the end of being an insider with her thoughts, but I do know from my end that the overriding feeling was futility.

We finished off our senior year, she went to a top graduate school in her field that’s even further away, and I have also done well for myself. We’ve spoken no more than the number of fingers and toes I have, which I don’t have too much trouble with; we’re both terrible at keeping up with people in general. Moreover, we’ve both been with others in long-term relationships since.

I’m writing you all to share and listen. What are your thoughts about feeling a deep connection to a love long lost? In hindsight, I haven’t been in love to the same degree as when I was with her. Are the thoughts that she’s a part of who I am forever, and probably the foremost expert on what makes me tick, out of line? The subsequent relationships I’ve had have had their strengths, but I haven’t felt that they holistically were as strong as my connection with her. For those that had amazing high school relationships, have you been able to get fully over them? I’m not looking for a cure, I’m quite comfortable the way things are, I just want to hear other experiences.

All in all, the process of writing and, therefore, confronting these thoughts has been unbelievably cathartic. If you’re a lurker who has itching thoughts, try writing a post—this is my first, and it surprised me."
e5vxz,5,2010-11-14,How to go about finding an online internship,[deleted],PHP,https://www.reddit.com/r/PHP/comments/e5vxz/how_to_go_about_finding_an_online_internship/,"I am trying to find a web development internship where I can work with people over the internet.  I've done a lot of studying and feel I'm at the point where I can handle working in a team environment.  But I live in South Korea, so I can't do an in-office internship.

BTW, I am proficient with Javascript, CSS, PHP, and am learning Python if it makes a difference.

Any suggestion would be helpful."
e66a8,10,2010-11-14,Question about linux on job description,[deleted],linux,https://www.reddit.com/r/linux/comments/e66a8/question_about_linux_on_job_description/,"I wasn't sure if this should go on /r/linux or  /r/jobs so I hope I chose the right subreddit.

I was looking at internships and noticed a lot of places saying candidates must be ""Familiar with linux"" and ""Comfortable using linux"" 

Based on this description what kind of experience/skills using linux would employers be  expecting from candidates.

Edit - Thanks Guys. A lot of your responses were a big help. It also gives me a direction of what do/look up how to do.
Also if I were to apply to a position where knowing linux is required/a plus what should I know before applying for the position?"
e66qn,6,2010-11-14,Trash or...not trash...?,[deleted],WritersGroup,https://www.reddit.com/r/WritersGroup/comments/e66qn/trash_ornot_trash/," Intro to novel. Rough, rough draft. I wrote the whole thing in the space of two hours or so. I just sat down and wrote 2100 words, nonstop. I'm trying to give the actual sense of what it is truly like to be in another person's head without giving in to the natural desire of ordering it into a single line of thought. /pretentiousjerk
Here's an excerpt; completely unedited.


Knock knock. 
“Who’s there?”
“Lance, uh, I’m an intern.”
“Lance who -- I mean. Come in.”

Lance enters the office, dressed internly, (white button-shirt, black tie, suit jacket that just looks off for no apparent reason, [way too khaki] slacks, [also, for no apparent reason]  and, of course, the kind of loafers that only twenty-somethings wear.)

“Hey, sir, I was just coming to uh, make sure I didn’t like…I mean, the coffee -- it’s your kind right, like, your favorite, kind?”

“Sure is. Thanks for the gesture.”

“Oh yeah, sure, no problem. Anything else I can (holy shit this kid is a kiss-ass. He’s going to be promoted) do for you? (in no time.)

“No, no, thanks, I’m good. But uh, what’s your last name again?”

“Tarkington.”

“…”

“…”

“Oh, okay. I’ll uh. I’ll remember that one.”

“Oh….Thanks! I should, uh, get…back to work….”

“Right right. Thanks for the coffee.”

Slam.
 (Well, it sounded like a slam, I mean, every door in this office sounds like it has been slammed [don’t know why, maybe because we’re 4 floors up,] when it’s closed, but, no way he actually meant to slam the door, right, [but wouldn’t less air pressure make the doors harder to close? No, wait, that doesn’t make any sense. Whatever.] of course, wouldn’t make sense. Surprised he hasn’t actually come back in, to apologize, for the [non] slamming, I --)

“Oh, sorry there Mr. Greenwood, (oh holy hell, this kid.) I just, didn’t mean to slam it, I mean.”

“You’re fine.”

“Oh, ohhkay.”

Slam.

I turn back to the window. The snow I browned/dirtied up with my tires this morning still sits, meltingly, outside the firm’s lot, outside the black iron gate, with the Volvos and Camaros, (and was it snowing that day, too? I don’t remember being cold, at all, I mean,) and Oldsmobiles and whatever else and whoever else and everything else and everyone else. Who cares. It’s outside the lot. Outside of the fence.
Inside the fence, the snow is unbelievably white. Not a single tire has besmirched the sugary purity that rests in the medians and front gardens. Not a single shoe or boot or intern’s loafer has dared make imprint mark 1. How nice.
This coffee is really doing the trick, I swear. (I do remember, though, specifically, something burningly white. Awfully. Could have been anything, anything would have been too bright, that day, with how hungover I was.) I boot up the computer, that sits, toweringly, black and ominous and classy and flat,  perched atop the faux/quasi wood desk, (but still, I think it really might have been snow, I remember I was actually in it, whatever it was,) with the keyboard oh-so stealthily and classily and modernly stashed beneath, in a lap drawer. (tossing in it, trying to figure out what the hell was going on, way too bright, even with my eyelids shut, achingly bright,) What’s on the agenda for today….Two new messages….(and someone was laughing, that I remember, that I know. I think. That I think.) Nothing major. I could probably leave, for today, and suffer no ill consequences. Maybe. Probably. Whatever. I don’t want to be home today, anyways. Outside the lot. 

(There was, most definitely, a Ronald McDonald blow up statue, waving, in the breeze, inviting me to stuff my organs with non-processed fat and whatnot, which, of course, I did, because there was/is nowhere else to eat, on the Interstate, and Jack, somehow, liked/[likes? I haven’t talked to Jack in ages,] Big Macs, so, there we were, under the waving Ronald, [didn’t I get a Christmas card from him once? Or something? Wedding invitation?] with myself practically being carried by Jack and Green, soldier-style, with one of my arm’s behind each of their necks,  [Of course he’s married {I was at his wedding, duh} but, to maybe his kid’s wedding? Why would that/{I even be invited} even happen?] being carried off the field of battle, but of course, they wouldn’t be my comrades,) Not with her, at home, with The Issue, The Elephant standing in our living room (literally.) (not if I had a choice, which I didn’t, I mean, I wouldn’t have even wanted to be a soldier -- but, extended metaphors aside,) Though she probably will have to forget about the whole ordeal by Christmas, which is how many days from now? I’ve forgotten, (I remember being deposited into an empty plasticized booth, while Jack and Green got Big Macs for the three of us, [where were Alexis and Sovereign? Wait, weren’t they at] which, I mean, again, no choice, but I probably would have eaten yellow snow at this point,)  and according to the calendar, it is exactly 17 days until Santy Klaus comes a’knockin and, [the McDonald’s? Oh, that’s right, Sovereign just had to try and slide down the big slide with a plastic tray, and Alexis was probably trying to subvert/egg on such efforts,] (so a greasy burger probably wasn’t such a stretch, thinking about it, even a Big Mac) hopefully, everyone will get what they want and shut up about it, but, honestly, I doubt that She will ever shut up about this Fagscot thing, which come on, honestly. (so I sat in the booth, faithfully awaiting the promised bounty of greasy nonmeat, [and then, yes, that had to be it, because then Alexis came in, covered in snow, half-laughing, half-worried, and Sovereign had a broken nose, but was almost laughing as well, because apparently it was just So Goddamn Funny.] (it’s not that big of a deal, honestly, he’ll grow up, he’ll be fine, if anything I feel sorry for the kid. Telling him he’s going to hell is probably not the best course of action, (as I remember Jack saying to Sovereign, but I was way too busy to give a shit, considering my level of hunger, and such. But then I realize; I‘m supposed to be somewhere.) Not to mention; I know for a fact she “experimented” with her roommate in college, and no, it’s clear, she does not just care about his mental/sexual/developmental health or whatever she says, it’s a personal projection issue, gotta be, ([ and before I could tell Jack and Co. that I had to be back at campus pronto, I have a final, a very important final, Alexis sits down, opposite me, and unwraps his Big Mac, calmly.]) because otherwise, if this issue were based around anything else, she would be all pity (for Him) and anger (for Everyone Else), so, she has to be afraid for him, afraid that he will end up like herself, ([ and I frenetically ask Where is Jack and Alexis just looks up at me, slowly, and says “He just left to take Sovereign to the Hospital, weren’t you listening?” And, clearly, “No I wasn’t, why didn’t we go too?” Which, why didn’t we? Can’t remember.) which, I don’t know, why would that be so bad, to her, unless she is hiding something I don’t know, from me, away, out. {Like what?} (But Alexis just stares at me, for a moment, before I blurt out, “Dude, I, I have to be back at campus ASAP, I’m supposed to be taking a final right now,” and shatter his look of pity/complacency and re-assemble it into one of empathy/panic, [that was actually pretty comical, in retrospect, like the way a sitcom actor’s face looks when something goes awfully wrong within the three walls] and I know, before he says it, that we have no car, and so, of course, as the legendary story goes, we end up calling a taxi, and pay the guy like 100$ to get to the university, and step on it, and so he does, and I make it back with 20 minutes to take a 60 minute final, and, of course, answer every question, and get an A-. [according to legend.]) She has to be legitimately bisexual.

Knock knock.

I realize I am sitting Indian style at my desk, and have spilled a little coffee onto my tie. I have no choice.

“Come in.”

Wendy opens the door, her black, slick, smooth hair obscuring her face, because, as I realize, her neck is craned down, and she’s staring at a stack of papers, and she talks into them, knowing I don’t care.
“Hey, did you get that memo, from Anderson?” She produces a white sheet from the top of the stack, without looking at it much. She holds it out for me. It’s a copy. (I don’t even have to ask/check.) She knows I don’t check the memos, but she wishes I did. (for some reason.) So she makes copies.

“Oh, no, must have missed it.”

“Oh, too bad. It’s semi-important.”

“Semi?”

“Yeah. Apparently we are having our first ever casual dress day.”

“Wow. That’s something.”

“It is. It’s on the day before Christmas Eve.”

“Oh. Makes sense. The interns will be overjoyed, I’m sure. (and I imagine Lance standing, coffeepot in hand, wearing an American Eagle t-shirt, with whiskered jeans and flip-flops,)

“So yeah. Just thought you might care.” (but of course that doesn’t make sense; it’s winter.) She lifts her head up, flashing a curt smile, politely ignoring the stain on my tie, not even glancing twice before stepping out of the office. I sip my coffee and slip off my tie.


"
e6snr,5,2010-11-16,Tips for a first-year PhD student interested in Quantitative Finance?,MillardFillmore,quantfinance,https://www.reddit.com/r/quantfinance/comments/e6snr/tips_for_a_firstyear_phd_student_interested_in/,"Hey /r/quantfinance,

I am nearly three months into a PhD program in Computational Biophysics and have been interested in going the quant route for some time now. I like to ask those who are now working in quant shops, what advice would you offer someone in my position? Should I begin seeking out internships now? What about taking a few classes in my University's MQF program?"
e7tzy,5,2010-11-17,Congress Staffer Says We Need a Phonebank &amp; Script,phonebankplz,OperationGrabAss,https://www.reddit.com/r/OperationGrabAss/comments/e7tzy/congress_staffer_says_we_need_a_phonebank_script/,"I just spoke with a friend of mine who's a staffer for a Republican house member. He said that, while they get hundreds of phone calls a day with a clear message about the Bush tax cuts or food safety legislation, the TSA calls have an incoherent message.

So: We need to set up scripts to guarantee that the congresspeople (that is, their interns) are getting the most important pieces of the message, to ensure that all the congresscritters are getting called, and to make sure that Congress knows that a lot of people care about this issue and are, basically, a force to be reckoned with.

What is the quick soundbyte to give to the person on the phone? What you say beyond that doesn't really matter -- you just get one more checkbox for ""complained about TSA."" 

How about this? ""I'm calling to ask that Senator/Rep. (Name) stop the TSA from its invasive, ineffective and expensive practices, which force people to choose between being photographed naked and being groped by TSA agents."" After you say this (or whatever we come with), the intern will just say ""Thank you, I'll pass your message on to the congressman""

Anyone want to program into the Wordpress page a way to report your calls and the results? There are probably forms out there..."
