dxfyx,6,2010-10-27,My agency charges the client 5x what they pay me for my services...wrong?,kekekhuk,web_design,https://www.reddit.com/r/web_design/comments/dxfyx/my_agency_charges_the_client_5x_what_they_pay_me/,"Hey /r/web_design, this question is for the redditors who work at agencies.

I graduated from college about 2 years ago and I messed around at a couple non-web corporate jobs until I realized that I wanted to focus on web development as a career path.  When applying, I had no agency experience and my portfolio was pretty weak (web development had always been a hobby of mine -- I have only been *paid* by friends/friends-of-friends to make simple static HTML sites...), but I was persistent and somehow convinced the President to bring me on-board.  

I've been here for about 8 months now and things have been going well.  The boss hired me purely because of my interest in the subject and my ability to sell myself -- he didn't really have any idea what he would do with me (My compensation reflects that -- I'm paid like a well-paid intern w/ no benefits).  I've since been involved in almost every aspect of agency life: HTML, CSS, JQuery, Project Management, Production Management, QA, Research/Digital Strategy...I've run client meetings, I've managed a small team of developers, UX designed two small sites...kind of everything.  

I was reviewing a project plan for an upcoming project (I was asked to take a look at the functional requirements) and noticed the rate at which my services were being billed...nearly 5x what I am paid by my agency.  I went back and looked at another project I worked on and my services were billed at the same rate. This stood out as ridiculous to me...they're billing the client the same cost as a person 2-3 levels higher than me in terms of seniority.  Keep in mind, I am still very inexperienced in the agency world and I am the youngest in the office (early twenties), but don't you think an 80% margin on my services is a little bit odd?  I mean, Apple has a 40% margin and that's unheard of.

Is this just one of the ""pay your dues"" things?  Should I say something? Maybe my angst is lingering around from when I was a teenager, but I work a lot longer hours and a lot more projects than most of the people here and seemingly am compensated significantly less.  I don't know what to do.

Maybe I should just relax and enjoy the job that I thought was great until I came across this?

I appreciate the feedback."
dy1ve,1,2010-10-28,"Just starting! Lose a few lbs., get in shape",Drache,loseit,https://www.reddit.com/r/loseit/comments/dy1ve/just_starting_lose_a_few_lbs_get_in_shape/,"First post here on reddit too!

I'm 21, 5'9"" 167 lbs. I'm a college student. In my high school years and the first year of college or so, it seemed I was always moving. I walked almost everywhere I could, I was semi-active, and it never seemed like I needed to worry about my diet at all. Weight was simply a non-issue. 

Flash forward a few years. I did 6 months of internship last year - typical desk job - no movement at all. No exercise, no calorie control, and lots of snacks in my desk, and the 'ol Poptarts for breakfast. I didn't think anything of it. I was back in school this summer and I tried to be more active with my free time...bike riding, hiking...and I think it was enough to maintain my weight and offset my crappy eating.

Skipping to the punchline....
Over the last year, I've gained 12 lbs., from 155 to 167, my blood pressure has gone up, I feel much less in shape. I understand that it's much easier to fix the problem now rather than later.

I'm addicted to food. I loved eating, and unhealthy meals were my way of coping with anxiety. I shoveled in chips and cookies at work when I was bored. Not so good. I've counted my calories, and realized that my diet was *very* high in carbs and sugars, and low in protein. I've been trying to make a few healthy changes....

* If I didn't consciously keep track of my calories, I could shovel in an easy 2300-2400 a day of unhealthy items without thought. Now I've cut back and can do more along the lines of 1800 with some willpower. 

* I've cut out fast food almost completely besides the occasional social outing. I make sure I pack my lunch at work (whole wheat roast beef sandwich with spinach leaves and canola oil mayo) and make sure I have some carrot sticks to nibble on. Oatmeal with dried fruit instead of poptarts. I still have my morning hot chocolate (not so great, but I use lowfat milk and the powder sparingly).

* I've exchanged soda for sparkling fruit juice. Less sugar, real fruit juice. Not ideal, but it's a start.

* I've started doing the P90 (not P90X) workout tapes. I either do that or try to get 30 or 40 minutes of bike riding or walking in each day to at least get started.

* I've tried changing my desserts to better options. A granola bar instead of cookies. Greek yogurt instead of icecream. Simple things like that to move in the right direction. 

Over the last few weeks I've probably dropped a pound or so. My principal complaint so far is I feel hungry without ""unlimited"" food. I assume it's the high carb/high sugar combo. Does anyone have any tips for lowering carbs and sugar and increasing protein to feel fuller?

I realize that 10-12 pounds shouldn't be a daunting task. I'm really hoping I can change my diet to get back into shape as well as drop some weight (it's no fun when your clothes from last year don't fit!). Hopefully soon I won't feel like I need a cardiologist on speed dial during exercise, and I'll start going down in weight instead of creeping up. Your advice, motivation, and tips are appreciated :) 

"
