gyn30,3,2011-04-27,Eurail Train Passes - Help!,b26354rdeckard,germany,https://www.reddit.com/r/germany/comments/gyn30/eurail_train_passes_help/,"I'll be spending three months in Lüneburg for a summer internship at the University of Lüneburg and I have questions about the options for traveling by train.  

The problem is I'm really not sure how much I'll be traveling while I'm working. I'd like to visit a number of German cities (Hamburg, Berlin, Dresden, Frankfurt, Köln, maybe München...) as well as Amsterdam, all during the weekends/holidays.  

Should I expect to need the train any more than on these occasions? I really have no idea how often German students use the train - perhaps University of Lüneburg students go to Hamburg every week as it's only a half hour away. In this case I'd probably need an unlimited pass.  

I plan to do some additional traveling after I'm finished with my work assignment. Here is my plan as of now, assuming I don't need an unlimited pass:  
Eurail: Benelux-Germany, 10 days within 2 months ($409) --&gt; For first two months   
Eurail: Select Pass 5 Countries, 10 days within 2 months ($549) --&gt; For last month and change  
          Germany, Austria, Italy, Switzerland, France  

What do you think? Is this a good plan? or should I anticipate needing an unlimited pass? Perhaps I should consider a German Rail Pass (25 or 50?). Also, should I purchase my pass before I leave or once I arrive? (I'm not sure if interning at the University of Lüneburg could get me a better rate).  

Any general advice is also welcome or even anything about Lüneburg. Is ~$1300 roundtrip a decent price for a flight?"
gyd6t,1,2011-04-27,Summer Internship Resume (xpost from r/career where I don't think anyone saw it):,internship-questions,resumes,https://www.reddit.com/r/resumes/comments/gyd6t/summer_internship_resume_xpost_from_rcareer_where/,"Hi guys. I'm a 25 year old transfer student (3rd year of 5 working towards a BS in computer science and a BA in theoretical linguistics) who's about to try to apply to some internships over the summer.

Now, I have a resumé already, but it's geared towards 'day job' type things, the stuff I did ages 18-24 (barista, sales rep). Basically, I don't have any work experience in the field that I'm trying to get the internship in; but that's the point, right?

So, my question is: how do I best represent myself in these settings? Mention that I'm a bit older and maybe more mature than the competition? Or does that sort of raise the question of why it took me so long to get my act together and get to school? Mention previous jobs? Or do people in technical fields look down on menial job/service industry stuff enough that it would harm my chances rather than help them?

Is there anything I should know about the process? Any protips from people who have done this before (or even people who hire for this sort of position)?

Thanks in advance for any help!
"
gy7j2,0,2011-04-26,I’m two years out of college and disillusionment is a brickload on my chest. How do I find a decent employer?,[deleted],AskReddit,https://www.reddit.com/r/AskReddit/comments/gy7j2/im_two_years_out_of_college_and_disillusionment/,"I get plenty of interviews and job offers, but every one so far has turned out to be malicious in one way or another. Please advise me.

My backstory: After getting a BA in English --I know, this is where I screwed up. Please spare the obvious-- from Wittenberg University in Ohio, I enrolled in a six-week master’s level program in publishing at the Denver Publishing Institute. After that, I moved to the DC area to live and work close to my sister, who just had a baby. Most of the work around here is through government contractors, and aside from the part-time jobs I took while I was getting on my feet, I’ve been both a proposal writer and a technical writer. I’m good too. I’ll limit my bragging to the fact that during my first six months as a proposal writer, one of my proposals won a 10 million dollar contract and created thirteen jobs.

The big lesson from my proposal writing job was to get a realistic picture of the company's expectations of hours and their feelings on work/life balance up front. In interviews, I ask about the average hours for similar positions and how the company manages comp time. I also try to talk to actual employees whenever possible. Any job that doesn't want you to wander around and talk to the employees after your interview does so for a reason; they don't want the employees scaring you off. And that SHOULD scare you off. The abridged story of that job should explain the justification for these things.

I worked in a back office as a proposal writer for a firm that focused mainly on defense contracts. I thought that I had bombed the interview because I brought in the wrong writing sample, but I got a job offer the next week. That’s when I should’ve known. I started out as an intern and for the most part was limited to forty hours a week. It was obvious the full-time writers stayed much later. The management explained this in the interview: ""There are times when we're busier than others, but there are lulls in between peaks."" I figured that when I started full-time, I'd be working a little later during busy seasons like when proposals peaked.  

A little later? Let’s pause on the hours for a second and consider that I had an hour and a half commute one way to this job.  After they brought me on full-time, I started working ten hour days nearly every day, every week. There was no fluctuation in workload like they'd said; we were busy all the time. I woke up at 5:30 for work and any time I managed to escape work before 5 PM seemed like a jinx that would bring on a night where I didn't leave until 10 or 11.

I tried to tell my bosses I was getting burned out.  I needed a better work/life balance, and they kept promising that they'd try to manage our workloads a little better. I noticed no difference. I was averaging at least fifty hours a week, leaving my house at 6:20 in the morning, every morning, and usually not getting back until 8 or 9 at night. I'd get home, shower, maybe eat, go to sleep, and get up to do the same thing. After a night where I didn't get out of the office until 11:30 and had to still be in by 7 the next day, I started to feel like I was going nuts.

The next week, one of my coworkers was sick. She took Monday off to recover and worked twelve hour days for the rest of the week so that she wouldn't have to use PTO for her sick day. Our boss had said that this was fine; HR had something else to say about it. Even after our boss approved it, they made her take the PTO for that day, disregarding the fact that she'd stayed even later than normal to make up for it. Our boss didn't stick up for her. I quit.

I had to leave that job before finding another because I would have never had time to look for one during my rigorous schedule, much less interview. I had only banked a month’s pay at that point, so I had to move quickly... but it was worth it.

My second foray into the crazy, dishonest world of government contract work was technical writing. The tl;dr on this one: After I scanned over all the documents and emails that I'd kept, trying to find that golden line that stated how long our training and temp status was supposed to be, I found nothing. They had fed us half-truths verbally in the interview and never put any of it in writing. That's the lesson from this job: Get everything that they promise in writing. If it's not in writing, you ain't gettin' it.

I was originally thrilled about this job because I was actually on contract, not in a back office, and was only allowed to work forty hours a week. It seemed like heaven. During the interview, they told me that I'd have to go through a one month training period and that I'd be on temporary status while training. This meant a low hourly rate and no benefits. So I thought, “One month? That's not bad.” When I got to the job site and spoke to the manager, I found out that the training period was actually three months. Ok, so I was less pleased about that, but I'd already accepted the job and figured three months wouldn't kill me. There were four other people hired for the same position, and we were all in the same boat. We’d all heard the same things during the interview process. We kept hearing about this big 90-day review, and connected it to the end of our three month training period. 90 days go by and we hear that a 90-day review is really only for full time employees and that ours would be an informal review to give us some feedback on our work. It was during these interviews that we learned that they had no intention of considering us for full-time positions until they knew if the contract was getting renewed in September. No health insurance. No bump in pay grade. That might change, but there’s no guarantee. They told us that thinking we’d get full time status after 90 days was a “misunderstanding,” but how do five people from five separate interviews all have the same “misunderstanding?”

I'm interviewing for new jobs because there's no way that I can keep putting off my student loans and living like a beggar until September for a job I don't even know I'll get. Last week, I had an interview that turned into a job offer. I had to decline because I noticed some huge red flags:

* They based their salary offer on what I told them I make at my current job, even though their job has a broader scope and more responsibilities.

* They mentioned in the offer letter, but not in the interview, that I’d need security clearance. When I attempted to renegotiate salary based on this, they refused.

* During the interview, they danced around all of my questions about average hours per week and comp time. The emails containing the offer letter and responses to my renegotiation requests were also sent way outside of normal business hours.

It's a shame because this place is a ten minute commute from my apartment, which would have been really nice. That perk, while huge, is negated if I have to work through dinner.

So where are all the good, decent companies that want to keep their employees happy? Are there companies who employ technical writers or proposal writers that don't suffer from high turnover rates? How do I find a company that won’t try to burn me out to make a buck? Thanks to my experience I know a little more about avoiding the bad companies, but I don't want to waste my time in interviews with them. I could sure use a little help and advice."
gzps4,5,2011-04-28,[for hire] [intern] Computer science intern. C++/C#/PHP/Perl/Python/Ruby/some asm x86.,[deleted],forhire,https://www.reddit.com/r/forhire/comments/gzps4/for_hire_intern_computer_science_intern/,"(I also know MySQL/PostgreSQL/HTML/CSS/Javascript w/ JQuery, and have done quite a bit of web development and design.)

I have the stupidest problem ever when it comes to internships, two of the three companies I've interviewed with have decided not to offer me an internship, but have offered me full-time positions instead. Sadly, I'm still in university, and I'm not really willing to drop out and move to California permanently.

So about me: I'm a freshman studying CS at University of Washington. I've been writing code for about 8 years on my own, and I have a 4.0 in every programming class I've taken to date as a result. Last year (my senior year in High School) I interned at Microsoft Research, where I published two conference papers (I'm first author on both), and the year before I worked at a [startup near my house](http://www.atigeo.com).

I'm willing to relocate for an internship so long as either the pay is reasonable enough to cover the housing situation, or there's some stipend for that. (Most of the other places I've applied have been in the latter.) Or if this is in the Seattle area, even better :)

If you can do anything, let me know and I'll send over my resume. :D You can email me at tyler@menez.es if you'd prefer.

Thanks, Reddit!"
gzj2x,3,2011-04-28,What is happening to this job market? Why can I NOT find a job,[deleted],jobs,https://www.reddit.com/r/jobs/comments/gzj2x/what_is_happening_to_this_job_market_why_can_i/,"Background: 

I am finishing my Junior year at university majoring in a technology related field, have had many years of real world job experience( web internship, technology camp, graphic designer), have a 3.4-3.5 GPA, have held teaching assistantships for courses, I have developed and designed many freelance websites, have a wide range of technical skills, and have really good references. I perused an internship this year.

I view myself as a great student and highly employable, but I cannot find a job. I have searched and searched. Applied to MANY openings, gone to many interviews (and have the employer express interest), but I have not received one job offer for this summer. I have been rejected a good 7-8 times now. What am I doing wrong? I have contacted the employers about how I could strengthen my employability, and they usually just get back to me saying that I had no negatives but they decided to hire someone else. I cannot find a job."
gz2rg,2,2011-04-28,[For hire] University of Washington Informatics major looking for summer job/internship,ethereal792,forhire,https://www.reddit.com/r/forhire/comments/gz2rg/for_hire_university_of_washington_informatics/,"I'm a junior at the UW studying Informatics (information science).  Here's a link to my [resume](http://students.washington.edu/leddie08/resume update 4-14-11.doc)


I have skills in php, sql, Java, Javascript, and I'm a newbie in web development.

Here's a link to my current coursework for my web development course:

http://students.washington.edu/leddie08/info344/home.html

I'm very interested in finding an internship or job this summer around the Seattle area that's related to my major or interests of programming and software development.  Please send me a PM if I can help your company, thanks for reading!

"
h0dv6,27,2011-04-29,"[for hire] Culinary student looking to extern at a restaurant or with a caterer in Houston, Texas. So I do not waste your time, up front, I will tell you that I've never worked at a restaurant before. If you're still interested, please keep reading.",rudifer_jones,forhire,https://www.reddit.com/r/forhire/comments/h0dv6/for_hire_culinary_student_looking_to_extern_at_a/,"I'm a 20 year old male and live in the Northwest area of Houston. I currently attend the John Folse Culinary Institute at Nicholls State University in Thibodaux, Louisiana. I come back to Houston at the end of the semester, which is around May 15, 2011.

This next semester I will be a senior and part of the curriculum involves me working an externship over the summer. As far as I understand, an externship is similar to an internship, but I would get paid. (What I get paid, is absolutely up to the employer.)

This externship involves me working approximately 360 hours over the summer, which is about 9-40 hour weeks. Preferably, I'd like to be rotated around different stations or positions within the kitchen, but that is up to the employer.

I have never worked in a restaurant, but I have worked several school functions. I've taken 3 years' worth of culinary classes, and have a great grasp on the basics of cooking and baking. Among the courses I've taken are Classical French Cuisine, Baking, Garde Manger, and a Bistro class (Essentially a student-run restaurant). I learn relatively easily and work well with other people.

If you're interested, please message me.

Thank you."
h06we,3,2011-04-29,[for hire] College student looking for internships in NoVa or DC.,[deleted],forhire,https://www.reddit.com/r/forhire/comments/h06we/for_hire_college_student_looking_for_internships/,"I'm currently a freshmen looking for a Summer internship in the DMV, I am currently majoring in Information Systems and minoring in Computer Science.

I have experience repairing and setting computers and hardware, I like to think of my self as a jack of all trades and can do pretty much anything i'm asked to do with some training and plenty of effort. I learn software extremely quickly and can adapt. I am currently learning to use Linux on my own and a hope to start programming this summer or fall. Most of my experience consists of hardware and setting up the occasional wireless+wired networking. I have also taught software and mentored for the Intel Computer Clubhouse network.

If you would like more information, or would like talk, send me a message on Reddit."
gzw4r,1,2011-04-29,Hi! I'm a masters student planning on applying to an internship at Mathworks,[deleted],AskReddit,https://www.reddit.com/r/AskReddit/comments/gzw4r/hi_im_a_masters_student_planning_on_applying_to/,anyone here working/has worked at Mathworks as an intern and would like to share your experiences and what questions to expect from the interview? I'm new to finding internships and applying for jobs.thanks!
gzqoq,15,2011-04-28,Non-Desk Jobs in CS?,Drache,cscareerquestions,https://www.reddit.com/r/cscareerquestions/comments/gzqoq/nondesk_jobs_in_cs/,"Short story, I should be graduating with a CS degree in about a years time. I had a short internship, and I came to dislike sitting in a dark cube 9-5 in front of a computer cranking out code. I'm looking to escape what seems like my inevitable future of staring at the glowing screen for the rest of my life.

I've looked into education -lots more classes, atleast 3+ years more needed to teach high school, seems like a masters degree is needed to teach at community colleges. Not sure about this one.

I've looked into the business/marketing/management side of things, but I tend to doubt that anyone would hire a business or management guy right out of college unless I was *really* exceptional.

Anyone have any cool non-typical CS jobs out there that keeps you away from the chair most of the day or any career path advice for me?

Thanks!"
h0r0q,1,2011-04-30,I am choosing between summer internships and need opinions.,[deleted],AskReddit,https://www.reddit.com/r/AskReddit/comments/h0r0q/i_am_choosing_between_summer_internships_and_need/,"First, I am glad that I have this problem but I still would like to weigh my options. So I have already received an offer to work for [NASA DEVELOP](http://develop.larc.nasa.gov/Mobile_County_Health_Department.html). The name alone gets cool points on a resume and I would be making approximately $3500, also all I have to do is accept the offer. The other internship to apply to  would be using GPS, GIS, and remote sensing to map out crane habitats for the [Grand Bay National Estuarine Research Reserve](http://grandbaynerr.org/). The work consists of being at a computer and outside, the pay is a big plus at $7200 as well as the experience. The third internship is with the [South Alabama Regional Planning Commision](http://www.sarpc.org/news.asp). This one would be dealing with census data and GIS, not sure what the pay is but probably not much. The most attracting thing to this one is that it may actually lead to a job with them. On top of these I will also be doing a paid research project for my university. So reddit, I ask you for your opinion."
h0mtx,4,2011-04-29,So I found out my sister is a Cam Girl.  What would you do?,bigbrother26,AskReddit,https://www.reddit.com/r/AskReddit/comments/h0mtx/so_i_found_out_my_sister_is_a_cam_girl_what_would/,"I was working on my design final for school and my Adobe design premium suite trial expired. I couldnt simply uninstall and reinstall due to Adobes DRM so I asked my sister to loan me her Macbook Pro. I used it and got my project done. My sister (Annie) took the computer back. I asked for it again to remove some files I was needing and noticed that my sister just closed out her browser and didnt log out of her gmail.

You see me and my sister are college students. I work as a workstudy on campus making peanuts on the dollar but it does pay for gas and food so no complaints here. My sister informed me that she landed a job as a blogger and was doing fine with the money. I generally believed her due to her writing background in high school. I never investigated the issue. I would periodically run google searches of her name and never brought up anything.

That was until this past Sunday. I admit that I looked through her email. This was not a big problem for me due to one of other sisters (Linda) almost commiting suicide and if it was not for me and Annies investigation the situation would have not turned out well.

I started noticing that Annie was pulling in an amazing amount of money for simply blogging. She would brag about making $800.00 in two weeks and recently made close to $1500.00. This caused me to become even more suspicious about the whole thing. I found out through her emails that my sister is not a blogger. She is a Cam girl. She performs sexual acts on the screen and people pay her for it. From what I figured out she started off striping but has escalated to other acts.

As you can imagine a million different thoughts and emotions have been racing though me. As her big brother I do not approve of what she is doing. I dont know If I should tell my parents or talk to her on my own. I doubt that me talking to her will change her mind. If I tell my parents then that will ruin her relationship with them. She is quite emotional. If I do nothing and if she fully embraces the lifestyle and that leads to porn or other acts I dont know how I could deal with that.

Let me just get a few things straight. Im not jealous. In fact Im rather angry because my sister made up a huge lie a few months ago that she won an internship to Disney and had to go to Orlando for orientation. She an opportunity of a lifetime and threw it away, or it was a fraud and went for some meeting for the company she works for. My mother had loaned her money for the plane ticket. Also when I finally found out about who she works for I went into her chat room. It basically works like this. There is chat room and they all have access to the girls webcamera. Every one in the room can tip her and she can flash or do whatever she wants to get more tips from the chat room participants. I went into her room once I found her user name and she conducts her shows from my mothers house and will talk to and call my mother from her phone while on camera. I see that as very disrespectful. On top of that my mother gives me a hard time cause I cant bank money while my sister can.

I honestly dont know what to do. Im just asking for some advice and if there are any former cam girls offer your advice as well. I understand that its her life and she has the right to do whatever she wants with it. She is 19 years old. I just think that it will lead to a desructive lifestyle and future. She's already hinting that she is not going back to school next semester. We are not poor or have a hard life. She had a full grant to go to college and study anything she wanted. She was living on campus and was doing well her first semester. The thought of fame and fortune have clouded her thoughts. Just looking for your thoughts on the situation. Thanks. My apologies on any grammar or spelling errors"
