1fhjum,4,2013-06-01,How early on can I get a paying internship?,John_G_Hancock,cscareerquestions,https://www.reddit.com/r/cscareerquestions/comments/1fhjum/how_early_on_can_i_get_a_paying_internship/,"After doing some real searching and not finding any satisfying/reliable results. I asked a friend for advice and he linked this sub as the best advice he could offer me.


**A little about me:** I'm a 25 year old Freshman (rising Sophomore) pursuing a BS in Computer Science. I currently work at a decent paying job that has nothing to do with CS. I can afford to make less money at an internship as long as it pays something and helps me get the right stuff on my resume. I've taken only 1 CS course and will be taking 1 more in the Fall and another in the Spring. In my spare time lately I've been working on learning Python and Java.


**My question:** How early can I get a paying internship? Are there Sophomores getting good internships?

Any help is appreciated. Thanks

"
1fgz3f,14,2013-06-01,"Question regarding the saturation of dev. jobs, as well as what is needed to get a 'foot in the door'",dannytt,cscareerquestions,https://www.reddit.com/r/cscareerquestions/comments/1fgz3f/question_regarding_the_saturation_of_dev_jobs_as/,"I have been browsing this sub for quite some time, and am curious about this. There seem to be several opposing opinions being posted on many new posts regarding employment, these are:

- There is a ton of demand for software devs.

vs.

- You likely won't even get a dev interview without an internship or other CS work outside of school. 

Looking through Dice and other posting sites there seems to be an abundance of Developer positions available, I am sure most of them are mediocre but even if only 1/4th are desirable that still seems like a good amount.

The second point has been coming up more and more these past few months as college grads/students are looking for work. This seems ludicrous if the first point is true, especially when you consider other professions where internships or outside involvement does not seem nearly as expected or required. 

Just something that has piqued my interest, and I am curious as to what you all think."
1fgtsm,2,2013-06-01,"Upcoming interviews, would it be appropriate to ask to spend a few hours with the company beforehand?",[deleted],cscareerquestions,https://www.reddit.com/r/cscareerquestions/comments/1fgtsm/upcoming_interviews_would_it_be_appropriate_to/,"I've got a few interviews coming up for various dev jobs. I've researched the companies and one of them seems like a very open/fun place to work from emails arranging an interview and their website. The interview ended up getting pushed back until the end of June, would it be appropriate to ask to come spend a few hours with the company beforehand?
Sort of like a tiny internship. Would that reflect positively or affect me negatively in anyway?"
1fgsfr,1,2013-06-01,"Upcoming interviews, would it be appropriate to ask to spend a few hours with the company beforehand?",[deleted],learnprogramming,https://www.reddit.com/r/learnprogramming/comments/1fgsfr/upcoming_interviews_would_it_be_appropriate_to/,"I've got a few interviews coming up for various dev jobs. I've researched the companies and one of them seems like a very open/fun place to work from emails arranging an interview and their website. The interview ended up getting pushed back until the end of June, would it be appropriate to ask to come spend a few hours with the company beforehand?

Sort of like a tiny internship. Or would that affect me negatively in anyway?"
1fgdjy,2,2013-06-01,Am I screwed without any internships?,LikeWhite0nRice,cscareerquestions,https://www.reddit.com/r/cscareerquestions/comments/1fgdjy/am_i_screwed_without_any_internships/,"I am in my fourth year in college (second year at a university) and I will most likely graduate next year with a CS major and a math minor.  However, it is too late to get an internship this summer (I already have a very nice summer job that is completely unrelated to CS) and I will be applying for jobs at the end of the next school year.  Is it going to be extremely difficult to find a job without having had any internships in the past?"
1fg5pm,11,2013-06-01,"Tonight, I babysat at a Gilded Age hotel. Something saw me, and I'm afraid to go back.",thesistergeek,nosleep,https://www.reddit.com/r/nosleep/comments/1fg5pm/tonight_i_babysat_at_a_gilded_age_hotel_something/,"I was just watching some kids for a wedding.  I swear to god, Stephen King had to have stayed at this place before he wrote the Shining.  It was so well restored, if you were by yourself it was easy to get lost in what time you were living.  In some areas, there were old fashioned locks on the doors, not the swipe keys most people use these days.  Don't get me wrong, it was breathtakingly beautiful and well appointed.  But it was so well done, it just felt... off.  Like it belonged in a novel or a movie, not real life.

I'm babysitting just trying to make extra money while I'm working on an internship for the summer.  Things are really tight right now, and the parents offered me a premium to drive half an hour and to be there on such short notice.  They're in town for a wedding, and only found me on Wednesday.

The kids were great, a 8 and 11 year old who loved Doctor Who and the Avengers.  After a month or so of sitting nothing but toddlers, it was a welcome break.  We spent most of our time playing basketball on the tennis court, long vacated by the elder crowd who were now more interested in fine dining than being outside.  We also explored the hotel and the grounds, learning some history about the place along the way.  I love kids at that age, even when we were sneaking into areas we weren't supposed to they were super excited.  I think stealing soda from a wedding reception with a couple kids makes me a pretty kickass babysitter, from the kids' perspective anyway.  Not sure about the parent's.

At about 10PM, the parents returned from their rehearsal dinner and paid me.  I thanked them and said goodnight to the kids.  Everything was great until I was making my way back to the elevator.

Their room was the last one in the hall, and the stairs were about halfway to the elevators.  It was a really long hallway, and it had two turns in it, making it impossible to see all the way down.  I made it around the first turn, around the ice machine and wheelchair ramp, and was staring down the longest section of the hallway.  From around the next corner walks a woman in a flapper dress, complete with period appropriate hair, makeup and shoes.  I stopped dead, thinking she was either a pretty hot ghost, or a member of the wedding party who was dressing for the location.

She walked over to the door nearest her, between me and the stairs.  Then, she just laid her hand on the handle.  And didn't move.  She just stood there, staring down slightly, completely casual.  I decided she was definitely a member of the wedding party, and probably drunk.  So I started walking again.

Suddenly, her head snapped to the side and she stared straight at my feet.  I jumped about 10 feet because of the sudden movement and stopped walking again.  I watched as she grazed her eyes from my feet to my face, her lips spreading in to a smile that got wider and wider.  It took a few seconds before I noticed it was unnaturally wide, spreading from ear to ear, completely out of proportion to her face.  Her dark red lipstick and short bob hair framed large white teeth in a smile that shouldn't have been possible.  Then, she started running and screaming, straight towards me, with her long arms stretched out.

I'm not sure why I didn't run.  You always think you'll choose fight or flight, but I didn't.  I completely shut down.  I turtled.  I dropped to the ground, pulling my knees up to my face and my arms over my head.  And I waited.

I'm not sure how I expected to die, but I obviously didn't.  When I got the courage to look up, I was alone in the hallway.  I decided to take the stairs down, and sprinted to my car.

I don't know what to do.  I need the money, they're paying me $15/hr and I'll make like $135 tomorrow if I go.  But I'm not sure what I saw, or if it'll happen again.  And I'm also sort of curious.  If I do go, I will report back, but would you go back /r/nosleep?"
1fj4wk,5,2013-06-02,EXCEL HELP: Beginner,letsgo15,excel,https://www.reddit.com/r/excel/comments/1fj4wk/excel_help_beginner/,"Hey guys..What's going on? 

I am new to this site and just wanted to throw a question at you guys asking for some advice.

I have an internship and excel is a must...It is with PwC.

What is the best way to learn excel. Are there any specific programs that you guys would recommend?

If it is free..that is great. If I have to pay that is fine as well as long as I am getting my money's worth. 

There is so many programs and materials out there..I am not sure which to choose from.

Thanks guys."
1fj1xv,2,2013-06-02,Can you guys review my resume.,jujiro,resumes,https://www.reddit.com/r/resumes/comments/1fj1xv/can_you_guys_review_my_resume/,"Looking for mainly a networking It position, and was wondering if there was any glaring problems with my resume. Thanks in advance !!

Network Support Specialist / Systems Administrator

Network computer technician trained in general and advanced computer hardware and software maintenance, with the proven ability to meet the technical needs of clients and customers in a courteous, professional manner. Seeking an entry-level technical support position where my training and skills will serve to increase your organizations’ production and earnings.

EDUCATION AND ACADEMIC HONORS
Delta Tech                                                                                                            
Lake Charles, Louisiana		      Associate Degree in Information Technology
Graduation:  December 2007	      Academic Honors:  Dean’s List &amp; Associate’s Pin
Certification: Comptia A+

Summary of Technology Class Room Training and Customer Service Skills.
F	Graduate of Cisco courses I, II, III, and IV from the Cisco Networking Academy.

F	Comprehend the essential concepts of technical structural design internetworking, security, systems development and database management. 

F	Skilled in Windows 2003 Server and Active Directory. Windows XP Pro, and Windows 7

F	Able to work with a network administrator managing backup, security and user help systems.

F	Great customer service skills in addition to consulting with users, management, vendors and technicians to assess computing needs and system requirements.

F	Proficient in installing, configuring, and upgrading computer hardware and troubleshooting computer systems.  

F	Creative problem solving skills. Help desk support skills, explaining to customers the proper proceedings in troubleshooting and repairing computers.

F	Able to work effectively in a team-oriented environment, as well as independently.



WORK HISTORY
Pizza-Hut
Shift Manager,
04/2010- Current
Assist overseeing daily operations of the store
Manage daily product inventory
Proficient in excellent customer service
Ensure a smooth flow of work by solving unforeseen situations
Manage deposits

Polaris Engineering                                                                                                      
Assistant to the Systems Administrator (student internship 180 hours),                             
09/ 2007 – 10/2007
Assisted in the installation of hard drives and troubleshooting networks
Effectively provided aid to employees offering help desk support
Actively installed software for security, debugging, spyware, and additional purposes
Performed numerous technical duties as assigned by systems administrator

Wal-Mart 	
GM Receiving Associate,			                                                          
 08/2005 – 09/2006

Received and organized product deliveries
Lead team in charge of bringing inventory out to the floor
Maintained equipment and cleanliness in work area
Constructed detailed assignment reports for managers 
Maintained deadlines and ensured steady stock departure from yard

"
1fidly,3,2013-06-02,"Student looking for internships for the fall, need some advice on resume",zoidbergLOL,cscareerquestions,https://www.reddit.com/r/cscareerquestions/comments/1fidly/student_looking_for_internships_for_the_fall_need/,"I recently had my first technical internship, and now that I'm back at school, I have to start looking for another one. I changed my resume to include new things, but I changed the layout a lot from the old one. If I could get some feedback and tips, that would be great.

https://docs.google.com/file/d/0B7V_Dgn_Mi_QRDhSV3RUUlYzUU0/edit?usp=sharing"
1fhvcb,7,2013-06-01,"[For Hire] Web Developer (PHP/MySQL, HTML[5], JavaScript/jQuery) and Android Developer (Java)",tslocum,forhire,https://www.reddit.com/r/forhire/comments/1fhvcb/for_hire_web_developer_phpmysql_html5/,"I'm located in Orange County, California and would like to work as an intern or apprentice at a local office.  I am also available for remote work on any size of project.  I have been writing [web applications](https://github.com/tslocum?tab=repositories) and more recently writing an [Android application](https://play.google.com/store/apps/details?id=sh.ftp.rocketninelabs.meditationassistant) as a hobby.  Now I would like to use these skills to start a career in programming.  I have been using Windows and Linux (Ubuntu) for several years and can develop using either.  I also have some experience with Linux server administration.

For remote work I usually charge $35/hr.  A lower rate can be negotiated depending on the project.

[Resume](http://tslocum.github.io/resume) - [GitHub](https://github.com/tslocum)  - tslocum@gmail.com"
1fm394,20,2013-06-03,Voyeur,[deleted],nosleep,https://www.reddit.com/r/nosleep/comments/1fm394/voyeur/,"I had always been chubby, but in college I gained a freshman thirty instead of fifteen.  My second semester, I decided to work out, but the gym was always full of muscle bound guys who sat on benches and wouldn’t let you through, and sorority girls in yoga pants who snickered at me as I puffed on the treadmill.  Thankfully, my dad was an alumnus, and recommended that I check out the old fitness trail.

It had been built in the 60s, but was pretty well unused since the new tracks were built by the fitness center back in the late nineties.  I’d see one or two students, a few professors there, but other than the days the Golden Sneakers Club from the senior citizen center downtown would come to walk, I wouldn’t bump into anyone.  It was a 1/8 mile trail with signs all along it, telling you to do sit ups and push-ups, with basic bars and platforms to help you work out.  For me, it was perfect.

The whole campus is sort of on a hillside, and the trail is elevated above the three freshmen halls, somewhere level between the second and third floors.  The halls there, where I lived at the time, were those blocky style dorms built in the seventies that had as much aesthetic as a LEGO building, all square and made of cinder block, designed to hold as many kids as possible for the least cost.  No one really closed their blinds, and I’d find myself glancing over as I walked my little workout.

There were pairs of mirror image rooms all down the way, all the same with just the slight differences made from what the residents hung from the walls, but a sort of soothing symmetry none the less.  I noticed it, but didn’t really look, for some time, until one day something got my attention.  By one of the windows, two students were going at it.  

She was sitting on the desk, back arched against the wall behind her.  Her leg, jeans still slung around her ankle, was up against the window.  He was in front of her, leaning forward, arm braced against the wall for support.  The thing that struck me most strange though, was the window next door.  In the next room, a guy sat at his desk just opposite the wall, clicking on his laptop, and looking bored, perhaps slightly pissed.  I saw him glance over his shoulder to the ceiling—sound travelled so strangely in the cinder block room, no doubt he couldn’t tell which room the couple was.  But from my vantage point, the wall blocked by the window frame, I could see how close they were, just three foot or so apart.  I could almost convince myself they were a strange threesome.  

The whole thing fascinated me, really.  I pictured how easily he could have high fived the other guy’s outstretched hand.  And strangest of all, none of them were thinking how close they were to each other.  

How would they feel about it, I wondered?  Would they see it as an interloper?  But it was, in some way, my secret that they had that third right there, so close! But were clueless.

I was hooked.  I started planning extra time in my workout, taking off at the end to stand and watch the drama in the buildings below.  

There were three buildings to choose from, I always had a window where some little drama was playing out like a silent film below.  I’d laugh when I saw a kid battling a microwave fire, or someone struggling into too tight pants.  There would be balloons, a birthday party!  Or maybe a half dozen kids sprawled across beds, smoking pot, laughing.  But I especially loved when a room had a weird interaction with the one next to it.  I saw two rooms, each with a kid in it battling with sticks like light sabers, oblivious to the fact that their neighbor was doing the same.  I saw a nerdy looking guy bored on a bed, picking his feet, not knowing that on the opposite side of the wall he was facing, two co-eds were dancing about in their underwear.  I saw it all.

Then one day, I saw something that confused me.  In one room, a kid paced.  He was agitated, talking to himself, shaking his head and flapping his arms as though trying to shake off something stuck to him.  I watched him for a moment, wondering.  Then I noticed the next window.  A girl stood, her face obscured to me, watching him.  

But she couldn’t really be watching him, could she?  There was a concrete block wall between them.  No, it was impossible, she couldn’t see him.  But, I couldn’t shake the feeling she was monitoring his every move.  He would pace away from me, and her whole head would turn with him, her brown hair sliding across his shoulders.  He would move towards me, and she would turn her head with his every step.  He’d stop, and she would stare right at him.  

Feeling weird, I tried to notice things about them each.  He was easy to describe, blonde, tall, and scrawny with an agitated face.  But she was more difficult to describe.  Her room must have been dark, I couldn’t make out features.  Just dark hair, a white shirt or some sort.  But with a month of experience reading people, I could sense more.  Anticipation of some kind, glee maybe.  She stared at him with so much intensity, it almost seemed violating.  It freaked me out, and I jetted out early.

The next day, I saw the guy again.  He was on the front page of the newspaper.  He had left a strange, rambling note, stripped naked, and walked in front of a bus.  The paper talked of how he had been acting erratically for a few weeks, schizophrenia becomes active in the late teens, we should watch for warning signs for others, etc.  He had died an hour after I saw him.

Finals were coming up anyway, and I decided to cut out my workouts for the rest of the semester.  But I was back that fall, walking and watching.  It was my same routine and nothing unusual for months and months.  

Then, one day I saw movement in one of the windows.  A fight!  It was only my third or fourth really good fight, and I sat myself down on the grass to take it in.  Two girls, a Blondie and a girl with darker skin, Hispanic maybe?  Blondie was screaming at Hispanic girl, she had something in her hand she was waving in front of her, gesturing, then threw it straight at her head.  Hispanic girl dodged it, motioning towards something in the corner, and Blondie had her hair, and they started grappling back and forth.  Oh, this was good!

Somewhere in my periphery I noticed the next window, and my breath stopped for a moment.  There stood creepy girl again, staring at the wall towards the fight with what could only be described as excitement.  She was practically quivering with it, tracking the movements of the girls as someone burst in the doors, pulled them apart, and they screamed at each other. 

I stopped watching that drama unfold and stared at the girl.  She was still in a partially dark room, and I could still make out nothing but that white shirt with dark hair.  But why was she there?  Holland Hall was very specifically freshman only.  I saw her in a first year dorm the year before, she should be a sophomore and out of there by now.  An RA, maybe?  I felt uncomfortable about her, and left in a hurry.

Creeped out, I watched the papers the next day.  Nothing.  I was relieved.  I let it slip from my mind, enjoying a good afternoon’s workout the next day with no issues.  Then, a week out, the Hispanic girl’s face was on the front page.  After a fight with her roommate, the roommate was moved to another room, the article said.  

Believing she had left something behind, the blonde roommate had come back and broke in the room.  Another fight ensued.  Hispanic girl was stabbed to death.

Normally, the dorms are on lockdown, but there was an impromptu memorial, and I joined the people pouring into the dorm to leave flowers and cards outside her old dorm room where she was killed.  I stood back and watched her friends hug and cry, but then noticed the next door.  It would have been the room where creepy girl stood, I realized.  But the sign on the door said “maintenance”.  I pushed the door open.  It was the AC unit, a pile of mops and brooms.  And no window.

I didn’t workout up on the track for the rest of the year, too afraid I would see creepy girl again.  It was depressing in a way.  Without my little alone time up the hill, my walks and my little viewpoint into other’s lives, I felt disconnected from the world.  

I spent that summer living with my parents, working an ice cream stand all day.  I’d come home and sit on the back porch and watch towards the neighbor’s house.  They fought a lot.  I hadn’t noticed it before that summer, but they would argue every night, voices raised, and vague shadows of angry figures on the curtains.  He would storm off to a room on the back of the garage and watch TV, his man cave, I figured.  She would end up in the bedroom, which was at an uncomfortable angle to my parents’ house, and only visible if I walked up the loft of my dad’s garage.  She’d sob into her pillow, and sometimes he’d come to bed.  Other times he just ended up sleeping on the uncomfortable looking futon in the garage.

She was hanging out wash the one day when I got home, and I did a double take.  She had a shiny black eye, apparently their fights had turned physical when I wasn’t watching.  The next week or two, I was sure of it.  In the kitchen through the roman shades, he threw her against a cupboard, in the bedroom he hit her so hard she fell across the bed unconscious.

And then one night the fighting was louder than ever.  They were in the bedroom, floor scattered with suitcases and trash bags and clothes, and she was yelling back like never before, words muffled by the wall.  He hit her, and she grabbed a phone, waved it in her face, and he stormed off.  She disappeared further in the room, the bathroom, I always guessed. 

I went inside to pour myself some lemonade, and stood back out on the porch.  He was in the man cave, storming about, still yelling.  And there, in the gloom of the garage, was the creepy girl, staring at him, watching as he pounded and raged.
I froze.  I had to do something.  I would call the police.  But what would they say?  How would I explain it?  No, I would go over there myself, charge in like a white knight and warn her, separate them, save them.  But could this even be stopped?  I couldn’t decide what to do!  I finally fled into my parent’s basement, turning on the TV as loud as I could to drown out my thoughts.  I didn’t hear the gunshot.  I didn’t hear the sirens.

It’s my senior year now, and they ask me what I want to do with myself.  I have a good major, good grades, I mention graduate school and internships vaguely.  But I know specifically what I need to do.  There are good schools in the middle of the city in Philly and Atlanta and New York.  I can get into at least one.  And in the city you can eat and watch out the window at all the people.  Better yet, those schools will house you in lofty high places, where you can see hundreds of windows with a decent set of binoculars.  You can find park benches that afford decent views and even some offices will let you see lots of people.  I can even still work out in gyms with treadmills set up in front of windows.  Oh yes, as I visit colleges, I’m seeing how many places I can watch.  And when that girl shows up, staring in her weird way, I will be waiting and this time I’ll do something.  I will act and stop the violence from happening and I will be a hero and save the day.  Just wait.

Updated at: http://redd.it/1foq2c"
