eosjm,2,2010-12-20,21-year-old college student needs advice on future job/living situation,ellydee,needadvice,https://www.reddit.com/r/needadvice/comments/eosjm/21yearold_college_student_needs_advice_on_future/,"Hey guys I'd really appreciate some advice on my future job/living situation. This is a little complicated so bear with me.

Some background: I am a 21-year-old college student with very little money in the bank. After all the bills I am expected to pay at this time of year I will probably be more in debt than ever. Currently, I work during breaks while I’m home. I just recently found out that my job will be cutting my hours and I will not be able to get full-time hours during the times I am home. Instead, I will only be able to work about 4 days per week. On top of all this, I have not been getting paid what I am “worth” for the past 1-1.5 years. I am in a graduate degree program with intern status and should be making a bit more than I am (2-3 more dollars per hour). For these reasons, I have decided to quit my current job as soon as I’ve secured employment in the city where I’m attending college. Previously I could afford to not work while at college so I could focus on my studies, but that just isn’t cutting it for me anymore. My problem is where to live this summer.

My parents would prefer that I stay home during my breaks so I don’t have to take out more loans to pay for housing. This would be nice, except that I do not have a place to stay in my house anymore. In September, they gave my room away to my 18-year-old brother and now I am sleeping on an air mattress downstairs with no place to put any of my belongings and little to no privacy. I don’t want to seem like a spoiled brat, but this is just not what I am used to. I feel like they no longer have room for me in their house, yet expect me to have no issues staying here for long periods of time. Specifically, they want me to stay here for 4 months over the summer. They have offered to kick my brother out of my old room and have him share a room with my other brother for the summer, so that I can have my room back for 4 months. I don’t think this is fair at all and I really don’t want to take my brother’s new room away from him.

As I see it, my options are:

(a)	Stay at home, suck it up, live rent-free and have my job in college city (assuming I can find employment) transfer me to a store near hometown. Spend the summer living with my family but sleeping on an air mattress.

(b)	Live in college city working at new job, pay rent for the summer, have a room and privacy, not see family as much.

I’m having a hard time deciding how to weigh the pros and cons on this one. I’m wondering if there is a way to do this that I haven’t thought of yet. Any advice is appreciated."
epgs1,7,2010-12-21,Is exam grading/curving this bad at most Uni's?,CrimsonVim,ECE,https://www.reddit.com/r/ECE/comments/epgs1/is_exam_gradingcurving_this_bad_at_most_unis/,"I just completed my BSE and I just started a good job at a company I've already had 3 internships with, and I feel like I was generally pretty successful throughout college and was very involved in multiple aspects of college life. But the one thing I could never understand was the idea of professors who design [engineering] exams for a 50%(ish) average score. As an example, one of the classes I just finished was an intro VLSI design course and as many of you know, that covers a wide variety of topics throughout the semester and the pace is pretty fast. I felt like I knew the material pretty well and the professor was a guy I knew well and liked his teaching style very much. But I was still very nervous about the exams because I know he likes to design them around the 50% average, so that the top students ""have a chance to show how much they studied/learned"" or something like that. So I took the exam, and as I feared, it was extremely hard - one of the toughest I have taken, with both short answer theory questions and long, multiple-part technical/math/calculation/sketching questions. Walking away from the test I had this nasty feeling in the pit of my stomach because even though I felt I was well prepared for the test, the sheer amount and breadth of material on the exam was out of control, and many questions were ""application"" type questions that I had never seen before and required very high level thinking to understand what the question was asking and how to apply multiple concepts we learned to answer it. The average ended up being 55% for a class of about 25 students, and I got a 64% which was toward the upper end of the scores (I think 70 was the highest in the class). I ended up getting an A in the class and yet I don't feel accomplished at all, knowing that I only answered slightly more than half of the material on the exam correctly. I guess my question is, do most Unis do it this way and does anyone else feel discouraged about this method? I really can't wrap my head around this."
eptjn,0,2010-12-22,Could you spare a vote? My friend is trying to win an internship competition.,mwc191,AskReddit,https://www.reddit.com/r/AskReddit/comments/eptjn/could_you_spare_a_vote_my_friend_is_trying_to_win/,"[Link](http://www.ef.de/globalintern/contestants/?id=27998&amp;ctr=de)

Please watch the video and if you like it, click on the thumbs up!

Internship in 3 different countries for 3 months in total.

Thank you so much :)"
er1l1,2,2010-12-24,Information science major. What is the best type of internship to get real experience and connections? Did you guys do any internships? What were your experiences?,[deleted],AskReddit,https://www.reddit.com/r/AskReddit/comments/er1l1/information_science_major_what_is_the_best_type/,"Reddit seems to have many tech people reading so I wanted to take the time to ask about internships and entry-level positions you guys have had and which ones/kinds you think provide the best experience or resume attention.

I'm looking for an internship over the summer and there are many available (I'm in Philadelphia, lots of places around), but some seem artificial. By artificial, I mean that it seems if I interned there I'd be running papers back and forth instead of doing anything related to computers, networks, or anything tech related.

Anyone have some advice for me?"
eri8z,4,2010-12-25,Interested in a job in Information Security (Location: San Jose - San Francisco)?,orwellian_gangsta,jobs,https://www.reddit.com/r/jobs/comments/eri8z/interested_in_a_job_in_information_security/,"I work for a large consulting firm. I am responsible for running and building a team around our information security services in the West coast.

I have 7 positions open (Staff through Manager).

Location: San Jose, San Francisco (if you are from out of California, relocation may be available).

HR is going to start advertising the positions in January, but as a fellow Redditor, I decided to post here first to see if anyone is interested.

My team provides consulting services for large companies located in the West coast. Based on your background and the clients' needs you can expect to help out in a variety of fields: attack &amp; penetration assessments, network security architecture, threat intelligence and threat modeling, mobile security, platform security, and identity and access management.

In terms of experience, I'm looking for 1. Recent college grads who have a strong enthusiasm in information security and have dabbled with the field as part of their hobby or internship, or taken a specialized course, and 2. Experienced professionals with a consulting background (2-10 years).

Send me a message if you are interested. "
erokt,1,2010-12-26,So I got my CS degree... now what?,PsYcHoMoNkY3169,AskReddit,https://www.reddit.com/r/AskReddit/comments/erokt/so_i_got_my_cs_degree_now_what/,"So I have finally gotten my degree in Computer Science from Virginia Tech and am looking for a job. I have gone on several interviews but all have said that I don't meet the requirements or they are going with more qualified people. I'm a pretty average student 2.7 gpa and nothing special stands out on my resume, no internships, nothing that puts me above the others.
  

I was just wondering has anyone else gone through a similar experience? Any words of advice for those entering the job market straight from college with no ""real world"" experience?  
  
**EDIT:** PM me your email if you would like to see a copy of my resume"
erzlp,3,2010-12-27,Dear Redditors: You all seem relatively smart. Help me decide where to work this summer? ,throwoutacnt,AskReddit,https://www.reddit.com/r/AskReddit/comments/erzlp/dear_redditors_you_all_seem_relatively_smart_help/,"This summer I have been offered two internships and circumstances make the decision a toughy. One is located in Silicon Valley, and the other is located in Irvine, CA.

I grew up in Southern California (Coto de Caza area) and was offered the internship in Irvine through mere connections. I'm only a second year Electrical Engineering student so I would be living at home (probably for the last time) if I interned in Irvine... but if I took the Silicon Valley offer, I would probably live in a really beautiful appartment in a great new city, which would be nice, etc etc.

Both pay essentially the same, and would look great on my resume regardless. I'm not quite sure which company I would rather stay with when I graduate, as the ultimate decision factor would be location.

My GF of 2 years lives and works in San Fran, but that's not really a factor because I would only be able to see her on the weekends anyway, and it'd either be an hour drive from San Jose, or an hour flight out of SNA to SFO. 

Maybe I just needed to type this out, but I feel like you are all much wiser than most internet goers so I figured I hear what you had to say etc. Thanks.

tl;dr:
I can't decide if I want to live at home and work somewhere where I got a job through connections, or move to a nice new appartment in San Jose on my own and intern at a place where I got offered the position based on my abilities. Both pay the same, have the same title, and are for world wide companies.
"
et5dm,0,2010-12-29,What type of freelance work can I find with these skills of mine?,[deleted],ECE,https://www.reddit.com/r/ECE/comments/et5dm/what_type_of_freelance_work_can_i_find_with_these/,"Hello All,

I am a new member to ECE subreddit (new account, but have been hanging around and reading stuff for a few months).

I am currently working as an intern in a robotics company, mostly programming Atmegas and LPC2148. I have learned enough to handle small projects as a freelancer. I will be putting up the code I had written for LPC2148 on my github as soon as the internship ends to showcase what I can do.

So, what kind of freelance work can I get with these skills?"
et5uj,6,2010-12-29,Alright /r/engineering... The new boss laid it out for me. Help me get back on the horse.,LaxBouncer,engineering,https://www.reddit.com/r/engineering/comments/et5uj/alright_rengineering_the_new_boss_laid_it_out_for/,"Here's a little context:

I'm 24 years old, I have 96 credits from 3 different universities (Syracuse University, Hofstra University, and SUNY at Buffalo). I landed an internship at company, and asked them to pick me up full time, which they did. Now, the reason I asked them to pick me up full time was because I was failing out of school, I couldn't dedicate the time to both working at my internship and school. I now work 50-60 a week standard and everything was great. My boss made it clear that I had the potential to move up in the company based on my work quality and ethic, life was good.

And then my boss got a sidemotion and there's a new VP of engineering who's made it quite clear that degrees will be important. As of now, I can sit in my same position as I've been grandfathered in, but I have pretty much lost my growth potential in the company.

I've got to go back and finish my degree. 

There's a couple things holding me back:

1.) I was kicked out of the engineering department at UB right before I decided to go full time. I was in the process of taking the two classes that would get me back in, granted that I got the grades in them, when I dropped them in order to work. 

2.) My GPA at my first two universities was very good, but at UB not so much. I live and work in Buffalo so I feel like I would have to go to UB to finish, where I have a poor track record. 

3.) I can't stop working. I work ten hour days, I need the hours. From what I remember at UB there's very slim to no choices for night classes that I need. 

So I'm looking for some advice on what you folks think the best way to resolve these issues would be? My company will pay for half of my tuition, and I'm still eligible for grants/loans, so hopefully tuition won't be a limiting factor. Would I be able to get back in at UB? Are there any online options for accredited engineering degrees that could work around my schedule? What would you do if you were in my position?

Thanks for the time. "
etq5b,9,2010-12-30,Why are so many apache cluster projects written in Java?,zaneyhaney54,learnprogramming,https://www.reddit.com/r/learnprogramming/comments/etq5b/why_are_so_many_apache_cluster_projects_written/,"I've been working on a web application and I decided that I'd break from my normal pattern of using relational databases (MySQL primarily) and try something new. I've been interviewing for an internship at facebook and I thought Apache Cassandra might be an interesting choice, when I started reading about it I thought it was strange that it was written in Java, later when I learned that Hadoop was also primarily implemented in Java, aswell as Hive and Derby I started wondering what the reasoning behind this decision was. Most of my studies have been in Scientific computing and the codebases are usually in C (or in some cases Fortran), in a cluster project like Cassandra or Hadoop why would you pick Java (a language that I've always been told is slow) as opposed to C or C++? Is it strictly a portability decision? Any insight here would be helpful."
