1akl28,4,2013-03-18,Salary Expectations?,dogdiarrhea,sysadmin,https://www.reddit.com/r/sysadmin/comments/1akl28/salary_expectations/,"I just saw a job pop up that seemed to be tailor made for my current experience. I'm about to graduate university but did about 2 years of worth of internships at an on campus information systems department on campus. I'm curious what I should put for salary expectations, I'm guessing the strategy would be not to put off the employer. 

The job title is: Infrastructure Analyst I

The responsibilities are:

&gt;Assist in the implementation of varying technologies with respect to new and continuing infrastructure projects.

&gt;Perform on-site or remote diagnosing of hardware related and software problems using highly integrated diagnostic tools and techniques with elevated privileges.

&gt;Maintain up to date structured diagrams for the specification of databases, communication systems, servers, storage area networks or any other infrastructure service.

&gt;Make recommendations on new maintenance procedures, services, protocols and security practices.

&gt;Manage and implement best practices for maintenance and operation procedures for the support of databases, applications, hardware systems, operating systems and network systems.

&gt;Create documentation at the onset of an infrastructure initiative and maintain such documentation through the project lifecycle in preparation for operational handoff.

&gt;Assist managing and implementing the IS architecture plan, ensuring the IS infrastructure meets existing and future requirements.

&gt;Assist in the maintenance of policies and procedures for IS administration to ensure consistency and adherence to standards.

&gt;Maintain a high level of communication and rapport with the Manager of Infrastructure Delivery.

&gt;Participate and assist in the weekly/monthly meetings to communicate progress on projects and objectives.

&gt;Work effectively with management, support staff, and clients/partners to enhance professionalism, productivity and team achievement.

Edit: I was thinking the most likely ranges I should put to be 40-50k or 50-60k."
1ap2ou,2,2013-03-20,Internship question,swbat55,UCDavis,https://www.reddit.com/r/UCDavis/comments/1ap2ou/internship_question/,Is it possible to get credit for having an internship off campus during school? Kinda like work experience? Any info would help thanks guys!
1ap2en,1,2013-03-20,"[Build Ready] First Time builder, how does this look.",[deleted],buildapc,https://www.reddit.com/r/buildapc/comments/1ap2en/build_ready_first_time_builder_how_does_this_look/,"How does this build look, are there any good ways to increase performance without increasing price or lower price without reducing performance? I'm looking for a good multipurpose computer which uses will include gaming and CAD use. I also wanted it to be ready for potential future upgrades such as 2 way SLI or other devices, that is why it has a 750 watt PSU. Also is there any reason to get a sound card if using only a simple 2 speaker system or will the built in sound be good enough? I am not in a hurry to build this (I am waiting to hear back from some out of state internships, if I get one I won't build it, if I don't I want to get it going by the beginning of May) so I have time to watch sales and learn more.

[PCPartPicker part list](http://pcpartpicker.com/p/L4s5) / [Price breakdown by merchant](http://pcpartpicker.com/p/L4s5/by_merchant/) / [Benchmarks](http://pcpartpicker.com/p/L4s5/benchmarks/)

Type|Item|Price
:----|:----|:----
**CPU** | [Intel Core i7-3770K 3.5GHz Quad-Core Processor](http://pcpartpicker.com/part/intel-cpu-bx80637i73770k) | $304.99 @ Newegg 
**CPU Cooler** | [Cooler Master Hyper 212 EVO 82.9 CFM Sleeve Bearing CPU Cooler](http://pcpartpicker.com/part/cooler-master-cpu-cooler-rr212e20pkr2) | $29.99 @ Newegg 
**Thermal Compound** | [Arctic Cooling MX4 4g Thermal Paste](http://pcpartpicker.com/part/arctic-cooling-thermal-paste-acmx4) | $9.99 @ Newegg 
**Motherboard** | [MSI Z77A-GD65 ATX  LGA1155 Motherboard](http://pcpartpicker.com/part/msi-motherboard-z77agd65) | $154.99 @ Newegg 
**Memory** | [Corsair XMS 8GB (1 x 8GB) DDR3-1600 Memory](http://pcpartpicker.com/part/corsair-memory-cmx8gx3m1a1600c11) | $54.99 @ Newegg 
**Memory** | [Corsair XMS 8GB (1 x 8GB) DDR3-1600 Memory](http://pcpartpicker.com/part/corsair-memory-cmx8gx3m1a1600c11) | $54.99 @ Newegg 
**Storage** | [OCZ Vertex 4 128GB 2.5"" Solid State Disk](http://pcpartpicker.com/part/ocz-internal-hard-drive-vtx425sat3128g) | $129.64 @ NCIX US 
**Storage** | [Western Digital Caviar Blue 1TB 3.5"" 7200RPM Internal Hard Drive](http://pcpartpicker.com/part/western-digital-internal-hard-drive-wd10ezex) | $69.98 @ Outlet PC 
**Video Card** | [EVGA GeForce GTX 670 2GB Video Card](http://pcpartpicker.com/part/evga-video-card-02gp42678kr) | $387.00 @ Amazon 
**Wireless Network Adapter** | [Asus PCE-N15 802.11b/g/n PCI-Express x1 Wi-Fi Adapter](http://pcpartpicker.com/part/asus-wireless-network-card-pcen15) | $26.98 @ Outlet PC 
**Case** | [Cooler Master Elite 431 Plus (Black) ATX Mid Tower Case](http://pcpartpicker.com/part/cooler-master-case-rc431pkwn2) | $39.99 @ Amazon 
**Power Supply** | [OCZ ZT 750W 80 PLUS Bronze Certified ATX12V Power Supply](http://pcpartpicker.com/part/ocz-power-supply-oczzt750w) | $98.99 @ Amazon 
**Optical Drive** | [Lite-On iHAS124-04 DVD/CD Writer](http://pcpartpicker.com/part/lite-on-optical-drive-ihas124-04) | $16.97 @ Outlet PC 
**Other**| card reader (external 3.5)|  
**Other**| Windows 7 Ultimate (university special offer)| $0.00 
 | | **Total**
 | Prices include shipping, taxes, and discounts when available. | $1379.49
 | Generated by PCPartPicker 2013-03-20 18:47 EDT-0400 |

I found I still have some Arctic Silver 5 thermal paste left over from doing the X-clamp fix to my xbox so I probably won't buy the listed thermal compound. I also have a segate 500GB external HDD I might salvage and place inside this build, its been gathering dust since I bought a 2 TB backup drive.

Edit: Also is a mid tower good for this or will I need a full tower?"
1ap085,7,2013-03-20,Any good programming activities going on during the summer for a college student?,[deleted],cscareerquestions,https://www.reddit.com/r/cscareerquestions/comments/1ap085/any_good_programming_activities_going_on_during/,As a sophomore I've decided to hold off on applying for internships this summer but I want to make sure I'm active. I'll already be working on person projects but I would like to be able to attend something for programming like a workshop that will help me even more. I know there are things like google's summer of code and hacker school but those are selective and might be a little too competitive. Any other suggestions?
1aorh9,1,2013-03-20,Question: When looking for an internship how long did it take you to get one? Did you have one before you graduated? Did it help a lot?,bmoe872,engineering,https://www.reddit.com/r/engineering/comments/1aorh9/question_when_looking_for_an_internship_how_long/,"I am currently in an IT position for campus, and I have been told by some other students that had worked here in the past that I should look into getting an internship withing the field I am studying (Computer Engineering). Because just IT for campus doesnt always look that great.

So I have been applying all over to these different positions, but I am hoping that someone on here has some type of idea of what to do I havent thought of? Or maybe the IT position is the shit and I dont need to worry so much?

Any help is appreciated. Thanks.

TL;DR Where do I look to get a good internship.
"
1aoc72,0,2013-03-20,How do I start a career in programming?,[deleted],cscareerquestions,https://www.reddit.com/r/cscareerquestions/comments/1aoc72/how_do_i_start_a_career_in_programming/,"Hey, /r/cscareerquestions.

I know this question has probably been asked thousands of times but I'm really trying to get enough information as possible. Sorry if this bothers you but I'm just trying to seek some answers.

I'm 18, in a few months time I finish sixth form, where I am studying computer science and photography. I haven't apply for any universities, colleges or internships and now, it looks like I'll spend next year working at my part time McDonald's job, which to be honest, is probably the most degrading thing I have ever had to do in my life.

Ever since I can remember, I was always certain that I was somehow I was going to get a job where I could work with computers. Using computers and programming are the only things that I believed I'm good at.

Every person I have spoken to about my future has given me some vague overview about what courses I should apply for and what I should and shouldn't do but all this information, with slight adjustments could easily be applied to any career out there.

So, I'm here looking for somebody who could give me some advise on becoming a programmer or give me a better insight into the computing industry, which courses I should look into, what experience I should get, what is the competition out there like (I live in the UK, what is it like here?) or if it's even worth trying. Just reading your experiences would be very useful for me too.

I won't bore you any further but thanks in advance to anybody who could help me out.

Repost due to spelling error in title."
1aobfk,1,2013-03-20,How do start a career in programming?,[deleted],cscareerquestions,https://www.reddit.com/r/cscareerquestions/comments/1aobfk/how_do_start_a_career_in_programming/,"Hey, /r/cscareerquestions.

I know this question has probably been asked thousands of times but I'm really trying to get enough information as possible. Sorry if this bothers you but I'm just trying to seek some answers.

I'm 18, in a few months time I finish sixth form, where I am studying computer science and photography. I haven't apply for any universities, colleges or internships and now, it looks like I'll spend next year working at my part time McDonald's job, which to be honest, is probably the most degrading thing I have ever had to do in my life.

Ever since I can remember, I was always certain that I was somehow I was going to get a job where I could work with computers. Using computers and programming are the only things that I believed I'm good at.

Every person I have spoken to about my future has given me some vague overview about what courses I should apply for and what I should and shouldn't do but all this information, with slight adjustments could easily be applied to any career out there.


So, I'm here looking for somebody who could give me some advise on becoming a programmer or give me a better insight into the computing industry, which courses I should look into, what experience I should get, what is the competition out there like (I live in the UK, what is it like here?) or if it's even worth trying. Just reading your experiences would be very useful for me too.

I won't bore you any further but thanks in advance to anybody who could help me out.
 "
1anv5o,1,2013-03-20,A little motivation for those job hunters!,[deleted],EngineeringStudents,https://www.reddit.com/r/EngineeringStudents/comments/1anv5o/a_little_motivation_for_those_job_hunters/,"Finding a job has been a struggle for me, despite having internship experience and a decent GPA. After more applications than I'd like to admit, 4 on-campus interviews, 7 phone interviews, and 3 on-site interviews, I have finally found a job that meets my expectations on a number of levels.

It was hard staying motivated throughout the job search when it seemed like application after application was being sent out, with little response from who I thought were my ideal potential employers. I had an offer a few weeks ago that didn't meet my expectations, and declining that with no other offer in sight was hard to do. This morning, I got a call I had been waiting for...and now my job search is officially over!"
1anv51,10,2013-03-20,Internship or graduate with my degrees?,Qbit42,cscareerquestions,https://www.reddit.com/r/cscareerquestions/comments/1anv51/internship_or_graduate_with_my_degrees/,"Hello. Firstly thanks for taking the time to read my post. It's a little long.

I have the option of getting my university to help place me in an internship for September or graduating in September. My university will help place me as long as I have 1 CS course left undone. Over this summer I could take that 1 CS course and graduate, or I could leave it out and get aid in finding an internship. However coming back to school for the sake of 1 course seems annoying, and ideally I want to move away to work so I'd have to deal with transfer credits.

 I am hoping to work in Winnipeg, Canada since I have friends there. I am concerned that if I enter the work force with no work experience I will not be able to get a job. The highlights of my resume will be:

* BSc Hons Applied Mathematics &amp; Physics, BA Computer Science (worked on all 3 majors concurrently across 5 years)

* 2 years running the undergraduate Mathematics Society (shows leadership and social skills)

* I have won a few scholarships over my university career

* Was awarded summer research position in mathematics

* Knows Java, C#, C++, SQL, and a bit of javascript. 

* I'll have 2 good letters of reference. One from a CS prof, one from a math prof

I am honestly open to working almost of any type programming job, I just worry that my lack of work experience will make me unhireable...

"
1angun,5,2013-03-20,Negotiating starting salary as a fresh CS PhD... what leverage do I have?,snapmaster,cscareerquestions,https://www.reddit.com/r/cscareerquestions/comments/1angun/negotiating_starting_salary_as_a_fresh_cs_phd/,"I recently finished a PhD from a very prestigious CS program.  I have zero work experience, but my research was fairly specialized and relevant to a company that recently extended me an offer.  The company basically only hires PhDs.

Looking at glassdoor.com and talking to a friend that works there, it's clear they are lowballing me by at least 10% (offer is barely over 100 for a silicon valley location).  I've read on here that new BS/MS grads have zero leverage.  Does that also apply to PhD students?

If that is true, can I gain more leverage by getting a competing offer?  I believe one is on the way, but I am not sure how much more they will offer me.  Unfortunately the first company is pushing me hard to respond while I buy time to get a second offer.  Bonus question- how long can I put them off?  They initially only gave me like 3 days!

EDIT - I've completed the negotiation process and got a job.  Here's what happened:

1. I got a competing offer.
2. I put off both places for just under 2 weeks.  They will pressure you, but they will wait if they want you.  The way you do this is by asking lots of questions and asking to talk to people in their organization.  This takes time, and they will respect you taking time to get more information.  They will not be happy if you take time just for the hell of it.
3. Having a highly ranked PhD was helpful, but didn't really get me leverage until I got the second offer.  Once I got the second offer, it was clear that both places were gunning for me hard.  I do believe that the weight of the PhD helped, but only once the second offer showed up.
4. The competing offer is truly how you get leverage.  Just send it to the first place, they will match or beat it.  Send the next offer to the second place, they will match or beat.  Then go back to the first.  That's all it took to go from just over 100 to almost 120.  During the process, be very cordial about everything, and express surprise at new offers; say that your goal is simply to get equivalent offers on the table.  Continually express how excited you are to join.  HR people know that competitors will try to counter- do not be shy about going back and forth.  Don't do it more than twice though.

NO ONE GAVE TWO SHITS that I didn't do an internship.  If you don't understand why, you don't understand the CS PhD process.

HTH"
1an6i9,3,2013-03-20,Can anyone help give me a better idea of what a signal integrity engineer actually does?,[deleted],AskEngineers,https://www.reddit.com/r/AskEngineers/comments/1an6i9/can_anyone_help_give_me_a_better_idea_of_what_a/,"So I'm a junior ECE student, currently looking at internship opportunities. I'm having trouble deciding between two offers, one is software development while the other is in signal integrity, so pretty huge difference there. I understand pretty well what the software job would entail, but I really don't have any idea if I would enjoy the signal integrity work.

Here's some basic stuff I believe is heavily involved: analyzing PCB layouts, timing analysis, DIMMs/memory systems, using lots of CAD tools. I know this is very vague, I'm just trying to give an idea of what I'm talking about. If I were able to explain better I probably wouldn't be making this thread.

So basically I have no idea if this would be an interesting position and I'm hoping someone with experience with this sort of work might be able to offer some insight. What's your experience with SI? Do you enjoy it? Why?

Thanks, and please let me know if there's any additional information that would be helpful."
1ampju,3,2013-03-19,Question about which internship to take.,[deleted],cscareerquestions,https://www.reddit.com/r/cscareerquestions/comments/1ampju/question_about_which_internship_to_take/,"So I applied for and got offered two internships.

Internship A is at ARM (in California). I live several states (read: about 1000 mi and several mountain ranges) away, and would have to move for the summer. I was completely fine with that, until I got offered Internship B.

Company B is located about 45 minutes from my house, and is a small collective of two electrical engineers, a couple of computer science people, and a mech-eng who can code. They basically work on commission and farm all the profits out to the employees. Their offer pays about $3 less per hour , but I wouldn't have to move, wouldn't have to sublet my apartment/do a more expensive month-to-month in CA. I'd be doing everything from FPGA design work to debugging an iphone app in Objective-C at company B, while at ARM I'd be working on a specific project that's already been at least vaguely outlined to me.

In both cases I would learn a lot of cool stuff and get a lot of experience. Both companies seem like they've got a good work atmosphere, both seem excited to have me. I signed and returned the offer letter for company B because I hadn't gotten a final offer letter from ARM  and was getting worried, and then literally that same day they came back with a formal offer.

I am divided between the big name for what actually would be less money, given the cost of living in Cali compared to where I live, cost of moving, etc, and going with the total unknown who does awesome stuff for anybody who wants to hire them, for several thousand dollars more over the course of the summer. 

tl;dr got offered two internships, one with a tech giant, one with a local collective of contract engineers. which to take? I need advice!"
1arm6u,2,2013-03-21,Advice for in person interview at a Fortune 500 company,Warshredder,cscareerquestions,https://www.reddit.com/r/cscareerquestions/comments/1arm6u/advice_for_in_person_interview_at_a_fortune_500/,"Here are the facts:

- It's a software engineering position

- I interned at this company last summer doing a project on mobile CRM

- I did pretty good in the phone interview, the manager and I have some common connections

- I'm going in to meet my potential manager and the software engineering team next Tuesday


I told him on the phone that I could get a letter of recommendation from my old manager (who no longer works there), but he said it would go through HR and never actually get to his desk. I am good friends with an intern (the common connection) that was working on the project I'm being hired full time for. I'm pretty sociable and good at interviewing, but other than acting really enthusiastic about the project what can I do to make sure I get hired at this company?"
1arepk,2,2013-03-21,When would it be appropriate for me to start applying for full-time positions?  (college student),mee777,cscareerquestions,https://www.reddit.com/r/cscareerquestions/comments/1arepk/when_would_it_be_appropriate_for_me_to_start/,"Hi, I'm a junior CS major.  I've already got an internship set for the summer, but its not with a company I'd like to work at on a more permanent basis.  I want to dive in and start looking at other companies whenever I can because I'm excited about the process.  When would it be okay for me to start applying?"
1ar4gf,3,2013-03-21,What was your first job after college?,osopolardefuego,AskReddit,https://www.reddit.com/r/AskReddit/comments/1ar4gf/what_was_your_first_job_after_college/,What was your experience like with an entry position or internship? are you still with the company? what are you doing now?
1aqwv8,0,2013-03-21,Is Java outdated,sourceCode145,learnprogramming,https://www.reddit.com/r/learnprogramming/comments/1aqwv8/is_java_outdated/,I learn Java and have 3 years of experience using it. I am wondering if it is outdated because every internship and job I apply to is looking for a computer science major but wants web-development works done. 
1aqlz2,0,2013-03-21,Internship Woes,Phannypax,EngineeringStudents,https://www.reddit.com/r/EngineeringStudents/comments/1aqlz2/internship_woes/,"I have been working at my internship as a manufacturing engineer since September 2012. It started out as a lot of fun, a lot of neat projects to help out with, and a really great learning experience. However, I don't feel as though I have accomplished a lot while working there. I have helped out with various projects, but nothing I can completely claim as my own. Most recently, there really has not been much for us two interns to work on, so we spend most of our days trying to keep ourselves busy. Our supervisors do not communicate a whole lot with us anymore, and we feel as though we have been put by the wayside. Unique situation about our plant is that it is in the process of being moved to a different plant, which I attribute to most of these problems. I understand that we are after all interns, but I was really hoping to have accomplished something that I could put on my resume to really impress employers and get into grad school. This is not my first internship, and at my previous internship I felt as though I was able to accomplish more, but I also had more freedom to act there. I am very grateful to have an opportunity for an internship, because I know many students do not. At the same time though, that makes me want to make sure that I do not waste this opportunity. Has anyone else had these sorts of problem while working their internship, or am I just expecting too much?
"
1aqgvg,0,2013-03-21,What are some best practices for Group Policy to push out to a domain?,[deleted],AskReddit,https://www.reddit.com/r/AskReddit/comments/1aqgvg/what_are_some_best_practices_for_group_policy_to/,I am doing an internship at my college IT lab.  I created a domain with the two instructor computers being the DC and having only 12 workstations.  I am looking for ideas on best practices to push out to the 12 computers using GPO.  Everything I found on the internet through Google is for bigger companies.  Server is Windows Server 2008 R2 and workstations are Windows 7.  Thanks guys.
