ek3py,26,2010-12-11,I wish someone could actually help me.,ohDontMindMe,SuicideWatch,https://www.reddit.com/r/SuicideWatch/comments/ek3py/i_wish_someone_could_actually_help_me/,"Instead of my trying to obsessively organize all of this to make perfect sense, and therefore never actually post anything, I'm going to just dump all my thoughts out here.  There'll probably be things missing or out of order a bit, but whatever.  I don't expect anyone to even care enough to read this, just as I don't expect anyone to actually help me or anything.  I can't think of the last time in my life that anything worked out for me, so there's no reason that'd change now.  I don't even know if I'm suicidal or not.  I know I wish I was just... just gone, or elsewhere, or I don't know.

I busted my ass for years to get into a great college.  I'm in the US, so of course I took a large chunk of debt (and threw my family another large chunk) so I could attend; my family has never been more than a lower-middle-class type, and some points we've been close to bankruptcy.  Even with that, they helped me go to a college to study what I had wanted to for years prior.  While there, I determined what exactly it was that I want to do, changed degrees within that program, and graduated with good standing.

I graduated in May 2008, and since then, I have never landed a job better than working food service.  I did everything I could during college to find internships, but I'd always get shafted at the last minute, some way or another, and I could never get one.  It didn't help that my focus wasn't something that particular college did a lot of outreach for.  I graduated and spent a year living with my family, building my portfolio and applying for work, with each application bringing a lower standard for job quality and farther distance from home.  After a year, there was still nothing - in the entire time, I got two declining emails from two companies, and a call from a third also declining my application.  Otherwise, I never heard anything.

With almost no money, I moved back to my college town to get away from my family, which had always been miserable - yelling, swearing, and general discomfort.  I met a great girl there, and since have been living in a shitty apartment with her and a few friends.  The apartment is a shithole, and we're under sports jocks who scream and yell and run all day and night, keeping us awake and raining plaster from the ceiling.  The landlord is a deadbeat, so no help there.

Upon first moving here, I found a dishwashing job and worked it for two months of absolute misery - 14-hour shifts with no breaks allowed for bathroom or eating, standing in two inches of dirty water.  I quit after they cut my hours repeatedly and had me earning so little that I could only afford to eat one meal every two or three days.  I found a ""better"" job at another restaurant, and then transitioned to the attached hotel's banquet hall, where I busted ass for 13 months.  They had me working 60+ hours for minimal pay, and no raises allowed.  My longest nonstop shift was 25 hours; I once worked almost 40 hours in two straight days, where I slept in the kitchen to save time.  I was treated like garbage, but I worked hard and saved up a small amount of money.

I quit that job in October due to job stress causing me to have constant breakdowns (which the managers didn't care about despite me crying and once blacking out).  I've lost hair, and my body has permanent stress-caused injuries (for example, I have no sensation in most of my feet/toes, probably from all the months of working 7-day weeks, 10+ hours each day).  But there was a hope!  I found a new college to attend, and was planning to move to Boston with my girlfriend and another friend.  I lined up a new bachelor's at that college, and was ready to turn my life around - the place was just perfect for me.  They loved me, accepted me, and wanted me to attend, and I had it all going smoothly... until I needed a loan co-signer, and my family refused because their finances are too shaky to sign a loan.  I begged them, but they refused.  I tried every person I knew, but not a single person could reliably offer to sign for the loans I needed.  Even with scholarships and grants, the amount I needed was too high, and at the last minute, I turned it down.  This happened just a few weeks ago, and the move was planned for mid-December.

My girlfriend is also attending the college, and will still be.  My friend is still moving there too.  I can't back out, and the lease was already signed anyway, so now I'll be moving to an extremely expensive city with barely over $2k in savings.  With all this in mind, I buckled down hard and got my portfolio website online, and made some new projects to show.  Even with all that, I have been turned down by every job I applied to.  Then I tried data entry places, and no luck.  I've actually been told that having food service on my resume is bad for me, because it makes them question why I spent time doing crap jobs - makes them think I don't have the drive to get or hold a real job.  I basically wasted my time with those jobs, when I was sure they'd make me seem like a solid worker.  

Now I'm stuck looking at food service jobs, but they don't pay enough for my bills and loans, so I'll need two.  The idea of doing even one food job makes me want to die.  I have not have health insurance in years, and before I lost it when I turned 23, I was already diagnosed with multiple severe sleep disorders, bipolar manic depression, and being pre-diabetic.  I need health insurance, but I sure as hell won't get it working food service!  I know how they operate to make sure employees don't get coverage, and besides, on the pay I'd get, I could never afford it.

I'm about to move to a new place, and immediately watch my life sink to bankruptcy.  I have no family to support me, no savings, and my degree is worthless.  Even my resume is too weak, and every day that goes by is a step closer to being a ""lifer"" in the food service industry.  I would honestly rather die painfully than ever go back to that madness.  My options are so limited though - I check job sites every day to no avail, and the stress is driving me to a breaking point.  I'm an emotionless blob that sits at home nearly crying... I lose time, my hair is still falling out, and I can't sleep or eat right.  As it is now, I've been awake for two days and I can barely eat without feeling ill.

I don't even know what I'm typing this for.  I'm a wreck.  I want to just disappear from all this, but I can't.  By the end of January I'll be out of money, and then what?  Jobs are so scarce, and I'm so miserable that I can't even think about looking for them now.  I just wanted to work an honest job and earn some money so I could live like a human.  I have a goddamn degree, for fuck's sake, but apparently I'm just trash.  I wish that someone could help me.  I swear, I just need those loans signed, but it'll never happen.  Good things don't necessarily happen to good people; maybe I'm one of those people who will never get a chance to be more than a slave, serving food to those who are actually successful.

I suppose I can chat to people if they want.  I tried to be vague since I know a lot of friends use reddit, but if you message me, I can maybe talk more detail or chat on AIM or something.  I dunno.  I doubt anyone is still reading by now... why would you?  I'm just a mess, and you probably have better, more important things to be doing.

EDIT: I hope people don't think I'm just here to beg or pester them or whatever.  I felt this was a better place to post for some helpful words than something like /r/Self... the last thing I want is a ton of upvotes turning me into some ridiculous circle-jerk front page charity case, so this seemed to make more sense.  I apologize if I was wrong."
ekg0k,1,2010-12-12,"Alright Reddit I am just sick of all the stress I have lately, any thoughts?",Mac_Attack18,AskReddit,https://www.reddit.com/r/AskReddit/comments/ekg0k/alright_reddit_i_am_just_sick_of_all_the_stress_i/,"I am studying for finals, trying to find a job(been looking for months), now my car might need work(rear brake lines and battery), I have no income and haven't in months. I have to find a way to pay for books next semester, depending on what my car costs I can probably afford it but it will seriously deplete my bank account. This xmas I was planning on getting computer parts to replace my gaming rig that died 1.5 years ago(i was going to have to put a little money into it, not the smartest idea on a limited budget but i really needed a pick me up), but with my car having issues I can't do that anymore.

My parents have been having their own issues and haven't been able to help me since my freshman year with money(half way through Jr year now). My dad got a new job and they said they should be able to help out next semester. I love my parents to death, but I'm not counting on it.

On top of that I royally screwed myself in a class. i went to the hospital the night before a test. only got 4 hours of sleep and took the test anyway I should NOT have, but I slept through my class and ran to the next class and just made a horrible judgement call. Talked to the Prof he said there is nothing he can do but if I do good on the final he will consider that into my second test score. only problem is his questions are set up so that the smallest is worth 5 out of 100 so i miss one question and thats a 95%. I can get a C if I ace the final but given past tests and quizzes doesn't seem likely.

The amount of stuff I have to know for my other finals is mind boggling and I will be spending all week studying.

I am trying to find an internship this summer with no luck so far school can't help me. I am just so stressed out. Even after finals I have 5 days till I know what my grades/ GPA is and I just want to know now.  What do you do when your stressed?

**I am not asking for money I want everyone to know that**

tl;dr I am very stressed and need to de-stress any ideas? I don't have much free time so yeah....."
ekg7g,10,2010-12-12,What's the oldest version of software/technology that you are still using?,ems573,AskReddit,https://www.reddit.com/r/AskReddit/comments/ekg7g/whats_the_oldest_version_of_softwaretechnology/,"I was surprised when I was at my summer internship and I saw guys still using CRT monitors and almost everyone still on Windows XP.  A friend of mine is still using Firefox 2.x because he doesn't like the way they started displaying tabs since 3.  I personally have a very hard time using old technology because I'm OCD or something, but it interests me when I see others getting along just fine with whatever they've been using for years.  What are you still using?"
ekjgu,48,2010-12-12,Ophthalmology,[deleted],nosleep,https://www.reddit.com/r/nosleep/comments/ekjgu/ophthalmology/,"I'll start by saying I have a very skeptical viewpoint of the supernatural. My parents are both fiercely religious as well as superstitious (perhaps you'll say that's redundant, ha) but I'm almost always an agnostic and I don't think I believe in ghosts.

That said, I'd like to tell you about an unsettling experience of mine.

My sophomore year at university I applied and was accepted as an intern in an ophthalmology lab. The position was unpaid, 15 hrs a week, performing cell counts. It was hardly interesting work, but necessary for a premed student to get lab experience.

The lab was in a converted hospital. That sounds ominous I know, but actually the section where I spent my time was a maternity ward, so it should have been filled with happy thoughts, right? The actual work we did, however, was a little creepy. We were testing compounds to try and find a way to decrease cell death and increase cell regeneration after crush of the optic nerve. We did this by surgically crushing the nerve of adult beagles, treating them, then putting them down and harvesting the retinas. My job was to take pictures of the retina, and quite literally count the cells under a microscope.

I had an almost immediate negative predisposition to my coworkers. They were irritable, impatient, and disrespectful even towards each other. They also seemed almost bafflingly incompetent. Equipment and samples were often lost, refrigerators would be left open or unplugged spoiling compounds, even data would occasionally get deleted. In hindsight, considering the frequency of these events, I should have thought it odd that no one had proposed the possibility of a poltergeist in the lab, but that would have required a modicum of humor between us, which I can assure you there was none.

As a result of these tensions, and the fact that my work was solitary, it wasn't long before I started keeping odd hours to avoid my colleagues. I'd come in around 6:00pm and work for 8 hours, twice a week. Since I was alone I'd play a book on tape or a netflix instant movie, and the experience would be largely more pleasurable without the bickering and conflict that defined the lab's daylight hours.

At least it was at first. I can only imagine it was the movies and books that kept me unaware for so long, but a few weeks before the holiday interim I let payment on my netflix account lapse. That night while I worked in silence I experienced a few sensations that I consider to be truly unexplainable.

It started fairly early in the evening. The dogs had already been fed, and I could hear them shuffling about and occasionally yipping from the kennel. It was already dark out, and the wind was whipping like it only really does in the winter, rattling the old glass panes of the windows. I left my desk to refill a water bottle. Upon stepping into the long hallway of the wing I was immediately hit with a nervousness. At first I didn't know to what to attribute it, when it struck me I almost called the lab supervisor. First, there was not a sound in the whole lab. No vibrations of washers, no spinning centrifuges, not even the gentle hum of computers. Secondly, every single door, dozens, was unlocked, and flung wide open on its hinges.

Instead, I quickened my pace. As I walked past room after room I noticed their interiors sickeningly dark, as if they could not be penetrated by the light from the hall. As I neared the fountain even the dogs had fallen silent, the hall's only sounds my footsteps. I began filling my bottle, only to drop it, startled, as I heard from the kennel a single impossibly simultaneous bark, from each dog. Not a bark, or really a growl, it sounded wet and I don't know how else to explain it.

At this point I was scared, and I was alone, so I dropped my bottle where I stood and ran. There's something about running down a hallway, try sometime at night, the hallway stretches and the running makes you afraid.

I spent the rest of the night rigidly at my desk. I don't know if it was in my head, or reality, but I felt at the time quite certain that there was a single shadow in the room that didn't belong, flitting outside my vision. Anyone who's worked in a lab like me, or perhaps a library, knows how you can feel after hours of silence, under a flickering fluorescent light. I stood up only once, to spin around and catch it, and immediately sat back down, knocked back by the screech of the autoclave's steam relief. I swear, I almost died at that moment.

I came into the lab again the next day. No one mentioned the unlocked doors. I can only imagine tests left to run over night were re-prepared, and run again during the day. People were irritable as usual, but there was no mention of things out of the ordinary. We did have one visit, a grad student who worked further down the wing walked by the labroom I was working in, no doubt to speak with my supervising professor. When passing by the room she stopped dead in her tracks, mouth agape, and stared first past me, then looking me straight in the eyes, before continuing.

A half an hour later the fire alarm went off. Grumbling, the lab workers shuffled out, we stood in the cold, then started to funnel back into the staircase to the ophthalmology wing. Thats when I saw her again, the staring grad student. She was standing at the mouth of the stairway, scanning the crowd. Her eyes finally landed on me, and she motioned me into a side hallway. Curious, I followed.

When we had moved a sufficient distance away from the grumpy crowd to talk I gave her a smile and asked how I could help her. She seemed not to hear me, gazing over my right shoulder she asked ""Have you lost an relatives lately? An older man? Or anyone close to you?"" I responded no and she quickly followed up with ""Has anyone you know of passed away that may have a special interest in you?"" I was mostly amused, a little spooked by her questions. ""No, why?""

What she told me next was stated with such matter of fact confidence, and followed by her immediate departure, I was left accepting it on default for moments before my skeptical brain could kick in. ""There's a dead man behind you, he's a ghost. One arm outstretched he's been pointing at you all morning.""

I've never believed in psychics, although I had before this point had one odd encounter. On a elementary school field trip a chaperone had turned to a friend of mine, eyes glassy, and abruptly said ""your dog is dead"". Afterwards she denied saying this, but sure enough... The dog had been struck by a car. When it didn't come to the door when called, even into the night, he was terrified. It was found the next day by the cloud of flies, it had dragged itself under the porch and died.

After returning to the crowd of people unevacuating the building, I purposefully pushed my way in to avoid standing next to the girl I had dubbed crazy. I returned to my lab room, and sat at my computer. Behind me two grad students were fighting. The argument, over another missing sample, grew louder than average. In fact, one girl turned to the other and actually rose her voice to a shout, and at the exact moment a glass cabinet shattered, pouring beakers and cylinders to the floor. Both grads students immediately stood quietly. One whispered ""Fuck this place"" and then walked out without making any attempt at cleaning.

It was that statement that pushed me over the edge. It was as if they knew, they knew there was something completely insane about the lab, and were resigned to it. I never came back to the lab at night. I worked two more weeks, frequently peering over my shoulder, and scampering quickly past the kennel on my trips to the bathroom, and then I left. I've not had any contact with the people I left behind, and for all I know they are continuing their business.

Whether anything I experienced represents a haunting, or a disturbance, or just paranoia and crappy employees, I have no idea. I tell people I quit because my coworkers were lousy. But there's definitely more to it than that, and I wont step in that building again."
emntt,3,2010-12-16,Looking for a junior/entry-level iphone dev job (UK),[deleted],jobs,https://www.reddit.com/r/jobs/comments/emntt/looking_for_a_juniorentrylevel_iphone_dev_job_uk/,"I'm a PHP guy and cross-training into iphone development. I'm still at a junior/entry-level stage and am working hard to produce my first iphone app (it'll be done in January *crosses fingers*) and I'm wanting to find a junior/entry-level iphone role.  

My preference is to work either in the North West or North East at a creative branding/marketing agency (mainly because I enjoy working in creative agencies), and I'm ideally looking to work on multiple apps (not just one) and get good exposure to different types of apps (games, core data, etc).

I do not want to be working on one app, nor do I feel I would enjoy a role that is primarily aimed at maintenance of existing apps.

I've looked on quite a few forums, websites and Twitter; but a lot of them want commercial experience, or apps in the app store.

I'm open to internships. I notice there is a lot of internships/junior iphone gigs in the US; its something I'm looking at, but I'm conscious of the fact that my lack of commercial experience does hinder me.

With this in mind, I'm hoping by posting on reddit will at least point me in the right direction."
engis,6,2010-12-17,[Hiring] High Performance Computing : Electrical Engineer and/or CS with FPGA design experience + internship opportunities available.,IrrelevantDictum,forhire,https://www.reddit.com/r/forhire/comments/engis/hiring_high_performance_computing_electrical/,"Stone Ridge Technology works in the High Performance Computing Industry. It is developing proprietary hardware and software that enable the use of multi-core CPUs, GPUs and FPGAs for accelerated computing.

We're a small startup company pursuing some very interesting opportunities in HPC Finance and Bio. The position is in Bel Air, MD, but we're open to some at home / in office arrangements if your a little further away and have a proven track record. 

Our company is seeking candidates with FPGA design experience for full-time and intern positions as an Electrical Engineer. The qualified candidate will have experience in FPGA development for implementation of complex algorithms and network processing. Experience should include FPGA design, simulation, synthesis and implementation with VHDL and/or Verilog for Xilinx and/or Altera devices. Electrical Engineers or Physicists with a BS or MS are desired.
Skills: FPGA design, VHDL/Verilog, C/C++, network processing, high speed interfaces e.g. PCI-e, device drivers, strong diagnostic skills, excellent interpersonal and team skills and ability to work independently.

Send me a message with your text resume, your experience and/or a public LinkedIn profile. 

Thanks!"
enmyw,5,2010-12-17,"I'm about to hand over my code to a MAJOR tech company, who hasn't paid me anything  yet or put my name on paper work.... suggestions?",CSinSF,learnprogramming,https://www.reddit.com/r/learnprogramming/comments/enmyw/im_about_to_hand_over_my_code_to_a_major_tech/,"Hello all, 
I wanted to put this in the programming subreddit, but I don't think that I'm trusted yet for that. 

I'm a Master's student in CS and doing my research with a very big tech company.  My professor got a grant from them for this research, and she hasn't dispersed any of the money to me (I've been working on it since July).  I just recently presented my research to them, and they were happy, and want to box it up and test it. 

It's been great working with this company, but they have only put up one of their researchers for once a week 20 minute phone calls, and my thesis adviser is not an expert in the subject I'm working in.  I've been teaching myself these skills, and worked out the algorithm myself. 

I want to tell them that I wont hand over my code until I get my name on some paper work either guaranteeing me some of the grant money, or perhaps an internship. 

I just feel a bit taken advantage of because I'm paying this school to do a master's thesis and for the chance to do research, and apparently I'm also paying for the opportunity to make this company money. 

Is this normal treatment of students?

Thanks!
"
eo5c8,0,2010-12-18,Does anyone work for a small neighborhood insurance agency and can share some insights?,steeping_tea,AskReddit,https://www.reddit.com/r/AskReddit/comments/eo5c8/does_anyone_work_for_a_small_neighborhood/,"Hi everyone,

I've graduated from college recently and my job hunt for an actuarial position is not going too great. So I was thinking of working/volunteering at my neighborhood insurance agency and was wondering if anyone working at one of these places can describe what exactly they do there and if I would get experience  doing any type of actuarial calculations and/or excel work. If I went in and approached them saying I wanted to get an internship would I get laughed out of the place? Thanks a lot for your input"
eood4,7,2010-12-20,"[For Hire] Recent College Grad in Computer Science, Will Relocate",Maixy,forhire,https://www.reddit.com/r/forhire/comments/eood4/for_hire_recent_college_grad_in_computer_science/,"I haven't seen much desire for entry level CS degrees, but here's to hoping! 

I finished up my Bachelor's in Computer Science (Minor in Interactive Games Development) this December from the University of Nevada, Reno.

I have internship experience with a large scale gaming company (I.G.T.) working on a C++ based OS/engine and related C# applications.

My strongest programming language is C++, w/ C# in a close second.  Currently working with JAVA/Android SDK for mobile app. development

I have programming experience in OpenGL, C++ Networking/Encryption, and Simulation physics

I'm willing to relocate (no assistance required) to pretty much anywhere.

Does this sound like the background for a position than anyone needs filled?
"
