dv5up,3,2010-10-22,"I'm lonely, chronically worried, and often depressed.",SpicyMilk,needadvice,https://www.reddit.com/r/needadvice/comments/dv5up/im_lonely_chronically_worried_and_often_depressed/,"Hello Reddit.  I'm currently a college student (2nd) year.  I don't know whether I am depressed or not (as per formal definitions or compared to others on here), but I do know that I'm perpetually worried, chronically tired, and often feel sad.  I elected to post here versus at /r/depression because I don't know how deep my problems actually are, and I don't want to offend anyone.

None of this has affected my school work, a I am fringing on a 4.0 QPA with nearly 100% in most of my engineering / math classes.  The issue is that my state of well being is so dependent on my grades that a slight stumble can set me into a depression state that lasts for days.  

The issue is that other than grades and internships and such, I have absolutely nothing going on.  I go to class, eat, and then incubate in my dorm room.  I have almost no friends up here, and I hardly have any confidence to leave my room, even to eat.  I haven't had anything close to a girlfriend for almost three years, and most of the very few friends I have up here I knew from high school.  I consider myself adept at conversation, but I cannot approach people.

I am afraid that this feeling of loneliness will evolve into a permanent mental pattern.  I have difficulty projecting myself into a future dominated by a successful career and nothing else (in fact, I worry that my intellectual successes are slowly eroding, which is one of the chief causes of the classroom anxiety described above).  Needless to say, over the last month or so (more than ever), I have felt chronically fatigued and my motivation (other than the motivation to study) in most of my affairs has started to asymptotically level to 0.  On weekends, I leave the room to eat, and that's it.

Please no behaviorist bullshit like: you need to conquer your fears and step out of your comfort zone.  It doesn't work for me, I've really made an effort.  It feels like there is a psychological barrier that is blocking me from getting away from all of this.  "
dw2rr,6,2010-10-25,Help me with my first gamer build?,mack_a,buildapc,https://www.reddit.com/r/buildapc/comments/dw2rr/help_me_with_my_first_gamer_build/,"Hi Reddit,

will you come to my aid in my struggles to build a new gaming machine?

-----------------------------

**Here's the setup so far:**

* Motherboard: Asus - Socket 1156 - ATX Intel P55 (P7P55D PRO)

* Corsair XMS3 4096MB DDR3 PC3-12800 1600MHz 2X2

* Fractal Design Define R3

* Gigabyte GeForce GTX 460 1GB OC

* Intel Core i5 760 2.80GHz / 8MB / Socket 1156

* OCZ PowerSupply (PSU) 600W ModXStream Pro

* Samsung Spinpoint F3 1TB (7200RPM / 32MB Cache)

* Samsung Intern SATA DVD±RW 22x - Svart (Dual-Layer) (SH-S223C) (Bulk)

-----------------------------

My goal for this machine is to be able to play a variety of games on high or good settings. I care about noise, and also about upgradeability.

-----------------------------

**Here are some questions:**

1.	The reason I'm paying for the “Pro” in the motherboard is that this one supports SLI. Will upgrading (with a second identical GPU) in the future work well with this motherboard and the rest of the machine?

2.	What do you think of the general noisiness of this machine?

3.	I have the option of buying the same thing from another store at a slightly different price with some components changing, do you think these changes would be upgrades or downgrades? The changes would be:

GPU turns into *Gainward GTX 460 1gb Golden Sample* instead of the Gigabyte with the same numbers

PSU turns into *Corsair TX 650W* instead of the OCZ

HD turns into *Western Digital  Caviar Green Power 1TB 3Gb/s 64Mb Cache* instead of the Samsung 

------------------------

Thanks for any help!"
dw6va,2,2010-10-25,"Reddit, help me choose a job(Engineering or Consulting)!",FatBabyCat,AskReddit,https://www.reddit.com/r/AskReddit/comments/dw6va/reddit_help_me_choose_a_jobengineering_or/,"Okay, I am a 21 year old senior in college graduating in may.  

I currently have one job offer for a software engineering role and have two second round interviews coming up with the big 4 for a consulting role where I will most likely get an offer.  

This past summer I did an SE internship in Silicon valley with a large software company. I currently have an offer from them and would be living and working in California where I would be starting off at 76k and a 10k relocation bonus. I may be able to negotiate to 80-85k.
 
This sounds great but I hated my job / company culture at my internship.  Most the engineers were introverted and I had no one to talk to at work.  Most the employees were older and had been working at the company for a while and were never excited about anything.  I also didn't like San Jose that much.

I had an office visit to a big 4 office in NYC and really liked the employees and atmosphere.  However, I am not sure if consulting would be any better.  I would most likely be making less starting at around 60k.  The cost of living in NYC is also a lot higher than California.  In Cali, I could continue to live like a college student and save up 40k in a year.   In NYC, I feel like I would be living paycheck to paycheck.  

Should I make the smart decision and go with the higher paying job where I would make 20k-30k more a year at the company I know I disliked?  Or should I take a risk and accept a Consulting position that pays less and I may dislike just as much?  Consulting would be about (20% travel) and working in forensics(enterprise stuff).  It sounds cool but I am not sure if it is. 


Ideally, I'd like to take a semester off to intern for a start-up before graduating to see how I like it but my dad may be loosing his construction job soon so my parents are pressuring me to graduate on time.

I am sure there a lot of people on reddit who have worked in both roles so give me your ideas.   Has anyone here worked in Penetration Testing or Forensics?  What do you think about it?  

**tldr: Choose high paying Software Engineering job at company I didnt like or go with a lower paying consulting job at Big 4 firm?**
"
dwgeu,8,2010-10-26,Another Question about IT work,burt0n,jobs,https://www.reddit.com/r/jobs/comments/dwgeu/another_question_about_it_work/,"Hey guys I was wondering if you would be able to help me figure out some stuff.  I am  about to complete a degree in Criminal Justice ( i know complete opposite), however I have always had a passion for computers also. I took a computer repair course back in high school (graduated in 05) and been fixing computers for family and friends ever since. I also helped at times testing hardware for a family friends small ebay business.
 

Here is the problem I want to try out IT work seeing as I really like working with computers. Plus the whole criminal justice field is not doing to well unless you want to move to the border in Texas or Arizona. My SO and I rather stay here in Orange County. Every job I have looked at for IT work requires some kind of degree or certs and will not even look at my resume seeing as I have no formal work experience. I have been applying and searching for jobs but they all require experience and it seems no companies will take you without any experience. So i am trying to find some kind of internship or volunteer work. If you guys have any ideas to gain experience for this let me know also please.


So I am looking at getting either an AA degree in Computer Information Systems or some kind of cert such as a the community college has a PC/Networking Hardware Cert. The thing is the AA degree they offer seems to have nothing to do with networking or hardware. The courses include: Access, Excel, Accounting, And word processing. So am i better off with AA in pretty much basic computer skills which i already have or going with an actual Cert. The cert courses include: Operating Systems, PC Hardware Configs, Intro Networking Hardware, Computer Desktop Support, Windows Server Administration. 


So which one do you guys think would be the best to help get my feet into IT/Network door? Eventually I might pursue a computer forensics cert in order to use both computers and criminal justice. 
 

Thanks for the help guys!"
dwmlo,0,2010-10-26,What is a quality and inexpensive business watch?,dtlss22,AskReddit,https://www.reddit.com/r/AskReddit/comments/dwmlo/what_is_a_quality_and_inexpensive_business_watch/,"Hey guys, so I am a college student and recently started a Co-Op (paid internship) at a nice company.  Anyways, I have some extra cash and I would like to buy a nice watch but don't really know where to start.  I would like to spend less than $150 (if thats possible?).

Anyways if some of you could point me in the right direction that would be great!!"
dwo67,3,2010-10-26,"Should I keep my stable job, or go part time to follow my dreams",mrwannabeartist,AskReddit,https://www.reddit.com/r/AskReddit/comments/dwo67/should_i_keep_my_stable_job_or_go_part_time_to/,"Edit:  Thanks guys, I think I'm going to keep the things the way they are for now.  If I can't get anywhere with my portfolio by just working 4 days a week, then perhaps I shouldn't bother going with graphics.   I might go part time if I decide to take my work and become very serious with it and have a clear/certain path in my life.  I don't know why, but your advices simply help me clear up my mind even though I should have been capable of coming up with them on my own.

This is probably not going to be as interesting as other posts you can find here, but I always felt that reddit could come up with some great advice, and I would appreciate even just a few regarding this matter(my first time posting ).  

I majored as an art student(3d animation), and I was pretty ok at it(best on my class, but my school was not as good compared to others - had to learn mostly everything on my own).  Because of some circumstances, I wasn't able to get a job right away, turned down some internships, and eventually had to work as a waiter to help support my parents.  Eventually, I was hired by a company(not related to my studies) that recruits international students, and I am now working full time as a tutor/assistant manager.  The job is easy, but I am not getting anything from it.  I hate dealing with the people at the company and   I am also sick of the kids and tutoring.  The pay is not bad ($40,000), and with the economy the way it is, I am thankful I have it.  
I've been trying to work on my portfolio(my old stuff is outdated, and must update my work) for years and get some stuff done so I could find either an internship or go back to school and get an MFA.  Unfortunately, I've procastinated too much on it, and after a day of work, I just don't want to do anything.
I was told that one of the reasons why I was not inclined to work on my portfolio or to find something better is because I just didn't have time and because I felt comfortable with my job.
Now some of the reasons why I don't want to change the way my life is  because the economy(feel lucky to have an easy job), the uncertainty that even after working on my portfolio maybe I won't be able to find a job(it's hard getting into this industry), and of course I hate change.
 
I know that some people might say that I should follow my dreams, but sometimes I find that type of mindset to be a bit unrealistic. 

Anyway, I have talked to my boss about it, and he has been supportive about it and even gave me fridays off(not much work on fridays anyways) so I could do something with my life, but he said that he still needs me at the company and doesn't want me to go part time.   I am considering just telling him that I want to work about 4 hours a day(tutoring only)instead so I can spend more time on my own work.  This means that I'll be paid only a fraction of what I was getting paid before.  I do have some money saved up, and I should be able to survive for a good 6-8 months or more.

Anyways, depending on the advice I get from you guys,  I will either keep the way things are or take a risk and focus on an uncertain future.

Thanks Reddit."
dxb78,2,2010-10-27,Girlfriend wants to get engaged now.,panzero0,AskReddit,https://www.reddit.com/r/AskReddit/comments/dxb78/girlfriend_wants_to_get_engaged_now/,"TL;DR - I'm a 25 year old professional and she is a 22 y/o grad student with one semester of school left and a 15 week internship out of town. She wants to get engaged before her internship but I don't want to be engaged and alone for 15 weeks of our engagement.

First of all, I initially didn't want to get engaged for another year but she is pressuring me. I've somewhat given in to her pressure and we've looked at rings, yada yada yada. EDIT: We've been dating for just over a year

Secondly, her internship experience will be much better if it's out of town and her chances of getting a great job are a lot higher if she goes out of town. There are opportunities nearby but they suck and it won't look great on her resume.

I may have an unwarranted fear because my sister tried a long distance engagement and it didn't work out. 

Should I be celebrating time alone? She is normally the one that is so clingy, I just think it would be so strange to be committed to someone that is so intangible, so to speak.

EDIT: It'd be so much easier for us if we just waited until she was done with school. Why can't she wait?

Thanks"
dxhop,1,2010-10-27,Need CS Career Advice...,purplegui,AskReddit,https://www.reddit.com/r/AskReddit/comments/dxhop/need_cs_career_advice/,"Hi all,

**Background:**
I am currently a senior CS major at a top-tier-ish public university and will graduate next June. I interned this past summer as a software engineer and the position has been extended into a PT position until the end of this calendar year. That, however, is also my first and only internship experience. I have limited research experience, as well (just starting).

What I gathered from my internship experience is this: I am not satisfied with sitting in a cube write code all day. I want to work on challenging problems. I don't want to write bitch code (perhaps part of being an intern?). Also, the experienced affirmed my belief that, in CS, experience trumps education (to a degree). If given the initial opportunity, 4 years of work experience trumps 4 years of college education.

**That said, here's my question:**
I'm now at a time where my decision would most likely affect how the rest of my life plays out.

Should I get a job after getting the B.S.? It seems to me this means getting a job that would be pure coding 24/7. That, of course, could be good or bad, depending on the projects I work on. I would also be able to be independent.

Should I go for an M.S.? An M.S. in Com Sci would give me some boost in salary, but would cost me another year or so of tuition and life. Is it worth it? Does it open that many more doors?

Lastly, the Ph.D. It requires a great amount of dedication. It requires around 4~6 years of my life. However, most colleges pay for your Ph.D. tuition. It doesn't give much of a salary boost compared to an M.S. However, it gives me the opportunity to do research and to teach, which I enjoy vastly.

So, reddit, I am really at a crossroads. I've given many thoughts to this subject and, with the grad school deadlines quickly approaching, I really can't delay this much longer. Your inputs are really appreciated.

Note: This is a throwaway. I don't know why I posted this under a throwaway, really. I'm a pussy?

*edit1:* My current research is in bioinformatics, if that matters."
dxz0p,5,2010-10-28,I would like some feedback from biomedical engineers- is it possible to go to grad school in biomedical engineering with decent (around a 3.1) GPA bachelors in electrical engineering?,chandrax,engineering,https://www.reddit.com/r/engineering/comments/dxz0p/i_would_like_some_feedback_from_biomedical/,"I have one semester left (after this one) and am getting ready to start the grad school application process. Biomedical engineering is what I am interested in. I am passionate about electronics, micro-controllers, and electrical theory but even more than that I am passionate about using what I know to try to help people. 

So far the schools I am looking at are only the University of Madison Wisconsin (the brain-twitter research project was awesome), and Virginia Tech (I had an internship there). 

Is there another way to get into the R and D side of the biomedical industry? I am from Alaska where practically no biomedical engineering research goes on and there are no biomedical engineering companies. 

Last question: What should I do to prepare my background for grad school? Are basic biology classes a requirement (that would be worth extending by graduation date out for in order to get those classes under my belt) or would I be fine just applying with what I have? 

I'm a girl, if it makes any difference (it shouldn't but sometimes it can help one stand out from an application pile of mostly male candidates).

I'd really appreciate any comments, pieces of advice, stories, or even sammich requests (but only if you are prepared for one fitted with electrical gidgets!) :)"
