1a2hzh,0,2013-03-11,"My Ultimate College Bucket list,What is on your list Reddit?",[deleted],AskReddit,https://www.reddit.com/r/AskReddit/comments/1a2hzh/my_ultimate_college_bucket_listwhat_is_on_your/,"COLLEGE BUCKET LIST and PROTIPS by nr2j
•	Do something so crazy that people you don't know are talking about it.
•	If you ain't first, you're last.
•	get higher than a 3.0 gpa
•	get an A in a hard class
•	pull an all-nighter (studying)
•	study abroad
•	have coffee with a professor
•	tutor someone else
•	get tutored
•	take initiative and get work done before weekend starts
•	join a study group
•	give someone random your number
•	prank your roommates
•	seran-wrap someones door
•	never puke
•	video tape your friends drunk
•	get a job
•	miss all classes one day
•	take a test in a class/lecture i’m not even taking
•	sit-in on a chem lecture. try to understand it.
•	participate in Holi, again (mid-march?) SO fun last year.
•	figure out my summer internship plans.
•	attend an event on something i know nothing about
•	spend an afternoon at the museum,just observing and appreciating art
•	spend an afternoon just taking photos around campus
•	climb the roofs of the science and rowan building again
•	have a potluck with close, special friends
•	visit NYC (spring break, maybe?
•	Beat ALL my video games
•	Learn to longboard
•	TRY BUBBLE TEA 
•	Finish a book before I go back home
•	Make the Dean’s List.
•	Walk down the hallway drinking water from a bottle of vodka in front of the RA’s.
•	Go without iPhones for a week
•	Go to a concert the night before finals.
•	Go to Canada.
•	Have a kegger.
•	Go skydiving.
•	Go camping.
•	Run a 5k.
•	Volunteer at a homeless shelter.
•	Go coning.
•	Dress like pro golfers and go mini golfing.
•	Be in a protest.
•	Make a vlog.
•	Pay a someones check at a restaurant
•	Donate clothes.
•	Go to a karaoke bar.
•	Speak in British accents for a day.
•	Talk to people in a public elevator.
•	Go to a Hood basketball game.
•	Take a roadtrip.
•	Confess a crush.
•	Go swimming in the pool in the rec center.
•	Be club president (or any office position)
•	Go to/host a blacklight party.
•	Confront a fear
•	Help a stranger in distress with car troubles
•	Solve a Rubik’s cube.
•	Do a Polar Bear Plunge.
•	Couchsurf.
•	Ride a segway.
•	Spend the night in each dorm building.
•	Go to the gym for a month straight.
•	Set up a couple on a blind date.
•	Go to a concert
•	Create a hilarious parody and put it on YouTube
•	Improve my dancing!!!
•	Learn a complex foreign language
•	Get involved with something on campus (if I’m not swamped with school work)
•	Go on a road trip with friends
•	Go to a hookah bar
•	Start building (good) credit
•	Learn to do taxes
•	Leave notes in library books
•	Go backpacking
•	Take one of these weird classes as an elective
•	Try out for the Real World
•	Excuse me bartender, there's too much liquor in this drink. When im 21
•	Party at every fraternity house
•	Leave your mark
•	Make an awesome beer pong table
•	Go on an actual date (not just hookup)
•	Sexile someone at least once.
•	Go out on a weekday night and then go to class at 8am the next morning.
•	Take a picture with the prof mascot.
•	Sleep through a fire alarm.
•	Take a test without studying for it.
•	Balance good grades and having fun.
•	Friends are like potatoes. They die if you eat them.
•	Participate in No Shave November. EASY
•	Say yes to everything for a day
•	Wear a shirt that says ""Life"" and hand out lemons.
•	Make my own sushi.
•	Quit being afraid and start living instead.
•	Pull pranks on friends.
•	[ ] Democratic party [ ] Republican party [x] Pizza party
•	Vote this year.
•	College isn't about the grades you make, but the hands you shake.
•	Actually keeping my room clean.
•	Crashing a party.
•	Subscribing a friend to ""Expecting Mothers Magazine"" as a prank.
•	Blackout and Wake Up with No Clue Where You Are.
•	Throw a paint party.
•	Quit Facebook. IMPOSSIBLE 
•	No classes on Friday.
•	Start a prank war with neighbors.
•	Take a totally random class.
•	Visit friends at other schools.
•	Build a bedsheet/pillow fort.
•	Use bad pick up lines and get numbers
•	Actually use office hours.
•	Complain about the dorm food.
•	Read a book a month.
•	Throw a crazy themed party.
•	Learn to cook better.
•	Win one beer pong tournament
•	kiss a girl at a party
•	do community service 
•	I hate mondays.
•	Throw a surprise birthday party for a friend.
•	All day I'm tired... But as soon as its time for sleep, I'm suddenly all awake.
•	Participate in a campus-wide tradition. Tent city or something
•	Donate blood
•	Yoga. Pants. enough said
•	Prank a professor
•	I just want a nap right now.
•	Monday classes suck.
•	That noise girls make when they see each other at a party...
•	Watch all 90’s shows for a day 
•	Make something to get rich!
•	1 Class tomorrow? No class tomorrow.
•	Everytime I hear sirens I assume a freshmen at chesnut or mimosa got alcohol poisoning.
•	Get up before noon on the weekends.
•	It's not friday, but I'm going to treat it like it is.
•	Make sure 25 year old me will be proud of what I'm doing right now.
•	Not burn food
•	Cover a friends desk with foil.
•	Never half-ass things, whole ass one thing.
•	Never spill anything on my laptop...
•	Learn to like coffee and energy drinks. Done
•	Throw a party with fake alcohol and see how many people act drunk
•	Get as much free stuff as I can
•	Do a good deed for somebody at least once a day.
•	Find money on the floor.
•	Learn how to eat healthier.
•	No matter how many clothes a girl has, there will always be nights she has nothing to wear
•	Go to a metal show 
•	Mosh
•	watch bryans band play battle of the bands
•	having a movie marathon and staying up all night
•	get some real fucking brooklyn pizza
•	comic con
•	Call you family.
•	Get a pet fish.
•	Tell random girls they look pretty.
•	Get out of your comfort zone regularly. 
•	Learn about a new culture.
•	Bring two different friend groups together.
To be continued…………..
"
1a2cn0,1,2013-03-11,I'm looking for a new motherboard. Help?,CalvinGFX,buildapc,https://www.reddit.com/r/buildapc/comments/1a2cn0/im_looking_for_a_new_motherboard_help/,"Hello! I just recently built my computer somewhat cheaper than I would've liked and I found out tomorrow I will start doubling my hours (Paid intern) so I will be making more money so I would like to upgrade some equipment. My current set up: 
http://pcpartpicker.com/b/AJC
I know I will be buying either a 250 or 128gb ssd want to upgrade mobo and add water cooling. any other suggestions that I should get would be awesome! I use this for casual gaming and every day use"
1a25i8,2,2013-03-10,"I am a recent graduate, and have gotten several part time and two full time jobs by applying online. Here is my experience.",IGetJobs,jobs,https://www.reddit.com/r/jobs/comments/1a25i8/i_am_a_recent_graduate_and_have_gotten_several/,"**1. Best Buy**

The trick with them (and a lot of positions) is passing the personality test. Realize that the personality test is way out of touch with reality and there is no need to second guess yourself. Answer the ""obvious"" correct one and try to not answer many questions ""in the middle."" For example:

Question: Do you like being in a crowd?

(a) Yes

(b) Sometimes

(c) No

The answer (unfortunately) is yes. You want to show yourself as being extroverted, etc. etc. It doesn't matter if the position is client facing or not, you need to be able to ""work in a team"" and somehow these personality tests reveal that /s. 

In addition, the ""sometimes"" answers are bad. At Best Buy at least (and probably other places as well), your whole application actually gets locked out if you do not score high enough. Your experience could be killer and you could have been a manager at Circuit City for 5 years, but if you don't pass that personality test, you're out. 

[http://www.ehow.com/how_4446746_pass-preemployment-personality-test.html](Here is an article on passing these tests.)

**2. Internship 1, 2, &amp; 3**

I applied (and got) three internships through my school job board. **I am not a technical major**, however the two paid ones were technical based (database management and technical writing). Two of them were paid, one of them was not but I got awesome experience (better than the two paid ones) and class credit. I thoroughly believe that school job boards are the way to go for internships as the employer has already got your school in mind when looking at applications.

In addition, one of the internships offered me a full time position upon graduation but I already had one lined up, read below.

**3. First Full Time Position**

I actually started out this position as part time while in college. I also doubled up, and took one of the other internships above while working at this place. It was my last semester and I only had classes two days a week, so it was easy to work 15 hrs/week at each place.

Anyways, this position was a posting on Craigslist regarding a product I LOVED (technical based) and it paid better than any other part time positions I'd had thus far. I applied, boosting my resume with a ""portfolio"" of projects I had done with the product throughout the years. I got the job during the summer, and went full time after graduating in December until...

**4. Second Full Time Position**

I just sent in the signed offer letter for my first ""career"" position. My previous role was at a company I loved with people I really liked working with, but in a field that I am not passionate about. The company was growing, but slowly. They have been very supportive about my progress and are still supportive in the wake of me leaving.

The company I just signed on with will be giving me training in advanced programs and in a field that I am very excited about being in.

This company had me do an online test. It was *hard*. Lots of pattern recognition, math problems (I have a funny form of number dyslexia so this was scary as mess for me since it was timed, as much as I otherwise like math), and a personality test at the end. I passed it, got two phone interviews and an in person interview... then had to take the test again. *shudder* My new manager told me that about 8% of the people pass the test. Whether this is due to laziness or not, I do not know.

What was interesting about this position however is that I really wasn't qualified for it. It is for making eLearning courses and I have had minimal experience in many of the programs they use, but they asked me for examples of any graphic work I did have and I sent it all in. In addition, I downloaded a trial version of Captivate and make a quick eLearning course in it to give to them as well. I've put a lot of effort into getting this position, and I'm happy that it panned out. 

That being said, all of the other positions I applied for that I was actually somewhat qualified for never contacted me. *shrug*

**So there it is**...

Some background on me:

* White, female
* ~3.3 GPA
* Humanities degree at a state college
* Technically oriented (but again, a degree that doesn't show it)
* Founded a club (unrelated to my major or career), president of ambassador program freshman year at a community college
* Studied abroad (related to my major, unrelated to career)
* Active LinkedIn profile (not sure if this ever helped)
* Held a total of 9 paid part-time jobs/internships while in college and one 1 unpaid internship, often two at a time
* Total jobs gotten by networking: 3 (part time), total jobs gotten online: 6 (+ unpaid internship)
* I deal with anxiety and depression issues, and some atypical migraines. I'm outgoing in the sense that I have no trouble with public speaking or approaching people, but I'm mostly antisocial and don't go out very much.

I apologize for the wall of text, and I am in NO way suggesting to drop the networking route. This has worked for me so far, and I am a huge advocate for job networking. If I can be more specific about anything or if you have any questions, please let me know."
1a6j70,0,2013-03-12,Hello fellow Redditors! Gather at once! Help out fellow procrastinator!,[deleted],gatech,https://www.reddit.com/r/gatech/comments/1a6j70/hello_fellow_redditors_gather_at_once_help_out/,"Hey there guys, my name is Harsh Patel and I need to collect some information about colleges. If you attend the following colleges and are either a Mathematics Major or any other major, would you take 10 minutes out of your life and fill out a simple survey? Thank you so much for your time.

Colleges: 
- Georgia Tech

Questions:   
1. How did you decide to choose the major you have chosen?  
2. Do you regret choosing that major?  
3. Have you changed majors before? Why?  
4. Do you enjoy college life? Describe any specific aspects you particularly enjoy.  
5. Where did you go to high school? (Optional)  
6. Are you on any form of financial aid/scholarship? (Optional)  
7. What kind of student activities are you a part of?  
8. Are you in a fraternity/sorority? If so, how has this benefited you?  
9. How far are you from home? Do you feel homesick often?  
10. How involved are you in supporting your school's athletic events? (Are you a big fan or just watch the highlights the next day?)  
11. Does your college offer any internship opportunities? Are you a part of one?  
12. What degree (type) are you planning on receiving?  
13. Where do you plan on going after you are finished with this college/institution?  

 "
1a62ep,1,2013-03-12,Need help with my job prospects,engineer_decision,engineering,https://www.reddit.com/r/engineering/comments/1a62ep/need_help_with_my_job_prospects/,"So, I'm graduating with my ME degree this summer, and I have excellent grades, internships, etc. I was recently contacted by an Apple recruiter who was really impressed with my resume, but after a brief conversation, he told me to get back in touch in a month or two (say April or May) when it's closer to my graduation date. Now, I've been building and fixing computers for years, love to keep up on technology, and my dream job is in consumer electronics/product design, so Apple would be awesome. 

The problem is, I have already accepted a solid job offer in Dallas, which I think I would enjoy too, but it's not quite the industry I am really passionate about. I hate to turn down a solid job offer when I don't even have another one yet (and may not find out for a month or two), but if I were to get a job with Apple, my SO and I would love to move there. SF is closer to her family, has nicer weather, has better outdoor activities, etc. (while also being stupidly expensive)

My SO has a verbal offer in the south Bay, which she would enjoy, but probably not quite as much as if she were teaching (she is finishing her PhD). We plan to have kids in about 2 years, at which point she will either work part time or not at all to raise the kids, so we aren't as worried about her career prospects. I also feel terrible about backing out of an offer but will do it if it's best for us.

**tldr**
I really want to work at Apple but haven't even had an interview yet, while I have already accepted an offer in Dallas. How can I address this situation?"
1a5y8g,6,2013-03-12,"Probably going to pull my first ""C"" in a programming class. Should I drop it?",throwawayandporn,AskComputerScience,https://www.reddit.com/r/AskComputerScience/comments/1a5y8g/probably_going_to_pull_my_first_c_in_a/,"Incidentally, it's a class in C. I understand most of it, and my grade is because I missed two assignments for stupid time management mistakes that I could have rectified. Other than that I do really well in the class, but most likely I'll make no higher than a ""B"". I'm going to study my ass off and do as well as I can but I need to come to terms with the possibility of a C.
 
A little more backstory: I go to the University of Texas, where the CS program is pretty competitive. I dedicate most of my time to my own projects rather than schoolwork (developing a pretty big android app right now and worked an internship at a local company last summer, with another summer gig set up for this one), right now I have a B+ average in my CS classes."
1a5xs7,7,2013-03-12,How to learn CUDA/OpenCL?,deckwasher,learnprogramming,https://www.reddit.com/r/learnprogramming/comments/1a5xs7/how_to_learn_cudaopencl/,"Hey Guys,

I'm curious if anyone knows any good tutorials/tips for learning CUDA and OpenCL. I have been programming in C and Objective-C for years and consider myself very comfortable with the language. 

Long story short, I want to work for a research lab that models protein folding with OpenCL and CUDA and would love to get my feet wet before committing to this internship.

Thank you!
-deckwasher"
1a5ttu,10,2013-03-12,.Net Developer with 4 yr experience. Looking for technical jobs. Scared of interview questions. Normal?,HattaKatta,cscareerquestions,https://www.reddit.com/r/cscareerquestions/comments/1a5ttu/net_developer_with_4_yr_experience_looking_for/,"I got hired as a .Net developer during my internship at one of the top Canadian banks and never looked back until now. I decided that I already had the job, so I could finish school at my own pace...bad decision on my part. I got promoted twice in this job and am currently as ""senior"" guy in the team who mentors new hires, acts as Problem management lead, basically gets the job done (hands-on/practical experience).

Anyways, now I've been at this company for over 4 years and its time for me to move on. I like my job but the problem is that I'm not learning anything new, its the same corporate bullshit everyday (cookie cutter approach for all applications). 

I have applied to a few job openings at Amazon and some other places as a Software Engineer (or Developer) as I'm hoping to get back in the game (technically) but I feel so out of place when it comes to all the questions that these companies are asking these days. I have the practical experience but I've been out of touch with basic algorithms, I feel so scared (I really do). I have no idea on how to create a maze algorithm (just an example)...I know I've been out of touch with the basic fundamentals, so I'm applying for entry level positions and not intermediate (I'm willing to start from scratch). 

I'm planning to go through all my old OOP books, review basic data structures/sorts etc...but its still so damn scary. Has anyone else been in my shoes? Any tips? Is this normal? I've been using only C# in the past few years, what language do you guys recommend that's considered acceptable during interviews...C++, Java?
I don't mind starting from scratch, I just need a way to get inside a real ""tech"" company, not sure where I stand."
1a5p50,1,2013-03-12,My dilemma: go to medical school or run a company...[x-post from r/offmychest],throwaway_dilemma,Advice,https://www.reddit.com/r/Advice/comments/1a5p50/my_dilemma_go_to_medical_school_or_run_a/,"I have a dilemma that I am facing and I am confused on what I want to do; should I go to medical school or should I run a company that has potential to make a lot of money. 

I am a married 26 year old male with no kids at the moment.

I have been going to school for quite some time to finish my bachelors degree (in which I will be done this Fall 2013) and right now I am at the point of going to take my MCATs so that I can apply for medical school this coming June 2013. There is a high probability that I will be able to get into medical school here in the states and I'm not ""too"" worried about being rejected. 

Here is where the ""issue"" comes in, I have been offered to work with my brother and to help run his electrical company. We do both commercial and residential buildings with occasional renovation work for quick cash and as of right now we have a total bid amount of $16 million with more contracts in the works. 

My brother is well aware of my work ethics and he wants someone who is like-minded like him so that he can amplify the business and make more money. The idea is that the more money that can be brought in, the more money we both can make rather than him handling everything himself. Basically he's the CEO, CFO, and COO and he needs help to distribute the load and reduce the bottleneck effect as he's having a hard time being in two places at once. And this is where I come in.

He is also aware that I am trying to go to medical school and he's trying to essentially ""buy me out"" of medical school and work with him to run the company and make a lot of money.

I am torn on what I want to do, I've invested a lot of time and energy to pursue a career in medicine and I truly do enjoy it because everything in biology makes sense. I also enjoy what I am learning out in the construction field and one misconception that I would like to correct is that it's not just a bunch of guys swinging hammers. To be able to run a job site, you have to know how to handle the people who work for you and to be able to get what you want out of them so that it's a win-win situation. And in order to do that, you have to be able to think on your feet and understand the limitations of people on what they can and cannot do. There are a lot of mind games that you have to play to achieve your ending goal and I enjoy being able to do that.

I also have 4 years experience in working in a genetic research facility for a muscle wasting disease and the level of work that I was doing (without having an degree of any kind) was that of a Ph.D. It was basically an internship that lead to an employment opportunity later on. I was working on a Ph.D. level without being paid as one and that was fine for me because the experience that I've gotten could not have been gotten anywhere else, especially for an undergraduate student. On a side note, I am also a published author in various medical journals and one of those publications, I am a ""second author"" (this is a very big deal in the medical field). And because of this this experience that I've gotten, I am not worried about being able to get into medical school.

Basically to answer a question that may potentially come up, I enjoy both medical field and the construction field. They both offer me mental stimulation and perspective on people and how to troubleshoot when things don't work out the way you plan (construction field and laboratory work).

I will be able to make money both ways, but I don't know which one I should take, there are both pros and cons to each and I need help from people who are not biased towards me and to offer me insight or personal experience. 

Thanks for taking the time to read this, I will do the best I can to answer questions that you may ask or to expand on details where appropriate.
"
1a5onp,1,2013-03-12,High school internships,[deleted],internships,https://www.reddit.com/r/internships/comments/1a5onp/high_school_internships/,"Is there any possibility of a high schooler getting a summer internship in San Francisco? I've inquired with 3-4 different startups around the Bay Area and nobody is willing to take a high schooler on board. Do you guys have any tips you could offer? I'm most interested in sales/marketing, but I have web programming experience and I know my way around a circuit board.

Also, how can I improve my resume? I have *very* little work experience, and it feels immature to be putting ""editor in chief of school newspaper"" on my CV. I'd really like an internship under my belt when applying to college, so this summer is my last chance to do anything. Help!"
1a5gao,2,2013-03-12,PXE/Ghost help. Anyone have experience multicasting over the network?,turini,sysadmin,https://www.reddit.com/r/sysadmin/comments/1a5gao/pxeghost_help_anyone_have_experience_multicasting/,"At one of my first internships we had a Ghost setup where you would

1. Start PXE server
2. Start Ghost database

You would then boot a computer into PXE mode and the PXE server will recognize it and is now able to be added to the Ghost database. You can send an image directly to it.

Does anyone have a guide on how to do this now a days? We have versions of Ghost, but are not sure where to begin.

Thanks"
1a4ffh,3,2013-03-11,Is an internship at a global tech company significantly better than a small business one that would teach me more?,rideswithbikes,cscareerquestions,https://www.reddit.com/r/cscareerquestions/comments/1a4ffh/is_an_internship_at_a_global_tech_company/,"So I have 2 offers for a programming internship this summer. (I'm attending a university). One is a technology company with offices worldwide, lets call it A, while the other, B, is a small car dealer business where I currently work. I am the only programmer at company B, and we built our own custom CRM and now it's expanding into all facets of the business. It will eventually track everything done in the company (and it's moving fast) to greatly increase business intelligence.

I did an internship at company A last summer and I learned a lot about working in small teams to complete projects, as well as some of a few programming languages.

However, while working at company B during the past 4 months, I've gained a lot more hands-on experience in a lot of different areas of programming than I did while at company A. If I stayed at company A for the summer, I would be rebuilding the CRM on a framework and gain a lot of experience with that (it's grown far larger than first anticipated and it's getting messy)

Also, at company B, I'll be making at least $3 more per hour (working full-time at both companies)

What do you guys think? Is company A favored far more? "
