19he3w,4,2013-03-01,MS in CS from a BS in Biology (in Chicago),pandorasnecklace,cscareerquestions,https://www.reddit.com/r/cscareerquestions/comments/19he3w/ms_in_cs_from_a_bs_in_biology_in_chicago/,"Hey everyone,
 
First post here. I have a bit of an unconventional background. I have a BS in Biology (minors in Business &amp; Chem)  and I graduated this past May with a good GPA from a Top 50 nationally ranked university and one of the best in my field for B.S. I wanted to pursue Biology research after college, but after working in a lab for a few years, I decided that really wasn't for me. After graduation, I had a pretty good internship with a start-up in the health IT space doing business development. I enjoyed what I was doing and more importantly I was very curious about the technologies we were using. I began to teach myself basic programming (already knew VBA, started Python and Java). Now, my knowledge level is pretty basic, but I'm teaching myself using online resources and find learning this stuff really exciting and enjoyable. After my internship was over in December, I am currently unemployed and looking for jobs. I know that the CS world has a lot of demand right now and is forecasted to have a great deal of demand in the future also. 

I have been specifically looking at the MS program at DePaul
My question is whether the MS in CS program at DePaul is worth it? The program seems like it's targeted towards not just CS people, but also non-CS folks. The people with non-CS backgrounds would end up adding an extra year to their program and would have to take foundation courses before they began their grad school courses. So the program ends up being 3 years instead of 2. Also, the program seems like it's really easy to get into. All I would need is a 3.0/4.0, transcript, application and fee. No rec letters or GRE scores. I checked with the admissions office and they said I had a very good chance of being accepted. One of the things I really like about this program is that it can be full-time and most of the classes are in the evenings so I could potentially work in the daytime and go to school at night. 
 
Does anyone have any experience with this program? Is it too good to be true? Or should I wait and get the foundation courses else where and apply to a more competitive program next year? I'd appreciate any feedback about this program, my next steps, or any other advice or comments you can provide. 
 
Thanks for you help! "
19hcci,1,2013-03-01,MS in CS (going in from B.S. in Biology),[deleted],cscareerquestions,https://www.reddit.com/r/cscareerquestions/comments/19hcci/ms_in_cs_going_in_from_bs_in_biology/,"Hey everyone,
 
First post here (hope this is the right place for this!). I have a bit of an unconventional background. I have a BS in Biology (minors in Business &amp; Chem)  and I graduated this past May with a good GPA from a Top 50 nationally ranked university and one of the best in my field for B.S. I wanted to pursue Biology research after college, but after working in a lab for a few years, I decided that really wasn't for me. After graduation, I had a pretty good internship with a start-up in the health IT space doing business development. I enjoyed what I was doing and more importantly I was very curious about the technologies we were using. I began to teach myself basic programming (already knew VBA, started Python and Java). Now, my knowledge level is pretty basic, but I'm teaching myself using online resources and find learning this stuff really exciting and enjoyable. After my internship was over in December, I am currently unemployed and looking for jobs. I know that the CS world has a lot of demand right now and is forecasted to have a great deal of demand in the future also. 
 
My question is whether the MS in CS program at DePaul is worth it? The program seems like it's targeted towards not just CS people, but also non-CS folks. The people with non-CS backgrounds would end up adding an extra year to their program and would have to take foundation courses before they began their grad school courses. So the program ends up being 3 years instead of 2. Also, the program seems like it's really easy to get into. All I would need is a 3.0/4.0, transcript, application and fee. No rec letters or GRE scores. I checked with the admissions office and they said I had a very good chance of being accepted. One of the things I really like about this program is that it can be full-time and most of the classes are in the evenings so I could potentially work in the daytime and go to school at night. 
 
Does anyone have any experience with this program? Is it too good to be true? Or should I wait and get the foundation courses else where and apply to a more competitive program next year? I'd appreciate any feedback about this program, my next steps, or any other advice or comments you can provide. 
 
Thanks for you help! "
19h8xq,2,2013-03-01,Personal Narrative Input,ChuckleWave,gradadmissions,https://www.reddit.com/r/gradadmissions/comments/19h8xq/personal_narrative_input/,"After reviewing several of the SOP's here, I've decided I needed to re-write my own as it was very subjective. I'm applying for an interdisciplinary master's program (MAIS), which requires the following:

A brief narrative outlining your academic interest and meeting the following criteria:

* Narrative should be approximately 650 words

* Include any current or long-range interests in research, teaching or other professional objectives.

* Please describe any publications or other evidence of scholarly endeavor you have achieved.

* List academic and professional organizations in which you are active and any fellowships, scholarships, or other honors you have received

I've removed some personal information for my own protection.

Here's what I've got:

I aspire to study geographic information systems (GIS), geology, and public policy at Reddit University using the MAIS degree plan to develop myself into an educated and experienced emergency manager. In 2010, I graduated from The University of Reddit with a bachelor’s degree in Emergency Administration and Disaster Planning. I have over 1.5 years of work experience in emergency management, in addition to skill sets gained from training exercises outside of the workplace. I excel under pressure and have a strong technical writing background. I have chosen Reddit University due to its science and technology atmosphere, the strong reputation for GIS, Dr. Awesome Sauce's impressive background and the flexibility of the MAIS program. In the short term, I look to achieve an edge in my industry while gaining experience. In the long term, I look to apply GIS and supplemental research to develop better ways for private and public industry to perform planning and analysis in disaster situations.

While at The University of Reddit, I was a member of the International Association of Emergency Managers - Student Chapter and completed certifications for nine FEMA Independent Study Courses. My area of study consisted of comprehensive emergency management involving the emergency management cycle: disaster response, recovery, preparedness, mitigation and terrorism. I learned what techniques are necessary to control, overcome and rebuild from a catastrophe.

I completed an emergency management internship at the Reddit Hospital, in which my main research concentrated on the hospital's new mass decontamination facility. I, with my mentor, put together training exercises in which we taught hospital staff how to mobilize and demobilize the facility, in addition to how to respond when needed. I have been involved in training ranging from small tabletop workshops to large full scale exercises in which stakeholders are actively involved. My current employment is the management of hazardous material releases throughout North America. In my position, it is critical to remain vigilant during stressful 'on-call' days when there is pressure for an expedited response. Following the account of a spill, I author detailed incident and corrective action reports to state and federal agencies, including the State Commission on Environmental Quality and the Environmental Protection Agency. I am a trained NOAA Super Severe Weather Skywarn Storm Spotter, and regularly attend the Severe Storms Association National Storm Conference. I am also a member of the County Community Emergency Response Team.

I am interested in researching GIS combined with geology and public policy due to their applications for effective and efficient disaster management. GIS technology allows for the 'fast-track' integration of vast amounts of data to turn into actionable intelligence for first responders and stakeholders. That data can be quickly assessed, shared, collaborated and can result in a coordinated response. Supplementing GIS with a background in geology will provide a better understanding of the natural environment and its possible risks. Executing this concept with an understanding of public policy can provide for better implementation of regulations preventing the loss of life or property. The combined study of these subjects will provide strong performance in situational awareness, data management, operations support and mitigation.

I was initially drawn to Reddit University due to its flexible yet strong science and technological programs. The atmosphere provided is beneficial for my anticipated research to thrive. Upon further investigation, the fact that Reddit University has been a leader for GIS research and education in this state is significant. The GIS program's recognition of excellence by the Council of Governments and Oracle Corporation make it noteworthy. When exploring the GIS faculty, the discovery of Dr. Awesome Sauce solidified my desire to continue my education at Reddit University. A member of the National Academy of Sciences, among other things retained for privacy make him someone to be astounded of.

I look to offer Reddit University my experience, knowledge and commitment. I hope to gain more of these three traits in return. I have no doubt I would succeed in this environment and am eager to do so. I am looking to invest in my future, and I want Reddit University to be a part of it.

"
19h35m,9,2013-03-01,"Reddit, would this qualify me as a crazy roommate?",karhu40,AskReddit,https://www.reddit.com/r/AskReddit/comments/19h35m/reddit_would_this_qualify_me_as_a_crazy_roommate/,"So, there is something wrong with my car. I can drive it, but there seems To be a short somewhere and it possibly has been causing other problems. One of these symptoms has led me to think using my turn signals exacerbates the problem. I need to figure out what this is!

Unfortunately, California law says I can't do car maintenance on the street. And I wouldn't really want to do a several hour project in the direct sunlight anyway.

My apartment has a parking spot, but my roommate has had her dead car there for three months now, meaning I nor any of my other roommates can use the spot. 

The problem with her car is as simple as a dead battery, but she keeps asking people to jump it for her, clearly not understanding that batteries' lives are not infinite. She has jumped it and reparked it upwards of five times now. I have done everything short of going and buying her a new battery. I've cleaned it for her, I've borrowed a device from my father to diagnose the problem, I've jumped it with my car twice now.

Last week, my own car died (failed ignition coil) and I replaced it, and I let her know that I needed the spot that Saturday to find if there was a root problem. After putting in the cleaned battery, the thing started, where she celebrated by driving to the bank where it died again. So, clearly, she gets it jumped again only to drive it back and park in our only spot. I tell her that I need to work on my car and my next free time was Monday, so I expect her to deal with it then since she only has two classes per week and an internship with flexible hours that she can telecommute to. Not happenin. Car is still there Monday. Wednesday is my next free time. Trying to be considerate, I let her sleep in until noon. Then, I went and looked up service stations she could tow it to. By then it was too late and I had to go to work.

So, I shot her a text saying I absolutely had to work on it this Saturday morning. No response. Texted her again asking if she got it. She did. 

Meanwhile, I have put probably 400 miles on my car waiting for her to get her act together. If I come home and the car is still there, meaning it's taking the spot for when I plan to work on mine tomorrow morning, I want to just push it out onto the curb. I am tired of waiting, I am paying for the spot too and every time I drive my hour long commute, I am putting my car and my peraonal safety at risk (by sparsely using my blinkers).

My question for you folks is: Am I overreacting by pushing her car to the curb and essentially forcing her to deal with it? What should I do in this situation? "
19gpl5,14,2013-03-01,"I'm currently a network engineer. However, I recently discovered C# and I'm 100% in love. How can I transition?",SyrioBroel,cscareerquestions,https://www.reddit.com/r/cscareerquestions/comments/19gpl5/im_currently_a_network_engineer_however_i/,"I went through college without an internship unfortunately. 

I graduated in 2010 and landed a network engineering job in 2011 and am currently employed. I have a few cisco certs, some Citrix certs, etc.

The problem is...I don't genuinely enjoy networking. I think it's dull, it's boring. Not to mention when there's not actually a problem, I'm just not doing anything.

I took it upon myself to learn some programming. I picked up a few introductory C# books, and I've blasted through them in less than 2 weeks. I seriously love it. I wake up and can't wait to come to work to practice my C# and do the quizzes and ""Try it Out!'s"" in the book, not networking. 

I get irritated if someone calls me in for a networking problem, but I love debugging my own code. 

I know there are a lot of branches off of programming, just like there are networking. Because I don't have much networking experience (brief VB.NET in college--which I aced and enjoyed), I know that I need to start practicing code in my off-time.

So, some questions:

* After I feel like I have a pretty strong grasp on C#, I want to get a firm grasp on ASP.NET as I've seen those 6 letters in almost every online position to apply to. Should I stick with C++ afterwards, or should I move into more valuable scripting such as Python, Ruby, Perl, etc?

* Is there a collaborative article on the types of different job markets for programming, as well as critiques and nuances of each? I.E. gaming, web-development, etc?

* Is there a way for me personally to be able to figure out which brance of programming I'd like to go down?

* Is it easy to switch/transition from networking to programming? I mean, I'm young, but I'm not sure if it's practical.

Thanks! :)"
19giqj,0,2013-03-01,[C++(/SFML)] FAST finding of a user defined type in a container. Hash functions?,[deleted],learnprogramming,https://www.reddit.com/r/learnprogramming/comments/19giqj/csfml_fast_finding_of_a_user_defined_type_in_a/,"So, basically i am writing a little tool for my intern so cant give you exact full code.
What i will do is basically spray the color of the non-transparent pixels of a picture onto the Transparents. On my previous attempt i wasnt blur the color evenly, but i got a quite nice spraying pattern which would be OK for most cases.
Though i now want to know all 
to safe a (SFML) sf::Color object with its corresponing coordinates and then be able to find any value as fast as possible when i do know the coordinates.

At first i tried unordered_set but it figured it requires a hashing function for the Key/Element sf::Color and as i never did it before i first looked for a slightly easier, simpler, solution. Well not quite simple as i found out is unordered_map with a pair&lt;int,int&gt; following with a sf::Vector2u, which basically is a pair but with all operators overloaded by the authors.
On stackoverflow i found snippets i combined to:

    template &lt;&gt;
    struct std::tr1::hash&lt;sf::Vector2u &gt; {
    public:
            size_t operator()( sf::Vector2u val ) const throw() {
    			size_t h = ( ( val.first + val.second )*( val.first + val.second ) + val.first - val.second ) / 2;//something with x   
                 return h;
            }
    };
still says it cant find operator ==  in this case because of any ambiguity in SFML or sth like that
Nevertheless i thought you guys maybe give me a hint on either another way to solve the problem itself or this very sub problem.
Now its your turn,
big thanks from landscapez"
19gamr,1,2013-03-01,"Advice for Senior with lots of theory knowledge, but little programming experience",csmathguy228,cscareerquestions,https://www.reddit.com/r/cscareerquestions/comments/19gamr/advice_for_senior_with_lots_of_theory_knowledge/,"**Background:**

Sorry if this looks obnoxious, but I bolded the important facts so you can skim this section.

I'm a **fourth year**, double majoring in **math and CS**.  I've been **focusing on math** most of my undergraduate career, and in fact only 7 of the 15 classes I took to qualify as a CS major involved programming, most of which were in my first year.  I got the CS degree mostly because I was very interested in the theory side of CS.  I've got a pretty good GPA (3.7) from a top 5 university in math, but it's pretty average in CS.  **As a result, I know a lot about algorithms, combinatorics, logic, and complexity theory, but not a whole lot of the practical aspects.**

I applied to grad school for math, but I'm having second thoughts (mainly that I think after getting a PhD, I probably won't want to continue to post-doc, and be back where I am now).  So **I'd like to apply to some software engineering jobs** (or anything else that might fit my profile, if you have a suggestion).

Now, **I don't have a whole lot of programming experience.**  I haven't done much in the way of designing code around objects, or writing code in C++ or Java since before college.  **I can hack together most algorithms in python or Haskell (cause it's basically just math), but I don't have big projects to show off**, and probably don't know python's capabilities that well anyway.

**Questions:**
I'm confused about where to go from here.  April 15th is the deadline for accepting math grad school, so I would love to have a serious job offer by then, but more realistically, I'd like to have a better idea of what I want to do before then.

1. Where should I be looking for jobs (preferably in Chicago, NY or some other city in the northeast), and **what kinds of companies** would want to hire me?

2. **How do I make my resume look better?**  I have 3 summers worth of math ""research"" (in quotes, because that really consists of learning math on the frontiers of research, rather than discovering new results).  I don't have much in the way of even class projects to talk about.

3. What can I do to **improve my employability in the short term?**  My first step is getting on github and uploading code, but is there anything more specific to this?  Should I bother refreshing my C and Java, or try to learn new languages for jobs I want?

4. Everyone I know from high school seems to be getting into CS.  Is it a field that's quickly becoming too crowded, especially for someone with less experience?  This line of thinking is what makes me think getting a PhD might hurt more than help.  Also, how do I tell the difference between good jobs that will let me move up in the future, places where I'll clearly be outclassed, and places that won't offer much advancement or help me with future jobs.

5. **Data science/Machine Learning?** I don't know a lot about this, but it's been interesting me a lot, at least when it involves HMMs and other AI algorithms.  What kind of experience or knowledge do I need, and will it be as fun as the theory I'm learning in class?

6. **How much do I actually know?** Talking to people at my school, I think I know a good bit about algorithms and data structures. I aced the class pretty easily 2 years ago, but it's been a while, and we're not exactly known for CS.  Does that matter more or less than domain knowledge, and how should I take this into account when applying for jobs?

7. **Summer Internships?** Would it be a good idea to apply to them?"
19g7l2,1,2013-03-01,Summer internship or relax and work on my side projects?,[deleted],cscareerquestions,https://www.reddit.com/r/cscareerquestions/comments/19g7l2/summer_internship_or_relax_and_work_on_my_side/,"I've spent an unreasonable amount of time in community college, switching my major at least a thousand times. However every semester I've taken 15-20 units, and over time it's burned me out pretty hard. I'm finishing up the last few physics/discrete math/CS courses and my mind is destroyed. The massive amount of stress from the previous few semesters is really taking its toll on me.

This summer I was offered a programming internship at a local startup. It's very very small and nothing impressive, but the company is reputable in the area and I know the guys working there. Very smart dudes who I'm sure have a lot to teach me. It would take up 20-30 hours of work a week, but unfortunately it is unpaid. 

On the other hand, I was thinking of just relaxing and refreshing my mind over the summer before going to a real university. This is probably the only summer when I won't be taking classes, so I could finally spend time with my friends and family. Of course I would do some programming for myself, work on side projects from the convenience of my house.

So I'm not sure what to do. Take up a position that will take up ~30 hours of unpaid work per week, or take it easy and work on my own side projects?"
19fyfs,6,2013-02-28,Should I Drop a Class?,spl1080,gatech,https://www.reddit.com/r/gatech/comments/19fyfs/should_i_drop_a_class/,"So with the withdrawal deadline for classes being tomorrow, I'm trying to decide whether or not to drop ECE-2026 from my schedule.  I did abysmal on the first test (47, which was the cutoff for getting a U for the progress reports, though strangely I had an S).  The next test is on Monday, which unfortunately is on the other side of the deadline.  While I've been studying and I feel confident this time around, it's basically a gamble at this point.  If I drop the class, no worrying about how I have to do on Monday, but possibly delay graduating by a semester (which sucks when you're on loans like me), or stay in the class, and risk screwing up on the test and killing my GPA and my chances at scholarships, internships, and GT-Lorraine.

I know it is completely my choice either way, but what do you think would be the best move?  I'm currently taking 17 hours (PHYS 2212, ECE 2020, ECE 2026, MATH 2403, and ENGL 1101), and have 23 credit hours counting last semester and AP exams."
19fw9c,2,2013-02-28,Computer Engineering undergraduate looking to go to grad school for other areas of study,crookster,GradSchool,https://www.reddit.com/r/GradSchool/comments/19fw9c/computer_engineering_undergraduate_looking_to_go/,"Hello, fellow redditors, I am an undergraduate student at Rutgers University, and I am on track to getting my Bachelor's Degree in Computer Engineering this semester (ends in May). I have a 3.8 GPA, but don't really have much outside work done- no research, no clubs/organizations. I had one internship last summer at IEEE, where I basically worked as a glorified tech position.  

I won't get into how I got into my situation now, as it isn't really important, but I have no passion for the field of Computer Engineering. I know it's a bit late to get into grad school right away, but I would like to get the process underway as soon as possible. I am going to look into taking the GRE as soon as possible, and look into different programs that are available at schools around the country. 

I am making this thread in hopes of getting any kind of advice on my chances of getting into a program that is different than my major, and on the process involved. I don't know why but I never even considered that it was a possibility until my friends brought it up, and they mentioned that having a Bachelor's in Computer Engineering, as well as with my good GPA, would be appealing to graduate schools. How true is this? I am very interested in studying either chemistry. biology or physics, however I have only taken Chem 1 &amp; 2 and Physics 1 &amp; 2 during college. Would I have to take summer classes or stay extra years here at Rutgers to take more classes?

I will be looking into a lot on my own as well but any feedback would appreciated, thank you!"
