grrsi,3,2011-04-16,[FOR HIRE] Cisco networking student looking for internship/shadowing in Cleveland-Akron area,xamboozi,forhire,https://www.reddit.com/r/forhire/comments/grrsi/for_hire_cisco_networking_student_looking_for/,"I am looking for a shadowing or internship opportunity to get work experience in Network Engineering. Specifically I am looking for a summer position with any amount of hours. A part time position under 20 hours a week for next year would be a bonus. If I have to drive from Akron the position will need to be paid. If I can walk from campus I will consider an unpaid internship if it is a quality entry on my resume.

I started my career in desktop support and have had one position as a IT Administrator for a small 100 employee company. I have experience with all sorts of desktop support, both hands on and phone support. I did this for approximately 5 years before choosing to go back to school to learn Cisco equipment and get my Bachelors degree.

I have excellent customer service skills. I am in my 2nd year of school at the University of Akron. My graduation date is approximately 2013. I am finishing up all the classes required to take the ICND 1 exam this year which is the first of two exams for the CCNA certification. I plan to take the ICND 1 exam this summer. I already posses the Comptia A+ certification.

My resume will be submitted upon request. Feel free pm me or email me at rjg33 [at] zips [dot] uakron [dot] edu."
gt2g7,1,2011-04-18,"dear reddit, I just had a huge interview today, help me put together my post-interview impressions....im freaking out!",sinedolo,jobs,https://www.reddit.com/r/jobs/comments/gt2g7/dear_reddit_i_just_had_a_huge_interview_today/,"The interview was for a project management internship btw.
so he started off with the typical question of where do i see myself in 10 years I responded

""I have always been the kid who wanted to start a business as soon as possible, for instance if I had 50,000 dollars I would start various business ventures in the Baltics and Balkans, however in a more realistic perspective 
I see myself working at a company quite like this one and after about 5 years creating my own business and overwhelming the competition."" 
He immediately responded (as if slightly impressed) ""Good Answer""

He then said something that surprised me (after short discussion about my language skills and a little chit chat) He said ""ok well lets skip the bullshit questions, if you had to be the project manager for say, creating a IT room at your school, what would be your process of setting up the project?"" 

After he had to re-ask the question twice (because it wasnt clear how he meant) I said first Analysis (discussed how important it was for a manager to do this properly), then Budget, Then Personnel, figuring out what your boss wants, then testing and delivery. 

I know i was rambling a bit and even said ""ill go through it in a listed order, while i know im being a bit redundant about some of these things"" 
There was another part that caught my ears 

1. He told me he was in AISEC, and i said oh really I am too, he retorted in a happy sounding way ""thats why I have your CV!"" 2.He discussed a lot of specifics with me, 

2. the length i was available. I told him I was only good for 3 months which he responded with ""Ideally I would want YOU (he didnt say SOMEONE) for 5 or 6 months but I can settle with 3"" 

3. He told me I would be paid, but HR was going to tell me about that because it was ""confidential and he doesnt even know"" 

4. *At the end of the interview i asked ""are there any shortcomings you noticed on my resume or anything else I can explain more?"" He instantly said ""No but ill tell you this, you did well and you are definitely on my shortlist, give me a week and ill get back to you because I still have 12 people to interview"" 


5.**He started throwing out extreme specifics. ""I might need you to go to Geneva for another interview, then talk to a guy in NYC and another in Mumbai (with little explanation about either)

I sent this email after the interview, was it too much?

Dear herpaderpa (secretary),
Thank you for everything! (or should I say Köszönöm szépen!) I just hoped you could pass this message on to Mr. herpaderpa, it would be very much appreciated, please do let me know if he gets it.
Dear Mr. herpaderpa,
I wanted to take this opportunity to thank you for giving me a chance to interview with you today. I very much look forward to hearing from you soon and hope we can have a productive and beneficial experience together. I can provide several references from past jobs if needed. Also, if you need me to go to Geneva like you briefly mentioned I will make myself available.
Cordially,
Herpa C. Derp"
gt1xy,1,2011-04-18,"dear reddit, I had an interview for a HUGE internship opportunity in budapest and I think i did well, tell me what you think!",sinedolo,AskReddit,https://www.reddit.com/r/AskReddit/comments/gt1xy/dear_reddit_i_had_an_interview_for_a_huge/,"The interview was for a project management internship btw.

so he started off with the typical question of where do i see myself in 10 years
I responded ""I have always been the kid who wanted to start a business as soon as possible, for instance if I had 50,000 dollars I would start various business ventures in the Baltics and Balkans, however in a more realistic perspective I see myself working at a company quite like this one and after about 5 years creating my own business and overwhelming the competition.""
He immediately responded (as if slightly impressed) ""Good Answer""
He then said something that surprised me (after short discussion about my language skills and a little chit chat) 
He said ""ok well lets skip the bullshit questions, if you had to be the project manager for say, creating a IT room at your school, what would be your process of setting up the project?""
After he had to re-ask the question twice (because it wasnt clear how he meant)
I said first Analysis (discussed how important it was for a manager to do this properly), then Budget, Then Personnel, figuring out what your boss wants, then testing and delivery. I know i was rambling a bit and even said ""ill go through it in a listed order, while i know im being a bit redundant about some of these things""
There was another part that caught my ears
1. He told me he was in AISEC, and i said oh really I am too, he retorted in a happy sounding way ""thats why I have your CV!""
2.He discussed a lot of specifics with me, 1. the length i was available. I told him I was only good for 3 months which he responded with ""Ideally I would want YOU (he didnt say SOMEONE) for 5 or 6 months but I can settle with 3""
3. He told me I would be paid, but HR was going to tell me about that because it was ""confidential and he doesnt even know"" 
4. ***At the end of the interview i asked ""are there any shortcomings you noticed on my resume or anything else I can explain more?"" He instantly said ""No but ill tell you this, you did well and you are definitely on my shortlist, give me a week and ill get back to you because I still have 12 people to interview""
5.****He started throwing out extreme specifics. ""I might need you to go to Geneva for another interview, then talk to a guy in NYC and another in Mumbai (with little explanation about either)

I sent this email after the interview, was it too much?

Dear herpaderpa (secretary),

Thank you for everything!
(or should I say Köszönöm szépen!)
I just hoped you could pass this message on to Mr. herpaderpa, it
would be very much appreciated, please do let me know if he gets it.

Dear Mr. herpaderpa,

I wanted to take this opportunity to thank you for giving me a chance
to interview with you today. I very much look forward to hearing from
you soon and hope we can have a productive and beneficial experience
together. I can provide several references from past jobs if needed.
Also, if you need me to go to Geneva like you briefly mentioned I will
make myself available.

Cordially,

Herpa C. Derp"
gsxij,0,2011-04-18,Sublease available for Summer '11,altesctab,UIUC,https://www.reddit.com/r/UIUC/comments/gsxij/sublease_available_for_summer_11/,"Hey r/uiuc ... if there is anybody out there looking for an apartment this summer that is close to campus with a great view at a great price, I have a pitch for ya - I'm graduating and leaving Chambana, my roomie has an internship in the 'burbs. Rent is 500/mo, with utilities/internet/cable/garage parking **included** Let me cut to the chase and give you the specs:

* [Tower at Third](http://tower3rd.com/) is the building, on 302 E. John. It used to be a [HILTON](http://www.bbc.co.uk/blogs/aceandvis/paris-hilton-001.jpg), so you know you'll be living in style. If you go to U of I, I know you don't need to be sold on the amenities of this building, because they are notoriously good. 

* You'll join the mile-high club on the [nineteenth floor](http://i.imgur.com/VFqYZ.jpg), with a southward-facing view of all Champaign-Urbana

* You'll be in the deluxe apartment, which was just renovated last summer. This means a new [flat-screen TV](http://i.imgur.com/AR7Ql.jpg) mounted on your wall, for your viewing pleasure

* Your summer pad has [a new kitchen](http://i.imgur.com/oDMR7.jpg) so you can get your Rachel Ray on, 24 hours a day

* You've also got a [brand new bathroom](http://i.imgur.com/GAN7M.jpg), so you can get all fresh and clean in style. Also, you'll probably be like the sixth or seventh person ever to take a dump in there.

* The [bedrooms](http://i.imgur.com/Z70nO.jpg) are spacious, with a walk-in closet and newly replaced, cushy full mattresses. 

To reiterate, this is a brand new, laundry/utilities/cable/tv/internet included apartment with a commanding view of your beloved campus. There are 2 workout facilities in the building and an A/C unit that can keep your beer cold for you in the hottest days of summer. We have a lower price than every other offer on Craigslist within the building - *plus* parking is included in the price. One or two bedrooms available, contact here or at RandB1989@gmail.com

You're welcome, reddit. "
gtzuy,1,2011-04-19,"[For hire] Computer science student seeking an internship in software development, research or IT",brmj,forhire,https://www.reddit.com/r/forhire/comments/gtzuy/for_hire_computer_science_student_seeking_an/,"I'm a 3rd year equivalent CS major at the Rochester Institute of Technology looking for an internship to help fulfil my graduation requirements. I am familiar with Haskell, Scheme, C/C++, Java and UNIX shells. I am also proficient with Prolog, Curry and Python. I am comfortable with standard computer and networking hardware. Somewhat less relevantly, I have fairly strong general science knowledge and a general-class amateur radio license.

Thank you for your consideration."
gtkt9,14,2011-04-19,Internship dilemma...,tranzue,AskReddit,https://www.reddit.com/r/AskReddit/comments/gtkt9/internship_dilemma/,"First time poster here.  

Anyway, I was hoping the more experienced could help out.  I recently got offered an internship at a pretty small company, about 35 employees.  I accepted when they called, as I need an internship this summer.  I was also offered to have a second interview with a place much bigger, with probably better pay.

Here is where the dilemma comes in at.  If I get offered the job with the bigger company, should I accept and just call the smaller company to tell them I can't do it?

EDIT: Thank you all for the responses, it seems that most people say keep the smaller one since I've accepted, and the rest saying take the bigger company.  My interview for the position at the bigger company is coming up, I will still go to it, as I feel like canceling the interview may burn a bridge in itself.  But, if they do offer me the internship, I believe I am going to just stick with the smaller company.

Again, thanks for all the replies! It is a tough situation, and I've seen more than one person be in the same exact position.
"
gth2j,3,2011-04-19,What have Redditors invented or patented?,[deleted],AskReddit,https://www.reddit.com/r/AskReddit/comments/gth2j/what_have_redditors_invented_or_patented/,"Have you ever applied for a utility or design patent? Share your story. A few days ago I asked this same question to Reddit on [this post](http://www.reddit.com/r/AskReddit/comments/gqq5r/what_have_redditors_invented_or_patented/). I am hoping to add to this information. Here were some of the best responses:

**Fishybowl:** 3 patents -- 1 design and 2 utility. One of the utility patents is called a [deckwedge](http://deckwedge.com/).

**Alchemoria:** Patented [Phone Cover](http://youtu.be/x4rrKnM7MXk) that acts as a dry-erase board. Wants to license the patent to a company.

**lutusp:** Wrote the best-selling computer program Apple Writer. Also invented a technology used on space shuttles. Power supplies for all the lights -- interior, exterior. High-efficiency 20 KHz inverters. About 30 of the units are flown on each Shuttle. [Link to AMA](http://www.reddit.com/r/IAmA/comments/9xgnd/iama_little_difficult_to_describe_designed_part/?limit=500)

**noahsachs:** 2 Patents for *Combination Therapy for the Treatment of Immunoinflammatory Disorder* and *Method for Synthesizing a Nucleic Acid Strand in Hot Start Conditions*. [comment](http://www.reddit.com/r/AskReddit/comments/gqq5r/what_have_redditors_invented_or_patented/c1pnhuc)

**nunobo:** First project at work out of college, was assigned to develop a device to prevent a pipe from vibrating inside a nuclear reactor. The company filed an [application](http://www.freepatentsonline.com/y2010/0246744.html).

**ATOHelmet:** [7,357,826](http://www.patentgenius.com/patent/7357826.html) - USPTO.gov. ""I am a nerd.""

**Bltst2:** Listed on *Method and System for internet hosting/security* [patent](http://www.google.com/patents/about?id=BZR4AAAAEBAJ&amp;dq=7007299)

**Mjrice:** Involved in four patents for electrical designs (instrumentation). [Latest patent]( http://patft.uspto.gov/netacgi/nph-Parser?Sect1=PTO2&amp;Sect2=HITOFF&amp;p=1&amp;u=%2Fnetahtml%2FPTO%2Fsearch-bool.html&amp;r=1&amp;f=G&amp;l=50&amp;co1=AND&amp;d=PTXT&amp;s1=7,923,985.PN.&amp;OS=PN/7,923,985&amp;RS=PN/7,923,985)

**paulnasca:** Invented several algorithms. One implemented in several free and commercial software synthesizers. The first software implementation was [ZynAddSubFX](http://zynaddsubfx.sourceforge.net/doc/PADsynth/PADsynth.htm) an open source software synthesizer. Another was an extreme audio time stretching algorithm, implemented in [Paulstretch](http://hypermammut.sourceforge.net/paulstretch/). 

**reason78:** Co-patented US Patent: 7,109,755 [link 1](http://www.freepatentsonline.com/7109755.html) [link 2](http://patft.uspto.gov/netacgi/nph-Parser?Sect1=PTO2&amp;Sect2=HITOFF&amp;p=1&amp;u=%2Fnetahtml%2FPTO%2Fsearch-bool.html&amp;r=1&amp;f=G&amp;l=50&amp;co1=AND&amp;d=PTXT&amp;s1=loental&amp;OS=loental&amp;RS=loental) and [background story](http://www.reddit.com/r/AskReddit/comments/gqq5r/what_have_redditors_invented_or_patented/c1pme4g)

**dennisjkrueger:** Patent pending on new approach to motion capture using RF to determine relative position. [Explanatory website](http://www.hivenw.com/)

**phubner:** *Distributing customer location access links across...* [Patent application](http://www.google.com/patents?id=2c3bAAAAEBAJ&amp;printsec=abstract&amp;zoom=4#v=onepage&amp;q&amp;f=false)

**Wranlon:** Method for sampling behavior on Web sites, used for a product called [IMNMotion](http://www.reddit.com/r/AskReddit/comments/gqq5r/what_have_redditors_invented_or_patented/c1plrm7)

**ashadeofgrey:** Patent pending that allows multiple, independent graphical user interfaces to interact simultaneously (and in a particular way) with a single audio/video device. Multiple people can interact simultaneously with a television, using iPhones or other MIDs, as remotes. Filed during an internship at Intel.

**Kurtwinter:** Applied for a patent for a reduced latency closed network design.

**Freeflow488:** Plasma sterilization pen for doctor/home use.

**legion_pua:** Sold two patents on components for PEM hydrogen fuel cells.

**puddlegum:** Patent pending for ""non-sexy industrial item"" used in paved roads."
gtc56,0,2011-04-19,I'm a sophomore undergrad Mechanical Engineering student,jakenoss,AskReddit,https://www.reddit.com/r/AskReddit/comments/gtc56/im_a_sophomore_undergrad_mechanical_engineering/,"I'm currently minoring in computer science also and have a concentration in aerospace engineering. I have an internship with a company that focuses in HVAC, what else should I do to help myself get a job in the field of Mechanical/Aerospace when i graduate? thanks!"
gt6xg,5,2011-04-18,"[For Hire] Computer Science grad, located in Midwest",WarnWar,forhire,https://www.reddit.com/r/forhire/comments/gt6xg/for_hire_computer_science_grad_located_in_midwest/,"I graduated from college in December, and I am in need of a job. Proficient in many languages including C#, C++, Java, even COBOL and a few others. Had an internship in 2010. PM me for my full resume. "
guuom,1,2011-04-20,"Dear Reddit, we need your wise advice about post-college job hunting:",[deleted],AskReddit,https://www.reddit.com/r/AskReddit/comments/guuom/dear_reddit_we_need_your_wise_advice_about/,"Here's the dilemma.

My boyfriend is 4 months out of Engineering School (graduated Dec. 2010 with his Masters). He has been job hunting since mid-August/September of last year and has landed a handful of interviews. His primary interest is in working with a major defense contractor or government contracted position. He has had a formal interview with one major defense company, which we initially assumed would land him a job and were very surprised when he was not selected. Also (this will be somewhat relevant for my later questions), he is around $7k in debt with school loans presently.

Here's a little of his background before I continue:

He went to a public state University (city university, technically) that used to be one of the more well recognized engineering schools in the country but now ranks significantly lower on the list. He majored in Electrical and Computer Engineering and has specific interest in RF work. He maintained a 3.3 GPA in Graduate School, worked as the project manager of his Capstone design project (which is planned for distribution and was a major project originally started at Vanderbilt). He worked at a city Internet and Cable provider as customer support and interning/shadowing under the Senior Engineer of the office for nearly two years during his college career. He has been a strong support for many peers and individuals at his school program, providing tutoring and mentoring. Many of the positions he has interviewed for have been what he was explicitly trained for and specifically concentrated in college for, however he has not been selected for any of these positions in spite several promising interviews. 

With all of this being said, I have a few questions and would appreciate feedback from the general community on this issue.

First of all, how important would you say that having an education at a recognized school is when trying to be placed with a top defense contractor or specialized government job like he is trying to do? If it is incredibly important, I would like to know what your opinion is on this idea. Many have suggested to him that he should return to complete another degree at a University that has a more recognized name for the sake of having it on his resume. The suggestions have been anywhere from him going and trying to finish another degree and reapplying, to trying to land an internship (which requires you be in school to achieve) while he is pursuing another degree, or to work part time at school and try to continue to apply for positions while doing so. Any suggestions or thoughts on this? I know he is explicitly expressed his concern about becoming more in debt, but I am beginning to wonder if he needs to take the gamble in order to make a more formidable impression on employers that he really wants to work for. My thought is too, that a lot of these employers will pay him to go to school, so if he could land a job while still attending part time, they could pay the remainder of his tuition possibly. I understand this is still a risk, which is why I would like opinions.

What do you think is a suitable alternative? Another thought many have suggested is to get a smaller, more available position and then apply to one of these bigger companies at a later time. The thing that he has expressed as a concern with this however is that he does not want to get caught in a situation where he is stuck in a certain field he did not want to get into, and then find he can't get a job where he really wants to have one later on.

It has been made perfectly clear to everyone who has expressed concern about this that he really wants to work for a bigger defense company as I mentioned above. We are really trying to figure out how to make this possible. It's quickly coming up on 6 months without any sort of luck and no college to fall back on, and I am starting to worry for him and his future. I want him to be happy and successful and I would love any advice you have on this.

Thanks in advance."
gus9b,2,2011-04-20,I want to start a project as a substitute for a summer internship (undergrad CS student),dr_kludge,learnprogramming,https://www.reddit.com/r/learnprogramming/comments/gus9b/i_want_to_start_a_project_as_a_substitute_for_a/,"I'm just wrapping up my first year as a community college CS student who will eventually transfer to a 4-year state university.  I've learned a lot!  I got a late start on school (I'm 22 now) and I had never written any code beyond TI-83 BASIC or HTML until about 10 months ago. 

At this moment I am comfortable starting projects in C, C++, C#, x86 assembly, arduino, and possibly objective-C.  I have not found an internship and due to summer school probably will not continue trying.  Instead I am thinking that I should come up with some sort of 3-month project which can fill the internship void in my resume and experience.  

The idea I came up with so far was to build a rudimentary game engine.  Something that could do sidescrolling platform type games, with some 2.5-D (parallax with background objects for example) elements.  I'd stick with image based sprites to keep most of the work code-related.  I feel like this would be enough work to take 3 months, would be advanced enough to look good later on, but isn't so far above my skill levels as to be unrealistic.  The end result would be both the engine, and a game that uses it. 

From both a programming perspective, and a future employer's perspective how does this all sound?  

I have an engineer friend who I discussed this with as well - he suggested coming up with a game for either iOS or android that utilizes openGL ES.  I'm not against this, but it seems more daunting to me than the idea outlined above.

I'm open to ideas about how to make my project idea better, or maybe a completely different kind of project.  Or maybe I've got this all wrong and should be doing something completely different?"
