1gx4u7,4,2013-06-23,"[Table] IAmA: I am the son of a CIA spy, and a former war reporter (Iraq, Afghanistan) writing about PTSD. AMA.",tabledresser,tabled,https://www.reddit.com/r/tabled/comments/1gx4u7/table_iama_i_am_the_son_of_a_cia_spy_and_a_former/,"**Verified?** *(This bot cannot verify AMAs just yet)*

**Date:** 2013-06-23

**[Link to submission](http://www.reddit.com/r/IAmA/comments/1gwx0f/)** (*Has self-text*)



Questions|Answers
:--|:--
[What is your thoughts on Snowden and his actions?](http://www.reddit.com/r/IAmA/comments/1gwx0f/i_am_the_son_of_a_cia_spy_and_a_former_war/caomhzd?context=5)|&gt; Re Snowden, I think it's hard to pass judgment right now on the long-term questions his actions raise. I do think that there are serious risks of government overreach when it comes to eavesdropping and data mining, and that the info Snowden leaked could, over time, develop into a much bigger problem.
[Is your father still alive? If so, his reactions as well?](http://www.reddit.com/r/IAmA/comments/1gwx0f/i_am_the_son_of_a_cia_spy_and_a_former_war/caomhzd?context=5)|&gt; Re my father, he's alive, yes. And he's been very supportive. I think parts of my book were difficult for him to read, but writing it brought us closer and allowed us to have discussions we might not otherwise have had.
[How could the classified info develop into a bigger problem than the data-mining itself?](http://www.reddit.com/r/IAmA/comments/1gwx0f/i_am_the_son_of_a_cia_spy_and_a_former_war/caonqtg?context=5)|If the gov't starts looking at the content of all the calls and emails, and not just the fact that they took place, for instance.  
[A lot of the people I've spoken to about the issue were unaware that this is actually what's happening. They thought the content of their calls was being listened to.](http://www.reddit.com/r/IAmA/comments/1gwx0f/i_am_the_son_of_a_cia_spy_and_a_former_war/caootvh?context=5)|Yep, i think that's part of the problem. it's a big and important difference. 
[What's the most stereotypical ""spy movie"" thing your father did? What part of being a spy would surprise us?  Also, what is the craziest thing you saw wile reporting?'](http://www.reddit.com/r/IAmA/comments/1gwx0f/i_am_the_son_of_a_cia_spy_and_a_former_war/caon2dg?context=5)|Well, let's see.  When he was based in India, he did a lot of running agents and things like that, which involved doing ""dead drops"" and meeting his agents in the middle of the night.  Once, the KGB tried to recruit him, too, and that was a pretty dramatic moment, one I recount in the book.  Re the second question, being a spy has its dramatic moments,  of course, but they are also ordinary people, with ordinary challenges, and I think that goes against the stereotypical idea that all of them are, literally, like James Bond. Re reporting, there were so many crazy things it's hard to think of them all. Once I interviewed a 15-year old boy who had been a child soldier and had cannibalized people while running around in the jungle with Joseph Kony. That was pretty crazy.  
[How did you find out your father was a spy?](http://www.reddit.com/r/IAmA/comments/1gwx0f/i_am_the_son_of_a_cia_spy_and_a_former_war/caon0qm?context=5)|I found out when I was 14. My dad took me to his office, in a suburban minimall outside Detroit, Michigan, and as we were sitting in the car, he came out with it, and told me he was a spy.  The whole story is in the book.  It was a pretty thrilling moment, and definitely marked a before and after in my life with him.  
[Why do you think he told you? Was it allowed by his employers?](http://www.reddit.com/r/IAmA/comments/1gwx0f/i_am_the_son_of_a_cia_spy_and_a_former_war/caon7gf?context=5)|My dad and I had always been close.  However his work meant that there was this big secret he couldn't share with me.  So he told me because he didn't want there to be such a big area of his life that was off-limits to me.  He wanted to share as much of himself as possible with me. Also, I think it was partly practical. I was old enough to be figuring out the truth on my own.  So keeping the secret would have been more of a headache than anything at a certain point.  There are no hard and fast rules about how CIA officers tell their families. Each case is different.  Some never reveal anything to their children.  Others, like my dad, do so when it seems right.  
[Did your mother know before this moment? Also what did you think he did beforehand?](http://www.reddit.com/r/IAmA/comments/1gwx0f/i_am_the_son_of_a_cia_spy_and_a_former_war/caon5bh?context=5)|My mother knew, yes. She had to be trained up as well (both she and my step mother, later) and so she was definitely in on the whole secret. There came a time when it was hard for her to keep up the lie and the deception. Before he told me, I thought he was just a ""diplomat"" or, later, a ""teacher,"" when we lived on a secret CIA training facility in southern Virginia.  
[Surely then, there was no immediate danger to your family if he was exposed as a CIA officer at this point in his life then. I feel like telling your family things like this couldn't be a positive if he was an active CIA spy at the time.](http://www.reddit.com/r/IAmA/comments/1gwx0f/i_am_the_son_of_a_cia_spy_and_a_former_war/caonmqz?context=5)|Well, the point is he felt he could trust me, and he was right.  Remember that if he hadn't told me, I might have figured it out on my own anyway, so it was going to come up sooner or later.  It could have become a negative in certain circumstances, yes. But it didn't.  And all CIA families have to deal with this issue at some point. It's unavoidable.  Ask any other children, and many will tell you a story similar to mine. Ask Carl Colby, for instance. 
[Camp Peary? ](http://www.reddit.com/r/IAmA/comments/1gwx0f/i_am_the_son_of_a_cia_spy_and_a_former_war/caoo5je?context=5)|Yep.
[Okay thanks and congratulations for keeping the secret. Did you ever tell any friend though?](http://www.reddit.com/r/IAmA/comments/1gwx0f/i_am_the_son_of_a_cia_spy_and_a_former_war/caonq78?context=5)|Nope, not until he had retired and it was okay to do so. he also ran a political campaign where he was out in public, so that helped. 
[How does someone become a CIA spy? Do you find the CIA or does the CIA find you?](http://www.reddit.com/r/IAmA/comments/1gwx0f/i_am_the_son_of_a_cia_spy_and_a_former_war/caonffl?context=5)|There are lots of different ways.  You can actually apply!  Most of the time, people apply or get recruited through the military.  Sometimes the CIA will look for you and recruit you. My father had a kind of unique story -- he sort of recruited himself. It's a story I tell in the book. But basically he was in Mexico City, working as a professor. And he found out that the CIA was interested in the school where he was teaching because the KGB was trying to recruit students there. So he inserted himself into the mix, and thus put himself in a position where they recruited him. 
[That's so cool. What was your father's opinion of the USSR? Does he have that vitriolic distaste for communism or was he just doing job? And what exactly does the CIA look into re your political affiliations when you apply?](http://www.reddit.com/r/IAmA/comments/1gwx0f/i_am_the_son_of_a_cia_spy_and_a_former_war/caoo63u?context=5)|He had a severe distaste for communism, yes. and i'm not sure what their take is now on political affiliations.  it's probably much different from my father's era. 
[Was it difficult knowing you had a parent that was a CIA spy and never being able to tell anyone? Also, did that life lead you to become a war reporter?](http://www.reddit.com/r/IAmA/comments/1gwx0f/i_am_the_son_of_a_cia_spy_and_a_former_war/caon9u9?context=5)|There were definitely times when it was hard, yes. For instance, having to lie to friends and family over long periods of time was hard. Sometimes I wanted to, but I never did, even though there were people who suspected.  As to the second question, yes, I think it may have contributed.  There are real similarities between the two professions, spy and journalist (esp foreign correspondent) that became clearer to me over time -- going out into the world, cultivating sources, getting restricted information, being in risky environments and so forth.  
[What type of surfing do you do?](http://www.reddit.com/r/IAmA/comments/1gwx0f/i_am_the_son_of_a_cia_spy_and_a_former_war/caon89i?context=5)|Oh, pretty much any wave I can catch. I like pretty mellow lefts, maybe 4-6 feet or so.  I'm goofy. I love long, smooth rides with some good push.  Mostly I love just being out there with my friends, enjoying the beauty and the ocean.
[Longboarding or shortboarding?](http://www.reddit.com/r/IAmA/comments/1gwx0f/i_am_the_son_of_a_cia_spy_and_a_former_war/caonhcb?context=5)|Both. I've got a 6'8"" for some days, and some days here in the Bay Area I'll rent a longboard to surf the small waves at a place like Bolinas :) 
[What do you feel is your most lasting memory from your time in Iraq and Afghanistan?](http://www.reddit.com/r/IAmA/comments/1gwx0f/i_am_the_son_of_a_cia_spy_and_a_former_war/caondi3?context=5)|Too many to recount here, I think.  I have very strong memories of some of the close calls I had, being bombed while riding in a humvee, for instance, or being ambushed and almost getting killed while driving north during the invasion. But those are pretty negative memories. I also remember certain interviews, talking with people about their lives, before and during the war, seeing them as human beings. I remember many wonderful evenings spent with Iraqis just talking.  I remember being rocketed in our house. And I remember friends who died, both Iraqi and American. 
[Are you aware of the research that MAPS and other organizations are doing regarding the use of MDMA-assisted psychotherapy in the treatment of PTSD? If so, what are your opinions on the research?](http://www.reddit.com/r/IAmA/comments/1gwx0f/i_am_the_son_of_a_cia_spy_and_a_former_war/caonfrm?context=5)|I'm aware of it, yes, and very intrigued by it.  I think it could lead to some exciting discoveries down the line. Generally, I think there's a lot of fascinating research being done in the world of psychedelics, like ayahuasca and so forth, but the extent to which it's all applicable to PTSD is, for me anyway, still unknown.  But I'd like to learn more. 
[Hey!  As part of the training does a spy learn martial arts/hand to hand combat?](http://www.reddit.com/r/IAmA/comments/1gwx0f/i_am_the_son_of_a_cia_spy_and_a_former_war/caoncll?context=5)|Some surely do. My father didn't.  He did learn weapons training, both in rifles and hand guns. He also learned things like surveillance detection, writing in invisible ink and resisting interrogation.  Paramilitary types learn a whole lot of other stuff, too! 
[What do you mean by paramilitary types? Also, thanks for doing this AMA, really interesting stuff.](http://www.reddit.com/r/IAmA/comments/1gwx0f/i_am_the_son_of_a_cia_spy_and_a_former_war/caookj4?context=5)|Well, the cia has a lot of paramilitary activities. read mark mazzett's book, ""the way of the knife."" 
[Why do you refer to your father as ""spy"", rather than officer?](http://www.reddit.com/r/IAmA/comments/1gwx0f/i_am_the_son_of_a_cia_spy_and_a_former_war/caonng8?context=5)|Answered this below. technically, officer is the right term, thanks!  but spy is the more pop culture meme that makes it more accessible for people to understand. but it's an important distinction. thanks! 
[What do you think about the upcoming withdrawal of US troops in Afghanistan?  The vice piece ""This Is What Winning Looks Like""(Link to www.vice.com certainly makes me concerned about the afghan police and militarys ability to keep any sort of stability.  What, if anything, do you think could be done to stabilize Afghanistan?](http://www.reddit.com/r/IAmA/comments/1gwx0f/i_am_the_son_of_a_cia_spy_and_a_former_war/caonaft?context=5)|Alas, not a lot, in my view.  Developing stability there has to come from the Afghan side of things, and that, I think, is something that will only develop slowly, with a lot of good will and effort from Afghans themselves. It can't be imposed by us, and we should have learned that by now, but leave it to American policy makers to keep making the same mistakes over and over again. 
[Have you ever met anyone who you suspected was an undercover spy while covering a story? Did your familiarity with the CIA affect what sources you interacted with?](http://www.reddit.com/r/IAmA/comments/1gwx0f/i_am_the_son_of_a_cia_spy_and_a_former_war/caonfmv?context=5)|I have met people I've suspected of being spies, yes, many times.  In Afghanistan, Iraq, Africa and elsewhere. In some cases, I've met people who I knew were spies, working either for the U.S or other agencies. In Afghanistan, we used to come across ""journalists"" who purported to be working for fictional news outlets, and we became convinced they were actually spies. Re the 2nd question -- I don't think it did, really. I just worked the way I worked, but maybe I was a little bit more sensitive to the fact that I knew a bit more about how certain relationships worked. 
[How much information is your father allowed to give you about his missions/operations? ](http://www.reddit.com/r/IAmA/comments/1gwx0f/i_am_the_son_of_a_cia_spy_and_a_former_war/caon98s?context=5)|Well, there are certain things he could never tell me. And he couldn't ever reveal what's called ""sources and methods"" which are the rules for how spying actually works. But he could tell me ""war stories"" if you will, the broad outlines of what happened, and how he was involved, without compromising national security or anything.  Also, when you're a child of a CIA officer, you pick up a lot just by osmosis over the years, so some of it came to me that way.  And finally, I've known a lot of CIA people as friends and acquaintances over the years, so you pick stuff up that way as well. 
[Any cool spy techniques you learned through osmosis?](http://www.reddit.com/r/IAmA/comments/1gwx0f/i_am_the_son_of_a_cia_spy_and_a_former_war/caonla5?context=5)|Hmmm. Well, I think I learned some things just by watching my father, like how to deflect if a question cut too close to home. That's the first thing that comes to mind. I'll add if I can think of anything else. 
[How exactly do you deflect a question like a spy?](http://www.reddit.com/r/IAmA/comments/1gwx0f/i_am_the_son_of_a_cia_spy_and_a_former_war/caonx9z?context=5)|Q: so what does your dad do?  A:  oh, he's in the gov't. boring bureaucrat stuff. hey, what's your girlfriend's name?  she's great! 
[Did you cover the 2003 bombing of Baghdad? If so, what was that like?](http://www.reddit.com/r/IAmA/comments/1gwx0f/i_am_the_son_of_a_cia_spy_and_a_former_war/caoncrc?context=5)|Well, yes and no.  I was in Baghdad before ""Shock and Awe"" started, yes, when Saddam Hussein was still in power.  I left just days before the actual bombing began -- my ""human shield"" visa had expired and the government was going to kick me out or throw me in jail. Then I went to Kuwait and covered the war as a ""unilateral"" journalist heading north behind the troops.  
[What was is like staying abroad, in so many different countries and continents? And which country was your favorite &amp; least favorite?](http://www.reddit.com/r/IAmA/comments/1gwx0f/i_am_the_son_of_a_cia_spy_and_a_former_war/caonaee?context=5)|I, for one, loved living overseas, both as a dependent when I was young, and as a foreign correspondent.  For me it broadened my perspective, I learned languages, saw things I would have never otherwise seen, it was just terrific. Of course, moving was challenging, but I took to it with relish. Not everyone does, and that's fine, people are different.  But I loved it.  My most favorite country?  I think South Africa.  It's beautiful, diverse, interesting, people are friendly, there's incredible history...it's one of the most amazing places I've ever been.
[What is your father's take on wikileaks? ](http://www.reddit.com/r/IAmA/comments/1gwx0f/i_am_the_son_of_a_cia_spy_and_a_former_war/caonkbh?context=5)|I think he's not a fan...too much of a scattershot approach for him, not selective or intelligent enough, not discerning enough. He was a big supporter of the Pentagon Papers though, because it was targeted and because he supported the anti-war movement.  
[Do you think war journalism lends itself to the same kind of PTSD symptoms as active-duty? I can imagine you were a little shell-shocked.](http://www.reddit.com/r/IAmA/comments/1gwx0f/i_am_the_son_of_a_cia_spy_and_a_former_war/caonpn6?context=5)|It can, absolutely, yes. I had some issues with it, and so did a lot of my friends. we don't talk about it all that much in journalism, but we're starting to more, and it has affected a lot of journalists over the years. 
[How did your father become a spy? What kind of qualifications do you need for that type of job? ](http://www.reddit.com/r/IAmA/comments/1gwx0f/i_am_the_son_of_a_cia_spy_and_a_former_war/caongdm?context=5)|I answered this above, where I talked about his work in Mexico City.  Re qualifications -- I think you need to be clever, enjoy mind games, be hungry for information, maybe patriotic or at least believe in what you're doing, skillful with people, psychologically astute, discrete...
[What's the most badass thing you think your father did as a spy?](http://www.reddit.com/r/IAmA/comments/1gwx0f/i_am_the_son_of_a_cia_spy_and_a_former_war/caongkv?context=5)|Ha. Not sure, maybe there's something he did that he never told me about.  He did some pretty badass things that I do know about -- recruiting a Chinese spy in one instance, or running around Afghanistan with Special Forces implementing various ""psy ops"" programs with Afghan tribal leaders. 
[Journalist question: I have been working on improving my writing, can you share any tips that can help me improve?](http://www.reddit.com/r/IAmA/comments/1gwx0f/i_am_the_son_of_a_cia_spy_and_a_former_war/caonqzr?context=5)|Sure. 
 |Write what's difficult. If it's hard to write, or painful, it needs to be written. 
 |Write every single day.
 |Read writers you like 
 |Try different styles on and in the process try to develop your own.
 |Be fearless.
[When you started writing, did you go through a course or was it natural?](http://www.reddit.com/r/IAmA/comments/1gwx0f/i_am_the_son_of_a_cia_spy_and_a_former_war/caoojl3?context=5)|I took some poetry courses in college and some basic writing classes, but that's it. i just always liked to do it. and then i learned a ton when i started at newsweek as an intern, from a mentor and other journalists. so most of my training actually happened on the job. 
[How do spies typically find relevant information when they're in other countries? ](http://www.reddit.com/r/IAmA/comments/1gwx0f/i_am_the_son_of_a_cia_spy_and_a_former_war/caonclw?context=5)|Well, they develop sources, much like journalists do, only they try to find people in sensitive jobs, like at the local Defense Ministry or Foreign Affairs Dept, and get them to betray the laws of their own countries to provide information to the U.S.  But it's all about people, finding people who share you ideas, your goals, your ideology, and working with them and against your common enemies, whether it's the totalitarian regime in which you find yourself, or the company in which you work.  
[Did your father ever question why he did the things he did? I don't necessarily mean asking questions that he knew he would never get an answer to, but more questioning his loyalty, if what he did was worth it, anything in that area?](http://www.reddit.com/r/IAmA/comments/1gwx0f/i_am_the_son_of_a_cia_spy_and_a_former_war/caonovp?context=5)|He did, yes, and still does.  There's a long process of reckoning, I think, in a world like his, where the moral outlines are kind of hazy and there's a lot of murkiness to be waded through.  I think he did think it was worth it, on some days, and on others maybe less so. He was not always in line with the U.S foreign policy of the time, especially lately, and so it was hard to be a servant in its message at times. But he loves his country, the best parts of it, and I think he felt that America was worth defending against, say, the threat of Stalinist mayhem.  Obviously, it's more complicated than just that, but that's a snapshot. 
[How do you think your life would of been, if your father had never told you? Would you be the person you are today? ](http://www.reddit.com/r/IAmA/comments/1gwx0f/i_am_the_son_of_a_cia_spy_and_a_former_war/caonhw7?context=5)|Most probably not.  I think I would never have had occasion to really think about what he did, and maybe not being let in on the secret would have engendered a more naive or trusting approach toward things?  Just a thought...then again, maybe I'd be just the same, and by now I would have known anyway, so it would have just come a little later.  It's hard to say, difficult to rethink what has already happened. But interesting to ponder...
[When you were a kid, and found out your dad was a spy, how tempting was it to tell everyone your dad was so cool because he was a spy!? I know I would've wanted to.](http://www.reddit.com/r/IAmA/comments/1gwx0f/i_am_the_son_of_a_cia_spy_and_a_former_war/caonj1n?context=5)|Well, I suppose it could have been tempting, but it was made very clear to me that that was not an option.  And in my household, in those circumstances, at that time, I took that admonition very seriously.  The context was very different.  
[Are having parents that are spies really all that it is cracked up to be? edit: Spy kids the movie always made me have this awesome perception as a kid.](http://www.reddit.com/r/IAmA/comments/1gwx0f/i_am_the_son_of_a_cia_spy_and_a_former_war/caoobw7?context=5)|It's not like the movies, bourne identity or spy kids, that's for sure. my wife and i had a joke that the next movie should be called ""Double Oh Dad"" 
[What are your thoughts/experiences on people treating their PTSD with marijuana? ](http://www.reddit.com/r/IAmA/comments/1gwx0f/i_am_the_son_of_a_cia_spy_and_a_former_war/caond0s?context=5)|I don't know, really.  I know that people have tried using ecstasy in some cases, but I'm not sure about marijuana.  There are a lot of other treatments as well -- including art, surfing, dogs, music and many other things. 
[What advice do you have for young student journalists looking to get involved in war reporting, and more specifically embedding within military forces?](http://www.reddit.com/r/IAmA/comments/1gwx0f/i_am_the_son_of_a_cia_spy_and_a_former_war/caono2e?context=5)|First, try to build a relationship with some news outlets that will take your stories. That done, start putting in requests for embeds via the PIO with whatever military force you'd like to embed with.  Build contacts and sources as much as possible.  
[This might be a bit off topic; but as a journalist who covered Iraq and Afghanistan, did you ever get to meet an Australian reporter by the name of Michael Ware? If so what was/is he like?  This might be too general, and maybe I'll have to read your book to find out, but what are your honest thoughts on the Iraq/Afghan wars (summed up of course\). Also, have you seen the VICE documentary ""This is what winning looks like"" and did you ever see evidence of Chai Boys while you were working in Afghanistan? ](http://www.reddit.com/r/IAmA/comments/1gwx0f/i_am_the_son_of_a_cia_spy_and_a_former_war/caono2e?context=5)|You might have to read the book, yes :) But all in all, Iraq was pretty disastrous I think.  Don't know the Chai boys, no. Who's that?  
[What do you think of 'centrism' in the news media?](http://www.reddit.com/r/IAmA/comments/1gwx0f/i_am_the_son_of_a_cia_spy_and_a_former_war/caonfwi?context=5)|I think it depends on the story.  Sometimes journalists need to be very centrist and objective and so forth.  And sometimes, there has to be more pushback because the tables are skewed too far in one direction already. See the reporting of Michael Hastings to get a better sense of what I mean by that. 
[What are your thoughts on the recent passing of American journalist Michael Hastings? Both of you have covered and written about similar issues and his death has deprived Americans of one of their most hard-hitting and fearless journalists. ](http://www.reddit.com/r/IAmA/comments/1gwx0f/i_am_the_son_of_a_cia_spy_and_a_former_war/caonq9c?context=5)|Well, I was Mike's boss in Baghdad, and we were very good friends. I was devastated by his death.  I think the world of journalism has suffered a huge loss by his passing, and other journalists need to step up and keep doing the kind of terrific journalism he was doing right up until the end.  
[What do you think America should do about the suicide rate of our current veterans?](http://www.reddit.com/r/IAmA/comments/1gwx0f/i_am_the_son_of_a_cia_spy_and_a_former_war/caoobp2?context=5)|Well, i don't know the answer, but they need to do something, don't they? it's unacceptable, really, that it's so high. 
[Hello! With your work with PTSD in the military, how would you assess the ability of army doctors (psychiatrists\) to identify and prevent PTSD? Do you feel we need more? Better trained? ](http://www.reddit.com/r/IAmA/comments/1gwx0f/i_am_the_son_of_a_cia_spy_and_a_former_war/caons7r?context=5)|Yes, we definitely  need better, better trained, more, the whole shabang.  there are some very good ones in the military, but not enough.  the whole issue just needs more exposure, more attention. 
[Thanks for doing this, i hope i'm not too late.  What would your reaction be to people disputing ""we give up our privacy for safety/security""? Both Obama and Bush have said that, but shouldn't this mass surveillance have stopped things like the Boston Marathon Bombing? Or do you think it has and that these tragedies were simply unavoidable?](http://www.reddit.com/r/IAmA/comments/1gwx0f/i_am_the_son_of_a_cia_spy_and_a_former_war/caonxfi?context=5)|I'm not sure. I think that's what everyone is wanting to know. 
[How accurate is the hollywood depiction of CIA spy's in regards to your father?](http://www.reddit.com/r/IAmA/comments/1gwx0f/i_am_the_son_of_a_cia_spy_and_a_former_war/caonxfi?context=5)|Not very accurate at all. Hollywood is good at art, not so good at reality.
 |Well, I have no doubt that heightened security measures have helped us on many occasions.  That said, they can't prevent everything. I think it's a bit of a gamble sometimes, that there's a hope and expectation that the increased security will prevent the worst tragedies from occurring. Just a guess though. 
[When and how did you realize you wanted to be a war journalist? What are the hardships and what are the moments that make you glad you do what you do? Thanks your book looks very interesting!](http://www.reddit.com/r/IAmA/comments/1gwx0f/i_am_the_son_of_a_cia_spy_and_a_former_war/caoojm1?context=5)|I realized I wanted to cover conflicts a year or so after I started doing journalism, in Paris, in 1998. I thought it was just the most interesting and exciting part of the profession. And in some respects it is. Not all though, and in more recent years I've found a lot of value doing other things. I did it when I was a young man, and in some respects it's a young person's job.  It can be hard, dangerous, dirty, ugly and exhausting, but it's also amazing to be so close to big moments in history, and to feel the forces of the world at work right around you. That's what I liked most.  Thanks for your interest. 
[Was your father in amazing shape as we come to believe spies all are? ](http://www.reddit.com/r/IAmA/comments/1gwx0f/i_am_the_son_of_a_cia_spy_and_a_former_war/caonla1?context=5)|Not that i know of! :) he does his best though...
[If someone, say, was interested in going to a conflict zone to cover it, freelance or otherwise, what advice would you give? What're the most important considerations when entering one?](http://www.reddit.com/r/IAmA/comments/1gwx0f/i_am_the_son_of_a_cia_spy_and_a_former_war/caoovt3?context=5)|Well, safety is first. don't think you're invincible because you're not, a mistake rookies often make. be intrepid but be smart first. don't think foreign governments will treat you nicely simply because you're an american. they won't always. get the backing of at least one org before you go. get to know other journalists before you go and seek their advice. travel with other journos at fist, until you get the lay of the land. have two phones. keep in touch. 
[Have you ever thought of following in your father's footsteps? As you became older, has the life and the secrecy ever appealed to you?](http://www.reddit.com/r/IAmA/comments/1gwx0f/i_am_the_son_of_a_cia_spy_and_a_former_war/caonr76?context=5)|I gave up on becoming a spy when I was pretty young. I thought, and he encouraged me in the belief, that other lines of work would ultimately be more rewarding. That said, I am attracted by the idea of having a sort of impunity to exist in a morally ambiguous world with the backing of a government, it's powerful, hard to resist. I didn't, of course, but it's interesting to fantasize about, isn't it?  
[Was your dad ever ""too busy"" to spend time with the family? Was his job time consuming? Did he enjoy his job? Would he recommend it?  Same goes for you, did you like being a reporter in Afghanistan? ](http://www.reddit.com/r/IAmA/comments/1gwx0f/i_am_the_son_of_a_cia_spy_and_a_former_war/caoorsv?context=5)|Sometimes he was too busy, but my dad was mostly there for us. and he mostly liked his job. i'm not sure he would recommend it, or if he did, not to everybody certainly. and i, yes, i loved and still love my job. 
[Has your father ever actually shared any of his ""Top Secret"" stories with you? And If so, are you able to share anything with us? ](http://www.reddit.com/r/IAmA/comments/1gwx0f/i_am_the_son_of_a_cia_spy_and_a_former_war/caons9m?context=5)|Only what he could share without breaking the law.  Read my book, there are a lot of great spy stories in there. I think you'll enjoy it. 
[Has your Dad ever talked about his cover being or almost being blown?](http://www.reddit.com/r/IAmA/comments/1gwx0f/i_am_the_son_of_a_cia_spy_and_a_former_war/caooo4a?context=5)|Well, it was always a risk when he was working during his career. but afterwards i didn't do anything to affect it. he was already out of the shadows by the time i was heavy into writing the book. 
[When you went to cover the wars in Iraq and Afghanistan did you have to get special training?  Did you write about things that you thought were particularly important about the conflicts that weren't printed?  Do you prefer to write freelance or for a particular newspaper or magazine?](http://www.reddit.com/r/IAmA/comments/1gwx0f/i_am_the_son_of_a_cia_spy_and_a_former_war/caoo1ea?context=5)|I did get some special training yes. Most journalists of my time, and into the present day, have taken security courses where we're taught what to do if kidnapped, for example. I took a course in nuclear, biological and chemical warfare. Also, first aid. All were helpful in some ways during the time I spent in war zones.  I wrote for Newsweek for most of my career, still do occasionally, actually. But now I'm mostly freelance. 
[Did you dad try to hide from you that he was a spy? How did you find out? Do you have cool spy gadgets?](http://www.reddit.com/r/IAmA/comments/1gwx0f/i_am_the_son_of_a_cia_spy_and_a_former_war/caonu55?context=5)|I answered this above. There's a story in the book about how he told me and in what circumstances.  I don't have any cool spy gadgets, no. I wish!
[What is your thoughts on television/films showing such intimate portrayals of either spies (anit-CIA\) or CIA agents themselves.  Obviously, ""The Americans (FX\)"" comes to mind in particularly.  What is the most accurate film or television series depicting CIA life?  ](http://www.reddit.com/r/IAmA/comments/1gwx0f/i_am_the_son_of_a_cia_spy_and_a_former_war/caoovpq?context=5)|I haven't seen the americans yet, but want to, i have a feeling it'll be the closest to the real thing? maybe?  i also liked ""tinker, tailor, soldier, spy"" but my dad didn't. he said it was too emotional and too fraught with feelings about betrayal and stuff. i'm not so sure. 
[As someone who works in the mental health field I don't think we have great ways to treat PTSD.  I've recently heard promising anecdotes about alternative ways to help folks with PTSD - some are even pretty out there like sweat lodges.  Have you come across any alternative or even sorta out there methods that you think might hold promise to help folks manage or heal their PTSD? ](http://www.reddit.com/r/IAmA/comments/1gwx0f/i_am_the_son_of_a_cia_spy_and_a_former_war/caonqmg?context=5)|I don't have anything more to offer than what the qualified medical professionals are already recommending. The problem isn't really innovative ideas, it's education and making them available to large numbers of people. 
[I'm seriously considering a career as a post-trauma therapist, I'd love to help people suffering from PTSD. Is there any advice you can give me about a career in this field? Or is there anything that most people don't know about before starting in this field that I should consider before making the decision to pursue this career path? ](http://www.reddit.com/r/IAmA/comments/1gwx0f/i_am_the_son_of_a_cia_spy_and_a_former_war/caonytj?context=5)|Well, be prepared to see, hear and immerse yourself in a fairly steady stream of horror. If you like that, or think you can handle it, then by all means go for it.  But it's not for the faint hearted. At least that's my sense of it.  Very interesting stuff though. it's bound to be a career that will keep you interested and excited. 
[If you can answer, What type of spy (case officer\) is/was your dad?](http://www.reddit.com/r/IAmA/comments/1gwx0f/i_am_the_son_of_a_cia_spy_and_a_former_war/caonnv3?context=5)|He was just a regular case officer, not sure what you mean by the question...
[Why did you choose Journalism as your profession? Did you ever think of following your father's footsteps and joining the CIA?](http://www.reddit.com/r/IAmA/comments/1gwx0f/i_am_the_son_of_a_cia_spy_and_a_former_war/caonxu5?context=5)|Journalism and the world of intelligence are eerily similar in many ways. I addressed this above. I think journalism was my way of sort of following in my father's footsteps, but doing it on my own terms.  They're similar enough to be noted, but different enough to feel autonomous. 
[Which journalist do you look up to the most? Any moments that inspired you to become a journalist? Thanks so much!](http://www.reddit.com/r/IAmA/comments/1gwx0f/i_am_the_son_of_a_cia_spy_and_a_former_war/caoopyp?context=5)|So many other writers i admire. kapuscinski (sp?), david grann, mark singer...on an on the list goes. the moment i stepped into the newsweek office in paris, and saw that world, i was hooked. from then on i knew i wanted to be a journalist and writer. 
[This has always boggled me. How does one actually get such a job as working as a CIA spy? Or any sort of ""higher up"" government position? I'd love to know how it actually happens.](http://www.reddit.com/r/IAmA/comments/1gwx0f/i_am_the_son_of_a_cia_spy_and_a_former_war/caoog9o?context=5)|I answered some of this above. you can actually just apply. but there are many routes in, from many different sectors, it depends on your skill set and lots of other things. 
[Are you familiar with the work on PTSD of Peter Levine or David Berceli? Their stuff has been hugely helpful to some folks i know, despite being a bit ""woo"". I've seen some pretty incredible results, particularly from Berceli's ""TRE"" method.](http://www.reddit.com/r/IAmA/comments/1gwx0f/i_am_the_son_of_a_cia_spy_and_a_former_war/caoomx6?context=5)|Yes, it's fascinating stuff. Levine's work, in particular, is very interesting. 
[How old are you and what was the timespan of your father's career? did your family ever live in a country that the US was not friendly with? ](http://www.reddit.com/r/IAmA/comments/1gwx0f/i_am_the_son_of_a_cia_spy_and_a_former_war/caoofnw?context=5)|I'm 39. my dad was a case officer for 25 years, from 68-94 or so. then he was an independent contractor for many years after 9/11. 
[How often did your dad have to leave for work?  Was he ever in a life threatening scenario?  Does he have any cool stories.](http://www.reddit.com/r/IAmA/comments/1gwx0f/i_am_the_son_of_a_cia_spy_and_a_former_war/caoo03l?context=5)|Yes, see some of the above answers. i've tried to address this there. and you can also read the book to find out more. 
[Do you feel that using MDMA could be effective at helping people with PTSD? Or is it more of a temporary fix for a very serious long term problem?](http://www.reddit.com/r/IAmA/comments/1gwx0f/i_am_the_son_of_a_cia_spy_and_a_former_war/caooh8k?context=5)|I don't know enough about the mechanics of it to give a thoughtful answer, sorry. 
[I had a friend in High School who's father did similar work in covert operations. She was often stressed because she knew he would be overseas on assignment but was rarely able to contact him for extended periods of time. For example, she was allowed to know he would be in a region or country, let's say somewhere like Syria, and then he wouldn't return her emails for a week(s\).  Did you have a similar experience? Was it ever rough?](http://www.reddit.com/r/IAmA/comments/1gwx0f/i_am_the_son_of_a_cia_spy_and_a_former_war/caoo2w9?context=5)|Yes, I did. My dad would go on assignment to places like Afghanistan and there were times he'd be out of touch for a long time. I was, too, as a journalist, and so I was more used to it. But it was hard on my step mom at times. And he had some close calls, yes.  Once, in Pakistan, he narrowly escaped a car bomb at a restaurant. That was nerve wracking to hear when he told me about it later. 


*Last updated: 2013-06-27 12:34 UTC*

*This post was generated by a robot! Send all complaints to [epsy](/message/compose/?to=epsy).*

"
