dlhmd,6,2010-10-01,"I've been laid off 4 times in the last 5 years and now employers are looking at my resume as if I'm a ""job hopper"".  What can I do to make my resume more stable?",bluesunshine,AskReddit,https://www.reddit.com/r/AskReddit/comments/dlhmd/ive_been_laid_off_4_times_in_the_last_5_years_and/,"I started working in IT in 2005 while I was still in college as an intern.  I didn't get the job when the internship was over and I moved on to a large company as a contractor.  After a year (and many attempts to sign on to be a full time employee) I was laid off.  I then went back to the place I interned at (I had a good relationship with the company) for a temporary position until I got a new job.

I got a job at a small company and the job was hell.  After six months I was micromanaged to the point of a nervous breakdown and left the company (the first time I've ever quit a job, ever).  During that time the economy tanked and the only choice I had was to take a temp job at a software company (which was an awesome place to work), and after more attempts to become a full time employee I was part of a mass layoff.  

Now I've been working at a large healthcare company as a contractor for a year and I have no room to grow.  I'm the lowest paid (mostly because I'm the youngest) on my team, I get less PTO then I did working at a grocery store in high school, I've been denied for raises, healthcare is abysmal (ironic isn't it?), and they don't want to promote me because they love my rock bottom salary.

Now that I'm looking for a new, full time job, it seems that HR departments are pegging me as a ""job hopper"".  I've had 2 phone interviews in the last week and they've told me that, ""Well it looks a little strange that you've only been with each company about a year or so"".  Most don't seem to understand that you have to pay dues when you're out of college, how much the economy has changed the job market, and how cut throat companies are when dealing with IT employees.   

So my question is, how should I spruce up my resume to make it look like I'm stable? Also, should I just tell HR flat out that I'm part of a rough market? I was thinking of putting ""temporary"" or ""contract"" next to my positions but I'm not sure how good that will look.  Here's a copy of my resume (I removed all the personal info for privacy and some of the formatting got jacked up, but all the info is there):

http://www.scribd.com/doc/38533299?secret_password=1b0yal5cxqy4qk7r0o5f


tl;dr; Been laid off several times due to a rough job market and need to tell employers that I'm not a job hopper."
dls26,5,2010-10-01,Suggestions for finding and affording an internship?,IntershipsSuck,AskReddit,https://www.reddit.com/r/AskReddit/comments/dls26/suggestions_for_finding_and_affording_an/,"Hey Reddit - long time lurker first time poster.

So basically I want to know if anyone has any ideas about actually finding and affording internships. To graduate from my school every student in the college has to have at least one summer long internship. The problem is that to get credit for the internship you also have to pay something like $750 for the credit. 

The other problem is most companies that recruit from my school or want my skill set are located in DC or other really expensive areas. I would have to buy a car, pay for local housing, pay for food and all that on top of paying my rent over the summer at school (it's impossible to find subletters in the summer - there's too many places open and my house is a crap-shack). The internships do pay but it wouldn't cover the cost of living and keeping my place here and I'd also be loosing out on saving money over the summer through working a local job.

I'd get an internship at my school but they don't pay, are hard to get, and all my peers would have internships at big companies - Booz Allen, Lockheed, Northrop Grumman, CIA and it puts me at a huge hiring disadvantage. 


Basically, I'm paying for school myself and a summer internship would cost me more money and I wouldn't be able to pay for school myself. Anyone have any ideas? It sucks being at a disadvantage to everyone else who seems to have school paid for them or in's at awesome companies. 

TL;DR: Need internship to graduate, can't afford one - suggestions?"
dmejh,0,2010-10-03,Laptop stolen - Advice on replacement,capitalh,AskReddit,https://www.reddit.com/r/AskReddit/comments/dmejh/laptop_stolen_advice_on_replacement/,"Greetings,

Long time lurker, first time topic poster.  I was recently visiting the National Aquarium in Baltimore when my car was broken into and my Dell XPS was stolen (among other important things) from the vehicle's trunk.

As a result, I find myself far too analog in this digital world and hope that the fine fellows of reddit can lend some advice in rectifying this.  I am looking for a performance laptop with a good size screen, but can still be considered portable (15"" sounds about right to me).  I do not consider myself a gamer but I do like higher-end graphics and pretty displays.  I probably prefer Windows 7 on the laptop, but I do plan to have it dual boot with Ubuntu.  I have (or... had) a substantial library of music and videos, so the more storage the merrier.  The laptop is used both for these ""recreational"" purposes and as a primary work laptop- I am a researcher/EE phd candidate, so I have (once again... had) a few math programs I'd run such as Mathematica as well as engineering mainstays such as MATLAB.  I have a tendency to multitask like a maniac (Are they known for their multitasking abilities? Perhaps this was a poor simile) so a processor that can handle running a MATLAB code while I review research papers (read: browse reddit) would be fantastic.  I am including my old Dell specs below for reference.  

I figure Reddit knows this stuff as well as anyone, which is why I came to ask the community here first.  I really appreciate any advice you guys have to help me out! This situation SUCKS  

My old lappy specs follow:
15"" XPS purchased late 2008 with Intel Core 2 Duo Processor T8100 (2.1GHz/800Mhz FSB, 3MB Cache)
4GB Shared Dual Channel DDR2 SDRAM at 667MHz (2 Dimms)
High Resolution, glossy widescreen 15.4 inch LED LCD (1440x900) &amp; 2.0 MP webcam (barely used the cam)
128MB NVIDIA® GeForce® 8400M GS
320GB 5400rpm SATA Hard Drive
OS: Vista
Stock DVD/RW drive
6 cell battery

P.S. Is it weird that the first thing I thought upon realizing my laptop, my internship laptop, my ONLY data backup, and my TI-89 from high school were stolen was that my personalized conky file is gone forever?  Don't worry, my attention then turned to the horror of the situation... but conky first.

THANK YOU"
dmg8c,2,2010-10-03,Graduating Computer Engineering Student here...,jahmez,jobs,https://www.reddit.com/r/jobs/comments/dmg8c/graduating_computer_engineering_student_here/,"I'm a Senior of Computer Engineering, and I am graduating in this upcoming May. I thought I would try here and see if anyone was hiring. Ill give you a TL;DR of my resume and my email, if anyone has any questions feel free to email me for my full resume.

Resume TL;DR:

* My emphasis is in Embedded Systems, I have experience with Microcontrollers and FPGAs, including both hardware and software design

* I have been programming for ~6 years, and I am strongest in C++, but also experienced in C, Java, Matlab, Assembly, and VHDL.

* I have ~1 year of work experience through a summer internship and an 8 month long Co-Op. My work experience include working with a Test Systems Engineering Team, as well as a Systems Engineering group.

* I have a ~3.4 Major GPA, and a 3.1 cumulative GPA

* I am more than willing to relocate, and would love to live/work in a city like Austin TX, Seattle WA, or San Francisco CA.


If you don't have a specific job to offer right now, I have no problem with taking questions or advice, as well as general networking. Feel free to PM me, or my email is james.munns at gmail.

Thanks!"
dnwrk,3,2010-10-07,College student internship?,noexperienceintern,AskReddit,https://www.reddit.com/r/AskReddit/comments/dnwrk/college_student_internship/,"I'm a lowly freshman in college right now and I need a job. I'm a CSE major and just learning the basics of Java programming. The only other programming experience I have is Visual Basic.

I'm getting e-mails from profs to sign up for Microsoft internships, but I don't know what I would do. Do you need some experience before applying as an intern, or will they train you?

"
do877,2,2010-10-07,Does anyone have any advice for getting a co-op or an internship?,sterling_m_archer,AskReddit,https://www.reddit.com/r/AskReddit/comments/do877/does_anyone_have_any_advice_for_getting_a_coop_or/,"I'm a college student, and today I went to my university's engineering career fair (I am a mechanical engineer btw). I am a junior, I have a 3.5 GPA, and I have already had an internship this summer working for an automotive company (I got that job through my father), but I don't want to return to where I was. I want to try to get a job on my own this year, but I feel like I am still under-qualified for just about everything. I certainly have things to offer, but I find it hard to believe that I stand out enough for an employer to pick my resume out of the huge amounts that they get. So does anyone have any advice that may help my goal? Some way to make myself more noticeable? Or am I just being paranoid?"
docnn,1,2010-10-07,"Have upcoming interview at Qualcomm SD, tips and experiences?",zzilong,AskReddit,https://www.reddit.com/r/AskReddit/comments/docnn/have_upcoming_interview_at_qualcomm_sd_tips_and/,"I have an upcoming interview for a software engineer intern position with Qualcomm, and am wondering if anyone who has previously interviewed with Qualcomm has any specific experiences and tips to share with me. Questions asked, what they look for, etc. Thanks in advance!"
dq2g2,10,2010-10-12,"Senior in college, lack refined direction, little ambition. Any advice or a swift kick in the ass?",ZayJay,AskReddit,https://www.reddit.com/r/AskReddit/comments/dq2g2/senior_in_college_lack_refined_direction_little/,"Hello reddit-nation,
  I'm currently a senior at a liberal arts college; my major is computer science.

I'll try and be as brief and to the point as I can be.

I got into computer science for my love of video games and technology but now realize that a liberal arts college probably wasn't the best place to go because a more specialized school would have given me a much better education (not that the one I'm getting now is bad).

Approaching graduation I'm not sure what to do about grad school because I don't know what I would like to specialize in.

I've had a full-time summer internship as a software engineer since summer of 2008 and got amazing experience there and a taste of the real world. However, I do not believe that is exactly what I would like to do every day in for my career. I was interesting and I learned a ton, but that exact atmosphere might not be my cup of tea.

Many video game design courses I found were part of undergraduate studies (would have been nice 4 years ago &gt;&lt;)...

I want to do something gaming related, so I'd like to maybe shadow people in the New England area who are in the industry or anyone else with a computer sciencey job to hone in on what I would like to do with my life.

I would also love to be something of a gaming journalist for a magazine, but feel like an English major w/ a Communications certificate would have been better suited for that.

Also, I am not so much a lazy person as I am an ""incubator,"" a term I found on reddit that means I procrastinate and think about what I have to do and them pump it out at the last minute with high efficiency. But there is no due date on life!

Any general advice? I have many paths rushing toward me and I'm sort of lost.

First time posting anything like this so any suggestions or questions would also be much appreciated.

Also, Deion Branch is back in New England. Rejoice ^_^

Thanks a lot!

**edit: Not trying to come across as a whiny bitch, just laying my situation out there; thanks again**"
dq8st,3,2010-10-12,GUI Design and self-review,tabgok,learnprogramming,https://www.reddit.com/r/learnprogramming/comments/dq8st/gui_design_and_selfreview/,"I'm a fairly recent college graduate (less than a year out of school) and have to admit that while I did learn how to program during school - I don't believe I learned how to program well.

I am currently working on a program which I developed during internships which involves both back-end work and GUI design. Looking at the code I've written that I have to keep coming back to has spawned a couple of questions I'd like to ask:

First: Should the GUI be separate from the program, or intertwined?  I.E. If an ""open"" button is clicked, should the event handler handle all of the file opening actions, or should it simply send a file path to a different method/class?

Second: How can I review my own code?  I have no idea if I am a good, average, or poor programmer.  Unfortunately my code was never reviewed during school beyond a grade for functionality.  "
dqhqw,3,2010-10-12,What's the best way to go about changing my graduate school program,changeofscenery1,AskReddit,https://www.reddit.com/r/AskReddit/comments/dqhqw/whats_the_best_way_to_go_about_changing_my/,"Hi Reddit,

Throwaway account here as my other account is my real name. I'm in the first semester of an MS program, in a field that I really enjoy. However, I'm finding that the school I'm at is not the greatest fit for me. I'm toying with the idea of changing back to the school that I did my undergrad work at for several reasons, specifically, the better reputation, proximity to family, friends that currently attend, and my love of the location.

However, I don't know the best route to take to pursue this. The new program would require me to obtain letters of recommendation. I feel like a letter of recommendation from my current advisor, who I also currently do research with, would carry a lot of weight in my application to the new program. However, I'm afraid that I would permanently burn a bridge with this professor if I expressed a desire to potentially leave this program, especially if I am not accepted to the new program.

As it stands right now, I believe that I can count on solid letters of recommendation from a supervisor from an internship, a supervisor from my first real industry experience, and a professor that worked with me during my capstone project as an undergrad. Do you guys think that I would lose out on too much if I proceeded with these guys, and did not broach the topic with my graduate professor unless I've heard positively from the program I'm applying to?

The other issue I see is a potential waste of a semester. Granted, this will not affect me too much in the long run, but it kinda sucks to put in the work only to lose out on the money, time, and studying that I invested. There's a possibility that I may be able to transfer some credit, but I'm not holding my breath.

Finally, does anyone know how university's feel about this kind of situation? I'd imagine that it reflects poorly on me as a student, but I've written a fairly convincing statement of purpose explaining exactly why I feel that this is right move for my situation.

Any advice on the issue is much appreciated.

-Anonymous Fellow Redditor

"
drcwx,2,2010-10-14,Another day of unemployment,Megapwnd,jobs,https://www.reddit.com/r/jobs/comments/drcwx/another_day_of_unemployment/,"This is just getting really old.  I've been looking for a job for over year now.  I came home from college looking for an internship position to finish my degree last Fall and haven't been able to find one.  I can't even find a *regular* job.  I'm an IT major with plenty of experience in databases, web design, computer networking and programming.  In the meantime, I've been doing IT consulting for friends' businesses but that just doesn't pay the bills.  I've been living at home for over a year now while all of my other friends and classmates have jobs and homes.  Even though I went back through admissions with the college to do a senior project online, everyone else is telling me I'm close enough to graduation to ""just get a job"" in the industry.  Is this really the case?"
drlcb,1,2010-10-15,"Female Redditors! My GF took contraceptives, now faces (medical) aftermath. Please advise",[deleted],AskReddit,https://www.reddit.com/r/AskReddit/comments/drlcb/female_redditors_my_gf_took_contraceptives_now/,"Disclaimer : I know this looks like it belongs in /r/relationships, but it's actually medical.

So the story is, we're together for almost 3 years. I'm 24, she's 22. Playing it safe, we decided that she will take the pill. After consulting the doctor, who decided everything was fine, she got her perscription, everything was fine for some time. After about a 1,5yr her sex drive went down, down to 0. We lived with it somewhat for a while, then last summer i got a 1yr internship 2000km from home. So we decide that's it's sensless for her to be on the pill during that time, and that it might help get her ""spunk"" back. 3 months pass, she visits me in my new place, sadly, nothing seems to change back :/

Things go bad between us, not only because of the lack of fun in bed, but because for some time now i feel more like a friend, than a SO. I finally make her realize and admit, that she doesn't feel for me anymore, but she still loves on me on some level and doesn't imagine herself without me. I still love her too, and give her another chance. She promises to change. I have my own theory.

I make her go see the gyno, and my suspitions are confirmed - because of the pill, her body stopped producing Estrogen altogether, and her hormonal balance is way off. Today she got a perscription for hormones(cyclo-progynova), and her first evaluation is in 3 months, but the whole curation may last up to a year. She feels really bad about this, saying ""i don't feel like a woman anymore"". I try to be as supportive as i possibly can from a 2000km distance.

My question is : any female redditors here that had the same/similar experience? How did it turn out for you?

**TL;DR** : my girlfriend took contraceptives, then stopped and her estrogen is gone. she feels like shit."
drsst,8,2010-10-15,"Reddit engineers, how did you get your first job? I've been doing everything I can, and I'm osing hope - thinking about completely giving up on this profession  ",stonefall090909090,engineering,https://www.reddit.com/r/engineering/comments/drsst/reddit_engineers_how_did_you_get_your_first_job/,"
I'm going to be honest here because it is my first post, and I don't want anyone to think this is one of those 'I need a job' threads. I'm not here to find work, I'm just looking for some realistic advice - don't be afraid to pour on the negatives, I am tired of false hope.

Here's my story: I have completed 2 University degrees - Communications and Mechanical Engineering . I am not rich, and I have paid myself through everything in my life. After completing my first degree, I realized that there wasn't much work (reputable, career type work) available. So after working in the communications field a few years (with work that I found almost INSTANTLY without ever really trying), I got tired of the monotony and I decided to go back to school for my engineering degree. I saved up a lot of money and worked most of my way through. The problem now, is that I had to quit my job in my last year to complete my engineering degree on the 4 year pace and I can't seem to interest ANY employers in the field (I have however receieved calls from the non-engineering field recruiters). 

I'm very put off, simply because I was naive in believing everyone I  spoke to saying 'there are millions of jobs out there for engineers, just finish your degree"" etc etc. I took this as fact, and I put all my effort into my studies and not nearly as much as I 'should' have for looking for work/connections during my schooling. 

Now I am fed up. It been over 7 months, and I am getting nowhere. I've signed up for all the job sites, I've attended career fairs, I cold call human resources managers for interest/positions, I have had my resume reviewed by many different people in HR fields and I am free to move anywhere that speaks English in the world. I've applied to many graduate programs/paid internships and I don't get considered because my GPA is not over 3.0 (its 2.9 - which I am very happy with considering I worked almost the entire time I was in the program -even though it is apparently not good enough). The only reason I didn't have a better GPA, is because my University was extremely poorly managed, yet was widely considered the 'best' engineering program for all the Univeristies closeby. Many people would cheat, and the people who didn't saw lower marks (I even tattled on them a few times and the school did nothing). Turns out, after calling a few people, that the school's reputation was awful -notorious for breeding 'idiot engineers' and being one of the 'non-idiots' I can tell you 100% employers are right in not hiring these people. However, how do I convince a hiring manager I am not?  By the time I found out all this, I was in my 4th year and it was too late to transfer universities.

The more time I spend in the job mix, the more I realize i have ZERO qualifications to get hired in this field without significant connections. I have about 10-15 connections in the field and they have been helping by asking around etc, but none are powerful enough to actually hire. I'm sure eventually something will come up, but I am competely sick of waiting. 

I am extremely proud of having 2 degrees, since I really did my best to learn the material and enjoy the subjects, so I do not regret going to school in the slightest. What I do regret, is going into engineering instead of medicine, which I could have gotten into as well. I chose engineering for 2 reasons, because I was interested in it more than medicine, and because I was SURE I would NEVER have to spend extended periods of time looking for work. There is NOTHING I HATE MORE than looking for work when I am a qualified candidate. I feel as though my phone should be ringing off the hook with offers since I am qualified but I went with the all out effort to find work anyway because I wanted a REALLY good job in this field. I have not been slacking - I think I've put in more effort into finding work than I did studying during my program. I would understand if I had no education but I have 11 years of failure free post secondary education and no on employers seem to care. 

Anyway, I'm just wondering how long it took everyone else to find work in engineering, and whether it is really worth it to continue looking? Some of my friends who have engineering experience and many don't even like it that much. I was initially VERY excited when I finished my degree and I was hoping to make a difference. Now, I'm thinking about going back to my old degree's field, and giving up engineering for good. I'll never regret learning the material and going back to school, I'll just regret wasting all this time looking for work in a field that will not hire new members. 

TL; DR - Very tired of looking for work in engineering field. Probably going to throw my degree away and look for a different profession that actually hires new graduates."
dtl0j,44,2010-10-19,What is expected from a CS major in an entry-level position?,Ch3dd4rNOW,compsci,https://www.reddit.com/r/compsci/comments/dtl0j/what_is_expected_from_a_cs_major_in_an_entrylevel/,"I need to know what is ACTUALLY expected from a CS major in an entry-level software engineering/development position besides some vague job requirements.  

What concepts are almost universally needed?  

Are you given time to learn things or are you expected to know a lot more than you initially expected?  

Do you have a lot of responsibilities or is it a glorified internship for the first few weeks?

edit: I'm basically looking for some anecdotes and personal experiences for your first job."
dujtp,0,2010-10-21,"First ever job interview tomorrow for an awesome 
job. Any tips?",bult,AskReddit,https://www.reddit.com/r/AskReddit/comments/dujtp/first_ever_job_interview_tomorrow_for_an_awesome/,"Throwaway account. So I have an interview for a paid internship tomorrow as a computer technician(duties include general computer help to clients(on site and remote), malware removal, etc.). It really seems like a great job for me, but I've never had an interview before. I Was hoping someone might have some tips for me?

I've also never written a resume before, so I'd like to get some feedback from people who have some experience, if you wouldn't mind looking: [resume](http://imgur.com/AsA3b.png)

I got the advice on how to write my resume from a friend who I'm not sure knows what he's doing. I just listed hobbies/courses that I thought were relevant to the job.

Appreciate any feedback, must go to class now, Thanks.

P.S. I'm 19 by the way."
