gnp28,0,2011-04-11,Undergraduate CS student looking for intern opportunities in Austin in Albuquerque any help?,tkemme,compsci,https://www.reddit.com/r/compsci/comments/gnp28/undergraduate_cs_student_looking_for_intern/,"hi, i'm a college student at UT and i had an intern position set up for this summer in my home town of albuquerque, but i was just informed there were not any more positions.  Does anyone know of anyway to look for other computer science internships?  Does anyone have any advice for what to do now that i don't have a job this summer?"
gn1ks,0,2011-04-10,Advice for getting a job after graduation,flumen,AskReddit,https://www.reddit.com/r/AskReddit/comments/gn1ks/advice_for_getting_a_job_after_graduation/,"So I am going to be graduating university in only a few weeks with a degree in software engineering. My grades have never been any good, and I wasn't able to land a decent internship.

My question is, what are my chances of finding a decent job after graduation?

Thanks reddit. 

EDIT 1:
I was hoping for a software development position in networking/security, but now I'll go for any software development, software QA, or systems administration. As for marketable skills, I have built this, well I find it cool, port scanner for Android and I spend plenty of time fiddling with network tools (nmap, ettercap, ...). I understand it's not much in the way of extracurricular activities, but I hope it helps.  "
gn1ct,0,2011-04-10,IAMA undergraduate engineer who got an internship through a career fair AMA,stdubop,engineering,https://www.reddit.com/r/engineering/comments/gn1ct/iama_undergraduate_engineer_who_got_an_internship/,"I went to the career fair at my college, and gave my resume to the company, and chit chatted with a lower level engineer who was there.

About 2 months later I was trying to figure out summer plans, so I called the company and told them I needed to know within a week about the internship. They let me know 3 days later I had a phone interview, and a few days after the interview they called me with the offer."
gogco,2,2011-04-12,Should I graduate a year ahead of the rest of my class?,sicophrenic,AskReddit,https://www.reddit.com/r/AskReddit/comments/gogco/should_i_graduate_a_year_ahead_of_the_rest_of_my/,"a little background info: im a CS major at a top public university and i have the opportunity to graduate in three years, but im not sure whether i should or not. i only have one more humanities class to take (which i can take in the summer after walking this semester), so taking an extra year to fulfill that last requirement while taking a few more CS classes here and there would be my default plan. however, graduating in three years would save me money from that last month's tuition, and getting started on full-time work would definitely be great. im currently working part-time at a tech company that ive been offered a full-time position in, and i have a different internship lined up for the upcoming summer, so i guess ideally i would have two possible choices for full-time work even if i were to graduate this semester. but, would it be a better idea to maybe stay in school for that last year to possibly (depending on my motivation) boost my gpa (its sitting at a comfortable 3.0~3.5 right now) and take the time to search more thoroughly for a job via applications and campus career fairs? or would it be better to just get out of college and get straight to work?

what do you think, reddit? opinions? personal stories? any advice is appreciated."
gnzpq,5,2011-04-12,Worried about GPA going into the job market...,[deleted],cscareerquestions,https://www.reddit.com/r/cscareerquestions/comments/gnzpq/worried_about_gpa_going_into_the_job_market/,"So, I'm a junior majoring in computer science at a pretty prestigious university, and I've got a fairly low GPA (2.4ish), mostly because I'm a slacker. I've been looking for summer internships, and I've had a couple interviews, haven't been turned down yet, but still waiting on responses.  I guess my paranoia is that I end up not getting an internship, working yet another crappy restaurant job, and going into the job market with a low GPA and no real reason for anyone to hire me. I've been told by my dad that his company, when hiring engineers, will throw out resumes if the applicant is under a 3.3, but one of my friends in CS just got an entry-level job with no GPA questions asked.

Reddit, are my fears well-founded, and how can I make myself more appealing to companies next year without any real experience?

tl;dr Low GPA, want to get a job next year on graduation. How?"
gpdgh,1,2011-04-13,I need a way to troll my co-op placement with out getting into trouble,[deleted],AskReddit,https://www.reddit.com/r/AskReddit/comments/gpdgh/i_need_a_way_to_troll_my_coop_placement_with_out/,"I am on a co-op term (or internship i guess it has been called), and my term ends next week. It has been nothing but crap. Let me explain as fast as i can:
I work for the client services (fix computers for the company, answer help questions, basicly IT help desk), the head of the team (no IT experience at all) decided she wants to hire her good buddy (again, no IT experience), but had to let go of someone to open a spot, so she let go of the only knowledgeable person. I learned more from him then anyone at the company.
I have been stuck sorting documentation for 4 months, and have had to restart 9 times, because my boss cant get the instructions right (IE, tells me to do one thing, but doesn't realize it is wrong). I have basicly been in a loop of depression doing the same pointless things over and over.

Is there a way I can get back at the company for being lame sauce, but not doing anything in a wrong sort of way?"
gozk9,3,2011-04-13,I'm a game designer looking to add programming to my resume; where do I start?,raevpet,gamedev,https://www.reddit.com/r/gamedev/comments/gozk9/im_a_game_designer_looking_to_add_programming_to/,"I'm currently an intern with a studio that makes games for handhelds. I have little experience and entry level jobs are hard to find. Programming skills/understanding of programming is a plus most places, so I'd like to get into some of that. I'm not hoping to become an expert programmer, I'd just like to aquire some good basic knowledge to put on my resume. Any advice?"
gozk8,0,2011-04-13,I'm a game designer looking to add programming to my resume; where do I start?,[deleted],gamedev,https://www.reddit.com/r/gamedev/comments/gozk8/im_a_game_designer_looking_to_add_programming_to/,"I'm currently an intern with a studio that makes games for handhelds. I have little experience and entry level jobs are hard to find. Programming skills/understanding of programming is a plus most places, so I'd like to get into some of that. I'm not hoping to become an expert programmer, I'd just like to aquire some good basic knowledge to put on my resume. Any advice?"
gow7x,13,2011-04-13,When a company says they do FPGA work..,theaman24,ECE,https://www.reddit.com/r/ECE/comments/gow7x/when_a_company_says_they_do_fpga_work/,"I'm an EE college student looking for internships.  When a company/job listing mentions FPGA work, what does that entail?  VHDL programming? Is it similar to using microcontrollers and embedded C?

edit: thanks for the help guys!"
gpkm6,1,2011-04-13,Reddit: How can I can get involved with research as a high school student?,highschoolstudent189,AskReddit,https://www.reddit.com/r/AskReddit/comments/gpkm6/reddit_how_can_i_can_get_involved_with_research/,"If it's of any importance, I'm located in the Bay Area (California), on the peninsula. I'm a current high school junior.

I'm asking this because most of the internship programs that I've found online have expired. Would anyone involved in research have any ideas on who/where to contact in order to get such an opportunity? Stanford University is the closest research university near my house, yet I'm not sure if that would be the best place to contact.

I'm pretty much interested in every type of science, and I have a decent math background, finishing calculus this year. Does anyone have any suggestions on what to do? Thanks!
"
gpjbu,1,2011-04-13,"Reddit, I hate my lucrative college major. Should I 
suck it up or change it?",[deleted],AskReddit,https://www.reddit.com/r/AskReddit/comments/gpjbu/reddit_i_hate_my_lucrative_college_major_should_i/,"All right, let me break things down.

Current situation: Junior computer science major at Rice, aiming for a BSCS. So far, I have no student debt thanks to living off campus and being a minority in an engineering field.

However, I'm pretty sure this isn't what I want to do for the rest of my life. I got into it because I was good at writing nifty little Java  programs in high school, I was *excellent* at Calculus, and, of course, the technology industry is booming right now and my parents wanted me to get into something with earning potential. 

But the farther into the curriculum I go, the more I realize that I hate analyzing systems, especially the guts of things like logic circuits or large-scale applications. I can't get interested in the work, and more and more often the assignments are just confusing me. I've failed enough classes that I'd definitely need a fifth year just to satisfy my degree requirements, which would likely mean I'd get financial aid cut off. My GPA is sitting below 2.0, I've made no connections in the department (or to anyone on campus, for that matter), and because of this, I couldn't get an internship if I tried.

So my question, Reddit, is, I've already registered for my Fall semester of senior year, and instead of excitement, all I feel is dread. I don't know what field I'd like to get into yet, but I know it isn't this, and chances are, it won't make as much money as a programming job. I don't want to let down my parents, and I definitely don't want to force them to pay for two or three extra years at such an expensive place. Should I suck it up and slog through the rest of my CS degree, or should I take the hit and try to head in a different direction?

*(I'm sorry if this is badly worded or posted in the wrong place; I'm still a little unsure of how AskReddit works.)*"
gqzkl,1,2011-04-15,[Hiring] Washington DC Tech Internships,BrazenJobs,jobs,https://www.reddit.com/r/jobs/comments/gqzkl/hiring_washington_dc_tech_internships/,"If you are a current undergrad in the Washington DC area. You may be interested in in Tech Summer.

You can apply here: http://bit.ly/hW48f0

DC Tech Summer is your common app for all the tech and startup internships in Washington, DC.

But DC Tech Summer is about more than internships! You'll get to attend special events, meet local founders and network with the DC startup community, while enjoying your summer in the nation's capital.

You can apply here: http://bit.ly/hW48f0"
gqwd7,3,2011-04-15,From Support/Analyst to Systems?,shael_at,sysadmin,https://www.reddit.com/r/sysadmin/comments/gqwd7/from_supportanalyst_to_systems/,"Hey guys! For the last 4 years, I've done IT contracting all over the place. Small clients. Small businesses. Individuals. The works. Basically, a HS/College kid who did a lot of backups, re-imaging, virus cleans, some Linux troubleshooting for advanced users, small business network setups, configs, etc. This experience has gotten me officially employed in the last 2 months.

I have an MCITP:EDST7, EDA7 and am working on my EA bit by bit. I have an Associates degree in Network Administration.

My current title is Desktop Support II, at a large medical center.

I'm curious, what is the best amount of solid job experience I should aim for before moving on to greater things? In my job, I've already assumed lead in a Windows 7 deployment as well as some server swaps, I'm doing basic network troubleshooting and am getting well rounded with our heterogeneous environment.

I'm just lost as to what my next step is. In my short time I've gone from Helpdesk I to Helpdesk II to Desktop Support II and I've gone through a raise each time. My prior experience also has internships at my college doing network support, deployment, etc. I feel like I'm ready for a Junior Admin role, but I'm lost as to how to go about it.

Sorry if that was a tid bit long."
gqvje,2,2011-04-15,"Reddits, I always walk the line between confident and creepy. What are your stories, what are the outcomes?",[deleted],AskReddit,https://www.reddit.com/r/AskReddit/comments/gqvje/reddits_i_always_walk_the_line_between_confident/,"This is the saga of elevator girl: 

In the building I work, the elevator doors are reflective. A month or so ago I got on the elevator and there was a cute intern in the back. As the doors close, I see a reflection of her looking me up and down.

""It's easier to ask for my name"" I said before I could stop myself. She turns bright red and stares at the floor the rest of the elevator ride. ""Too bad"" I say as I get off at my stop.

A week or so later I see her across the hall and she doesn't break eye contact with me, even though she's engaged in a conversation right next to her. I casually walk over, hand her my business card, smile, and keep going.

At this point, I feel like a BOSS, but acknowledge that from her perspective I'm either A-) Suave, or B-) Creepy as fuck. 

I see elevator girl yesterday and she smiles, waves, and yells ""hi {Verbicide}"". This is not the conclusion of the story....I will nail that intern. But for now, I think I'm clear of the ""creepy"" side.

What's your story/resolution?"
gqrwx,0,2011-04-15,Question about background check,[deleted],AskReddit,https://www.reddit.com/r/AskReddit/comments/gqrwx/question_about_background_check/,"So I graduated from college with a not-so-great GPA (2.85) last June. I found an internship that became a full-time job at a small software company, but they had to let me go a few months ago. 

While I was with them, I interviewed for another position. I didn't write down my GPA on the resume. The position didn't work out, but this company called me again for a new position, and after a few interviews offered me the job. 

I never mentioned and they never brought up my GPA, but the thing is I can't remember if they asked me about it in the first interview way back when. If they did, I might have lied about it (stupid, I know).

So the person that hired me asked me to call HR. I did and she said when the orientation was, asked me to bring proof of eligibility and told me to take a Tuberculosis test as soon as possible (this is at a hospital). I kind of asked ""is there anything else, like a background check or drug test"" and she said ""Nope""., but I'm still worried about it.

So the question is:

1) Would the HR tell me if there was a background check, especially if they told me all the other stuff?
2) If they do a background check, would they check GPA, and would this be shown to anyone if there is no inconsistency with my resume (since it doesn't have my GPA on it)

Thanks! "
gqri0,35,2011-04-15,Paid IT training for 18-24 year olds,xenodata,jobs,https://www.reddit.com/r/jobs/comments/gqri0/paid_it_training_for_1824_year_olds/,"Free IT Training for 18-24 year olds who live in the San Francisco Bay Area, DC, MD, or VA, Providence, Boston, Chicago, Rhode Island, New York City, Atlanta. If you know anyone with a high school diploma or a GED who are between the ages of 18-24 yrs old and have an interest in IT Refer them to this site www.yearup.org to learn more about this free program.

This program asks for a 1-year commitment between the hours of 8:30 am and 5:00 pm. They provide the student with a stipend and after six months, internships at companies such as Freddie Mac and AOL to name a few.

About Year Up:

Year Up is a one-year, intensive training program that provides urban young adults 18-24, with a unique combination of technical and professional skills, college credits, an educational stipend and corporate apprenticeship. Success of their graduates -- enabling them to move on to full-time employment and higher education Year Up is about providing opportunities for urban young adults to demonstrate their true potential. We have achieved excellent results to date: 

• 100% placement of qualified students into apprenticeships 
• 83% student retention 
• 90% of apprentices meet or exceed apprenticeship partner expectations 
• 87% of graduates placed in full or part-time positions within 4 months of graduation 
• $15/hr average wage at placement

Check out the website for more info: www.yearup.org.

"
gqktv,0,2011-04-15,Where should I work this summer before grad school?,[deleted],AskReddit,https://www.reddit.com/r/AskReddit/comments/gqktv/where_should_i_work_this_summer_before_grad_school/,"Hey Reddit,

I need some help.  I need some ideas of where I should work this summer.

I'm graduating from college this May with a degree in computer science and math I will be attending grad school to go for my PhD in the fall (for computer science as well).

I've had an internship and a research position my previous 2 summers that were full time deals.  Those took up a lot of time and now I really just wanna CHILL, hang out with my family and make enough money to get me through the summer and have some extra at the beginning of school.

Can anyone suggest some types of jobs that they think will fulfill my needs?"
grk1j,1,2011-04-16,drug test question! [x-post from trees],[deleted],engineering,https://www.reddit.com/r/engineering/comments/grk1j/drug_test_question_xpost_from_trees/,"hello everyone. i am a mechanical engineering student, finishing up my junior year, and have an on sight interview with a software company for a summer internship on monday. I have stopped smoking for 3 weeks now, but there is a cannabis festival this weekend in my town, and quite frankly i really want to toke up. I have resisted for weeks now in anticipation of a drug test (if i get the job), but i am unsure of how big of a deal it is if say, they ask for one and i tell them that i smoked this weekend and either need time to let it out of my system, or that i will simply stop all together. are they looking for just harder drugs? or is cannabis use a means for termination? or lack of employment? will i get a chance to explain myself or is it a big deal to them? I am unsure, and any help, insight, or advice would be greatly appreciated."
grfsw,1,2011-04-16,"[For Hire] Part-time Summer Intern, CFL, Computer-related",[deleted],forhire,https://www.reddit.com/r/forhire/comments/grfsw/for_hire_parttime_summer_intern_cfl/,"Hello,

I'm currently looking for a part-time summer internship in the Central Florida area. I prefer Volusia county, but I'm open to any CFL locations. I'm twenty years old and very passionate about computers.

**Education**

* Graduated with an Associate of Arts (2010). GPA 3.7+ and dean's list almost every semester.

* Currently going to UCF to obtain a degree in computer science. Can't afford summer semester, however.

**Skills**

* **Mathematics:** Algebra, statistics, and of course calculus. Very comfortable working with mathematics.

* **Programming:** Taken basic classes for C/Java programming and excelled. I've made minor contributions to a few open source projects. Dabbled in Python and Ruby, and am willing to learn new languages or frameworks.

* **Software/hardware troubleshooting**: Have built all of my computers for almost a decade now. Family computer technician so I often have to assist computer illiterate people.

* **Linux/BSD**: I use Linux alongside Windows. Ran many distributions. Knowledge beyond ""end-user."" Familiar with many utilities such as Bash (scripting), Grep, Sed, Screen, Top, Vim, Cron, etc. Have submitted/fixed some bugs and packages for certain distributions. 

* **Office:** Microsoft Office certified. Fast touch typist.

**Relevant Experience**

* Worked a summer internship doing I.T. for a local city government.

* Maintained some databases for a small company for a summer.

**I can lift fifty pounds!**

Send me a message if you're interested, or want a resume/more information."
grviy,2,2011-04-17,[for hire] computer engineering student looking for internship - boston/cambridge  ma,jeffc313,forhire,https://www.reddit.com/r/forhire/comments/grviy/for_hire_computer_engineering_student_looking_for/,"computer engineering sophomore (at boston university, easily top 10% in my program),  see resume for skills. c/c++, matlab, verilog, circuit design, excellent soldering skills. looking for internship, something in electric/computer engineering.

PM me for a resume or examples of some of my projects"
grtp7,4,2011-04-16,How to represent internship and job at same place on resume?,Sikul,cscareerquestions,https://www.reddit.com/r/cscareerquestions/comments/grtp7/how_to_represent_internship_and_job_at_same_place/,"After college I took a job at one of the companies that I interned for.  There was a gap between interning and working there for real, during which I worked at another place.  How should I represent this on my resume?  Should I have two sections under my work experience?  One for ""Software Developer"" and one for ""Software Developer Intern""?  i.e. how do you represent working for the same company at two different times on a resume?"
grsfz,3,2011-04-16,Fire Investigator,[deleted],forhire,https://www.reddit.com/r/forhire/comments/grsfz/fire_investigator/,"Willing to relocate.


Formal Education

Bachelor of Science – Administration of Justice
	University of Louisville – Louisville, KY
	Coursework: Criminal Law and Evidence; Criminal Procedure; Law Enforcement; Homeland 	Security; Criminal Behavior; Juvenile Justice; Criminal Justice Ethics
	Honors: Dean's List

Bachelor of Arts – Liberal Studies with a focus on Crime-Related Interviewing
	University of Louisville – Louisville, KY
	Coursework: Communication; Experimental Psychology; Forensic Psychology; Juvenile 	Delinquency

Minor – Psychology
	University of Louisville – Louisville, KY
	Coursework: Abnormal Psychology, Social Psychology

Certifications

NAFI Certified Fire and Explosion Investigator (CFEI)

Technical Training

Internship – Louisville Metro Fire Department, Arson Bureau;
	122 in-service hours from August to October 2007.

Bureau of Alcohol, Tobacco, Firearms, and Explosives Courses
ATF Electrical Fire Investigation Training – Cleveland, TN 2010 

CFI Trainer Courses
Understanding Fire Through the Candle Experiments – 2011 (4 hr)
Fire Investigator Scene Safety – 2010 (3 hr)
Electrical Safety – 2010 (3 hr)
Investigating Motor Vehicle Fires – 2010 (4 hr)
Fundamentals of Residential Building Construction - 2010 (3 hr)
Documenting the Event – 2010 (4 hr)
An Analysis of the Station Nightclub Fire - 2010 (4 hr)
Introduction to Evidence – 2010 (4 hr)
Vacant and Abandoned Buildings: Hazards and Solutions – 2010 (4hr)
Post-flashover Fires – 2010 (4 hr)
The HAZWOPER Standard – 2010 (4 hr)
Investigating Fatal Fires – 2009 (4 hr)
A Ventilation-Focused Approach to the Impact of Building Structures and Systems on Fire 	Development – 2009 (4 hr)
Fire and Explosion Investigations: Utilizing NFPA 1033 and 921 – 2009 (4 hr)
Motive, Means, and Opportunity: Determining Responsibility in an Arson Case – 2009 (4 hr)
The Scientific Method for Fire and Explosion Investigation – 2009 (3 hr)
Arc Mapping Basics – 2009 (4 hr)

Federal Emergency Management Agency Courses
Crime Scene Management for CBRNE Incidents – Lebanon, TN 2010 (8 hr)

International Association of Arson Investigators Courses
TN Chapter IAAI Conference – Pigeon Forge 2010 (40 hr)
Effective Investigation &amp; Testimony - Seattle 2009 (8 hr)

Maury County Fire Department, Maury County, Tennessee
Basic Firefighting (64 hr)
Introduction to Fire and Emergency Services (16 hr)

Public Agency Training Council
Fire/Arson Fatality Fire Scene Investigation – Lebanon, TN 2011 (16 hr)
Fire Pattern Certification – Lebanon, TN 2010 (20 hr)

Tennessee Advisory Committee on Arson
Training Seminar 2010- Murfreesboro, TN (16 hr)

Tennessee Fire Service and Codes Enforcement Academy
Hazardous Materials Awareness (Certification #1011HMA-2751) - 2010
Firefighter I Live Burn (F111) – TFACA 2010 (16 hr)

Texas Engineering Extension Service/ TEEX Domestic Preparedness Campus
Medical Effects of Primary Blast Injuries (1 hr)

Working Experience

-Volunteer Firefighter – Maury County Fire Department
	October 2009 to Present

Memberships

National Association of Fire Investigators
International Association of Arson Investigators
Tennessee Advisory Committee on Arson
International Association of Arson Investigators – Tennessee Chapter

Awards

Recruit of the Year 2009 – Maury County Fire Department
Who's Who Among Students in American Junior Colleges – 2006"
