gfzlo,0,2011-03-31,I got accepted to be part of a Summer Internship Selection Interviews!,[deleted],jobs,https://www.reddit.com/r/jobs/comments/gfzlo/i_got_accepted_to_be_part_of_a_summer_internship/,"It is for a fortune 500 company, and it is tomorrow!  


The company wasn't very specific about what we should expect, except for a tour of the company and meeting with managers we've talked with over the phone.  Weird thing is, I never had a phone interview with them.  

I'm not sure how to dress, what to bring, or what to expect with this kind of thing.  Any advice for me?  This will be my 3rd chance for an internship this summer, and I'm hoping that the third time is a charm!


Edit+ It is for a software intern position

"
gh5ph,1,2011-04-02,Question about delta,[deleted],learnprogramming,https://www.reddit.com/r/learnprogramming/comments/gh5ph/question_about_delta/,"I have an internship doing some programming and over heard my boss saying something about having to calculate a new delta. I don't really know what this means. We are using APIs to test some hardware functionality. I'm not going to be doing this but I would like to know what this means.

I don't know if this clear enough to get a detailed answer but any feedback would  be appreciated.

Edit:
Talked to my boss about it, delta was used as the change in time between when a signal was being sent and when a signal was being received. Although the calculation was different than just timeend - timestart. It didn't occur to me that delta could have been the change in time, i thought it would have been a more abstract item. I think im just overthinking things. Thanks for the help guys."
gierm,28,2011-04-04,I just need someone to listen to my story,glyoxial,SuicideWatch,https://www.reddit.com/r/SuicideWatch/comments/gierm/i_just_need_someone_to_listen_to_my_story/,"I don't even know if this is the right place to post this. I just need to get this out of my system. 

I dated this girl my last year in college for about 9 months. She was like the exact opposite of me - I was liberal, atheist, shy/antisocial; she was conservative, religious, in a sorority. Despite the differences, we were really happy together. Eventually with our graduations looming and mostly my stubbornness, we split up and I took it pretty hard. But I made a promise to myself to become a better person. I started working out, focusing on trying to improve my social/fashion skills, working on being more tolerant/openminded, etc. and to an extremely large extent, I feel I succeeded. One night, I was drunk and facebook messaged her kind of just saying hey and hoping that she was doing better. She ended up coming over and staying the night. Slowly we started talking again via text, pretty much every day. Her texts were always the highlight of my day. I'm working in KS as a chemist, and she's moved to Atlanta, GA for an internship. We start to talk about life goals and how we've changed, etc. and it slowly evolves into a 'hey, you know, we seemed to be much more in line with each other now, maybe there's a possibility this could work this time'. And the sentiment is mutual. I plan a trip to fly down and visit her this past weekend, with the intent of laying the formation for a slow, but potentially great recovery and loving relationship.

Friday night, I get in and we go out drinking. We're being really flirty and having a great time then she just disappears. So now I'm alone in a bar in a foreign land and super confused. After 45 minutes of looking for her, I find her in the backseat of her car with some random guy. She doesn't even know his name, and they're clothed, but I flip out. She says it's not what it looks like, etc etc. We go back to her place, have angry sex, and pass out. In the morning we talk about it; she says she was scared/nervous about me being there, and this is her way of pushing people away when they get close. She says she loves me and wants to be with me, but doesn't think she can offer me what I want/deserve from her. I play the role of the nice guy and say ""alright, well, let's do some sight seeing and rent a movie and take it easy tonight, my flight leaves in the morning."" She thinks that's a great idea and she gets in the shower. While she's showering, I'm laying there and I kind of freak out. I sit up, think to myself ""No, I'm sick of being a good guy and letting girls walk all over me"". So I start to pack my stuff up to head to the airport and leave early. She gets out and asks me what's wrong, and I respectfully let her have it. I tell her that what she did is not okay, and that I came down here with what I felt like was a mutual interest in pursuing a meaningful relationship only to have her pull some insane stunt that hurt me more than I can put into words. She cries and apologizes, and I give her every chance to stop me from leaving, but she doesn't. I walk to the door, without turning to look at her say ""I hope you get everything you want in life"" and walk out. After walking for 45 min trying to figure out where the hell I am to call a cab, I find a McDonalds and start looking up cab numbers on my phone. She calls me. She asks me to come back and talk to her and stay. I comply. We kind of lounge around at her apt for the rest of the day, rent a movie and snuggle and watch it, then go to bed (no sex). We wake up, she takes me to the airport and I leave. She texts me after I leave telling me that she loves me and she's sorry, she just doesn't think she can give me what I want right now, and that she wants to be with me and that she needs me to be a part of her life. I tell her that I wish I could understand that. I tell her that I need some time away from talking to her for a while to try and figure out what I need to do.

I don't know what to do. I feel like my entire motivation to keep waking up and going to work is gone now. I think there's a part of her that wants what I want - the ""well, I'm an adult now and I want to settle down and share my life with someone"" stage but I also think she isn't completely out of that ""I'm young and want to party and meet people and be crazy"" stage either. I don't want to let her go, but I don't want to wait around to be the consolation prize because I might be waiting for nothing. She has always had psychological issues, she's been suicidal/a self mutilator in the past, and I think she's dealing with some of that stuff right now, so I don't want to leave her to deal with that alone, but I can't let myself be dangled along. I guess I just don't know what to do and don't know how to keep on keeping on. I know this was long, but thanks for reading."
gi8gn,10,2011-04-04,IBM or NASA internship?,[deleted],AskReddit,https://www.reddit.com/r/AskReddit/comments/gi8gn/ibm_or_nasa_internship/,"Hi Reddit,

I'm in a tough situation and need help making a decision. I have the opportunity to choose between and internship at IBM and an internship at NASA this summer. I know I'm in an great situation and probably can't go wrong either way, but I would still like to make the best choice and not just wing it. I ultimately want to go to grad school for something in Computer Engineering or Computer Science, namely Robotics. The internship at IBM involves working with a database of microprocessor simulation results using SQL in IBM's Custom Microprocessor department, where they develop and test processors for major game consoles such as Xbox, PS3, and Wii. For NASA Ames Research Center, I would help analyze a database of power management data using MATLAB algorithms. The database information is coming from their Sustainability Base, a building developed by NASA that utilizes zero net energy, meaning it generates as much energy from renewable sources as it draws from he power grid:

http://www.nasa.gov/externalflash/sustainability-base/index.html

I'd really love to hear from anyone that has worked at NASA ARC as an intern or IBM. It's a really tough choice for me because they both seem amazing and I'm glad to have a chance with either of them, let alone both of them at the same time. Any insight is appreciated. Thanks!
"
gi792,4,2011-04-04,Student Programmer preparing for an Interview,Yiruru,learnprogramming,https://www.reddit.com/r/learnprogramming/comments/gi792/student_programmer_preparing_for_an_interview/,"Hello Reddit,

I'm in the process of trying to prepare for an technical internship interview in a few days. Most of what I know is self-taught, so Im unsure of how to prepare for it.

They ask for an understanding of Object-oriented development, and the software development process, and knowledge of Agile, Databases, and Silverlight. I've only touched on the first two topics slightly, so I was hoping to get some advice from Reddit on possible questions, or resources to study with.

Java is the language of choice, so I'll be trying some problems at codingbat for that~

Thanks!"
gj6xg,2,2011-04-05,Building a Portfolio,Flamefury,learnprogramming,https://www.reddit.com/r/learnprogramming/comments/gj6xg/building_a_portfolio/,"I'm a university fledgling, in the middle of my second year. I'm not exactly intelligent, so university is a serious struggle and it's difficult to find time to build up a decent portfolio so I'll have something to present to employers when I'm out of there.

Also, the software engineering program I'm in forces us to find internships every once in a while and I'm starting to feel the heat of competition. Employers are going to give me a lot less leeway in terms of how lacking in knowledge I am as I progress through uni.

I want to be a game developer. Though, right now my internship has me managing some CRM apps, which I don't particularly mind either. 
Any developing's good, really, wouldn't mind freelancing and doing whatever oddball job I can find. Gaming's where I'd favour, but isn't really required.

Truth be told, I can honestly say my only real experience in programming languages is (sigh) Visual FoxPro because that's what I've been doing the last three months for my internship. I scraped basic SQL from a QA job I had before, but nothing too advanced. I'm attempting to manage a blog, but my HTML, CSS and PHP skills could use some work so I'm really just stealing off a default skin. University / high school led me through C, C++, Java and Scheme (hah), but for whatever reason, I don't feel like you can understand the ins and outs for each language by only doing incredibly tricky one-shot assignments as opposed to a program to be released for public use.

Enough backstory, into the actual questions.

1. What matters more, the number of projects or the size? In other words, would it be better to do a bunch of small little applications (like a bunch of mini-games) or chart out one big project (like a console-ish game)?

2. For those of you that schedule out your hobby projects, what do you do to help you stick to schedule? (University hogs so much time some days...)

3. Does it matter how many languages you know and what each project is based on? Or would I better my time using what I know instead of picking up new languages and their interesting IDEs?"
gj5zg,2,2011-04-05,Best way to learn SQL?,vtmeta,compsci,https://www.reddit.com/r/compsci/comments/gj5zg/best_way_to_learn_sql/,"I'm a CS major at a respected university looking for a summer internship in my field but it seems like every internship I apply for requires prior experience in SQL. My problem is that I haven't (and won't in the foreseeable future) had a class in SQL. Have any of you all taught yourself the language? Have any advice as to what the best way to go about it would be?

Thanks in advance! "
giwla,4,2011-04-05,Looking for gaming laptop &lt;2000,sausagelink,SuggestALaptop,https://www.reddit.com/r/SuggestALaptop/comments/giwla/looking_for_gaming_laptop_2000/,"I'm looking at the Asus G73SW-A1 but I'm just wondering if theres anything better. I'm selling my desktop since theres no way I can take it with me to my summer internship (AND I CAN'T GO A SUMMER WITHOUT GAMING). 

Also, are USB 3.0 speeds comparable to Sata 2?"
gitf9,98,2011-04-04,There's something in Hawaii.,[deleted],nosleep,https://www.reddit.com/r/nosleep/comments/gitf9/theres_something_in_hawaii/,"I know it's cheesy to say ""this story is 100% true"", but in this case it is. I'm a regular redditor and you can look at my comment history if you doubt me. 

Last year I did an internship in Hawaii in agroforestry. I lived on a farm on a lava flow on the Big Island; it was a small place, so it was only the farmer, his dog, and myself living there at the time. This part of Hawaii is mostly uninhabitable due to the lava rock, but the farmer had managed to keep a decent forest of fruit trees going with innovative techniques. He was a bit of a nut, living out there all alone, and was really big on sustainability. The place was powered by solar panels, which worked about 60% of the five months I spent there.

One night, I was walking from the main part of the farm back to my yurt, along the main path. It was a moonless night, and I didn't bother bringing my flashlight as I'm really not afraid of the dark. I was able to navigate by looking up to see the trees to either side of me obscure the stars in the sky. Also, the lighthouse to the south would flash a faint bit of light about every 15 seconds, and I could use it to reorient myself when if I got turned around. The total distance was no more than 1/2 a mile, and it usually took me about 15 minutes to walk.

Now, the place I was living has some history. [See here.](http://en.wikipedia.org/wiki/Kapoho,_Hawai'i) The lava flow made a ring around a 10-acre patch of rainforest, which they called a ""kipuka"". The idea is that Pele, the goddess of fire, spared this patch of forest because it is spiritually sacred. I worked within the forest for several hours every day, and my yurt sat right on its perimeter.

After about 10 minutes, I reached the point where the little path to my place cut off from the main trail. To help me find the path in the dark, I had tied a piece of white cloth onto a tree branch (I had missed it way too many times) so I knew where to turn. The cloth barely registered in my vision on this night, but it was better than nothing.

The secondary path to my yurt was really narrow and overgrown, so I couldn't use the stars to navigate the rest of the way, but rather had to rely on memory and my outstretched arms as a last resort. It was kind of relaxing and exhilarating at the same time. I liked to pretend that I was an original Polynesian settler- before the introduction of electricity and flashlights.

I had just turned onto my path when I heard something crashing through the trees and brush, about 15 feet ahead and to the left. My first thought was pigs, which often came at night to tear up roots and plants, so I froze in place, listening. Before I knew what was happening, the thing came bolting down the path towards me at full speed. It was then I realized that whatever this thing was, it was clearly bipedal. I was paralyzed by fear and bewilderment, and it was still coming. To my amazement, it *sped up* as it passed by me, brushing my upper arm (I'm 6' 2""), and crashed back into the brush behind me and to the right. I was only able to make out a simple form, but it was definitely not any animal found in the entire islands of Hawaii.

As soon as it went crashing into the forest, my paralysis broke, and I broke into a full sprint back the entire 1/2 mile to the main farm. I started yelling the farmer's name, freaking out the dog, and he came running. (Nothing like this had ever happened before.) Between breaths, I told him what happened, and his eyes widened with every detail. Without saying a word, he fished out his .22, got the dog on the leash, and went searching for the intruder. I grabbed my flashlight and followed. The moment we reached the spot of the encounter, the dog flipped out, barking, and tore off into the forest in the same direction the thing went, following a scent trail. After a tense 20 minutes, she finally came back, no sign of anything.

We never figured out what it was. I used my flashlight every night after that."
gk5ga,1,2011-04-06,Need to quickly become a spreadsheet jockey,[deleted],excel,https://www.reddit.com/r/excel/comments/gk5ga/need_to_quickly_become_a_spreadsheet_jockey/,"So I pretty much just had one of the best internships around fall into my lap.  The problem is that the company is looking for me to work with spreadsheets.  

I have some pretty basic knowledge that I've picked up from high school and a few college courses, but I feel like this is probably no where near enough.  I would begin working in roughly mid May.  Am I screwed here or do I have time to learn what I need?  If so, where would be the best place to start?"
gjzcg,1,2011-04-06,"Any recommendations for startups to work for in Austin,TX over summer?",neophoebus,startups,https://www.reddit.com/r/startups/comments/gjzcg/any_recommendations_for_startups_to_work_for_in/,"I'm looking for an internship position (preferably paid) over summer in ATX. Anyone know anyone who's looking for a novice software engineer? I'd rather work on something exciting, and pick up the entrepreneurial spirit, than work at something larger and more boring. 

ATX is a cool place, and there's a lot of tech happening there. I also happen to live there over summers =)


For reference, or if it interests anyone, my degree is, formally, Honors BEng of ""Artificial Intelligence and Software Engineering"" at the University of Edinburgh (Scotland). I'm a junior, so I won't be graduating for another year."
gkk9o,8,2011-04-07,What's a better use of my summer?,unregisteredusr,ECE,https://www.reddit.com/r/ECE/comments/gkk9o/whats_a_better_use_of_my_summer/,"Hi ECE, I'm a sophomore EE student and I have a couple different options over the summer.  I can either:

* Work on my school's robotics team for a 5-8k research stipend
* Intern at Microsoft in Beijing

Money's not an issue, so it's mainly experience.  My gut instinct says Microsoft is better just because it's well known, except it's a software job and it's international.  What would you do?

Edit: Thanks for the advice! It seems like Microsoft is a good idea for my professional development.  I can always do research another year anyways.

Double Edit: Doing research and I got another job. "
gkjoo,3,2011-04-07,"Reddit, tell me about your worst job interview. ",[deleted],AskReddit,https://www.reddit.com/r/AskReddit/comments/gkjoo/reddit_tell_me_about_your_worst_job_interview/,"I had my first 'in my carrier' Internship Interview today... I did a mock interview, researched the company, practiced, practiced, practiced wore a suit, talked to professors about the company and talked to someone who had worked with the company before, but I think I bombed it. The interviewers (3 of them) ended up asking me mainly technical questions about IT I could've answered If i was able to think (nervous as a fat kid in a speedo). I couldn't complete their intern test (didn't help the nerves at all). I give myself a 4/10. 

What I learned: 
- Get a job description 
- Get a job description
- Get a job description (Something that wasn't provided to me) 
- Smile More
- Make more small talk with the receptionist to calm down maybe? 
- Those questions you think you'll remember to ask? write em down
- Post interview is worse than pre-interview "
gkdm6,7,2011-04-06,This is my first post ever (really) and I have come to you Redditers for some life advice for a history major.,moses_man,AskReddit,https://www.reddit.com/r/AskReddit/comments/gkdm6/this_is_my_first_post_ever_really_and_i_have_come/,"Hello Reddit! Pleasure to meet you all and here we go. 

I've been out of college for about a year and a half and I'm having no luck with the real world. I have applied for many jobs but I haven't even been able to get an interview. 

The core of my issues revolve around my lack experience. I graduated with a good GPA and even completed my undergrad in 3.5 years. Unfortunately, I didn't plan too well for post college life.  
 I took up as a temporary job when I graduated, but  I've been there for so long that I'm now managing the place. While the pay is good enough to support me, the job ultimately drives me crazy. 

I've volunteered at a non-profit historical site to gain some relevant history focused professional experience. Yet, after 4 months at the internship, I realized that any future in this job would require grad school and the market for related jobs were slim to none. 

At this juncture, I tink I have to re-evaluate my career choices, yet I am lacking in experience or direction!

I've been considering teaching abroad just for a change of pace.

If there are any post grad history or liberal arts majors who have shared a smilar experience please tell me about it! I want to move my life forward and I need some sort of outlet!

Thank you Reddit 
 


"
gll2q,4,2011-04-08,How bad does a company have to screw up to be shut down by OSHA,AgentMull,AskReddit,https://www.reddit.com/r/AskReddit/comments/gll2q/how_bad_does_a_company_have_to_screw_up_to_be/,"I was hired at the beginning of last summer to be an engineering intern (read: only engineer) at a very small (4 employees) solar hot water tank manufacturer. My boss really liked me and kept me on over this past school year (I graduate with a degree in Mech Eng in a few weeks). Over that time there was an employee, lets say Tom, who I got along with really well, and liked a a lot. But my boss was always on him about various job performance issues. Some might have been legit, but some seemed ticky tacky, and it almost seemed like my boss was trying to drive him out. Anyways, things finally came to a head, and Tom ended up leaving the company, and filing for unemployment. My boss apparently has decided to fight. This morning I was copied on an email from Tom saying ""You WILL be contacted by OSHA and DOL on claims against the company."" and ""I'm positive after talking with OSHA today about my claim that [Company] will be shut down and [Other company in the same building owned by the landlord] will also be effected.""  Tom had indicated he liked me, and wouldn't do anything to screw me over, but then he goes and does this. 
  
Now I know there were some things we do/did that aren't ""OSHA standards"" but then who does follow all of OSHA's rules. I may be wrong, but I can't think of anything that we've done that would warrant any more than a slap on the wrist, and certainly not ""shut down."" I was really hoping to stay this company after I graduate (I'm in the middle of negotiating with my bosses), and the last thing I want to see is this company shut down."
gmhjh,2,2011-04-09,Tried to make my resume as concise as possible. Seeking position at a ship building company - either doing manual labor in shipyard or in design position. Suggestions?,[deleted],resumes,https://www.reddit.com/r/resumes/comments/gmhjh/tried_to_make_my_resume_as_concise_as_possible/,"Objective: To obtain experience designing or building vessels, expanding my current knowledge and skills. 

Education: 
2010 - Present: Attending East Carolina University. Major: Fine Arts with a concentration in Sculpture. Minor: Mechanical design. GPA: 4.0. 
2006 - 2007: Boston University.
2005 - 2006: University of Massachusetts Dartmouth.



Experience:
COMPANY - Estimator

January 2011 - June 2011. Area, NC.
Sketched and dimensioned clients' properties for an emergency cleaning and restoration company using Xactimate 27.0. Provided estimates assessing the cost of damages. Occasional work in the field cleaning smoke damaged property, tracking moisture levels, tearing out unsalvagable floors and drywall.



COMPANY - Clerical Intern

November 2010 - January 2011. Area, NC.
Worked at front desk taking applications from and initially screening potential employees. Data entry, answering multiline phones, and customer service skills required.


COMPANY - Food technician and Hostess Supervisor

January 2010 - January 2011. Area, NC.
Supervisor for a new food service program. Managed small team of employees, delivered diet-specific trays to patients and entered menu orders using a program called CBORD. Answered multiline phones, ensured employees were completing their job correctly and patients were satisfied with service.



COMPANY - Sanitation Department - Galley Steward

July 2009 - December 2009. Area, FL.
Kept galley equipment (ovens, dishwashers, etc.) and public areas of cruise ship maintained and sanitized according to FDA and CDC standards.


Skills and Software:

-AutoCAD 2010 : Spent two semesters using to sketch blueprints for Computer Aided Design and Drafting class and Engineering Design class.

-Autodesk Inventor 2010 : Spent one semester using to design 3d parts for Computer Aided Design and Drafting class.

-Xactimate 27.0 : Used every day for work to accurately dimension properties and determine repair costs.

-Microsoft Office Suite

-Quickbooks

-Proficient at MIG and acetylene torch welding: Use both techniques frequently in sculpture. Also experienced using plasma cutter and other power tools.


Personal:

-Completed coast guard mandated Fire Safety, First Aid, and Crowd Management courses.


Edit: Took off high school, elaborated Skills and Software.
"
