eetzn,6,2010-12-01,"Trying to land an EE job, need some ideas on preparation.",n00bEE,engineering,https://www.reddit.com/r/engineering/comments/eetzn/trying_to_land_an_ee_job_need_some_ideas_on/,"Reddit engineers, I'm really excited that I've been given the opportunity to interview in a couple of days for what I hope is my first electrical engineering position.  At the same time I feel woefully unprepared and a little nervous about asking for help.  You guys, I'm ready to be an engineer.  My professional experience thus far has been four years of mind numbing IT related work, I'm (surprise) very good at it.  I'm very rarely challenged when tasked with finding a solution to what my employers feel are ""big issues"", and I feel like my mind is rotting from the core.  I want to contribute my technical and problem solving abilities to the world.  I feel like this is my last chance to be an electrical engineer as I've had absolutely no luck with landing a position over the past 3 years since graduating with my BSEE.  I don't know what I'll do with myself if I fail to get into this field.

Here are a few things that I'm not quite sure how to explain to a would be employer.  I really could use some help with phrasing my responses to questions that prod at what I'm about to mention.  I have absolutely no professional engineering experience.  A few extra curricular projects is it.  I never managed to land an internship, and couldn't stay in the city during summers since I had to move back to a remote rural town.  I have a low GPA.  While I had tremendous work ethic towards practical things such as my labs, or my extra extracurriculars or even my self-taught knowledge of web-programming, I found it very difficult to achieve in a structured learning environment.  Still I am stubborn and I refuse to quit.  I redid any courses that I had to and did what it took to complete my education.  On top of all that, it's been nearly 3 years since I graduated and I feel as if my retained knowledge of analog and digital electronics is fading pretty badly.  I have my books though, and I try to keep my mind exercised with a couple of fairly simple hobby projects (i.e. most recently restored and old radio).  I feel though that the combination of the lack of experience, poor gpa and time out of school are things that produce a mountain of complication larger than Everest for me.  I'm not quite sure what I can do to prove myself. 

I think after explaining all of that, it's important for me to mention that I still I feel that I have confidence in myself as a worthy candidate.  What I lack in experience, I make up for with my skills in critical thinking and problem solving.  I'm an engineer, I organize a problem that I don't understand and am interested in and science it until I come to a conclusion.  I'm never satisfied with letting others figure out or fix my electronics, my computer or whatever (excepting my car, it's too essential for me to test inaccurate conclusions on).

The next thing I want to do is study up a little bit on a few things that pertain to this position.  I have a little insider information on the position (an awesome friend graciously gave my resume to their boss, prompting this interview).  The hiring manager apparently has an interest in my skills with web based programming, HTML, PHP, CSS, mySQL, etc.  On top of that, I'm told they tend to have applicants analyze a couple of circuit diagrams and either look at or produce some programming in C.  For the circuitry, I'm told that the company is fairly serious about intrinsic safety.  Understandable as the company specializes in machines that deposit coatings, adhesives and lubricants (and ketchup at McDonalds).  These are coatings, or components of which, that could be explosive (hopefully excluding the ketchup) in the presence of a spark or heat from competent failure I'd imagine.  My first guess is that this involves circuitry with diodes or fuses, but can anyone give me any insight into what I should really be familiarizing myself with regarding this?  What do I do if they show me a circuit, and I can't off-hand tell them or calculate what it does?  Does anyone have any ideas on what people tend to ask when it comes to jotting down a simple C program?  I don't program in C, I program in PHP (similar), I have no idea what little ""gotchas"" or simple nuggets/tricks a budding C programmer tends to know.  Something like programming the actions of a physical digital component seems reasonable.  For instance, a D-flip-flop doesn't sound difficult to do quickly on paper, and honestly I just put a rudimentary program together in my head while writing this, but that's just a shot in the dark.  And again, I don't really know what to do if I'm stumped on the spot.  I certainly can't go back home, converse with friends, read a book and google it until I can resolve the problem like I might normally do.

I don't expect the holy grail of answers out of this, but I value any input that folks might have.  I've seen other people that've been given a tremendous amount of help on here, many times with positive results.  If nothing else, I hope that I can leave my interview feeling confident that I fully explained who I am and what I can do for them.

Thanks everyone.

(for those who want short details):  I have an EE interview.  I have no experience, had a low GPA and graduated 3 years ago.  I feel like it's my last chance to get an EE job.  What can I familiarize myself with regarding circuitry that's intrinsically safe?  What kinds of things to people like to ask to test knowledge of C programming?"
effy6,12,2010-12-03,Need advice on landing my first software job/internship (in C++/Java) [switching careers],goblgobl,learnprogramming,https://www.reddit.com/r/learnprogramming/comments/effy6/need_advice_on_landing_my_first_software/,"I'm hoping to learn about the most pragmatic way to go about getting my first programming gig. Here's my situation  - I'd greatly appreciate any input. 

I'm in my early 20's, and after graduating college a year ago (with a design degree), I stumbled upon programming, and particularly its intersection with math, and statistics. I found some really cool careers I'd like to work in that are at the intersection, but when I approach people in the industry, I keep getting the same response: 

""you're math/quant background is great, but come back when you get some real-world programming experience under your belt""

Understandable. My programming ""experience"" is as follows: I've taken a single Java course recently. And I took C++ courses in high school. I have (IMHO) a moderate understanding of basic principles of OOP, encapsulation, inheritance, polymorphism, etc. And I'm currently reading things like deitel c++ and carlH programming to brush up. So admittedly, I'm a novice, and don't have any significant personal projects, or work experience to speak of. 

My dilemma: I'm not interested in pursuing a second degree, nor do I have the resources (financially) or patience for it. I'm pretty autodidactic and can spend the next few years teaching myself the foundations of CS. But my biggest priority right now, and cause of anxiety, is trying to get a job/internship. I need to start earning an income ASAP. 

My 1-3yr goal is to ultimately get really good at high performance computing - the type of skill set that gets recruited for at places like Google, Amazon, and most automated trading firms. I know I won't be able to start out at places like these, but thats what I'm aiming for down the road. 

Since I'm not pursuing another degree, my questions are: 

1. What do you suggest is the best way to get my foot in the door? 

2. What types of companies should I be looking at, that a) deal with high performance issues and b) are willing to hire someone with my background/lack of experience? (big vs. small, telecom vs internet, etc) (I'm in NY if that helps)

3. What level of skill/competence is expected for a typical internship position? 

4. Where should I be looking specifically, to get my first job? 

Basically, I have a hodgepodge of skills due to a recent shift in career focus, believe myself to be able to pickup technical things very quickly, find programming enjoyable and intuitive, good at math, and have strong work ethic. I'm in New York, don't mind starting at the bottom, and I will take unpaid positions (if I have to) as long as I can learn a great deal, and it opens doors. What can I do to maximize the chance of getting a job within a relatively short amount of time? 

I appreciate the help!

**Just to clarify:** I'm not looking for advice on preparing for interviews - I've found a ton of useful posts here and elsewhere for how to do that. My problem is I'm pretty sure I wouldn't even get a callback at most places (given I'm not in a CS or related degree program, and don't have extensive coursework). I'm asking how can I get a shot at interviewing (anywhere really), with my background."
efrr3,2,2010-12-03,Have an software development internship interview with Amazon. Need advice.,xMrAx,AskReddit,https://www.reddit.com/r/AskReddit/comments/efrr3/have_an_software_development_internship_interview/,I am going to be having a technical phone interview with amazon for a software development internship. Just wondering if anyone here has had an interview with them and has any advice. I've heard they really like asking questions about trees. Is this true?
egcs7,28,2010-12-04,"Can't find an internship/first job, am I screwed?",MoonrakerElite,engineering,https://www.reddit.com/r/engineering/comments/egcs7/cant_find_an_internshipfirst_job_am_i_screwed/,"A little background, I graduated with a BS in Mech.E from the University of Minnesota Twin Cities this past May.  My GPA was not very good (2.7-2.8) and I wasnt able to find any internships while in school.  I also did not do any extra-curricular research/lab work which I now deeply regret.

I have been trying to find a job for the last year and have had exactly zero interviews/replies from applying online with a resume/cover letter.  Since I am no longer a student and have no experience whatsoever it seems that nobody wants to hire me, even for 10$/hr.

Am I ever going to be able to find an engineering job with a background like this?"
egfc3,1,2010-12-05,Do jobs look at your overall GPA or what you received in your Major GPA?,bewareoftraps,AskReddit,https://www.reddit.com/r/AskReddit/comments/egfc3/do_jobs_look_at_your_overall_gpa_or_what_you/,"So here’s a little something about me. First off, got into a decent university and was accepted into their Aerospace Engineering Major. Started to do bad in physics, got Academic Probation because having mediocre grades (B-C) and an F (or 2, yeah Physics…) can really hurt. Dropped into Undeclared Engineering because of my belief that I wasn’t all that bad (big mistake) and could still make it. 

Come summer, my grades were still relatively shit (GPA at 2.25, average for engineer student: 2.75). Took some time and asked my friends what they would do in my shoes (which was extremely hard, as they are all smart and I didn’t want to be looked down upon…stupid pride), and finally decided, enough is enough. Switched out to Business Economics and now my Major GPA is relatively high but my overall is still a lovely 2.2 (Only my single variable calculus class was counted into my Major GPA)

My question is this, to all you people who look at resumes, if I were to send my Major GPA, would you then ask to see my overall GPA? Or is there not even an option to show your Major GPA and you automatically have to send in what your overall is? 

Also, I know that for the most part a lot of people have been telling me to not worry as much, because if I get an internship then for some strange reason, I’ll magically be fine. But then my question is, a lot of internships ask for your GPA, what do you do in that case? (Submit overall or major?)

TL;DR I did bad in engineering, moved to Business Econ, will my old and bad grades from Engineering affect me for applying to a job?"
eggnc,0,2010-12-05,"Help Reddit, I don't know what to do with my life (so many options, but if I do nothing, I'll lose my wife)",innercontemplation,AskReddit,https://www.reddit.com/r/AskReddit/comments/eggnc/help_reddit_i_dont_know_what_to_do_with_my_life/,"(25 years old) The background to this story is that I met my wife 6 years ago, both crazy anime nerds in college. Time went on, we became best friends, and then much more. We married the summer before she graduated. She started working at Walgreens as an assistant manager. Her plan was to go to Japan and teach English after building up capital.

As for me, I went to school to get a BBA in computer science/programming/business analysis (main language was Java). I got good grades and consider myself to be very amiable compared to most of the people in my program. I became trilingual (English, Japanese, Spanish). I also had many leadership positions in clubs that I learned a wealth of knowledge about leading and teaching. I also had an programming/business analysis internship with a fortune 500 company.

Problem is, I graduated a year ago and everything went to crap. I pursued quite a few companies, but a lack of experience seemingly killed all my chances (even for entry level ones). Not only that, my training in Java and MySQL didn't seem to take me very far. I searched for months and was never hired (I'm very good in interviews, usually anything that gets to that point, my success rate improves dramatically).

At this point, I start to work for a buddy of mine at his establishment as a business consultant/web developer/programmer for a sum far below what I need to pay for my loans, let alone living expenses so I can get something. This means I have to start dipping in to what my wife is making to pay for my most of my expenses.

It is at this point that my wife feels we should prepare to go to Japan. We start doing an online course for teaching English in a foreign country for a hefty sum of money. Problem is that I'm working a lot of hours to get things done for my friends shop and don't have time for this course. During this time, my wife reminds me that she is only staying in this country because she is waiting for me.

Finally, I'm forced to stop working for my friend and settle for a job in manufacturing so I can make ends meet. Trouble is, second day on the job, I get injured pretty bad and can't go back to work. At the same time, my bank account is basically empty, bills are piling up, the English teaching online program deadline is closely approaching with me having completed less than 50% of it, and I've got forced time off for injury.

The worst part is that I combat this indecision and extra free time with video games and surfing reddit/kotaku/internets because I'm so confused as to what I should do, leaving completely unproductive.

What the hell do I do? Do I try to make my programming knowledge functional again for me? Do I pursue some other business venture? Do I use my time to finish the English teaching course? Do I just focus on getting better, working manufacturing, and paying bills? Is there some way I can use my skills that I am missing? I AM SICK OF FEELING USELESS AND BEING A BURDEN ON MY WIFE!!! 

I would appreciate any insight offered.

**TL;DR Can't find and/or keep job. Smart and capable, but injured and at a crossroads, going the wrong way could cause my wife to leave me**

Edit: Just wanted to thank everyone for their responses. They were informative and helpful."
eha9s,1,2010-12-06,Interviewing for an Android Developer position on Wednesday. Any advice?,Robamaton,AskReddit,https://www.reddit.com/r/AskReddit/comments/eha9s/interviewing_for_an_android_developer_position_on/,"The company is a Federally-Funded Research and Development Center. I'm still in school, and I worked with Android at an internship last summer."
ehepg,6,2010-12-06,Not an emergency. Just a depressed guy who is getting close to his limit.,inhalexhale,SuicideWatch,https://www.reddit.com/r/SuicideWatch/comments/ehepg/not_an_emergency_just_a_depressed_guy_who_is/,"I'd really appreciate anyone who has a few minutes to comment:


From the time I was in junior high school I really devoted myself to working hard. Ridiculously hard. I've lost whole groups of friends, potential girlfriends and put myself socially quite far behind my peers just to succeed academically. The thought of future success coupled with the idea of making my parents proud drove me.

For a long time this worked out. I've always been an above average student. I did amazingly well in high school, got into a great university, and currently have a tremendous gpa coupled with extensive research and even a corporate internship. All the while I went out occasionally with friends, managed some hook-ups and participated in a varsity, intercollegiate sport.

Then I met the one. The girl who everything just seems right with - the person who you trust beyond anyone else. Long story short: quite a while after we got together, she cheated on me and left. Right as this was falling apart, my best friend passed away. I fell into quite a depression. I forced myself to keep working out and to keep my grades up. While I was crushed and barely capable of leaving my room, my will to succeed academically (and shit tons of whiskey) helped push me through...

Fast forward a year. This semester I applied to ~100 jobs and received about 15 interviews at extremely well respected companies. All of the positions were high paying with full benefits and lots of room for future promotion. Outcome? Zero offers. This has utterly demolished me.

I feel a lot like Dexter right now. Emotionless. Removed from life. The one driving force in my life - my will to succeed academically - has been lost. What's the point in working anymore if I can't get a job? My whole life I was delusional: If I worked my ass off, got good grades, conducted outside research, joined a sports team and got an internship, I was guaranteed to get an amazing job upon graduation. Coupled with this, every relationship I've attempted since last year just falls apart. I'm more than capable of putting on a poker face to look happy and confident to draw girls in, but I quickly lose interest. No one just seems as perfect as that last gf...

So here I am. A jobless, emotionally vacant college student whose only single friends are named Jack Daniels and Mary Jane. I just feel so empty every day. Nothing I try seems to fill the vacancy...I'm just about at the point where I just want to end it. "
ehjlc,1,2010-12-07,Have you had an internship?  How did you get it?  Where did you start and how long did it take?,[deleted],AskReddit,https://www.reddit.com/r/AskReddit/comments/ehjlc/have_you_had_an_internship_how_did_you_get_it/,"I'm currently starting a search for a winter/spring/summer internship.  I sent out some cover letters and resumes, but I have this gut feeling that this is going to end with nothing if I don't have some sort of plan.

I have gotten some great advice from reddit before in all different fields, and I have been reading a bunch on /r/jobs, but I felt the need to ask a larger subreddit due to /r/jobs relatively low reader rate and a feeling that many of you have some great stories to share with me.
"
ei1x1,2,2010-12-07,Help: any Redditors in the tech industry feel like sharing some resume/ cover letter tips? ,shellyap48,AskReddit,https://www.reddit.com/r/AskReddit/comments/ei1x1/help_any_redditors_in_the_tech_industry_feel_like/,"Okay background: I'm trying to get a business internship at a company that I have wanted to work at for, well since forever. It's my dream. And I've never had to write a resume or a cover letter geared towards the tech industry before, so I was wondering if anyone was willing to share their insights into what they could be looking for. 
THANK YOU! 

Addtl note: If anyone feels like being constructively and highly critical and is good at editing, they also ask for a 250 word statement. I'm sorry to be asking, but this truly is my biggest dream. 

EDIT: If you're willing to help, please PM me, might be easier than doing it over comments. "
eiarn,1,2010-12-08,Should I stay with new job OR become Project Manager?,henriski,AskReddit,https://www.reddit.com/r/AskReddit/comments/eiarn/should_i_stay_with_new_job_or_become_project/,"Work for  hospital in I.S. (Information Systems) in the area. Came about as an intern to their software support team 3 years ago. Worked out of the position and currently handling UNIX coding and troubleshooting. (bit of an upgrade in my eyes) Have a go getter of a new boss and he's great. Learning a great deal.    **Old Support team and current Unix team - under same umbrella/software/company**


HOWEVER, my manager for my old support team is leaving out of state for a new position.  My current manager told me ""so theres an open position now for project manager on the old support team, what do you think...?"" All I told him was that I am flexible and we could sit down and talk about it later this week.


What would you do? Stick with new team learning UNIX OR become Project Manager for the old support team and already know the ropes...? (possible salary increase, but 3 of the workers on that team have a different ""work ethic"")

I have always been told to look for my next job opportunity. My father is a director for a different company and feel he would be stoked. I could also go to him for all advice. I am learning a lot now, but would also have the status and experience of project manager.  Happy Problems

Thanks in advance Reddit!
"
eiiqt,2,2010-12-08,Internship dilemma,apatosauruswalrus,needadvice,https://www.reddit.com/r/needadvice/comments/eiiqt/internship_dilemma/,"Hi Reddit,

I need some advice on my very brief, but confusing career. I'm currently on a gap year after having finished college, planning on doing my masters in the coming year. I decided to use this year to gain some professional experience, landing my first real working experience at a big company as a PR intern. Going into this, I wasn't sure exactly how a PR department operated, but knew I wanted to do something media and communications related. During my interview I was told that interns receive a lot of responsibility, and that I would have a role in creating and managing content.

Fast forward a couple of months later, and I've found that my job involves a buttload of menial tasks (i.e: updating contact information and spreadsheets, uploading images, assembling gift bags for conferences, making birthday cards for board members), that offer little in personal or professional development. While I understand the role of an intern, I also feel that in this case the role that was described to me was slightly embellished, and that I would be able to find something more rewarding and in tune with my interests.

After doing a little research I contacted a small weekly publication, focusing on art/music/movies/events etc, which can possibly offer me the chance to write and produce actual content.

The only thing thats preventing me from quitting the PR gig tomorrow is that I signed on for 6 months. Doing the whole 6 months is out of the question, but I figured I could at least do 4. At the same time, dragging out an internship which I feel is a complete waste of my time at a company in which I see no future with no doors opening up for me, seems futile.

Having said that, it is a good name to have on your resume, and I don't want to leave on bad terms, even if it's merely for the sake of a reference. In general, opportunities around here are few and far between due to me being an English speaker living abroad.


To put it briefly, I understand that this decision probably won't have any long term impact on my future, but if anyone has any advice on the situation it would be much appreciated.

**tldr; Trying to decide whether to leave a PR internship (without pissing anyone off for quitting early) at a biiig company in favour of writing for a tiny little magazine to attain a sense of fulfillment  **"
