1fxgt0,2,2013-06-08,How achievable is finding a job in this field?,maybe2,gamedev,https://www.reddit.com/r/gamedev/comments/1fxgt0/how_achievable_is_finding_a_job_in_this_field/,"Hello everyone I have been lurking in this sub for a while and I just made up the courage to post something here. I am done with my first year of college ( Computer Science ), and have to have an internship in my 3rd year.

I see a lot of people saying that they work in this field, so I was wondering, is it achievable to get an internship in a game-development oriented company / entry-level job in such a company at the end of your studies?  

Bonus question : Can you have internships only when the college requests you to have an internship , or can you have it anytime (I'm not referring to your ability to apply for one, but do recruiters accept people that apply for internships, yet they aren't at the end of their studies. Also I'm curious about this one : Can you apply for an internship at companies that don't have displayed an available internship position?

I am trying to rack up as many projects under my belt as possible, having had made 3 small games so far, planning this summer to learn another language in which to make another small game.

"
1fx9ny,11,2013-06-08,Internship killing my desire to pursue a CS career,bon0,cscareerquestions,https://www.reddit.com/r/cscareerquestions/comments/1fx9ny/internship_killing_my_desire_to_pursue_a_cs_career/,"I have been at an internship for ~3 weeks, and it is killing my desire to pursue a career in CS. 

My brain feels like mush constantly, and after ~4 hours I feel completely useless (even more so than the general feeling of uselessness). This is more exhausting than physical labor, but without any of the reward at the end (quality sleep, satisfaction). 

I am getting doubts about spending my adult life sitting in front of a screen, and am starting to think that just about anything would be better, although I am certain the grass is always greener applies."
1fx4x8,1,2013-06-08,Should I continue college after getting a misdemeanor?,[deleted],Advice,https://www.reddit.com/r/Advice/comments/1fx4x8/should_i_continue_college_after_getting_a/,"Hello Reddit. I need some advice, but I can't seem to find anybody that has any experience or solid reasoning for my situation. I really need some help, and any insight or information would be greatly appreciated.

I returned to college after 10+ years of not being in school, working toward a degree in an information technology major. I struggled initially with going to class as I have bi-polar disorder. My doctor misdiagnosed me with depression (his words), and put me on some rather powerful antidepressants. He explained to me, after my incident, that antidepressants are bad for those with bi-polar because they can enter a super-manic state, which can put a person in a really bad state of mind and can have serious consequences. My consequence ended up being a misdemeanor criminal mischief conviction.

I have never been in trouble with the law in my life. I'm one of those people that can't handle waiting for someone in a fire lane for even 20 seconds because it is against the law and it would bother me.

I recently applied for an internship but was rejected because of this conviction. I have a year left of college, but cannot graduate without an internship. Even if I graduate, I am very worried that I will never be able to get a job in my field because of this. I wonder if I should just drop out now, as it is expensive and time consuming, and not worth that waste if I won't be able to get a job.

What should I do? Where do I go from here? I am struggling with daily life as this weighs very heavily on me. Help me Reddit, you are my only hope."
1fx2en,2,2013-06-08,Just got a coop offer. not sure if i should accept,[deleted],EngineeringStudents,https://www.reddit.com/r/EngineeringStudents/comments/1fx2en/just_got_a_coop_offer_not_sure_if_i_should_accept/,"Hey everyone, never posted on here before but I'm currently at a crossroads and would like input from 3rd party, non-biased group of people.

Recently I got a job offer from GE oil and gas to work as a co-op during the fall 2013 semester. I interviewed with then last October (fall 2012) and it was a general interview for spring/summer/fall internships. When i hadn't heard back and no one responded to my emails, I assumed I didn't get the job. I did however get a job offer from Solvay chemicals and am currently working for them as a summer intern in one of their eco plants. Most of my supervisors seem to really like me so far and really want me to apply for full time when i graduate. I wouldnt want to risk my chances with them if they found out i went to a different company which i might not even like working for.

On one hand, even though I already have an internship for this summer, there's no such thing as too much experience and a coop with GE is a really good opportunity. Ill get to travel to a new place, and work for an entire semester with a different company and in a different culture. It would also build my resume significantly and help me network with really important people.

On the other hand it's just a one term coop, and I would have to push graduation back a whole year. I'd also have nothing to take the next spring since all my electives are out of the way and our courses are blocked in by semester. When I come back to regular chemE classes after that I wouldn't know anyone in my classes. My friends, study groups, peers that I've taken classes with the last 2 years will all have graduated and i wont know anyone in the year below me.

I would also need to consider the cost of living there by myself for 4 months... and figure out how I'm going to get around since i don't have a car. Also from the job description they sent me its seems like more of a lab setting as opposed to a plant setting which is where i would rather end up. Ill be doing r&amp;d-type work which really isn't what I want to do after i graduate.

I also just got elected as president of our Omega Chi Epsilon and Aiche chapters. Both leadership positions i was actually looking forward to having during my final year. (remember, i thought the possibility of a coop was out of the question)

Basically.... Take the job for the sake of Work &amp; professional life or Decline the job for the sake of a social life and hope that I can still get a decent job offer with what i already have on my resume.

Facts i left out: just finished my junior year of chemE at LSU, have a gpa &gt; 3.5, active member of AICHE, OXE, TBP, EWB, &amp; the LGBT advocacy group at our school. Only classes i have left- Unit operations (F), Reaction Kinetics (F), Process Controls (F), UO lab (S), Materials (S) and Plant design (S). (IM SO CLOSE I CAN TASTE IT)

Just let me know what you guys think. I'm sure I'm not the only one who's been in this position.
"
1fwz9v,22,2013-06-08,"This New Unpaid Internship Craze. I will not work for free, ever or for any reason! Call me uppity.",JamesJohnHardy,rant,https://www.reddit.com/r/rant/comments/1fwz9v/this_new_unpaid_internship_craze_i_will_not_work/,"I go to a third-rate public university because I don't come from money and I will **never** accumulate a six-figure debt before even owning anything but a rag with a prestigious emblem. To shit with the supposed job opportunities that come with said rag; quite a few young people are graduating from private universities, even in STEM fields, and heading right back to McDonald's. School is not everything in the real world, and that's what our ignorant elders *keep failing* to *understand*!

My university email account gets a constant barrage of ""job posting"" messages. That's supposed to mean FUCKING **JOB** POSTINGS, not these outrageously infuriating unpaid internships! Also, I occasionally look for gigs on Craigslist, and at least half the postings there are invariably unpaid. And yes, I am looking in a Reddit-vaunted STEM field as well as in writing, which I can obviously by this post at least do with competence.

Corporations are shameless. Thankfully, my university doesn't require us to take unpaid internships for credit as all too many schools do. Doubtless these schools are receiving decent compensation for sending so many gofers their way. Nonetheless, I am constantly barraged with messages about how internships are necessary for getting a job.

[They are illegal](http://www.dol.gov/whd/regs/compliance/whdfs71.htm), but go on unchecked. What in the fuck do you think an intern's purpose is? I'll tell you what it is. It's to be as good a boy or girl as possible so you can impress your potential future employer. It's to fetch coffee and file papers. It's to prove that one day, you might get a reference from your boss if not a job from him or her. But that day never seems to be today.

I refuse to participate. I'll never give any of **MY** time and **MY** effort without fair pay. I already make OK money freelancing, so if I have to go through an unpaid ""trial period"" to get a job, I won't take your fucking job just to make some Ivy League MBA jerk even richer; I'll keep doing what I'm doing. I won't work for someone who does no work of his or her own, opting instead to drink in his or her plush office and delegate tasks. I know all too well these ""manager"" types; they talk like they work 25 hours a day dragging a cross through the building, but this is a Machiavellian PR tactic; they really just drink in their office, delegate all the work to their subordinates, and take all the credit while passing down all the blame. They hold ""meetings"" in country clubs and upscale restaurants. They don't work; they live it up on the fruits of our labor!
__________
Oh, and (trigger warning) I came across [this video](http://youtu.be/zs_Hld6Wj8U?t=2m42s) in which Kevin O'Leary says exactly what I'm saying: that unpaid interns are there to impress their boss through hard work, and their only compensation is that they *might* get a job later on.

Fuck that country club Republican, silk-curtain Irish blowhard in the ass. Obviously he's taking his hollow rich WASP businessman act to the outrageous extreme with his libertarian fuck-everyone-but-me rhetoric. We've seen what unbridled capitalism did to your people 100-odd years ago, working long hours in miserable conditions for pennies, and he wants it to happen again. And it is happening again through the modern internship craze, the decline of unions, et cetera, et cetera, et cetera.
__________
**EDIT:** A couple of commenters are indignantly huffing about how most unpaid internships in fact *are* legal according to my link; they're ""working interviews,"" in fact!

Look at [this Craigslist section for New York unpaid writing gigs](http://newyork.craigslist.org/search/wrg?zoomToPosting=&amp;query=&amp;srchType=A&amp;addThree=nopay). If you want an example, look at [this ""Blogger Internship"" post](http://newyork.craigslist.org/mnh/wrg/3858737854.html). Clearly these people are looking for free workers, offering nothing but résumé padding and/or a potential job there in the future.

Now look at the Department of Labor link above. Note the line about ""no immediate advantage."" I am not a lawyer, but give me a break on this one. Of course there are some internships which provide training and not exploitation, but don't act like I'm ranting about a fantasy. Notice Kevin O'Leary's statement above as well. This is how businesspeople think, unfiltered and unadulterated. Prove me wrong."
1fwrve,1,2013-06-08,Is there any way to stick up for yourself as an intern?,[deleted],AskReddit,https://www.reddit.com/r/AskReddit/comments/1fwrve/is_there_any_way_to_stick_up_for_yourself_as_an/,"My supervisor started out really nice, but as the weeks have progressed, she’s become ruder and ruder to the point that I don’t want to work with her anymore. Nothing I do is ever right or good enough for her, and she treats me like I’m about two inches tall. The most maddening thing is she will get angry at me for not doing things that I was never told to do. I’ve never had a problem with a job or boss in my life, but she makes me so nervous that I’m going to slip up – and I always do, according to her – that going to work is no longer enjoyable when she’s there. She even called my work useless once. She will say these things within earshot of the whole office, and they probably all think I’m an idiot now. I don’t know what to do.


I’m honestly starting to think that she’s doing this on purpose, and am super paranoid now when she asks me to do anything because I just know she will find things wrong with it and then make me feel as stupid as possible. There is no way to make her happy. 


She is well established and good at what she does. As an intern, I have no power, not even to say “Excuse me, you never told me this.” I absolutely understand about “paying your dues” and all that, but it’s the principle of the thing. Is there any way I can stand up for myself?"
1fwqwj,6,2013-06-08,CS/Math double major career help,throwawaycsquestion,cscareerquestions,https://www.reddit.com/r/cscareerquestions/comments/1fwqwj/csmath_double_major_career_help/,"Hi, I'm a going to a junior next year double majoring in CS and Math. Most of my education has been very theoretical but I make up for it by exploring languages in my free time. I currently have a summer internship at a large corporation doing application development in Java/JS/SQL. However, I think for next summer (and after college) I want to try and work for a company that specifically hires CS/Math talent.        
    

I've heard (mostly rumors from fellow students) that these areas are good for CS/Math double majors: Financial Algorithms, Computer/Cyber Security, Higher learning/university research    
    

Can anyone point me in the right direction? Not looking for the most lucrative area - just one that CS/Math double majors may fit well in. It seems really hard for me to find information on such a specific question like this, so I figured I would ask here. I hope this hasn't been asked yet - I used the search function and couldn't find much.    
    

Thanks in advance for any advice."
1fwj2i,0,2013-06-07,"Data dictionary/ArcPad help, please?",hellamanteca,gis,https://www.reddit.com/r/gis/comments/1fwj2i/data_dictionaryarcpad_help_please/,"Hi everyone,

I'm finding my intro ArcGIS course really didn't do much to prepare me for real-world work applications except teach me what the buttons are and how to trace borders it seems.

I find myself in a bit of a pickle in my internship this summer: I'm working for an ecological restoration organization and my boss would like me to *update a data dictionary* for a TrimbleXT Geoexplorer 6000 by adding a few items to the drop down menus associated with the map. He would also like me to *learn how to create data dictionaries for future mapping needs.* I shouldn't say ""he wants me to,"" because *I* want to. I really like this company and would like to demonstrate I can do this.

I can make maps with existing data collected using the Trimble, but I have zero clue how to make a data dictionary because it was never taught to me. 

I have access to: ArcMap (10.1, i believe - i'm home for the weekend now) ArcCatalog, and ArcPad (on the PC). Also, Excel and Access. They do not have Pathfinder, and while I am able to open the file on ArcPad/Catalog on the PC, I seem to be unable to edit on either one. Perhaps there is a wizard or edit functionality I am missing somewhere?

Can any of you guys help me out by offering instructions or point me in the right direction to links with instructions that don't require Pathfinder?

Please excuse my semi-ignorance, I'm motivated to learn this but can't spend an extended period of time on the phone with ESRI in the office because I'm in the field 90% of the work day.
"
1fwh05,0,2013-06-07,Looking for Housing for just the Month of August. Any advice?,[deleted],UMD,https://www.reddit.com/r/UMD/comments/1fwh05/looking_for_housing_for_just_the_month_of_august/,"Hi, I am a male summer intern working on campus at UMD. 

Right now I am looking for somewhere to rent for the month of August. My current lease only lasts until July, so I am looking for somewhere to stay for August to finish the summer. The problem is that I only have a bike, so I'm looking for somewhere that is within biking distance to the campus. Does anyone have any advice for where I should look?"
